"No.","Time","Source","Destination","Protocol","Length","Info"
"5","2.858283759","2601:5cf:4100:3de0:71ad:d37e:96b9:4fe2","2606:4700::6810:f9f9","TCP","94","39250  >  443 [SYN] Seq=0 Win=64800 Len=0 MSS=1440 SACK_PERM TSval=1022701730 TSecr=0 WS=128"
"6","3.115121055","2606:4700::6810:f9f9","2601:5cf:4100:3de0:71ad:d37e:96b9:4fe2","TCP","94","443  >  39250 [SYN, ACK] Seq=0 Ack=1 Win=64704 Len=0 MSS=1360 SACK_PERM TSval=1543554295 TSecr=1022701730 WS=8192"
"7","3.115177642","2601:5cf:4100:3de0:71ad:d37e:96b9:4fe2","2606:4700::6810:f9f9","TCP","86","39250  >  443 [ACK] Seq=1 Ack=1 Win=64896 Len=0 TSval=1022701987 TSecr=1543554295"
"8","3.115804882","2601:5cf:4100:3de0:71ad:d37e:96b9:4fe2","2606:4700::6810:f9f9","TLSv1.3","603","Client Hello (SNI=cloudflare-dns.com)"
"10","3.319612354","2606:4700::6810:f9f9","2601:5cf:4100:3de0:71ad:d37e:96b9:4fe2","TCP","86","443  >  39250 [ACK] Seq=1 Ack=518 Win=57344 Len=0 TSval=1543554524 TSecr=1022701987"
"11","3.319612785","2606:4700::6810:f9f9","2601:5cf:4100:3de0:71ad:d37e:96b9:4fe2","TLSv1.3","3385","Server Hello, Change Cipher Spec, Application Data"
"12","3.319665355","2601:5cf:4100:3de0:71ad:d37e:96b9:4fe2","2606:4700::6810:f9f9","TCP","86","39250  >  443 [ACK] Seq=518 Ack=3300 Win=62976 Len=0 TSval=1022702191 TSecr=1543554525"
"15","3.320943891","2601:5cf:4100:3de0:71ad:d37e:96b9:4fe2","2606:4700::6810:f9f9","TLSv1.3","166","Change Cipher Spec, Application Data"
"16","3.525070078","2606:4700::6810:f9f9","2601:5cf:4100:3de0:71ad:d37e:96b9:4fe2","TLSv1.3","646","Application Data, Application Data"
"17","3.525114483","2601:5cf:4100:3de0:71ad:d37e:96b9:4fe2","2606:4700::6810:f9f9","TLSv1.3","402","Application Data, Application Data, Application Data, Application Data"
"18","3.626980593","2606:4700::6810:f9f9","2601:5cf:4100:3de0:71ad:d37e:96b9:4fe2","TLSv1.3","117","Application Data"
"19","3.627024716","2601:5cf:4100:3de0:71ad:d37e:96b9:4fe2","2606:4700::6810:f9f9","TLSv1.3","117","Application Data"
"20","3.731340043","2606:4700::6810:f9f9","2601:5cf:4100:3de0:71ad:d37e:96b9:4fe2","TCP","86","443  >  39250 [ACK] Seq=3891 Ack=945 Win=65536 Len=0 TSval=1543555080 TSecr=1022702499"
"21","3.834949792","2606:4700::6810:f9f9","2601:5cf:4100:3de0:71ad:d37e:96b9:4fe2","TLSv1.3","202","Application Data"
"22","3.835161584","2606:4700::6810:f9f9","2601:5cf:4100:3de0:71ad:d37e:96b9:4fe2","TLSv1.3","195","Application Data"
"23","3.835952775","2601:5cf:4100:3de0:71ad:d37e:96b9:4fe2","2606:4700::6810:f9f9","TCP","86","39250  >  443 [ACK] Seq=945 Ack=4116 Win=64128 Len=0 TSval=1022702707 TSecr=1543555136"
"24","3.836208020","2601:5cf:4100:3de0:71ad:d37e:96b9:4fe2","2606:4700::6810:f9f9","TCP","86","39250  >  443 [FIN, ACK] Seq=945 Ack=4116 Win=64128 Len=0 TSval=1022702708 TSecr=1543555136"
"26","3.935081490","2606:4700::6810:f9f9","2601:5cf:4100:3de0:71ad:d37e:96b9:4fe2","TCP","86","443  >  39250 [FIN, ACK] Seq=4116 Ack=946 Win=65536 Len=0 TSval=1543555248 TSecr=1022702708"
"28","3.935141374","2601:5cf:4100:3de0:71ad:d37e:96b9:4fe2","2606:4700::6810:f9f9","TCP","86","39250  >  443 [ACK] Seq=946 Ack=4117 Win=64128 Len=0 TSval=1022702807 TSecr=1543555248"
"64","4.882098519","2601:5cf:4100:3de0:71ad:d37e:96b9:4fe2","2606:4700::6810:f9f9","TCP","94","39254  >  443 [SYN] Seq=0 Win=64800 Len=0 MSS=1440 SACK_PERM TSval=1022703754 TSecr=0 WS=128"
"67","5.060738948","2606:4700::6810:f9f9","2601:5cf:4100:3de0:71ad:d37e:96b9:4fe2","TCP","94","443  >  39254 [SYN, ACK] Seq=0 Ack=1 Win=64704 Len=0 MSS=1360 SACK_PERM TSval=3411149607 TSecr=1022703754 WS=8192"
"68","5.060795806","2601:5cf:4100:3de0:71ad:d37e:96b9:4fe2","2606:4700::6810:f9f9","TCP","86","39254  >  443 [ACK] Seq=1 Ack=1 Win=64896 Len=0 TSval=1022703932 TSecr=3411149607"
"69","5.061349557","2601:5cf:4100:3de0:71ad:d37e:96b9:4fe2","2606:4700::6810:f9f9","TLSv1.3","603","Client Hello (SNI=cloudflare-dns.com)"
"71","5.162564180","2606:4700::6810:f9f9","2601:5cf:4100:3de0:71ad:d37e:96b9:4fe2","TCP","86","443  >  39254 [ACK] Seq=1 Ack=518 Win=57344 Len=0 TSval=3411149743 TSecr=1022703933"
"72","5.163283475","2606:4700::6810:f9f9","2601:5cf:4100:3de0:71ad:d37e:96b9:4fe2","TLSv1.3","3385","Server Hello, Change Cipher Spec, Application Data"
"73","5.163296911","2601:5cf:4100:3de0:71ad:d37e:96b9:4fe2","2606:4700::6810:f9f9","TCP","86","39254  >  443 [ACK] Seq=518 Ack=3300 Win=62976 Len=0 TSval=1022704035 TSecr=3411149744"
"74","5.164251662","2601:5cf:4100:3de0:71ad:d37e:96b9:4fe2","2606:4700::6810:f9f9","TLSv1.3","166","Change Cipher Spec, Application Data"
"79","5.203082314","2606:4700::6810:f9f9","2601:5cf:4100:3de0:71ad:d37e:96b9:4fe2","TLSv1.3","646","Application Data, Application Data"
"80","5.203109796","2601:5cf:4100:3de0:71ad:d37e:96b9:4fe2","2606:4700::6810:f9f9","TLSv1.3","415","Application Data, Application Data, Application Data, Application Data"
"81","5.368977599","2606:4700::6810:f9f9","2601:5cf:4100:3de0:71ad:d37e:96b9:4fe2","TLSv1.3","117","Application Data"
"82","5.369002086","2601:5cf:4100:3de0:71ad:d37e:96b9:4fe2","2606:4700::6810:f9f9","TLSv1.3","117","Application Data"
"83","5.369407765","2606:4700::6810:f9f9","2601:5cf:4100:3de0:71ad:d37e:96b9:4fe2","TLSv1.3","202","Application Data"
"84","5.369407856","2606:4700::6810:f9f9","2601:5cf:4100:3de0:71ad:d37e:96b9:4fe2","TLSv1.3","201","Application Data"
"85","5.369911461","2601:5cf:4100:3de0:71ad:d37e:96b9:4fe2","2606:4700::6810:f9f9","TCP","86","39254  >  443 [ACK] Seq=958 Ack=4122 Win=64128 Len=0 TSval=1022704241 TSecr=3411149904"
"86","5.370144183","2601:5cf:4100:3de0:71ad:d37e:96b9:4fe2","2606:4700::6810:f9f9","TCP","86","39254  >  443 [FIN, ACK] Seq=958 Ack=4122 Win=64128 Len=0 TSval=1022704242 TSecr=3411149904"
"87","5.395248408","2601:5cf:4100:3de0:71ad:d37e:96b9:4fe2","2606:4700::6810:f9f9","TCP","94","39268  >  443 [SYN] Seq=0 Win=64800 Len=0 MSS=1440 SACK_PERM TSval=1022704267 TSecr=0 WS=128"
"91","5.696268934","2601:5cf:4100:3de0:71ad:d37e:96b9:4fe2","2606:4700::6810:f9f9","TCP","86","[TCP Retransmission] 39254  >  443 [FIN, ACK] Seq=958 Ack=4122 Win=64128 Len=0 TSval=1022704568 TSecr=3411149904"
"95","5.894234854","2606:4700::6810:f9f9","2601:5cf:4100:3de0:71ad:d37e:96b9:4fe2","TCP","98","[TCP Previous segment not captured] 443  >  39254 [ACK] Seq=4123 Ack=959 Win=65536 Len=0 TSval=3411150455 TSecr=1022704568 SLE=958 SRE=959"
"96","5.894234994","2606:4700::6810:f9f9","2601:5cf:4100:3de0:71ad:d37e:96b9:4fe2","TCP","86","[TCP Out-Of-Order] 443  >  39254 [FIN, ACK] Seq=4122 Ack=959 Win=65536 Len=0 TSval=3411150469 TSecr=1022704568"
"97","5.894278567","2601:5cf:4100:3de0:71ad:d37e:96b9:4fe2","2606:4700::6810:f9f9","TCP","86","39254  >  443 [ACK] Seq=959 Ack=4123 Win=64128 Len=0 TSval=1022704766 TSecr=3411150469"
"100","6.400195153","2601:5cf:4100:3de0:71ad:d37e:96b9:4fe2","2606:4700::6810:f9f9","TCP","94","[TCP Retransmission] 39268  >  443 [SYN] Seq=0 Win=64800 Len=0 MSS=1440 SACK_PERM TSval=1022705272 TSecr=0 WS=128"
"101","6.493693856","2606:4700::6810:f9f9","2601:5cf:4100:3de0:71ad:d37e:96b9:4fe2","TCP","94","443  >  39268 [SYN, ACK] Seq=0 Ack=1 Win=64704 Len=0 MSS=1360 SACK_PERM TSval=915162428 TSecr=1022704267 WS=8192"
"102","6.493752487","2601:5cf:4100:3de0:71ad:d37e:96b9:4fe2","2606:4700::6810:f9f9","TCP","86","39268  >  443 [ACK] Seq=1 Ack=1 Win=64896 Len=0 TSval=1022705365 TSecr=915162428"
"103","6.494343549","2601:5cf:4100:3de0:71ad:d37e:96b9:4fe2","2606:4700::6810:f9f9","TLSv1.3","603","Client Hello (SNI=cloudflare-dns.com)"
"104","6.596784631","2606:4700::6810:f9f9","2601:5cf:4100:3de0:71ad:d37e:96b9:4fe2","TCP","94","[TCP Retransmission] 443  >  39268 [SYN, ACK] Seq=0 Ack=1 Win=64704 Len=0 MSS=1360 SACK_PERM TSval=915162472 TSecr=1022704267 WS=8192"
"105","6.596785172","2606:4700::6810:f9f9","2601:5cf:4100:3de0:71ad:d37e:96b9:4fe2","TCP","86","443  >  39268 [ACK] Seq=1 Ack=518 Win=57344 Len=0 TSval=915162481 TSecr=1022705366"
"106","6.596785413","2606:4700::6810:f9f9","2601:5cf:4100:3de0:71ad:d37e:96b9:4fe2","TLSv1.3","3385","Server Hello, Change Cipher Spec, Application Data"
"107","6.596825539","2601:5cf:4100:3de0:71ad:d37e:96b9:4fe2","2606:4700::6810:f9f9","TCP","86","[TCP Dup ACK 102#1] 39268  >  443 [ACK] Seq=518 Ack=1 Win=64896 Len=0 TSval=1022705468 TSecr=915162428"
"108","6.596876045","2601:5cf:4100:3de0:71ad:d37e:96b9:4fe2","2606:4700::6810:f9f9","TCP","86","39268  >  443 [ACK] Seq=518 Ack=3300 Win=62976 Len=0 TSval=1022705468 TSecr=915162483"
"109","6.598049171","2601:5cf:4100:3de0:71ad:d37e:96b9:4fe2","2606:4700::6810:f9f9","TLSv1.3","166","Change Cipher Spec, Application Data"
"110","6.698620455","2606:4700::6810:f9f9","2601:5cf:4100:3de0:71ad:d37e:96b9:4fe2","TLSv1.3","646","Application Data, Application Data"
"111","6.698653287","2601:5cf:4100:3de0:71ad:d37e:96b9:4fe2","2606:4700::6810:f9f9","TLSv1.3","410","Application Data, Application Data, Application Data, Application Data"
"112","6.801769180","2606:4700::6810:f9f9","2601:5cf:4100:3de0:71ad:d37e:96b9:4fe2","TLSv1.3","117","Application Data"
"113","6.801794268","2601:5cf:4100:3de0:71ad:d37e:96b9:4fe2","2606:4700::6810:f9f9","TLSv1.3","117","Application Data"
"114","6.903541604","2606:4700::6810:f9f9","2601:5cf:4100:3de0:71ad:d37e:96b9:4fe2","TCP","86","443  >  39268 [ACK] Seq=3891 Ack=953 Win=65536 Len=0 TSval=915162826 TSecr=1022705673"
"115","7.621771439","2606:4700::6810:f9f9","2601:5cf:4100:3de0:71ad:d37e:96b9:4fe2","TLSv1.3","203","Application Data"
"116","7.621864937","2606:4700::6810:f9f9","2601:5cf:4100:3de0:71ad:d37e:96b9:4fe2","TLSv1.3","294","Application Data"
"117","7.622620982","2601:5cf:4100:3de0:71ad:d37e:96b9:4fe2","2606:4700::6810:f9f9","TCP","86","39268  >  443 [ACK] Seq=953 Ack=4216 Win=64128 Len=0 TSval=1022706494 TSecr=915163503"
"118","7.622856328","2601:5cf:4100:3de0:71ad:d37e:96b9:4fe2","2606:4700::6810:f9f9","TCP","86","39268  >  443 [FIN, ACK] Seq=953 Ack=4216 Win=64128 Len=0 TSval=1022706494 TSecr=915163503"
"120","7.723790652","2606:4700::6810:f9f9","2601:5cf:4100:3de0:71ad:d37e:96b9:4fe2","TCP","86","443  >  39268 [FIN, ACK] Seq=4216 Ack=954 Win=65536 Len=0 TSval=915163612 TSecr=1022706494"
"122","7.723838092","2601:5cf:4100:3de0:71ad:d37e:96b9:4fe2","2606:4700::6810:f9f9","TCP","86","39268  >  443 [ACK] Seq=954 Ack=4217 Win=64128 Len=0 TSval=1022706595 TSecr=915163612"
"168","9.178732706","2601:5cf:4100:3de0:71ad:d37e:96b9:4fe2","2606:4700::6810:f9f9","TCP","94","52692  >  443 [SYN] Seq=0 Win=64800 Len=0 MSS=1440 SACK_PERM TSval=1022708050 TSecr=0 WS=128"
"170","9.258359299","2606:4700::6810:f9f9","2601:5cf:4100:3de0:71ad:d37e:96b9:4fe2","TCP","94","443  >  52692 [SYN, ACK] Seq=0 Ack=1 Win=64704 Len=0 MSS=1360 SACK_PERM TSval=3599530451 TSecr=1022708050 WS=8192"
"172","9.258480759","2601:5cf:4100:3de0:71ad:d37e:96b9:4fe2","2606:4700::6810:f9f9","TCP","86","52692  >  443 [ACK] Seq=1 Ack=1 Win=64896 Len=0 TSval=1022708130 TSecr=3599530451"
"173","9.258928539","2601:5cf:4100:3de0:71ad:d37e:96b9:4fe2","2606:4700::6810:f9f9","TLSv1.3","603","Client Hello (SNI=cloudflare-dns.com)"
"174","9.361323374","2606:4700::6810:f9f9","2601:5cf:4100:3de0:71ad:d37e:96b9:4fe2","TCP","86","443  >  52692 [ACK] Seq=1 Ack=518 Win=57344 Len=0 TSval=3599530531 TSecr=1022708130"
"175","9.361461677","2606:4700::6810:f9f9","2601:5cf:4100:3de0:71ad:d37e:96b9:4fe2","TLSv1.3","3384","Server Hello, Change Cipher Spec, Application Data"
"176","9.361487907","2601:5cf:4100:3de0:71ad:d37e:96b9:4fe2","2606:4700::6810:f9f9","TCP","86","52692  >  443 [ACK] Seq=518 Ack=3299 Win=62976 Len=0 TSval=1022708233 TSecr=3599530532"
"177","9.362913231","2601:5cf:4100:3de0:71ad:d37e:96b9:4fe2","2606:4700::6810:f9f9","TLSv1.3","166","Change Cipher Spec, Application Data"
"178","9.464200726","2606:4700::6810:f9f9","2601:5cf:4100:3de0:71ad:d37e:96b9:4fe2","TLSv1.3","646","Application Data, Application Data"
"179","9.464245271","2601:5cf:4100:3de0:71ad:d37e:96b9:4fe2","2606:4700::6810:f9f9","TLSv1.3","406","Application Data, Application Data, Application Data, Application Data"
"180","9.565968943","2606:4700::6810:f9f9","2601:5cf:4100:3de0:71ad:d37e:96b9:4fe2","TLSv1.3","117","Application Data"
"181","9.565995013","2601:5cf:4100:3de0:71ad:d37e:96b9:4fe2","2606:4700::6810:f9f9","TLSv1.3","117","Application Data"
"182","9.668495409","2606:4700::6810:f9f9","2601:5cf:4100:3de0:71ad:d37e:96b9:4fe2","TCP","86","443  >  52692 [ACK] Seq=3890 Ack=949 Win=65536 Len=0 TSval=3599530872 TSecr=1022708438"
"183","9.668495639","2606:4700::6810:f9f9","2601:5cf:4100:3de0:71ad:d37e:96b9:4fe2","TLSv1.3","202","Application Data"
"184","9.668495669","2606:4700::6810:f9f9","2601:5cf:4100:3de0:71ad:d37e:96b9:4fe2","TLSv1.3","199","Application Data"
"185","9.669124463","2601:5cf:4100:3de0:71ad:d37e:96b9:4fe2","2606:4700::6810:f9f9","TCP","86","52692  >  443 [ACK] Seq=949 Ack=4119 Win=64128 Len=0 TSval=1022708541 TSecr=3599530883"
"186","9.669338409","2601:5cf:4100:3de0:71ad:d37e:96b9:4fe2","2606:4700::6810:f9f9","TCP","86","52692  >  443 [FIN, ACK] Seq=949 Ack=4119 Win=64128 Len=0 TSval=1022708541 TSecr=3599530883"
"187","9.694592909","2601:5cf:4100:3de0:71ad:d37e:96b9:4fe2","2606:4700::6810:f9f9","TCP","94","52706  >  443 [SYN] Seq=0 Win=64800 Len=0 MSS=1440 SACK_PERM TSval=1022708566 TSecr=0 WS=128"
"188","9.780871684","2606:4700::6810:f9f9","2601:5cf:4100:3de0:71ad:d37e:96b9:4fe2","TCP","86","443  >  52692 [FIN, ACK] Seq=4119 Ack=950 Win=65536 Len=0 TSval=3599530943 TSecr=1022708541"
"189","9.780904196","2601:5cf:4100:3de0:71ad:d37e:96b9:4fe2","2606:4700::6810:f9f9","TCP","86","52692  >  443 [ACK] Seq=950 Ack=4120 Win=64128 Len=0 TSval=1022708652 TSecr=3599530943"
"190","9.879932986","2606:4700::6810:f9f9","2601:5cf:4100:3de0:71ad:d37e:96b9:4fe2","TCP","94","443  >  52706 [SYN, ACK] Seq=0 Ack=1 Win=64704 Len=0 MSS=1360 SACK_PERM TSval=1948922209 TSecr=1022708566 WS=8192"
"191","9.879974876","2601:5cf:4100:3de0:71ad:d37e:96b9:4fe2","2606:4700::6810:f9f9","TCP","86","52706  >  443 [ACK] Seq=1 Ack=1 Win=64896 Len=0 TSval=1022708751 TSecr=1948922209"
"192","9.880336011","2601:5cf:4100:3de0:71ad:d37e:96b9:4fe2","2606:4700::6810:f9f9","TLSv1.3","603","Client Hello (SNI=cloudflare-dns.com)"
"193","9.975660068","2606:4700::6810:f9f9","2601:5cf:4100:3de0:71ad:d37e:96b9:4fe2","TCP","86","443  >  52706 [ACK] Seq=1 Ack=518 Win=57344 Len=0 TSval=1948922302 TSecr=1022708752"
"194","9.975763605","2606:4700::6810:f9f9","2601:5cf:4100:3de0:71ad:d37e:96b9:4fe2","TLSv1.3","3385","Server Hello, Change Cipher Spec, Application Data"
"195","9.975789374","2601:5cf:4100:3de0:71ad:d37e:96b9:4fe2","2606:4700::6810:f9f9","TCP","86","52706  >  443 [ACK] Seq=518 Ack=3300 Win=62976 Len=0 TSval=1022708847 TSecr=1948922303"
"196","9.977201754","2601:5cf:4100:3de0:71ad:d37e:96b9:4fe2","2606:4700::6810:f9f9","TLSv1.3","166","Change Cipher Spec, Application Data"
"197","10.080530922","2606:4700::6810:f9f9","2601:5cf:4100:3de0:71ad:d37e:96b9:4fe2","TLSv1.3","646","Application Data, Application Data"
"198","10.080576518","2601:5cf:4100:3de0:71ad:d37e:96b9:4fe2","2606:4700::6810:f9f9","TLSv1.3","408","Application Data, Application Data, Application Data, Application Data"
"199","10.390609102","2606:4700::6810:f9f9","2601:5cf:4100:3de0:71ad:d37e:96b9:4fe2","TLSv1.3","117","Application Data"
"200","10.390609332","2606:4700::6810:f9f9","2601:5cf:4100:3de0:71ad:d37e:96b9:4fe2","TLSv1.3","202","Application Data"
"201","10.390609372","2606:4700::6810:f9f9","2601:5cf:4100:3de0:71ad:d37e:96b9:4fe2","TLSv1.3","198","Application Data"
"202","10.390609412","2606:4700::6810:f9f9","2601:5cf:4100:3de0:71ad:d37e:96b9:4fe2","TCP","198","[TCP Retransmission] 443  >  52706 [PSH, ACK] Seq=4007 Ack=920 Win=65536 Len=112 TSval=1948922741 TSecr=1022708952"
"203","10.390636424","2601:5cf:4100:3de0:71ad:d37e:96b9:4fe2","2606:4700::6810:f9f9","TLSv1.3","117","Application Data"
"204","10.390654027","2601:5cf:4100:3de0:71ad:d37e:96b9:4fe2","2606:4700::6810:f9f9","TCP","98","52706  >  443 [ACK] Seq=951 Ack=4119 Win=64128 Len=0 TSval=1022709262 TSecr=1948922540 SLE=4007 SRE=4119"
"205","10.391935940","2601:5cf:4100:3de0:71ad:d37e:96b9:4fe2","2606:4700::6810:f9f9","TCP","86","52706  >  443 [FIN, ACK] Seq=951 Ack=4119 Win=64128 Len=0 TSval=1022709263 TSecr=1948922540"
"206","10.425383026","2601:5cf:4100:3de0:71ad:d37e:96b9:4fe2","2606:4700::6810:f9f9","TCP","94","52712  >  443 [SYN] Seq=0 Win=64800 Len=0 MSS=1440 SACK_PERM TSval=1022709297 TSecr=0 WS=128"
"207","10.505422643","2606:4700::6810:f9f9","2601:5cf:4100:3de0:71ad:d37e:96b9:4fe2","TCP","86","443  >  52706 [FIN, ACK] Seq=4119 Ack=952 Win=65536 Len=0 TSval=1948922823 TSecr=1022709262"
"208","10.505472177","2601:5cf:4100:3de0:71ad:d37e:96b9:4fe2","2606:4700::6810:f9f9","TCP","86","52706  >  443 [ACK] Seq=952 Ack=4120 Win=64128 Len=0 TSval=1022709377 TSecr=1948922823"
"209","10.540022306","2606:4700::6810:f9f9","2601:5cf:4100:3de0:71ad:d37e:96b9:4fe2","TCP","94","443  >  52712 [SYN, ACK] Seq=0 Ack=1 Win=64704 Len=0 MSS=1360 SACK_PERM TSval=961804396 TSecr=1022709297 WS=8192"
"210","10.540133587","2601:5cf:4100:3de0:71ad:d37e:96b9:4fe2","2606:4700::6810:f9f9","TCP","86","52712  >  443 [ACK] Seq=1 Ack=1 Win=64896 Len=0 TSval=1022709412 TSecr=961804396"
"211","10.540748965","2601:5cf:4100:3de0:71ad:d37e:96b9:4fe2","2606:4700::6810:f9f9","TLSv1.3","603","Client Hello (SNI=cloudflare-dns.com)"
"212","10.692696408","2606:4700::6810:f9f9","2601:5cf:4100:3de0:71ad:d37e:96b9:4fe2","TCP","86","443  >  52712 [ACK] Seq=1 Ack=518 Win=57344 Len=0 TSval=961804448 TSecr=1022709412"
"213","10.692696849","2606:4700::6810:f9f9","2601:5cf:4100:3de0:71ad:d37e:96b9:4fe2","TLSv1.3","3384","Server Hello, Change Cipher Spec, Application Data"
"214","10.692751252","2601:5cf:4100:3de0:71ad:d37e:96b9:4fe2","2606:4700::6810:f9f9","TCP","86","52712  >  443 [ACK] Seq=518 Ack=3299 Win=62976 Len=0 TSval=1022709564 TSecr=961804450"
"215","10.693930570","2601:5cf:4100:3de0:71ad:d37e:96b9:4fe2","2606:4700::6810:f9f9","TLSv1.3","166","Change Cipher Spec, Application Data"
"216","10.696769517","2606:4700::6810:f9f9","2601:5cf:4100:3de0:71ad:d37e:96b9:4fe2","TCP","688","[TCP Spurious Retransmission] 443  >  52712 [PSH, ACK] Seq=2697 Ack=518 Win=65536 Len=602 TSval=961804563 TSecr=1022709412"
"217","10.696808912","2601:5cf:4100:3de0:71ad:d37e:96b9:4fe2","2606:4700::6810:f9f9","TCP","98","[TCP Dup ACK 214#1] 52712  >  443 [ACK] Seq=598 Ack=3299 Win=64128 Len=0 TSval=1022709568 TSecr=961804563 SLE=2697 SRE=3299"
"218","10.794659997","2606:4700::6810:f9f9","2601:5cf:4100:3de0:71ad:d37e:96b9:4fe2","TLSv1.3","646","Application Data, Application Data"
"219","10.794703078","2601:5cf:4100:3de0:71ad:d37e:96b9:4fe2","2606:4700::6810:f9f9","TLSv1.3","411","Application Data, Application Data, Application Data, Application Data"
"220","11.000298489","2606:4700::6810:f9f9","2601:5cf:4100:3de0:71ad:d37e:96b9:4fe2","TLSv1.3","117","Application Data"
"221","11.000323727","2601:5cf:4100:3de0:71ad:d37e:96b9:4fe2","2606:4700::6810:f9f9","TLSv1.3","117","Application Data"
"222","11.102330496","2606:4700::6810:f9f9","2601:5cf:4100:3de0:71ad:d37e:96b9:4fe2","TCP","86","443  >  52712 [ACK] Seq=3890 Ack=954 Win=65536 Len=0 TSval=961804941 TSecr=1022709872"
"226","11.613953430","2606:4700::6810:f9f9","2601:5cf:4100:3de0:71ad:d37e:96b9:4fe2","TLSv1.3","203","Application Data"
"227","11.613994307","2606:4700::6810:f9f9","2601:5cf:4100:3de0:71ad:d37e:96b9:4fe2","TLSv1.3","295","Application Data"
"228","11.614583115","2601:5cf:4100:3de0:71ad:d37e:96b9:4fe2","2606:4700::6810:f9f9","TCP","86","52712  >  443 [ACK] Seq=954 Ack=4216 Win=64128 Len=0 TSval=1022710486 TSecr=961805430"
"229","11.614811879","2601:5cf:4100:3de0:71ad:d37e:96b9:4fe2","2606:4700::6810:f9f9","TCP","86","52712  >  443 [FIN, ACK] Seq=954 Ack=4216 Win=64128 Len=0 TSval=1022710486 TSecr=961805430"
"231","11.716689995","2606:4700::6810:f9f9","2601:5cf:4100:3de0:71ad:d37e:96b9:4fe2","TCP","86","443  >  52712 [FIN, ACK] Seq=4216 Ack=955 Win=65536 Len=0 TSval=961805529 TSecr=1022710486"
"233","11.716736443","2601:5cf:4100:3de0:71ad:d37e:96b9:4fe2","2606:4700::6810:f9f9","TCP","86","52712  >  443 [ACK] Seq=955 Ack=4217 Win=64128 Len=0 TSval=1022710588 TSecr=961805529"
"272","12.969132545","2601:5cf:4100:3de0:71ad:d37e:96b9:4fe2","2606:4700::6810:f9f9","TCP","94","52724  >  443 [SYN] Seq=0 Win=64800 Len=0 MSS=1440 SACK_PERM TSval=1022711841 TSecr=0 WS=128"
"275","13.150018011","2606:4700::6810:f9f9","2601:5cf:4100:3de0:71ad:d37e:96b9:4fe2","TCP","94","443  >  52724 [SYN, ACK] Seq=0 Ack=1 Win=64704 Len=0 MSS=1360 SACK_PERM TSval=3663974150 TSecr=1022711841 WS=8192"
"276","13.150076512","2601:5cf:4100:3de0:71ad:d37e:96b9:4fe2","2606:4700::6810:f9f9","TCP","86","52724  >  443 [ACK] Seq=1 Ack=1 Win=64896 Len=0 TSval=1022712022 TSecr=3663974150"
"277","13.150761622","2601:5cf:4100:3de0:71ad:d37e:96b9:4fe2","2606:4700::6810:f9f9","TLSv1.3","603","Client Hello (SNI=cloudflare-dns.com)"
"278","13.252535801","2606:4700::6810:f9f9","2601:5cf:4100:3de0:71ad:d37e:96b9:4fe2","TCP","86","443  >  52724 [ACK] Seq=1 Ack=518 Win=57344 Len=0 TSval=3663974269 TSecr=1022712022"
"279","13.256571850","2606:4700::6810:f9f9","2601:5cf:4100:3de0:71ad:d37e:96b9:4fe2","TLSv1.3","3385","Server Hello, Change Cipher Spec, Application Data"
"280","13.256616073","2601:5cf:4100:3de0:71ad:d37e:96b9:4fe2","2606:4700::6810:f9f9","TCP","86","52724  >  443 [ACK] Seq=518 Ack=3300 Win=62976 Len=0 TSval=1022712128 TSecr=3663974270"
"281","13.257805791","2601:5cf:4100:3de0:71ad:d37e:96b9:4fe2","2606:4700::6810:f9f9","TLSv1.3","166","Change Cipher Spec, Application Data"
"282","13.359509446","2606:4700::6810:f9f9","2601:5cf:4100:3de0:71ad:d37e:96b9:4fe2","TLSv1.3","646","Application Data, Application Data"
"283","13.359535024","2601:5cf:4100:3de0:71ad:d37e:96b9:4fe2","2606:4700::6810:f9f9","TLSv1.3","415","Application Data, Application Data, Application Data, Application Data"
"284","13.457475269","2606:4700::6810:f9f9","2601:5cf:4100:3de0:71ad:d37e:96b9:4fe2","TLSv1.3","117","Application Data"
"285","13.457519433","2601:5cf:4100:3de0:71ad:d37e:96b9:4fe2","2606:4700::6810:f9f9","TLSv1.3","117","Application Data"
"286","13.457737366","2606:4700::6810:f9f9","2601:5cf:4100:3de0:71ad:d37e:96b9:4fe2","TLSv1.3","202","Application Data"
"287","13.457737577","2606:4700::6810:f9f9","2601:5cf:4100:3de0:71ad:d37e:96b9:4fe2","TLSv1.3","209","Application Data"
"288","13.458307829","2601:5cf:4100:3de0:71ad:d37e:96b9:4fe2","2606:4700::6810:f9f9","TCP","86","52724  >  443 [ACK] Seq=958 Ack=4130 Win=64128 Len=0 TSval=1022712330 TSecr=3663974502"
"289","13.458517617","2601:5cf:4100:3de0:71ad:d37e:96b9:4fe2","2606:4700::6810:f9f9","TCP","86","52724  >  443 [FIN, ACK] Seq=958 Ack=4130 Win=64128 Len=0 TSval=1022712330 TSecr=3663974502"
"290","13.484674590","2601:5cf:4100:3de0:71ad:d37e:96b9:4fe2","2606:4700::6810:f9f9","TCP","94","52740  >  443 [SYN] Seq=0 Win=64800 Len=0 MSS=1440 SACK_PERM TSval=1022712356 TSecr=0 WS=128"
"291","13.560772028","2606:4700::6810:f9f9","2601:5cf:4100:3de0:71ad:d37e:96b9:4fe2","TCP","86","443  >  52724 [FIN, ACK] Seq=4130 Ack=959 Win=65536 Len=0 TSval=3663974572 TSecr=1022712329"
"292","13.560821181","2601:5cf:4100:3de0:71ad:d37e:96b9:4fe2","2606:4700::6810:f9f9","TCP","86","52724  >  443 [ACK] Seq=959 Ack=4131 Win=64128 Len=0 TSval=1022712432 TSecr=3663974572"
"294","13.661929507","2606:4700::6810:f9f9","2601:5cf:4100:3de0:71ad:d37e:96b9:4fe2","TCP","94","443  >  52740 [SYN, ACK] Seq=0 Ack=1 Win=64704 Len=0 MSS=1360 SACK_PERM TSval=4217175491 TSecr=1022712356 WS=8192"
"295","13.661963622","2601:5cf:4100:3de0:71ad:d37e:96b9:4fe2","2606:4700::6810:f9f9","TCP","86","52740  >  443 [ACK] Seq=1 Ack=1 Win=64896 Len=0 TSval=1022712533 TSecr=4217175491"
"296","13.662319497","2601:5cf:4100:3de0:71ad:d37e:96b9:4fe2","2606:4700::6810:f9f9","TLSv1.3","603","Client Hello (SNI=cloudflare-dns.com)"
"297","13.711589368","2606:4700::6810:f9f9","2601:5cf:4100:3de0:71ad:d37e:96b9:4fe2","TCP","86","443  >  52740 [ACK] Seq=1 Ack=518 Win=57344 Len=0 TSval=4217175604 TSecr=1022712534"
"298","13.764381332","2606:4700::6810:f9f9","2601:5cf:4100:3de0:71ad:d37e:96b9:4fe2","TLSv1.3","3384","Server Hello, Change Cipher Spec, Application Data"
"299","13.764410648","2601:5cf:4100:3de0:71ad:d37e:96b9:4fe2","2606:4700::6810:f9f9","TCP","86","52740  >  443 [ACK] Seq=518 Ack=3299 Win=62976 Len=0 TSval=1022712636 TSecr=4217175607"
"300","13.765408982","2601:5cf:4100:3de0:71ad:d37e:96b9:4fe2","2606:4700::6810:f9f9","TLSv1.3","166","Change Cipher Spec, Application Data"
"301","13.865598856","2606:4700::6810:f9f9","2601:5cf:4100:3de0:71ad:d37e:96b9:4fe2","TLSv1.3","646","Application Data, Application Data"
"302","13.865633361","2601:5cf:4100:3de0:71ad:d37e:96b9:4fe2","2606:4700::6810:f9f9","TLSv1.3","412","Application Data, Application Data, Application Data, Application Data"
"303","14.071772295","2606:4700::6810:f9f9","2601:5cf:4100:3de0:71ad:d37e:96b9:4fe2","TLSv1.3","117","Application Data"
"304","14.071772515","2606:4700::6810:f9f9","2601:5cf:4100:3de0:71ad:d37e:96b9:4fe2","TLSv1.3","202","Application Data"
"305","14.071772556","2606:4700::6810:f9f9","2601:5cf:4100:3de0:71ad:d37e:96b9:4fe2","TLSv1.3","149","Application Data"
"306","14.071801831","2601:5cf:4100:3de0:71ad:d37e:96b9:4fe2","2606:4700::6810:f9f9","TLSv1.3","117","Application Data"
"307","14.072492842","2601:5cf:4100:3de0:71ad:d37e:96b9:4fe2","2606:4700::6810:f9f9","TCP","86","52740  >  443 [ACK] Seq=955 Ack=4069 Win=64128 Len=0 TSval=1022712944 TSecr=4217175806"
"308","14.072708011","2601:5cf:4100:3de0:71ad:d37e:96b9:4fe2","2606:4700::6810:f9f9","TCP","86","52740  >  443 [FIN, ACK] Seq=955 Ack=4069 Win=64128 Len=0 TSval=1022712944 TSecr=4217175806"
"310","14.172113725","2606:4700::6810:f9f9","2601:5cf:4100:3de0:71ad:d37e:96b9:4fe2","TCP","86","443  >  52740 [FIN, ACK] Seq=4069 Ack=956 Win=65536 Len=0 TSval=4217176019 TSecr=1022712943"
"311","14.172174641","2601:5cf:4100:3de0:71ad:d37e:96b9:4fe2","2606:4700::6810:f9f9","TCP","86","52740  >  443 [ACK] Seq=956 Ack=4070 Win=64128 Len=0 TSval=1022713044 TSecr=4217176019"
"348","15.334247675","2601:5cf:4100:3de0:71ad:d37e:96b9:4fe2","2606:4700::6810:f9f9","TCP","94","52742  >  443 [SYN] Seq=0 Win=64800 Len=0 MSS=1440 SACK_PERM TSval=1022714206 TSecr=0 WS=128"
"351","15.607563772","2606:4700::6810:f9f9","2601:5cf:4100:3de0:71ad:d37e:96b9:4fe2","TCP","94","443  >  52742 [SYN, ACK] Seq=0 Ack=1 Win=64704 Len=0 MSS=1360 SACK_PERM TSval=3497895484 TSecr=1022714206 WS=8192"
"352","15.607597016","2601:5cf:4100:3de0:71ad:d37e:96b9:4fe2","2606:4700::6810:f9f9","TCP","86","52742  >  443 [ACK] Seq=1 Ack=1 Win=64896 Len=0 TSval=1022714479 TSecr=3497895484"
"353","15.607954564","2601:5cf:4100:3de0:71ad:d37e:96b9:4fe2","2606:4700::6810:f9f9","TLSv1.3","603","Client Hello (SNI=cloudflare-dns.com)"
"354","15.657343281","2606:4700::6810:f9f9","2601:5cf:4100:3de0:71ad:d37e:96b9:4fe2","TCP","86","443  >  52742 [ACK] Seq=1 Ack=518 Win=57344 Len=0 TSval=3497895688 TSecr=1022714479"
"355","15.712705132","2606:4700::6810:f9f9","2601:5cf:4100:3de0:71ad:d37e:96b9:4fe2","TLSv1.3","3386","Server Hello, Change Cipher Spec, Application Data"
"356","15.712751770","2601:5cf:4100:3de0:71ad:d37e:96b9:4fe2","2606:4700::6810:f9f9","TCP","86","52742  >  443 [ACK] Seq=518 Ack=3301 Win=62976 Len=0 TSval=1022714584 TSecr=3497895690"
"357","15.713695651","2601:5cf:4100:3de0:71ad:d37e:96b9:4fe2","2606:4700::6810:f9f9","TLSv1.3","166","Change Cipher Spec, Application Data"
"358","15.814958540","2606:4700::6810:f9f9","2601:5cf:4100:3de0:71ad:d37e:96b9:4fe2","TLSv1.3","646","Application Data, Application Data"
"359","15.815013184","2601:5cf:4100:3de0:71ad:d37e:96b9:4fe2","2606:4700::6810:f9f9","TLSv1.3","408","Application Data, Application Data, Application Data, Application Data"
"360","16.119677298","2606:4700::6810:f9f9","2601:5cf:4100:3de0:71ad:d37e:96b9:4fe2","TLSv1.3","117","Application Data"
"361","16.119702666","2601:5cf:4100:3de0:71ad:d37e:96b9:4fe2","2606:4700::6810:f9f9","TLSv1.3","117","Application Data"
"362","16.324641837","2606:4700::6810:f9f9","2601:5cf:4100:3de0:71ad:d37e:96b9:4fe2","TCP","86","443  >  52742 [ACK] Seq=3892 Ack=951 Win=65536 Len=0 TSval=3497896241 TSecr=1022714991"
"363","16.528984897","2606:4700::6810:f9f9","2601:5cf:4100:3de0:71ad:d37e:96b9:4fe2","TLSv1.3","202","Application Data"
"364","16.529076862","2606:4700::6810:f9f9","2601:5cf:4100:3de0:71ad:d37e:96b9:4fe2","TLSv1.3","278","Application Data"
"365","16.529795375","2601:5cf:4100:3de0:71ad:d37e:96b9:4fe2","2606:4700::6810:f9f9","TCP","86","52742  >  443 [ACK] Seq=951 Ack=4200 Win=64128 Len=0 TSval=1022715401 TSecr=3497896403"
"366","16.530033116","2601:5cf:4100:3de0:71ad:d37e:96b9:4fe2","2606:4700::6810:f9f9","TCP","86","52742  >  443 [FIN, ACK] Seq=951 Ack=4200 Win=64128 Len=0 TSval=1022715402 TSecr=3497896403"
"367","16.558363835","2601:5cf:4100:3de0:71ad:d37e:96b9:4fe2","2606:4700::6810:f9f9","TCP","94","52744  >  443 [SYN] Seq=0 Win=64800 Len=0 MSS=1440 SACK_PERM TSval=1022715430 TSecr=0 WS=128"
"368","16.631591518","2606:4700::6810:f9f9","2601:5cf:4100:3de0:71ad:d37e:96b9:4fe2","TCP","86","443  >  52742 [FIN, ACK] Seq=4200 Ack=952 Win=65536 Len=0 TSval=3497896617 TSecr=1022715402"
"369","16.631617237","2601:5cf:4100:3de0:71ad:d37e:96b9:4fe2","2606:4700::6810:f9f9","TCP","86","52742  >  443 [ACK] Seq=952 Ack=4201 Win=64128 Len=0 TSval=1022715503 TSecr=3497896617"
"370","16.631725723","2606:4700::6810:f9f9","2601:5cf:4100:3de0:71ad:d37e:96b9:4fe2","TCP","94","443  >  52744 [SYN, ACK] Seq=0 Ack=1 Win=64704 Len=0 MSS=1360 SACK_PERM TSval=3158190003 TSecr=1022715430 WS=8192"
"371","16.631739659","2601:5cf:4100:3de0:71ad:d37e:96b9:4fe2","2606:4700::6810:f9f9","TCP","86","52744  >  443 [ACK] Seq=1 Ack=1 Win=64896 Len=0 TSval=1022715503 TSecr=3158190003"
"372","16.632120582","2601:5cf:4100:3de0:71ad:d37e:96b9:4fe2","2606:4700::6810:f9f9","TLSv1.3","603","Client Hello (SNI=cloudflare-dns.com)"
"373","16.733792869","2606:4700::6810:f9f9","2601:5cf:4100:3de0:71ad:d37e:96b9:4fe2","TCP","86","443  >  52744 [ACK] Seq=1 Ack=518 Win=57344 Len=0 TSval=3158190067 TSecr=1022715504"
"374","16.734120009","2606:4700::6810:f9f9","2601:5cf:4100:3de0:71ad:d37e:96b9:4fe2","TLSv1.3","3385","Server Hello, Change Cipher Spec, Application Data"
"375","16.734151449","2601:5cf:4100:3de0:71ad:d37e:96b9:4fe2","2606:4700::6810:f9f9","TCP","86","52744  >  443 [ACK] Seq=518 Ack=3300 Win=62976 Len=0 TSval=1022715606 TSecr=3158190069"
"376","16.735446757","2601:5cf:4100:3de0:71ad:d37e:96b9:4fe2","2606:4700::6810:f9f9","TLSv1.3","166","Change Cipher Spec, Application Data"
"377","16.837080712","2606:4700::6810:f9f9","2601:5cf:4100:3de0:71ad:d37e:96b9:4fe2","TLSv1.3","646","Application Data, Application Data"
"378","16.837125527","2601:5cf:4100:3de0:71ad:d37e:96b9:4fe2","2606:4700::6810:f9f9","TLSv1.3","409","Application Data, Application Data, Application Data, Application Data"
"379","16.900277852","2606:4700::6810:f9f9","2601:5cf:4100:3de0:71ad:d37e:96b9:4fe2","TLSv1.3","117","Application Data"
"380","16.900321836","2601:5cf:4100:3de0:71ad:d37e:96b9:4fe2","2606:4700::6810:f9f9","TLSv1.3","117","Application Data"
"381","16.936984494","2606:4700::6810:f9f9","2601:5cf:4100:3de0:71ad:d37e:96b9:4fe2","TLSv1.3","202","Application Data"
"382","16.937263824","2606:4700::6810:f9f9","2601:5cf:4100:3de0:71ad:d37e:96b9:4fe2","TLSv1.3","200","Application Data"
"383","16.938181927","2601:5cf:4100:3de0:71ad:d37e:96b9:4fe2","2606:4700::6810:f9f9","TCP","86","52744  >  443 [ACK] Seq=952 Ack=4121 Win=64128 Len=0 TSval=1022715810 TSecr=3158190301"
"384","16.938403617","2601:5cf:4100:3de0:71ad:d37e:96b9:4fe2","2606:4700::6810:f9f9","TCP","86","52744  >  443 [FIN, ACK] Seq=952 Ack=4121 Win=64128 Len=0 TSval=1022715810 TSecr=3158190301"
"386","16.995439656","2606:4700::6810:f9f9","2601:5cf:4100:3de0:71ad:d37e:96b9:4fe2","TCP","86","443  >  52744 [FIN, ACK] Seq=4121 Ack=953 Win=65536 Len=0 TSval=3158190364 TSecr=1022715772"
"387","16.995474993","2601:5cf:4100:3de0:71ad:d37e:96b9:4fe2","2606:4700::6810:f9f9","TCP","86","52744  >  443 [ACK] Seq=953 Ack=4122 Win=64128 Len=0 TSval=1022715867 TSecr=3158190364"
