"No.","Time","Source","Destination","Protocol","Length","Type","HTTP2 Length","TCP Header Length","TLS Length","Info"
"8","2.562258071","2601:5cf:4100:3de0:53f4:479c:be9c:997d","2606:4700::6810:f8f9","TCP","94","","","40","","58480  >  443 [SYN] Seq=0 Win=64800 Len=0 MSS=1440 SACK_PERM TSval=958446905 TSecr=0 WS=128"
"9","2.868060284","2606:4700::6810:f8f9","2601:5cf:4100:3de0:53f4:479c:be9c:997d","TCP","94","","","40","","443  >  58480 [SYN, ACK] Seq=0 Ack=1 Win=65535 Len=0 MSS=1360 SACK_PERM TSval=2281710098 TSecr=958446905 WS=8192"
"10","2.868121933","2601:5cf:4100:3de0:53f4:479c:be9c:997d","2606:4700::6810:f8f9","TCP","86","","","32","","58480  >  443 [ACK] Seq=1 Ack=1 Win=64896 Len=0 TSval=958447211 TSecr=2281710098"
"11","2.868555270","2601:5cf:4100:3de0:53f4:479c:be9c:997d","2606:4700::6810:f8f9","TLSv1.3","603","","","32","512","Client Hello (SNI=cloudflare-dns.com)"
"12","3.175029989","2606:4700::6810:f8f9","2601:5cf:4100:3de0:53f4:479c:be9c:997d","TCP","86","","","32","","443  >  58480 [ACK] Seq=1 Ack=518 Win=65536 Len=0 TSval=2281710413 TSecr=958447211"
"13","3.175030240","2606:4700::6810:f8f9","2601:5cf:4100:3de0:53f4:479c:be9c:997d","TLSv1.3","2782","","","32","122,1","Server Hello, Change Cipher Spec"
"14","3.175030280","2606:4700::6810:f8f9","2601:5cf:4100:3de0:53f4:479c:be9c:997d","TLSv1.3","690","","","32","3162","Encrypted Extensions, Certificate, Certificate Verify, Finished"
"15","3.175063174","2601:5cf:4100:3de0:53f4:479c:be9c:997d","2606:4700::6810:f8f9","TCP","86","","","32","","58480  >  443 [ACK] Seq=518 Ack=2697 Win=63488 Len=0 TSval=958447518 TSecr=2281710414"
"16","3.175075487","2601:5cf:4100:3de0:53f4:479c:be9c:997d","2606:4700::6810:f8f9","TCP","86","","","32","","58480  >  443 [ACK] Seq=518 Ack=3301 Win=62976 Len=0 TSval=958447518 TSecr=2281710414"
"17","3.178298804","2601:5cf:4100:3de0:53f4:479c:be9c:997d","2606:4700::6810:f8f9","TLSv1.3","166","","","32","1,69","Change Cipher Spec, Finished"
"18","3.178648920","2601:5cf:4100:3de0:53f4:479c:be9c:997d","2606:4700::6810:f8f9","HTTP2","190","SETTINGS,WINDOW_UPDATE","36,4","32","99","Magic, SETTINGS[0], WINDOW_UPDATE[0]"
"19","3.184114929","2601:5cf:4100:3de0:53f4:479c:be9c:997d","2606:4700::6810:f8f9","DoH","285","HEADERS,WINDOW_UPDATE,DATA,DATA","71,4,22,0","32","110,48,26","Standard query 0xbbd9 NS 0.sb"
"21","3.343714725","2606:4700::6810:f8f9","2601:5cf:4100:3de0:53f4:479c:be9c:997d","TCP","86","","","32","","443  >  58480 [ACK] Seq=3301 Ack=901 Win=65536 Len=0 TSval=2281710718 TSecr=958447521"
"22","3.344513869","2606:4700::6810:f8f9","2601:5cf:4100:3de0:53f4:479c:be9c:997d","HTTP2","655","SETTINGS,WINDOW_UPDATE,SETTINGS","18,4,0","32","493,66","SETTINGS[0], WINDOW_UPDATE[0], SETTINGS[0]"
"23","3.344514320","2606:4700::6810:f8f9","2601:5cf:4100:3de0:53f4:479c:be9c:997d","HTTP2","202","HEADERS","85","32","111","HEADERS[1]: 200 OK"
"24","3.344514440","2606:4700::6810:f8f9","2601:5cf:4100:3de0:53f4:479c:be9c:997d","DoH","195","DATA","78","32","104","Standard query response 0xbbd9 NS 0.sb NS ns1.xiufeng.de NS ns2.xiufeng.nl"
"25","3.345192229","2601:5cf:4100:3de0:53f4:479c:be9c:997d","2606:4700::6810:f8f9","HTTP2","117","SETTINGS","0","32","26","SETTINGS[0]"
"26","3.346978941","2601:5cf:4100:3de0:53f4:479c:be9c:997d","2606:4700::6810:f8f9","TCP","86","","","32","","58480  >  443 [FIN, ACK] Seq=932 Ack=4095 Win=64128 Len=0 TSval=958447690 TSecr=2281710718"
"27","3.368167411","2601:5cf:4100:3de0:53f4:479c:be9c:997d","2606:4700::6810:f9f9","TCP","94","","","40","","49006  >  443 [SYN] Seq=0 Win=64800 Len=0 MSS=1440 SACK_PERM TSval=1821612683 TSecr=0 WS=128"
"29","3.440884769","2606:4700::6810:f8f9","2601:5cf:4100:3de0:53f4:479c:be9c:997d","TCP","86","","","32","","443  >  58480 [FIN, ACK] Seq=4095 Ack=933 Win=65536 Len=0 TSval=2281710887 TSecr=958447688"
"30","3.440941679","2601:5cf:4100:3de0:53f4:479c:be9c:997d","2606:4700::6810:f8f9","TCP","86","","","32","","58480  >  443 [ACK] Seq=933 Ack=4096 Win=64128 Len=0 TSval=958447784 TSecr=2281710887"
"32","3.542144062","2606:4700::6810:f9f9","2601:5cf:4100:3de0:53f4:479c:be9c:997d","TCP","94","","","40","","443  >  49006 [SYN, ACK] Seq=0 Ack=1 Win=65535 Len=0 MSS=1360 SACK_PERM TSval=584147131 TSecr=1821612683 WS=8192"
"33","3.542177557","2601:5cf:4100:3de0:53f4:479c:be9c:997d","2606:4700::6810:f9f9","TCP","86","","","32","","49006  >  443 [ACK] Seq=1 Ack=1 Win=64896 Len=0 TSval=1821612857 TSecr=584147131"
"34","3.542502094","2601:5cf:4100:3de0:53f4:479c:be9c:997d","2606:4700::6810:f9f9","TLSv1.3","603","","","32","512","Client Hello (SNI=cloudflare-dns.com)"
"35","4.096443715","2606:4700::6810:f9f9","2601:5cf:4100:3de0:53f4:479c:be9c:997d","TCP","86","","","32","","443  >  49006 [ACK] Seq=1 Ack=518 Win=65536 Len=0 TSval=584147240 TSecr=1821612857"
"36","4.096443985","2606:4700::6810:f9f9","2601:5cf:4100:3de0:53f4:479c:be9c:997d","TLSv1.3","3385","","","32","122,1,3161","Server Hello, Change Cipher Spec, Encrypted Extensions, Certificate, Certificate Verify, Finished"
"37","4.096444035","2606:4700::6810:f9f9","2601:5cf:4100:3de0:53f4:479c:be9c:997d","TCP","689","","","32","","[TCP Retransmission] 443  >  49006 [PSH, ACK] Seq=2697 Ack=518 Win=65536 Len=603 TSval=584147465 TSecr=1821612857"
"38","4.096477560","2601:5cf:4100:3de0:53f4:479c:be9c:997d","2606:4700::6810:f9f9","TCP","86","","","32","","49006  >  443 [ACK] Seq=518 Ack=3300 Win=62976 Len=0 TSval=1821613411 TSecr=584147241"
"39","4.096489714","2601:5cf:4100:3de0:53f4:479c:be9c:997d","2606:4700::6810:f9f9","TCP","98","","","44","","[TCP Dup ACK 38#1] 49006  >  443 [ACK] Seq=518 Ack=3300 Win=62976 Len=0 TSval=1821613411 TSecr=584147465 SLE=2697 SRE=3300"
"40","4.097592233","2601:5cf:4100:3de0:53f4:479c:be9c:997d","2606:4700::6810:f9f9","TLSv1.3","166","","","32","1,69","Change Cipher Spec, Finished"
"41","4.097878547","2601:5cf:4100:3de0:53f4:479c:be9c:997d","2606:4700::6810:f9f9","HTTP2","190","SETTINGS,WINDOW_UPDATE","36,4","32","99","Magic, SETTINGS[0], WINDOW_UPDATE[0]"
"42","4.105089737","2601:5cf:4100:3de0:53f4:479c:be9c:997d","2606:4700::6810:f9f9","DoH","300","HEADERS,WINDOW_UPDATE,DATA,DATA","71,4,37,0","32","110,63,26","Standard query 0x1d6f NS 0000000000.download"
"43","4.252348197","2606:4700::6810:f9f9","2601:5cf:4100:3de0:53f4:479c:be9c:997d","TCP","86","","","32","","443  >  49006 [ACK] Seq=3300 Ack=702 Win=65536 Len=0 TSval=584147788 TSecr=1821613412"
"44","4.252348467","2606:4700::6810:f9f9","2601:5cf:4100:3de0:53f4:479c:be9c:997d","HTTP2","655","SETTINGS,WINDOW_UPDATE,SETTINGS","18,4,0","32","493,66","SETTINGS[0], WINDOW_UPDATE[0], SETTINGS[0]"
"45","4.252348527","2606:4700::6810:f9f9","2601:5cf:4100:3de0:53f4:479c:be9c:997d","TCP","86","","","32","","443  >  49006 [ACK] Seq=3869 Ack=916 Win=65536 Len=0 TSval=584147841 TSecr=1821613420"
"46","4.252348567","2606:4700::6810:f9f9","2601:5cf:4100:3de0:53f4:479c:be9c:997d","HTTP2","202","HEADERS","85","32","111","HEADERS[1]: 200 OK"
"47","4.252348617","2606:4700::6810:f9f9","2601:5cf:4100:3de0:53f4:479c:be9c:997d","DoH","213","DATA","96","32","122","Standard query response 0x1d6f NS 0000000000.download NS coleman.ns.cloudflare.com NS meera.ns.cloudflare.com"
"48","4.252924329","2601:5cf:4100:3de0:53f4:479c:be9c:997d","2606:4700::6810:f9f9","HTTP2","117","SETTINGS","0","32","26","SETTINGS[0]"
"49","4.253916756","2601:5cf:4100:3de0:53f4:479c:be9c:997d","2606:4700::6810:f9f9","TCP","86","","","32","","49006  >  443 [FIN, ACK] Seq=947 Ack=4112 Win=64128 Len=0 TSval=1821613569 TSecr=584147788"
"50","4.275627234","2601:5cf:4100:3de0:53f4:479c:be9c:997d","2606:4700::6810:f9f9","TCP","94","","","40","","49010  >  443 [SYN] Seq=0 Win=64800 Len=0 MSS=1440 SACK_PERM TSval=1821613590 TSecr=0 WS=128"
"51","4.361378372","2606:4700::6810:f9f9","2601:5cf:4100:3de0:53f4:479c:be9c:997d","TCP","86","","","32","","443  >  49006 [ACK] Seq=4112 Ack=947 Win=65536 Len=0 TSval=584147943 TSecr=1821613568"
"52","4.361378553","2606:4700::6810:f9f9","2601:5cf:4100:3de0:53f4:479c:be9c:997d","TCP","86","","","32","","443  >  49006 [FIN, ACK] Seq=4112 Ack=948 Win=65536 Len=0 TSval=584147953 TSecr=1821613569"
"53","4.361407529","2601:5cf:4100:3de0:53f4:479c:be9c:997d","2606:4700::6810:f9f9","TCP","86","","","32","","49006  >  443 [ACK] Seq=948 Ack=4113 Win=64128 Len=0 TSval=1821613676 TSecr=584147953"
"54","4.506045630","2606:4700::6810:f9f9","2601:5cf:4100:3de0:53f4:479c:be9c:997d","TCP","94","","","40","","443  >  49010 [SYN, ACK] Seq=0 Ack=1 Win=65535 Len=0 MSS=1360 SACK_PERM TSval=1529762640 TSecr=1821613590 WS=8192"
"55","4.506086950","2601:5cf:4100:3de0:53f4:479c:be9c:997d","2606:4700::6810:f9f9","TCP","86","","","32","","49010  >  443 [ACK] Seq=1 Ack=1 Win=64896 Len=0 TSval=1821613821 TSecr=1529762640"
"56","4.506530437","2601:5cf:4100:3de0:53f4:479c:be9c:997d","2606:4700::6810:f9f9","TLSv1.3","603","","","32","512","Client Hello (SNI=cloudflare-dns.com)"
"57","4.813447027","2606:4700::6810:f9f9","2601:5cf:4100:3de0:53f4:479c:be9c:997d","TCP","86","","","32","","443  >  49010 [ACK] Seq=1 Ack=518 Win=65536 Len=0 TSval=1529762785 TSecr=1821613821"
"58","4.813447257","2606:4700::6810:f9f9","2601:5cf:4100:3de0:53f4:479c:be9c:997d","TLSv1.3","3385","","","32","122,1,3161","Server Hello, Change Cipher Spec, Encrypted Extensions, Certificate, Certificate Verify, Finished"
"59","4.813480492","2601:5cf:4100:3de0:53f4:479c:be9c:997d","2606:4700::6810:f9f9","TCP","86","","","32","","49010  >  443 [ACK] Seq=518 Ack=3300 Win=62976 Len=0 TSval=1821614128 TSecr=1529762786"
"60","4.815124186","2601:5cf:4100:3de0:53f4:479c:be9c:997d","2606:4700::6810:f9f9","TLSv1.3","166","","","32","1,69","Change Cipher Spec, Finished"
"61","4.815418174","2601:5cf:4100:3de0:53f4:479c:be9c:997d","2606:4700::6810:f9f9","HTTP2","190","SETTINGS,WINDOW_UPDATE","36,4","32","99","Magic, SETTINGS[0], WINDOW_UPDATE[0]"
"62","4.822606861","2601:5cf:4100:3de0:53f4:479c:be9c:997d","2606:4700::6810:f9f9","DoH","295","HEADERS,WINDOW_UPDATE,DATA,DATA","71,4,32,0","32","110,58,26","Standard query 0x93d2 NS 000webhost.com"
"63","5.121736548","2606:4700::6810:f9f9","2601:5cf:4100:3de0:53f4:479c:be9c:997d","TCP","689","","","32","","[TCP Spurious Retransmission] 443  >  49010 [PSH, ACK] Seq=2697 Ack=518 Win=65536 Len=603 TSval=1529763087 TSecr=1821613821"
"64","5.121736999","2606:4700::6810:f9f9","2601:5cf:4100:3de0:53f4:479c:be9c:997d","TCP","86","","","32","","443  >  49010 [ACK] Seq=3300 Ack=702 Win=65536 Len=0 TSval=1529763096 TSecr=1821614130"
"65","5.121737119","2606:4700::6810:f9f9","2601:5cf:4100:3de0:53f4:479c:be9c:997d","HTTP2","655","SETTINGS,WINDOW_UPDATE,SETTINGS","18,4,0","32","493,66","SETTINGS[0], WINDOW_UPDATE[0], SETTINGS[0]"
"66","5.121737230","2606:4700::6810:f9f9","2601:5cf:4100:3de0:53f4:479c:be9c:997d","HTTP2","202","HEADERS","85","32","111","HEADERS[1]: 200 OK"
"67","5.121737330","2606:4700::6810:f9f9","2601:5cf:4100:3de0:53f4:479c:be9c:997d","DoH","203","DATA","86","32","112","Standard query response 0x93d2 NS 000webhost.com NS emily.ns.cloudflare.com NS terin.ns.cloudflare.com"
"68","5.121777958","2601:5cf:4100:3de0:53f4:479c:be9c:997d","2606:4700::6810:f9f9","TCP","98","","","44","","[TCP Dup ACK 59#1] 49010  >  443 [ACK] Seq=911 Ack=3300 Win=64128 Len=0 TSval=1821614436 TSecr=1529763087 SLE=2697 SRE=3300"
"69","5.121810932","2601:5cf:4100:3de0:53f4:479c:be9c:997d","2606:4700::6810:f9f9","TCP","86","","","32","","49010  >  443 [ACK] Seq=911 Ack=3869 Win=64128 Len=0 TSval=1821614436 TSecr=1529763096"
"70","5.121827163","2601:5cf:4100:3de0:53f4:479c:be9c:997d","2606:4700::6810:f9f9","TCP","86","","","32","","49010  >  443 [ACK] Seq=911 Ack=3985 Win=64128 Len=0 TSval=1821614436 TSecr=1529763111"
"71","5.121836381","2601:5cf:4100:3de0:53f4:479c:be9c:997d","2606:4700::6810:f9f9","TCP","86","","","32","","49010  >  443 [ACK] Seq=911 Ack=4102 Win=64128 Len=0 TSval=1821614437 TSecr=1529763111"
"72","5.122524681","2601:5cf:4100:3de0:53f4:479c:be9c:997d","2606:4700::6810:f9f9","HTTP2","117","SETTINGS","0","32","26","SETTINGS[0]"
"73","5.123449517","2601:5cf:4100:3de0:53f4:479c:be9c:997d","2606:4700::6810:f9f9","TCP","86","","","32","","49010  >  443 [FIN, ACK] Seq=942 Ack=4102 Win=64128 Len=0 TSval=1821614438 TSecr=1529763111"
"74","5.145762861","2601:5cf:4100:3de0:53f4:479c:be9c:997d","2606:4700::6810:f8f9","TCP","94","","","40","","58494  >  443 [SYN] Seq=0 Win=64800 Len=0 MSS=1440 SACK_PERM TSval=958449488 TSecr=0 WS=128"
"78","5.289528126","2606:4700::6810:f9f9","2601:5cf:4100:3de0:53f4:479c:be9c:997d","TCP","86","","","32","","443  >  49010 [FIN, ACK] Seq=4102 Ack=943 Win=65536 Len=0 TSval=1529763404 TSecr=1821614437"
"79","5.289528557","2606:4700::6810:f8f9","2601:5cf:4100:3de0:53f4:479c:be9c:997d","TCP","94","","","40","","443  >  58494 [SYN, ACK] Seq=0 Ack=1 Win=65535 Len=0 MSS=1360 SACK_PERM TSval=271932776 TSecr=958449488 WS=8192"
"80","5.289578714","2601:5cf:4100:3de0:53f4:479c:be9c:997d","2606:4700::6810:f9f9","TCP","86","","","32","","49010  >  443 [ACK] Seq=943 Ack=4103 Win=64128 Len=0 TSval=1821614604 TSecr=1529763404"
"81","5.289629782","2601:5cf:4100:3de0:53f4:479c:be9c:997d","2606:4700::6810:f8f9","TCP","86","","","32","","58494  >  443 [ACK] Seq=1 Ack=1 Win=64896 Len=0 TSval=958449632 TSecr=271932776"
"82","5.290334774","2601:5cf:4100:3de0:53f4:479c:be9c:997d","2606:4700::6810:f8f9","TLSv1.3","603","","","32","512","Client Hello (SNI=cloudflare-dns.com)"
"84","5.386626827","2606:4700::6810:f8f9","2601:5cf:4100:3de0:53f4:479c:be9c:997d","TCP","86","","","32","","443  >  58494 [ACK] Seq=1 Ack=518 Win=65536 Len=0 TSval=271932921 TSecr=958449633"
"85","5.386627278","2606:4700::6810:f8f9","2601:5cf:4100:3de0:53f4:479c:be9c:997d","TLSv1.3","3385","","","32","122,1,3161","Server Hello, Change Cipher Spec, Encrypted Extensions, Certificate, Certificate Verify, Finished"
"87","5.386706451","2601:5cf:4100:3de0:53f4:479c:be9c:997d","2606:4700::6810:f8f9","TCP","86","","","32","","58494  >  443 [ACK] Seq=518 Ack=3300 Win=62976 Len=0 TSval=958449729 TSecr=271932923"
"89","5.388372889","2601:5cf:4100:3de0:53f4:479c:be9c:997d","2606:4700::6810:f8f9","TLSv1.3","166","","","32","1,69","Change Cipher Spec, Finished"
"90","5.388645556","2601:5cf:4100:3de0:53f4:479c:be9c:997d","2606:4700::6810:f8f9","HTTP2","190","SETTINGS,WINDOW_UPDATE","36,4","32","99","Magic, SETTINGS[0], WINDOW_UPDATE[0]"
"91","5.393076005","2601:5cf:4100:3de0:53f4:479c:be9c:997d","2606:4700::6810:f8f9","DoH","298","HEADERS,WINDOW_UPDATE,DATA,DATA","71,4,35,0","32","110,61,26","Standard query 0x91c0 NS 000webhostapp.com"
"93","5.487878681","2606:4700::6810:f8f9","2601:5cf:4100:3de0:53f4:479c:be9c:997d","TCP","86","","","32","","443  >  58494 [ACK] Seq=3300 Ack=914 Win=65536 Len=0 TSval=271933013 TSecr=958449731"
"94","5.487879141","2606:4700::6810:f8f9","2601:5cf:4100:3de0:53f4:479c:be9c:997d","HTTP2","655","SETTINGS,WINDOW_UPDATE,SETTINGS","18,4,0","32","493,66","SETTINGS[0], WINDOW_UPDATE[0], SETTINGS[0]"
"95","5.487879262","2606:4700::6810:f8f9","2601:5cf:4100:3de0:53f4:479c:be9c:997d","HTTP2","202","HEADERS","85","32","111","HEADERS[1]: 200 OK"
"96","5.487879382","2606:4700::6810:f8f9","2601:5cf:4100:3de0:53f4:479c:be9c:997d","DoH","201","DATA","84","32","110","Standard query response 0x91c0 NS 000webhostapp.com NS dns1.000webhost.com NS dns2.000webhost.com"
"97","5.488518787","2601:5cf:4100:3de0:53f4:479c:be9c:997d","2606:4700::6810:f8f9","HTTP2","117","SETTINGS","0","32","26","SETTINGS[0]"
"98","5.489421140","2601:5cf:4100:3de0:53f4:479c:be9c:997d","2606:4700::6810:f8f9","TCP","86","","","32","","58494  >  443 [FIN, ACK] Seq=945 Ack=4100 Win=64128 Len=0 TSval=958449832 TSecr=271933013"
"99","5.513160298","2601:5cf:4100:3de0:53f4:479c:be9c:997d","2606:4700::6810:f8f9","TCP","94","","","40","","58498  >  443 [SYN] Seq=0 Win=64800 Len=0 MSS=1440 SACK_PERM TSval=958449856 TSecr=0 WS=128"
"100","5.734888312","2606:4700::6810:f8f9","2601:5cf:4100:3de0:53f4:479c:be9c:997d","TCP","86","","","32","","443  >  58494 [FIN, ACK] Seq=4100 Ack=946 Win=65536 Len=0 TSval=271933125 TSecr=958449831"
"101","5.734888563","2606:4700::6810:f8f9","2601:5cf:4100:3de0:53f4:479c:be9c:997d","TCP","94","","","40","","443  >  58498 [SYN, ACK] Seq=0 Ack=1 Win=65535 Len=0 MSS=1360 SACK_PERM TSval=2310942428 TSecr=958449856 WS=8192"
"104","5.734954280","2601:5cf:4100:3de0:53f4:479c:be9c:997d","2606:4700::6810:f8f9","TCP","86","","","32","","58494  >  443 [ACK] Seq=946 Ack=4101 Win=64128 Len=0 TSval=958450078 TSecr=271933125"
"105","5.734972154","2601:5cf:4100:3de0:53f4:479c:be9c:997d","2606:4700::6810:f8f9","TCP","86","","","32","","58498  >  443 [ACK] Seq=1 Ack=1 Win=64896 Len=0 TSval=958450078 TSecr=2310942428"
"106","5.735404389","2601:5cf:4100:3de0:53f4:479c:be9c:997d","2606:4700::6810:f8f9","TLSv1.3","603","","","32","512","Client Hello (SNI=cloudflare-dns.com)"
"109","6.042129487","2606:4700::6810:f8f9","2601:5cf:4100:3de0:53f4:479c:be9c:997d","TCP","86","","","32","","443  >  58498 [ACK] Seq=1 Ack=518 Win=65536 Len=0 TSval=2310942657 TSecr=958450078"
"110","6.042129587","2606:4700::6810:f8f9","2601:5cf:4100:3de0:53f4:479c:be9c:997d","TLSv1.3","3384","","","32","122,1,3160","Server Hello, Change Cipher Spec, Encrypted Extensions, Certificate, Certificate Verify, Finished"
"112","6.042163493","2601:5cf:4100:3de0:53f4:479c:be9c:997d","2606:4700::6810:f8f9","TCP","86","","","32","","58498  >  443 [ACK] Seq=518 Ack=3299 Win=62976 Len=0 TSval=958450385 TSecr=2310942658"
"113","6.043276533","2601:5cf:4100:3de0:53f4:479c:be9c:997d","2606:4700::6810:f8f9","TLSv1.3","166","","","32","1,69","Change Cipher Spec, Finished"
"114","6.043569800","2601:5cf:4100:3de0:53f4:479c:be9c:997d","2606:4700::6810:f8f9","HTTP2","190","SETTINGS,WINDOW_UPDATE","36,4","32","99","Magic, SETTINGS[0], WINDOW_UPDATE[0]"
"115","6.050908256","2601:5cf:4100:3de0:53f4:479c:be9c:997d","2606:4700::6810:f8f9","DoH","293","HEADERS,WINDOW_UPDATE,DATA,DATA","71,4,30,0","32","110,56,26","Standard query 0x1030 NS 00117163.xyz"
"117","6.236133746","2606:4700::6810:f8f9","2601:5cf:4100:3de0:53f4:479c:be9c:997d","TCP","86","","","32","","443  >  58498 [ACK] Seq=3299 Ack=702 Win=65536 Len=0 TSval=2310942961 TSecr=958450386"
"118","6.236134096","2606:4700::6810:f8f9","2601:5cf:4100:3de0:53f4:479c:be9c:997d","HTTP2","655","SETTINGS,WINDOW_UPDATE,SETTINGS","18,4,0","32","493,66","SETTINGS[0], WINDOW_UPDATE[0], SETTINGS[0]"
"119","6.236134147","2606:4700::6810:f8f9","2601:5cf:4100:3de0:53f4:479c:be9c:997d","TCP","86","","","32","","443  >  58498 [ACK] Seq=3868 Ack=909 Win=65536 Len=0 TSval=2310943010 TSecr=958450394"
"120","6.236662096","2601:5cf:4100:3de0:53f4:479c:be9c:997d","2606:4700::6810:f8f9","HTTP2","117","SETTINGS","0","32","26","SETTINGS[0]"
"121","6.554121519","2606:4700::6810:f8f9","2601:5cf:4100:3de0:53f4:479c:be9c:997d","TCP","86","","","32","","443  >  58498 [ACK] Seq=3868 Ack=940 Win=65536 Len=0 TSval=2310943148 TSecr=958450579"
"123","6.861763976","2606:4700::6810:f8f9","2601:5cf:4100:3de0:53f4:479c:be9c:997d","HTTP2","203","HEADERS","86","32","112","HEADERS[1]: 200 OK"
"124","6.861764437","2606:4700::6810:f8f9","2601:5cf:4100:3de0:53f4:479c:be9c:997d","DoH","294","DATA","177","32","203","Standard query response 0x1030 NS 00117163.xyz NS ns1.huaweicloud-dns.com NS ns1.huaweicloud-dns.cn NS ns1.huaweicloud-dns.net NS ns1.huaweicloud-dns.org"
"125","6.862818183","2601:5cf:4100:3de0:53f4:479c:be9c:997d","2606:4700::6810:f8f9","TCP","86","","","32","","58498  >  443 [ACK] Seq=940 Ack=4193 Win=64128 Len=0 TSval=958451205 TSecr=2310943713"
"126","6.863430536","2601:5cf:4100:3de0:53f4:479c:be9c:997d","2606:4700::6810:f8f9","TCP","86","","","32","","58498  >  443 [FIN, ACK] Seq=940 Ack=4193 Win=64128 Len=0 TSval=958451206 TSecr=2310943713"
"127","6.885119545","2601:5cf:4100:3de0:53f4:479c:be9c:997d","2606:4700::6810:f8f9","TCP","94","","","40","","35918  >  443 [SYN] Seq=0 Win=64800 Len=0 MSS=1440 SACK_PERM TSval=958451228 TSecr=0 WS=128"
"128","7.168835231","2606:4700::6810:f8f9","2601:5cf:4100:3de0:53f4:479c:be9c:997d","TCP","86","","","32","","443  >  58498 [FIN, ACK] Seq=4193 Ack=941 Win=65536 Len=0 TSval=2310943785 TSecr=958451206"
"129","7.168835681","2606:4700::6810:f8f9","2601:5cf:4100:3de0:53f4:479c:be9c:997d","TCP","94","","","40","","443  >  35918 [SYN, ACK] Seq=0 Ack=1 Win=65535 Len=0 MSS=1360 SACK_PERM TSval=991938423 TSecr=958451228 WS=8192"
"130","7.168881550","2601:5cf:4100:3de0:53f4:479c:be9c:997d","2606:4700::6810:f8f9","TCP","86","","","32","","58498  >  443 [ACK] Seq=941 Ack=4194 Win=64128 Len=0 TSval=958451512 TSecr=2310943785"
"131","7.168926266","2601:5cf:4100:3de0:53f4:479c:be9c:997d","2606:4700::6810:f8f9","TCP","86","","","32","","35918  >  443 [ACK] Seq=1 Ack=1 Win=64896 Len=0 TSval=958451512 TSecr=991938423"
"132","7.169450970","2601:5cf:4100:3de0:53f4:479c:be9c:997d","2606:4700::6810:f8f9","TLSv1.3","603","","","32","512","Client Hello (SNI=cloudflare-dns.com)"
"133","7.476095054","2606:4700::6810:f8f9","2601:5cf:4100:3de0:53f4:479c:be9c:997d","TCP","86","","","32","","443  >  35918 [ACK] Seq=1 Ack=518 Win=65536 Len=0 TSval=991938707 TSecr=958451512"
"134","7.476095505","2606:4700::6810:f8f9","2601:5cf:4100:3de0:53f4:479c:be9c:997d","TLSv1.3","2782","","","32","122,1","Server Hello, Change Cipher Spec"
"135","7.476095635","2606:4700::6810:f8f9","2601:5cf:4100:3de0:53f4:479c:be9c:997d","TLSv1.3","690","","","32","3162","Encrypted Extensions, Certificate, Certificate Verify, Finished"
"136","7.476153797","2601:5cf:4100:3de0:53f4:479c:be9c:997d","2606:4700::6810:f8f9","TCP","86","","","32","","35918  >  443 [ACK] Seq=518 Ack=2697 Win=63488 Len=0 TSval=958451819 TSecr=991938709"
"137","7.476178184","2601:5cf:4100:3de0:53f4:479c:be9c:997d","2606:4700::6810:f8f9","TCP","86","","","32","","35918  >  443 [ACK] Seq=518 Ack=3301 Win=62976 Len=0 TSval=958451819 TSecr=991938709"
"138","7.477607015","2601:5cf:4100:3de0:53f4:479c:be9c:997d","2606:4700::6810:f8f9","TLSv1.3","166","","","32","1,69","Change Cipher Spec, Finished"
"139","7.477891785","2601:5cf:4100:3de0:53f4:479c:be9c:997d","2606:4700::6810:f8f9","HTTP2","190","SETTINGS,WINDOW_UPDATE","36,4","32","99","Magic, SETTINGS[0], WINDOW_UPDATE[0]"
"140","7.485174314","2601:5cf:4100:3de0:53f4:479c:be9c:997d","2606:4700::6810:f8f9","DoH","294","HEADERS,WINDOW_UPDATE,DATA,DATA","71,4,31,0","32","110,57,26","Standard query 0x0e29 NS 001k.exchange"
"141","7.783594464","2606:4700::6810:f8f9","2601:5cf:4100:3de0:53f4:479c:be9c:997d","HTTP2","646","SETTINGS,WINDOW_UPDATE","18,4","32","493,57","SETTINGS[0], WINDOW_UPDATE[0]"
"142","7.783594905","2606:4700::6810:f8f9","2601:5cf:4100:3de0:53f4:479c:be9c:997d","HTTP2","117","SETTINGS","0","32","26","SETTINGS[0]"
"143","7.783595035","2606:4700::6810:f8f9","2601:5cf:4100:3de0:53f4:479c:be9c:997d","HTTP2","202","HEADERS","85","32","111","HEADERS[1]: 200 OK"
"144","7.783595135","2606:4700::6810:f8f9","2601:5cf:4100:3de0:53f4:479c:be9c:997d","DoH","203","DATA","86","32","112","Standard query response 0x0e29 NS 001k.exchange NS chin.ns.cloudflare.com NS gabe.ns.cloudflare.com"
"145","7.784553777","2601:5cf:4100:3de0:53f4:479c:be9c:997d","2606:4700::6810:f8f9","HTTP2","117","SETTINGS","0","32","26","SETTINGS[0]"
"146","7.785445199","2601:5cf:4100:3de0:53f4:479c:be9c:997d","2606:4700::6810:f8f9","TCP","86","","","32","","35918  >  443 [FIN, ACK] Seq=941 Ack=4125 Win=64128 Len=0 TSval=958452128 TSecr=991939011"
"147","7.806043090","2601:5cf:4100:3de0:53f4:479c:be9c:997d","2606:4700::6810:f9f9","TCP","94","","","40","","46674  >  443 [SYN] Seq=0 Win=64800 Len=0 MSS=1440 SACK_PERM TSval=1821617121 TSecr=0 WS=128"
"148","8.090210316","2606:4700::6810:f8f9","2601:5cf:4100:3de0:53f4:479c:be9c:997d","TCP","86","","","32","","443  >  35918 [FIN, ACK] Seq=4125 Ack=942 Win=65536 Len=0 TSval=991939328 TSecr=958452127"
"149","8.090210777","2606:4700::6810:f9f9","2601:5cf:4100:3de0:53f4:479c:be9c:997d","TCP","94","","","40","","443  >  46674 [SYN, ACK] Seq=0 Ack=1 Win=65535 Len=0 MSS=1360 SACK_PERM TSval=1033398315 TSecr=1821617121 WS=8192"
"150","8.090257247","2601:5cf:4100:3de0:53f4:479c:be9c:997d","2606:4700::6810:f8f9","TCP","86","","","32","","35918  >  443 [ACK] Seq=942 Ack=4126 Win=64128 Len=0 TSval=958452433 TSecr=991939328"
"151","8.090297154","2601:5cf:4100:3de0:53f4:479c:be9c:997d","2606:4700::6810:f9f9","TCP","86","","","32","","46674  >  443 [ACK] Seq=1 Ack=1 Win=64896 Len=0 TSval=1821617405 TSecr=1033398315"
"152","8.091066320","2601:5cf:4100:3de0:53f4:479c:be9c:997d","2606:4700::6810:f9f9","TLSv1.3","603","","","32","512","Client Hello (SNI=cloudflare-dns.com)"
"153","8.397839489","2606:4700::6810:f9f9","2601:5cf:4100:3de0:53f4:479c:be9c:997d","TCP","86","","","32","","443  >  46674 [ACK] Seq=1 Ack=518 Win=65536 Len=0 TSval=1033398608 TSecr=1821617406"
"154","8.397839930","2606:4700::6810:f9f9","2601:5cf:4100:3de0:53f4:479c:be9c:997d","TLSv1.3","2782","","","32","122,1","Server Hello, Change Cipher Spec"
"155","8.397840060","2606:4700::6810:f9f9","2601:5cf:4100:3de0:53f4:479c:be9c:997d","TLSv1.3","689","","","32","3161","Encrypted Extensions, Certificate, Certificate Verify, Finished"
"156","8.397896880","2601:5cf:4100:3de0:53f4:479c:be9c:997d","2606:4700::6810:f9f9","TCP","86","","","32","","46674  >  443 [ACK] Seq=518 Ack=2697 Win=63488 Len=0 TSval=1821617713 TSecr=1033398609"
"157","8.397921157","2601:5cf:4100:3de0:53f4:479c:be9c:997d","2606:4700::6810:f9f9","TCP","86","","","32","","46674  >  443 [ACK] Seq=518 Ack=3300 Win=62976 Len=0 TSval=1821617713 TSecr=1033398609"
"158","8.399394514","2601:5cf:4100:3de0:53f4:479c:be9c:997d","2606:4700::6810:f9f9","TLSv1.3","166","","","32","1,69","Change Cipher Spec, Finished"
"159","8.399680706","2601:5cf:4100:3de0:53f4:479c:be9c:997d","2606:4700::6810:f9f9","HTTP2","190","SETTINGS,WINDOW_UPDATE","36,4","32","99","Magic, SETTINGS[0], WINDOW_UPDATE[0]"
"160","8.406912246","2601:5cf:4100:3de0:53f4:479c:be9c:997d","2606:4700::6810:f9f9","DoH","287","HEADERS,WINDOW_UPDATE,DATA,DATA","71,4,24,0","32","110,50,26","Standard query 0xfb58 NS 003.cx"
"161","8.704636419","2606:4700::6810:f9f9","2601:5cf:4100:3de0:53f4:479c:be9c:997d","TCP","86","","","32","","443  >  46674 [ACK] Seq=3300 Ack=702 Win=65536 Len=0 TSval=1033398912 TSecr=1821617714"
"162","8.704636770","2606:4700::6810:f9f9","2601:5cf:4100:3de0:53f4:479c:be9c:997d","HTTP2","655","SETTINGS,WINDOW_UPDATE,SETTINGS","18,4,0","32","493,66","SETTINGS[0], WINDOW_UPDATE[0], SETTINGS[0]"
"163","8.704636860","2606:4700::6810:f9f9","2601:5cf:4100:3de0:53f4:479c:be9c:997d","TCP","86","","","32","","443  >  46674 [ACK] Seq=3869 Ack=903 Win=65536 Len=0 TSval=1033398965 TSecr=1821617722"
"164","8.704636950","2606:4700::6810:f9f9","2601:5cf:4100:3de0:53f4:479c:be9c:997d","HTTP2","202","HEADERS","85","32","111","HEADERS[1]: 200 OK"
"165","8.704637030","2606:4700::6810:f9f9","2601:5cf:4100:3de0:53f4:479c:be9c:997d","DoH","198","DATA","81","32","107","Standard query response 0xfb58 NS 003.cx NS jerome.ns.cloudflare.com NS sima.ns.cloudflare.com"
"166","8.705341351","2601:5cf:4100:3de0:53f4:479c:be9c:997d","2606:4700::6810:f9f9","HTTP2","117","SETTINGS","0","32","26","SETTINGS[0]"
"167","8.706225118","2601:5cf:4100:3de0:53f4:479c:be9c:997d","2606:4700::6810:f9f9","TCP","86","","","32","","46674  >  443 [FIN, ACK] Seq=934 Ack=4097 Win=64128 Len=0 TSval=1821618021 TSecr=1033398912"
"168","8.729018171","2601:5cf:4100:3de0:53f4:479c:be9c:997d","2606:4700::6810:f9f9","TCP","94","","","40","","46684  >  443 [SYN] Seq=0 Win=64800 Len=0 MSS=1440 SACK_PERM TSval=1821618044 TSecr=0 WS=128"
"169","9.012133543","2606:4700::6810:f9f9","2601:5cf:4100:3de0:53f4:479c:be9c:997d","TCP","86","","","32","","443  >  46674 [ACK] Seq=4097 Ack=934 Win=65536 Len=0 TSval=1033399211 TSecr=1821618020"
"170","9.012133994","2606:4700::6810:f9f9","2601:5cf:4100:3de0:53f4:479c:be9c:997d","TCP","86","","","32","","443  >  46674 [FIN, ACK] Seq=4097 Ack=935 Win=65536 Len=0 TSval=1033399220 TSecr=1821618021"
"171","9.012134124","2606:4700::6810:f9f9","2601:5cf:4100:3de0:53f4:479c:be9c:997d","TCP","94","","","40","","443  >  46684 [SYN, ACK] Seq=0 Ack=1 Win=65535 Len=0 MSS=1360 SACK_PERM TSval=1352952931 TSecr=1821618044 WS=8192"
"172","9.012189992","2601:5cf:4100:3de0:53f4:479c:be9c:997d","2606:4700::6810:f9f9","TCP","86","","","32","","46674  >  443 [ACK] Seq=935 Ack=4098 Win=64128 Len=0 TSval=1821618327 TSecr=1033399220"
"173","9.012232745","2601:5cf:4100:3de0:53f4:479c:be9c:997d","2606:4700::6810:f9f9","TCP","86","","","32","","46684  >  443 [ACK] Seq=1 Ack=1 Win=64896 Len=0 TSval=1821618327 TSecr=1352952931"
"174","9.012968767","2601:5cf:4100:3de0:53f4:479c:be9c:997d","2606:4700::6810:f9f9","TLSv1.3","603","","","32","512","Client Hello (SNI=cloudflare-dns.com)"
"175","9.319475808","2606:4700::6810:f9f9","2601:5cf:4100:3de0:53f4:479c:be9c:997d","TCP","86","","","32","","443  >  46684 [ACK] Seq=1 Ack=518 Win=65536 Len=0 TSval=1352953220 TSecr=1821618328"
"176","9.319476259","2606:4700::6810:f9f9","2601:5cf:4100:3de0:53f4:479c:be9c:997d","TLSv1.3","2782","","","32","122,1","Server Hello, Change Cipher Spec"
"177","9.319476389","2606:4700::6810:f9f9","2601:5cf:4100:3de0:53f4:479c:be9c:997d","TLSv1.3","690","","","32","3162","Encrypted Extensions, Certificate, Certificate Verify, Finished"
"178","9.319534321","2601:5cf:4100:3de0:53f4:479c:be9c:997d","2606:4700::6810:f9f9","TCP","86","","","32","","46684  >  443 [ACK] Seq=518 Ack=2697 Win=63488 Len=0 TSval=1821618634 TSecr=1352953221"
"179","9.319558748","2601:5cf:4100:3de0:53f4:479c:be9c:997d","2606:4700::6810:f9f9","TCP","86","","","32","","46684  >  443 [ACK] Seq=518 Ack=3301 Win=62976 Len=0 TSval=1821618634 TSecr=1352953221"
"180","9.320948673","2601:5cf:4100:3de0:53f4:479c:be9c:997d","2606:4700::6810:f9f9","TLSv1.3","166","","","32","1,69","Change Cipher Spec, Finished"
"181","9.321237401","2601:5cf:4100:3de0:53f4:479c:be9c:997d","2606:4700::6810:f9f9","HTTP2","190","SETTINGS,WINDOW_UPDATE","36,4","32","99","Magic, SETTINGS[0], WINDOW_UPDATE[0]"
"182","9.328587690","2601:5cf:4100:3de0:53f4:479c:be9c:997d","2606:4700::6810:f9f9","DoH","289","HEADERS,WINDOW_UPDATE,DATA,DATA","71,4,26,0","32","110,52,26","Standard query 0xfa70 NS 003ms.ru"
"184","9.481854289","2606:4700::6810:f9f9","2601:5cf:4100:3de0:53f4:479c:be9c:997d","TCP","86","","","32","","443  >  46684 [ACK] Seq=3301 Ack=702 Win=65536 Len=0 TSval=1352953520 TSecr=1821618636"
"185","9.481948902","2606:4700::6810:f9f9","2601:5cf:4100:3de0:53f4:479c:be9c:997d","HTTP2","655","SETTINGS,WINDOW_UPDATE,SETTINGS","18,4,0","32","493,66","SETTINGS[0], WINDOW_UPDATE[0], SETTINGS[0]"
"186","9.481949122","2606:4700::6810:f9f9","2601:5cf:4100:3de0:53f4:479c:be9c:997d","TCP","86","","","32","","443  >  46684 [ACK] Seq=3870 Ack=905 Win=65536 Len=0 TSval=1352953569 TSecr=1821618643"
"187","9.482906502","2601:5cf:4100:3de0:53f4:479c:be9c:997d","2606:4700::6810:f9f9","HTTP2","117","SETTINGS","0","32","26","SETTINGS[0]"
"189","9.524429699","2606:4700::6810:f9f9","2601:5cf:4100:3de0:53f4:479c:be9c:997d","TCP","86","","","32","","443  >  46684 [ACK] Seq=3870 Ack=936 Win=65536 Len=0 TSval=1352953688 TSecr=1821618798"
"190","10.138801869","2606:4700::6810:f9f9","2601:5cf:4100:3de0:53f4:479c:be9c:997d","HTTP2","202","HEADERS","85","32","111","HEADERS[1]: 200 OK"
"191","10.138802320","2606:4700::6810:f9f9","2601:5cf:4100:3de0:53f4:479c:be9c:997d","DoH","199","DATA","82","32","108","Standard query response 0xfa70 NS 003ms.ru NS micah.ns.cloudflare.com NS rose.ns.cloudflare.com"
"192","10.139847680","2601:5cf:4100:3de0:53f4:479c:be9c:997d","2606:4700::6810:f9f9","TCP","86","","","32","","46684  >  443 [ACK] Seq=936 Ack=4099 Win=64128 Len=0 TSval=1821619454 TSecr=1352953807"
"193","10.140359609","2601:5cf:4100:3de0:53f4:479c:be9c:997d","2606:4700::6810:f9f9","TCP","86","","","32","","46684  >  443 [FIN, ACK] Seq=936 Ack=4099 Win=64128 Len=0 TSval=1821619455 TSecr=1352953807"
"194","10.164090353","2601:5cf:4100:3de0:53f4:479c:be9c:997d","2606:4700::6810:f8f9","TCP","94","","","40","","35934  >  443 [SYN] Seq=0 Win=64800 Len=0 MSS=1440 SACK_PERM TSval=958454507 TSecr=0 WS=128"
"195","10.204572969","2606:4700::6810:f9f9","2601:5cf:4100:3de0:53f4:479c:be9c:997d","TCP","86","","","32","","443  >  46684 [FIN, ACK] Seq=4099 Ack=937 Win=65536 Len=0 TSval=1352954340 TSecr=1821619455"
"196","10.204573220","2606:4700::6810:f8f9","2601:5cf:4100:3de0:53f4:479c:be9c:997d","TCP","94","","","40","","443  >  35934 [SYN, ACK] Seq=0 Ack=1 Win=65535 Len=0 MSS=1360 SACK_PERM TSval=562475798 TSecr=958454507 WS=8192"
"197","10.204606564","2601:5cf:4100:3de0:53f4:479c:be9c:997d","2606:4700::6810:f9f9","TCP","86","","","32","","46684  >  443 [ACK] Seq=937 Ack=4100 Win=64128 Len=0 TSval=1821619519 TSecr=1352954340"
"198","10.204629779","2601:5cf:4100:3de0:53f4:479c:be9c:997d","2606:4700::6810:f8f9","TCP","86","","","32","","35934  >  443 [ACK] Seq=1 Ack=1 Win=64896 Len=0 TSval=958454547 TSecr=562475798"
"199","10.205110999","2601:5cf:4100:3de0:53f4:479c:be9c:997d","2606:4700::6810:f8f9","TLSv1.3","603","","","32","512","Client Hello (SNI=cloudflare-dns.com)"
"200","10.516085061","2601:5cf:4100:3de0:53f4:479c:be9c:997d","2606:4700::6810:f8f9","TCP","603","","","32","","[TCP Retransmission] 35934  >  443 [PSH, ACK] Seq=1 Ack=1 Win=64896 Len=517 TSval=958454859 TSecr=562475798"
"201","10.518634337","2606:4700::6810:f8f9","2601:5cf:4100:3de0:53f4:479c:be9c:997d","TCP","86","","","32","","443  >  35934 [ACK] Seq=1 Ack=518 Win=65536 Len=0 TSval=562475854 TSecr=958454548"
"202","10.518634787","2606:4700::6810:f8f9","2601:5cf:4100:3de0:53f4:479c:be9c:997d","TLSv1.3","3385","","","32","122,1,3161","Server Hello, Change Cipher Spec, Encrypted Extensions, Certificate, Certificate Verify, Finished"
"203","10.518634918","2606:4700::6810:f8f9","2601:5cf:4100:3de0:53f4:479c:be9c:997d","TCP","689","","","32","","[TCP Retransmission] 443  >  35934 [PSH, ACK] Seq=2697 Ack=518 Win=65536 Len=603 TSval=562475956 TSecr=958454548"
"204","10.518691557","2601:5cf:4100:3de0:53f4:479c:be9c:997d","2606:4700::6810:f8f9","TCP","86","","","32","","35934  >  443 [ACK] Seq=518 Ack=3300 Win=62976 Len=0 TSval=958454861 TSecr=562475855"
"205","10.518716525","2601:5cf:4100:3de0:53f4:479c:be9c:997d","2606:4700::6810:f8f9","TCP","98","","","44","","[TCP Dup ACK 204#1] 35934  >  443 [ACK] Seq=518 Ack=3300 Win=62976 Len=0 TSval=958454861 TSecr=562475956 SLE=2697 SRE=3300"
"206","10.520062556","2601:5cf:4100:3de0:53f4:479c:be9c:997d","2606:4700::6810:f8f9","TLSv1.3","166","","","32","1,69","Change Cipher Spec, Finished"
"207","10.525990017","2601:5cf:4100:3de0:53f4:479c:be9c:997d","2606:4700::6810:f8f9","DoH","395","SETTINGS,WINDOW_UPDATE,HEADERS,WINDOW_UPDATE,DATA,DATA","36,4,71,4,28,0","32","99,110,54,26","Standard query 0xfbd4 NS 004307.com"
"208","10.855297460","2606:4700::6810:f8f9","2601:5cf:4100:3de0:53f4:479c:be9c:997d","TCP","98","","","44","","[TCP Dup ACK 201#1] 443  >  35934 [ACK] Seq=3300 Ack=518 Win=65536 Len=0 TSval=562476153 TSecr=958454859 SLE=1 SRE=518"
"209","10.855297721","2606:4700::6810:f8f9","2601:5cf:4100:3de0:53f4:479c:be9c:997d","TCP","86","","","32","","443  >  35934 [ACK] Seq=3300 Ack=598 Win=65536 Len=0 TSval=562476169 TSecr=958454863"
"210","10.855297771","2606:4700::6810:f8f9","2601:5cf:4100:3de0:53f4:479c:be9c:997d","TCP","86","","","32","","443  >  35934 [ACK] Seq=3300 Ack=907 Win=65536 Len=0 TSval=562476170 TSecr=958454869"
"211","10.855297801","2606:4700::6810:f8f9","2601:5cf:4100:3de0:53f4:479c:be9c:997d","HTTP2","655","SETTINGS,WINDOW_UPDATE,SETTINGS","18,4,0","32","493,66","SETTINGS[0], WINDOW_UPDATE[0], SETTINGS[0]"
"212","10.855297831","2606:4700::6810:f8f9","2601:5cf:4100:3de0:53f4:479c:be9c:997d","HTTP2","202","HEADERS","85","32","111","HEADERS[1]: 200 OK"
"213","10.855297871","2606:4700::6810:f8f9","2601:5cf:4100:3de0:53f4:479c:be9c:997d","DoH","198","DATA","81","32","107","Standard query response 0xfbd4 NS 004307.com NS bella.ns.cloudflare.com NS dion.ns.cloudflare.com"
"214","10.855297901","2606:4700::6810:f8f9","2601:5cf:4100:3de0:53f4:479c:be9c:997d","TCP","198","","","32","","[TCP Retransmission] 443  >  35934 [PSH, ACK] Seq=3985 Ack=907 Win=65536 Len=112 TSval=562476340 TSecr=958454869"
"215","10.855340053","2601:5cf:4100:3de0:53f4:479c:be9c:997d","2606:4700::6810:f8f9","TCP","98","","","44","","35934  >  443 [ACK] Seq=907 Ack=4097 Win=64000 Len=0 TSval=958455198 TSecr=562476170 SLE=3985 SRE=4097"
"216","10.855806774","2601:5cf:4100:3de0:53f4:479c:be9c:997d","2606:4700::6810:f8f9","HTTP2","117","SETTINGS","0","32","26","SETTINGS[0]"
"217","10.856704719","2601:5cf:4100:3de0:53f4:479c:be9c:997d","2606:4700::6810:f8f9","TCP","86","","","32","","35934  >  443 [FIN, ACK] Seq=938 Ack=4097 Win=64128 Len=0 TSval=958455199 TSecr=562476170"
"218","10.878191189","2601:5cf:4100:3de0:53f4:479c:be9c:997d","2606:4700::6810:f9f9","TCP","94","","","40","","46688  >  443 [SYN] Seq=0 Win=64800 Len=0 MSS=1440 SACK_PERM TSval=1821620193 TSecr=0 WS=128"
"219","11.156112629","2601:5cf:4100:3de0:53f4:479c:be9c:997d","2606:4700::6810:f8f9","TCP","86","","","32","","[TCP Retransmission] 35934  >  443 [FIN, ACK] Seq=938 Ack=4097 Win=64128 Len=0 TSval=958455499 TSecr=562476170"
"220","11.157854824","2606:4700::6810:f8f9","2601:5cf:4100:3de0:53f4:479c:be9c:997d","TCP","86","","","32","","443  >  35934 [FIN, ACK] Seq=4097 Ack=939 Win=65536 Len=0 TSval=562476498 TSecr=958455198"
"221","11.157855275","2606:4700::6810:f9f9","2601:5cf:4100:3de0:53f4:479c:be9c:997d","TCP","94","","","40","","443  >  46688 [SYN, ACK] Seq=0 Ack=1 Win=65535 Len=0 MSS=1360 SACK_PERM TSval=3242666546 TSecr=1821620193 WS=8192"
"222","11.157906745","2601:5cf:4100:3de0:53f4:479c:be9c:997d","2606:4700::6810:f8f9","TCP","86","","","32","","35934  >  443 [ACK] Seq=939 Ack=4098 Win=64128 Len=0 TSval=958455501 TSecr=562476498"
"223","11.157958965","2601:5cf:4100:3de0:53f4:479c:be9c:997d","2606:4700::6810:f9f9","TCP","86","","","32","","46688  >  443 [ACK] Seq=1 Ack=1 Win=64896 Len=0 TSval=1821620473 TSecr=3242666546"
"224","11.158435927","2601:5cf:4100:3de0:53f4:479c:be9c:997d","2606:4700::6810:f9f9","TLSv1.3","603","","","32","512","Client Hello (SNI=cloudflare-dns.com)"
"225","11.469802455","2606:4700::6810:f8f9","2601:5cf:4100:3de0:53f4:479c:be9c:997d","TCP","98","","","44","","[TCP Dup ACK 220#1] 443  >  35934 [ACK] Seq=4098 Ack=939 Win=65536 Len=0 TSval=562476793 TSecr=958455499 SLE=938 SRE=939"
"226","11.469802896","2606:4700::6810:f9f9","2601:5cf:4100:3de0:53f4:479c:be9c:997d","TCP","86","","","32","","443  >  46688 [ACK] Seq=1 Ack=518 Win=65536 Len=0 TSval=3242666834 TSecr=1821620473"
"227","11.469803006","2606:4700::6810:f9f9","2601:5cf:4100:3de0:53f4:479c:be9c:997d","TLSv1.3","2782","","","32","122,1","Server Hello, Change Cipher Spec"
"228","11.469862100","2601:5cf:4100:3de0:53f4:479c:be9c:997d","2606:4700::6810:f9f9","TCP","86","","","32","","46688  >  443 [ACK] Seq=518 Ack=2697 Win=63488 Len=0 TSval=1821620785 TSecr=3242666835"
"229","11.469995047","2606:4700::6810:f9f9","2601:5cf:4100:3de0:53f4:479c:be9c:997d","TLSv1.3","689","","","32","3161","Encrypted Extensions, Certificate, Certificate Verify, Finished"
"230","11.470000898","2601:5cf:4100:3de0:53f4:479c:be9c:997d","2606:4700::6810:f9f9","TCP","86","","","32","","46688  >  443 [ACK] Seq=518 Ack=3300 Win=62976 Len=0 TSval=1821620785 TSecr=3242666835"
"231","11.470920835","2601:5cf:4100:3de0:53f4:479c:be9c:997d","2606:4700::6810:f9f9","TLSv1.3","166","","","32","1,69","Change Cipher Spec, Finished"
"232","11.471222488","2601:5cf:4100:3de0:53f4:479c:be9c:997d","2606:4700::6810:f9f9","HTTP2","190","SETTINGS,WINDOW_UPDATE","36,4","32","99","Magic, SETTINGS[0], WINDOW_UPDATE[0]"
"233","11.478400305","2601:5cf:4100:3de0:53f4:479c:be9c:997d","2606:4700::6810:f9f9","DoH","294","HEADERS,WINDOW_UPDATE,DATA,DATA","71,4,31,0","32","110,57,26","Standard query 0xca2d NS 004837963.xyz"
"234","11.776918524","2606:4700::6810:f9f9","2601:5cf:4100:3de0:53f4:479c:be9c:997d","HTTP2","646","SETTINGS,WINDOW_UPDATE","18,4","32","493,57","SETTINGS[0], WINDOW_UPDATE[0]"
"235","11.776918764","2606:4700::6810:f9f9","2601:5cf:4100:3de0:53f4:479c:be9c:997d","TCP","86","","","32","","443  >  46688 [ACK] Seq=3860 Ack=910 Win=65536 Len=0 TSval=3242667146 TSecr=1821620786"
"236","11.776918804","2606:4700::6810:f9f9","2601:5cf:4100:3de0:53f4:479c:be9c:997d","HTTP2","117","SETTINGS","0","32","26","SETTINGS[0]"
"237","11.776918845","2606:4700::6810:f9f9","2601:5cf:4100:3de0:53f4:479c:be9c:997d","HTTP2","203","HEADERS","86","32","112","HEADERS[1]: 200 OK"
"238","11.776918875","2606:4700::6810:f9f9","2601:5cf:4100:3de0:53f4:479c:be9c:997d","DoH","295","DATA","178","32","204","Standard query response 0xca2d NS 004837963.xyz NS ns1.huaweicloud-dns.com NS ns1.huaweicloud-dns.net NS ns1.huaweicloud-dns.org NS ns1.huaweicloud-dns.cn"
"239","11.777415233","2601:5cf:4100:3de0:53f4:479c:be9c:997d","2606:4700::6810:f9f9","HTTP2","117","SETTINGS","0","32","26","SETTINGS[0]"
"240","11.778530508","2601:5cf:4100:3de0:53f4:479c:be9c:997d","2606:4700::6810:f9f9","TCP","86","","","32","","46688  >  443 [FIN, ACK] Seq=941 Ack=4217 Win=64128 Len=0 TSval=1821621093 TSecr=3242667138"
"241","11.799439663","2601:5cf:4100:3de0:53f4:479c:be9c:997d","2606:4700::6810:f9f9","TCP","94","","","40","","46698  >  443 [SYN] Seq=0 Win=64800 Len=0 MSS=1440 SACK_PERM TSval=1821621114 TSecr=0 WS=128"
"242","12.083994075","2606:4700::6810:f9f9","2601:5cf:4100:3de0:53f4:479c:be9c:997d","TCP","86","","","32","","443  >  46688 [FIN, ACK] Seq=4217 Ack=942 Win=65536 Len=0 TSval=3242667447 TSecr=1821621092"
"243","12.083994706","2606:4700::6810:f9f9","2601:5cf:4100:3de0:53f4:479c:be9c:997d","TCP","94","","","40","","443  >  46698 [SYN, ACK] Seq=0 Ack=1 Win=65535 Len=0 MSS=1360 SACK_PERM TSval=3282395323 TSecr=1821621114 WS=8192"
"244","12.084033180","2601:5cf:4100:3de0:53f4:479c:be9c:997d","2606:4700::6810:f9f9","TCP","86","","","32","","46688  >  443 [ACK] Seq=942 Ack=4218 Win=64128 Len=0 TSval=1821621399 TSecr=3242667447"
"245","12.084056145","2601:5cf:4100:3de0:53f4:479c:be9c:997d","2606:4700::6810:f9f9","TCP","86","","","32","","46698  >  443 [ACK] Seq=1 Ack=1 Win=64896 Len=0 TSval=1821621399 TSecr=3282395323"
"246","12.084394348","2601:5cf:4100:3de0:53f4:479c:be9c:997d","2606:4700::6810:f9f9","TLSv1.3","603","","","32","512","Client Hello (SNI=cloudflare-dns.com)"
"247","12.188206803","2606:4700::6810:f9f9","2601:5cf:4100:3de0:53f4:479c:be9c:997d","TCP","86","","","32","","443  >  46698 [ACK] Seq=1 Ack=518 Win=65536 Len=0 TSval=3282395608 TSecr=1821621399"
"248","12.188207054","2606:4700::6810:f9f9","2601:5cf:4100:3de0:53f4:479c:be9c:997d","TLSv1.3","2782","","","32","122,1","Server Hello, Change Cipher Spec"
"249","12.188207114","2606:4700::6810:f9f9","2601:5cf:4100:3de0:53f4:479c:be9c:997d","TLSv1.3","689","","","32","3161","Encrypted Extensions, Certificate, Certificate Verify, Finished"
"250","12.188237623","2601:5cf:4100:3de0:53f4:479c:be9c:997d","2606:4700::6810:f9f9","TCP","86","","","32","","46698  >  443 [ACK] Seq=518 Ack=2697 Win=63488 Len=0 TSval=1821621503 TSecr=3282395609"
"251","12.188248654","2601:5cf:4100:3de0:53f4:479c:be9c:997d","2606:4700::6810:f9f9","TCP","86","","","32","","46698  >  443 [ACK] Seq=518 Ack=3300 Win=62976 Len=0 TSval=1821621503 TSecr=3282395609"
"252","12.189559316","2601:5cf:4100:3de0:53f4:479c:be9c:997d","2606:4700::6810:f9f9","TLSv1.3","166","","","32","1,69","Change Cipher Spec, Finished"
"253","12.189850880","2601:5cf:4100:3de0:53f4:479c:be9c:997d","2606:4700::6810:f9f9","HTTP2","190","SETTINGS,WINDOW_UPDATE","36,4","32","99","Magic, SETTINGS[0], WINDOW_UPDATE[0]"
"254","12.197128189","2601:5cf:4100:3de0:53f4:479c:be9c:997d","2606:4700::6810:f9f9","DoH","291","HEADERS,WINDOW_UPDATE,DATA,DATA","71,4,28,0","32","110,54,26","Standard query 0x18ac NS 006622.xyz"
"255","12.493607144","2606:4700::6810:f9f9","2601:5cf:4100:3de0:53f4:479c:be9c:997d","TCP","86","","","32","","443  >  46698 [ACK] Seq=3300 Ack=702 Win=65536 Len=0 TSval=3282395704 TSecr=1821621504"
"256","12.493607594","2606:4700::6810:f9f9","2601:5cf:4100:3de0:53f4:479c:be9c:997d","HTTP2","655","SETTINGS,WINDOW_UPDATE,SETTINGS","18,4,0","32","493,66","SETTINGS[0], WINDOW_UPDATE[0], SETTINGS[0]"
"257","12.493607725","2606:4700::6810:f9f9","2601:5cf:4100:3de0:53f4:479c:be9c:997d","HTTP2","202","HEADERS","85","32","111","HEADERS[1]: 200 OK"
"258","12.493607825","2606:4700::6810:f9f9","2601:5cf:4100:3de0:53f4:479c:be9c:997d","DoH","201","DATA","84","32","110","Standard query response 0x18ac NS 006622.xyz NS isabel.ns.cloudflare.com NS jay.ns.cloudflare.com"
"259","12.494585263","2601:5cf:4100:3de0:53f4:479c:be9c:997d","2606:4700::6810:f9f9","HTTP2","117","SETTINGS","0","32","26","SETTINGS[0]"
"260","12.495607097","2601:5cf:4100:3de0:53f4:479c:be9c:997d","2606:4700::6810:f9f9","TCP","86","","","32","","46698  >  443 [FIN, ACK] Seq=938 Ack=4100 Win=64128 Len=0 TSval=1821621810 TSecr=3282395704"
"261","12.516027919","2601:5cf:4100:3de0:53f4:479c:be9c:997d","2606:4700::6810:f9f9","TCP","94","","","40","","46700  >  443 [SYN] Seq=0 Win=64800 Len=0 MSS=1440 SACK_PERM TSval=1821621831 TSecr=0 WS=128"
"262","12.800931692","2606:4700::6810:f9f9","2601:5cf:4100:3de0:53f4:479c:be9c:997d","TCP","86","","","32","","443  >  46698 [FIN, ACK] Seq=4100 Ack=939 Win=65536 Len=0 TSval=3282396020 TSecr=1821621809"
"263","12.800931933","2606:4700::6810:f9f9","2601:5cf:4100:3de0:53f4:479c:be9c:997d","TCP","94","","","40","","443  >  46700 [SYN, ACK] Seq=0 Ack=1 Win=65535 Len=0 MSS=1360 SACK_PERM TSval=695282728 TSecr=1821621831 WS=8192"
"264","12.800960197","2601:5cf:4100:3de0:53f4:479c:be9c:997d","2606:4700::6810:f9f9","TCP","86","","","32","","46698  >  443 [ACK] Seq=939 Ack=4101 Win=64128 Len=0 TSval=1821622116 TSecr=3282396020"
"265","12.800980467","2601:5cf:4100:3de0:53f4:479c:be9c:997d","2606:4700::6810:f9f9","TCP","86","","","32","","46700  >  443 [ACK] Seq=1 Ack=1 Win=64896 Len=0 TSval=1821622116 TSecr=695282728"
"266","12.801338729","2601:5cf:4100:3de0:53f4:479c:be9c:997d","2606:4700::6810:f9f9","TLSv1.3","603","","","32","512","Client Hello (SNI=cloudflare-dns.com)"
"267","13.109822837","2606:4700::6810:f9f9","2601:5cf:4100:3de0:53f4:479c:be9c:997d","TCP","86","","","32","","443  >  46700 [ACK] Seq=1 Ack=518 Win=65536 Len=0 TSval=695283009 TSecr=1821622116"
"268","13.109823078","2606:4700::6810:f9f9","2601:5cf:4100:3de0:53f4:479c:be9c:997d","TLSv1.3","2782","","","32","122,1","Server Hello, Change Cipher Spec"
"269","13.109823118","2606:4700::6810:f9f9","2601:5cf:4100:3de0:53f4:479c:be9c:997d","TLSv1.3","690","","","32","3162","Encrypted Extensions, Certificate, Certificate Verify, Finished"
"270","13.109854629","2601:5cf:4100:3de0:53f4:479c:be9c:997d","2606:4700::6810:f9f9","TCP","86","","","32","","46700  >  443 [ACK] Seq=518 Ack=2697 Win=63488 Len=0 TSval=1821622425 TSecr=695283009"
"271","13.109865600","2601:5cf:4100:3de0:53f4:479c:be9c:997d","2606:4700::6810:f9f9","TCP","86","","","32","","46700  >  443 [ACK] Seq=518 Ack=3301 Win=62976 Len=0 TSval=1821622425 TSecr=695283009"
"272","13.111432577","2601:5cf:4100:3de0:53f4:479c:be9c:997d","2606:4700::6810:f9f9","TLSv1.3","166","","","32","1,69","Change Cipher Spec, Finished"
"273","13.111718149","2601:5cf:4100:3de0:53f4:479c:be9c:997d","2606:4700::6810:f9f9","HTTP2","190","SETTINGS,WINDOW_UPDATE","36,4","32","99","Magic, SETTINGS[0], WINDOW_UPDATE[0]"
"274","13.119079531","2601:5cf:4100:3de0:53f4:479c:be9c:997d","2606:4700::6810:f9f9","DoH","290","HEADERS,WINDOW_UPDATE,DATA,DATA","71,4,27,0","32","110,53,26","Standard query 0xc1f1 NS 00a4g.top"
"275","13.415367330","2606:4700::6810:f9f9","2601:5cf:4100:3de0:53f4:479c:be9c:997d","TCP","86","","","32","","443  >  46700 [ACK] Seq=3301 Ack=906 Win=65536 Len=0 TSval=695283320 TSecr=1821622426"
"276","13.415367560","2606:4700::6810:f9f9","2601:5cf:4100:3de0:53f4:479c:be9c:997d","HTTP2","655","SETTINGS,WINDOW_UPDATE,SETTINGS","18,4,0","32","493,66","SETTINGS[0], WINDOW_UPDATE[0], SETTINGS[0]"
"277","13.415367610","2606:4700::6810:f9f9","2601:5cf:4100:3de0:53f4:479c:be9c:997d","HTTP2","202","HEADERS","85","32","111","HEADERS[1]: 200 OK"
"278","13.415367641","2606:4700::6810:f9f9","2601:5cf:4100:3de0:53f4:479c:be9c:997d","DoH","203","DATA","86","32","112","Standard query response 0xc1f1 NS 00a4g.top NS oaklyn.ns.cloudflare.com NS yevgen.ns.cloudflare.com"
"279","13.416381229","2601:5cf:4100:3de0:53f4:479c:be9c:997d","2606:4700::6810:f9f9","HTTP2","117","SETTINGS","0","32","26","SETTINGS[0]"
"280","13.417367093","2601:5cf:4100:3de0:53f4:479c:be9c:997d","2606:4700::6810:f9f9","TCP","86","","","32","","46700  >  443 [FIN, ACK] Seq=937 Ack=4103 Win=64128 Len=0 TSval=1821622732 TSecr=695283320"
"281","13.438471627","2601:5cf:4100:3de0:53f4:479c:be9c:997d","2606:4700::6810:f8f9","TCP","94","","","40","","35946  >  443 [SYN] Seq=0 Win=64800 Len=0 MSS=1440 SACK_PERM TSval=958457781 TSecr=0 WS=128"
"282","13.722707037","2606:4700::6810:f9f9","2601:5cf:4100:3de0:53f4:479c:be9c:997d","TCP","86","","","32","","443  >  46700 [FIN, ACK] Seq=4103 Ack=938 Win=65536 Len=0 TSval=695283624 TSecr=1821622731"
"283","13.722707497","2606:4700::6810:f8f9","2601:5cf:4100:3de0:53f4:479c:be9c:997d","TCP","94","","","40","","443  >  35946 [SYN, ACK] Seq=0 Ack=1 Win=65535 Len=0 MSS=1360 SACK_PERM TSval=2638092718 TSecr=958457781 WS=8192"
"284","13.722758235","2601:5cf:4100:3de0:53f4:479c:be9c:997d","2606:4700::6810:f9f9","TCP","86","","","32","","46700  >  443 [ACK] Seq=938 Ack=4104 Win=64128 Len=0 TSval=1821623037 TSecr=695283624"
"285","13.722801649","2601:5cf:4100:3de0:53f4:479c:be9c:997d","2606:4700::6810:f8f9","TCP","86","","","32","","35946  >  443 [ACK] Seq=1 Ack=1 Win=64896 Len=0 TSval=958458065 TSecr=2638092718"
"286","13.723351902","2601:5cf:4100:3de0:53f4:479c:be9c:997d","2606:4700::6810:f8f9","TLSv1.3","603","","","32","512","Client Hello (SNI=cloudflare-dns.com)"
"287","14.029919747","2606:4700::6810:f8f9","2601:5cf:4100:3de0:53f4:479c:be9c:997d","TCP","86","","","32","","443  >  35946 [ACK] Seq=1 Ack=518 Win=65536 Len=0 TSval=2638093011 TSecr=958458066"
"288","14.029920198","2606:4700::6810:f8f9","2601:5cf:4100:3de0:53f4:479c:be9c:997d","TLSv1.3","2782","","","32","122,1","Server Hello, Change Cipher Spec"
"289","14.029920318","2606:4700::6810:f8f9","2601:5cf:4100:3de0:53f4:479c:be9c:997d","TLSv1.3","688","","","32","3160","Encrypted Extensions, Certificate, Certificate Verify, Finished"
"290","14.029978952","2601:5cf:4100:3de0:53f4:479c:be9c:997d","2606:4700::6810:f8f9","TCP","86","","","32","","35946  >  443 [ACK] Seq=518 Ack=2697 Win=63488 Len=0 TSval=958458373 TSecr=2638093013"
"291","14.030003199","2601:5cf:4100:3de0:53f4:479c:be9c:997d","2606:4700::6810:f8f9","TCP","86","","","32","","35946  >  443 [ACK] Seq=518 Ack=3299 Win=62976 Len=0 TSval=958458373 TSecr=2638093013"
"292","14.031488448","2601:5cf:4100:3de0:53f4:479c:be9c:997d","2606:4700::6810:f8f9","TLSv1.3","166","","","32","1,69","Change Cipher Spec, Finished"
"293","14.031785111","2601:5cf:4100:3de0:53f4:479c:be9c:997d","2606:4700::6810:f8f9","HTTP2","190","SETTINGS,WINDOW_UPDATE","36,4","32","99","Magic, SETTINGS[0], WINDOW_UPDATE[0]"
"294","14.038996373","2601:5cf:4100:3de0:53f4:479c:be9c:997d","2606:4700::6810:f8f9","DoH","298","HEADERS,WINDOW_UPDATE,DATA,DATA","71,4,35,0","32","110,61,26","Standard query 0x218d NS 00b5dxgbkl.online"
"295","14.172138468","2606:4700::6810:f8f9","2601:5cf:4100:3de0:53f4:479c:be9c:997d","TCP","86","","","32","","443  >  35946 [ACK] Seq=3299 Ack=702 Win=65536 Len=0 TSval=2638093311 TSecr=958458374"
"296","14.172138728","2606:4700::6810:f8f9","2601:5cf:4100:3de0:53f4:479c:be9c:997d","HTTP2","655","SETTINGS,WINDOW_UPDATE,SETTINGS","18,4,0","32","493,66","SETTINGS[0], WINDOW_UPDATE[0], SETTINGS[0]"
"297","14.172138778","2606:4700::6810:f8f9","2601:5cf:4100:3de0:53f4:479c:be9c:997d","HTTP2","202","HEADERS","85","32","111","HEADERS[1]: 200 OK"
"298","14.172138829","2606:4700::6810:f8f9","2601:5cf:4100:3de0:53f4:479c:be9c:997d","DoH","209","DATA","92","32","118","Standard query response 0x218d NS 00b5dxgbkl.online NS hadlee.ns.cloudflare.com NS sean.ns.cloudflare.com"
"299","14.172711956","2601:5cf:4100:3de0:53f4:479c:be9c:997d","2606:4700::6810:f8f9","HTTP2","117","SETTINGS","0","32","26","SETTINGS[0]"
"300","14.173593679","2601:5cf:4100:3de0:53f4:479c:be9c:997d","2606:4700::6810:f8f9","TCP","86","","","32","","35946  >  443 [FIN, ACK] Seq=945 Ack=4107 Win=64128 Len=0 TSval=958458516 TSecr=2638093311"
"301","14.197482321","2601:5cf:4100:3de0:53f4:479c:be9c:997d","2606:4700::6810:f9f9","TCP","94","","","40","","46712  >  443 [SYN] Seq=0 Win=64800 Len=0 MSS=1440 SACK_PERM TSval=1821623512 TSecr=0 WS=128"
"302","14.294567346","2606:4700::6810:f8f9","2601:5cf:4100:3de0:53f4:479c:be9c:997d","TCP","86","","","32","","443  >  35946 [FIN, ACK] Seq=4107 Ack=946 Win=65536 Len=0 TSval=2638093463 TSecr=958458515"
"303","14.294598897","2601:5cf:4100:3de0:53f4:479c:be9c:997d","2606:4700::6810:f8f9","TCP","86","","","32","","35946  >  443 [ACK] Seq=946 Ack=4108 Win=64128 Len=0 TSval=958458637 TSecr=2638093463"
"304","14.439391654","2606:4700::6810:f9f9","2601:5cf:4100:3de0:53f4:479c:be9c:997d","TCP","94","","","40","","443  >  46712 [SYN, ACK] Seq=0 Ack=1 Win=65535 Len=0 MSS=1360 SACK_PERM TSval=3759813021 TSecr=1821623512 WS=8192"
"305","14.439424798","2601:5cf:4100:3de0:53f4:479c:be9c:997d","2606:4700::6810:f9f9","TCP","86","","","32","","46712  >  443 [ACK] Seq=1 Ack=1 Win=64896 Len=0 TSval=1821623754 TSecr=3759813021"
"306","14.439770326","2601:5cf:4100:3de0:53f4:479c:be9c:997d","2606:4700::6810:f9f9","TLSv1.3","603","","","32","512","Client Hello (SNI=cloudflare-dns.com)"
"307","14.746704987","2606:4700::6810:f9f9","2601:5cf:4100:3de0:53f4:479c:be9c:997d","TCP","86","","","32","","443  >  46712 [ACK] Seq=1 Ack=518 Win=65536 Len=0 TSval=3759813174 TSecr=1821623754"
"308","14.746705217","2606:4700::6810:f9f9","2601:5cf:4100:3de0:53f4:479c:be9c:997d","TLSv1.3","3386","","","32","122,1,3162","Server Hello, Change Cipher Spec, Encrypted Extensions, Certificate, Certificate Verify, Finished"
"309","14.746737760","2601:5cf:4100:3de0:53f4:479c:be9c:997d","2606:4700::6810:f9f9","TCP","86","","","32","","46712  >  443 [ACK] Seq=518 Ack=3301 Win=62976 Len=0 TSval=1821624061 TSecr=3759813175"
"310","14.747957116","2601:5cf:4100:3de0:53f4:479c:be9c:997d","2606:4700::6810:f9f9","TLSv1.3","166","","","32","1,69","Change Cipher Spec, Finished"
"311","14.748265732","2601:5cf:4100:3de0:53f4:479c:be9c:997d","2606:4700::6810:f9f9","HTTP2","190","SETTINGS,WINDOW_UPDATE","36,4","32","99","Magic, SETTINGS[0], WINDOW_UPDATE[0]"
"312","14.755697560","2601:5cf:4100:3de0:53f4:479c:be9c:997d","2606:4700::6810:f9f9","DoH","295","HEADERS,WINDOW_UPDATE,DATA,DATA","71,4,32,0","32","110,58,26","Standard query 0x9bfd NS 00hgmaq6yv.com"
"314","15.053759369","2606:4700::6810:f9f9","2601:5cf:4100:3de0:53f4:479c:be9c:997d","TCP","690","","","32","","[TCP Spurious Retransmission] 443  >  46712 [PSH, ACK] Seq=2697 Ack=518 Win=65536 Len=604 TSval=3759813468 TSecr=1821623754"
"315","15.053759660","2606:4700::6810:f9f9","2601:5cf:4100:3de0:53f4:479c:be9c:997d","TCP","86","","","32","","443  >  46712 [ACK] Seq=3301 Ack=702 Win=65536 Len=0 TSval=3759813473 TSecr=1821624063"
"316","15.053759790","2606:4700::6810:f9f9","2601:5cf:4100:3de0:53f4:479c:be9c:997d","HTTP2","655","SETTINGS,WINDOW_UPDATE,SETTINGS","18,4,0","32","493,66","SETTINGS[0], WINDOW_UPDATE[0], SETTINGS[0]"
"317","15.053759890","2606:4700::6810:f9f9","2601:5cf:4100:3de0:53f4:479c:be9c:997d","TCP","86","","","32","","443  >  46712 [ACK] Seq=3870 Ack=911 Win=65536 Len=0 TSval=3759813526 TSecr=1821624070"
"318","15.053760001","2606:4700::6810:f9f9","2601:5cf:4100:3de0:53f4:479c:be9c:997d","HTTP2","202","HEADERS","85","32","111","HEADERS[1]: 200 OK"
"319","15.053760101","2606:4700::6810:f9f9","2601:5cf:4100:3de0:53f4:479c:be9c:997d","DoH","149","DATA","32","32","58","Standard query response 0x9bfd Server failure NS 00hgmaq6yv.com"
"320","15.053793746","2601:5cf:4100:3de0:53f4:479c:be9c:997d","2606:4700::6810:f9f9","TCP","98","","","44","","[TCP Dup ACK 309#1] 46712  >  443 [ACK] Seq=911 Ack=3301 Win=64128 Len=0 TSval=1821624368 TSecr=3759813468 SLE=2697 SRE=3301"
"321","15.053820427","2601:5cf:4100:3de0:53f4:479c:be9c:997d","2606:4700::6810:f9f9","TCP","86","","","32","","46712  >  443 [ACK] Seq=911 Ack=3870 Win=64128 Len=0 TSval=1821624368 TSecr=3759813473"
"322","15.053829244","2601:5cf:4100:3de0:53f4:479c:be9c:997d","2606:4700::6810:f9f9","TCP","86","","","32","","46712  >  443 [ACK] Seq=911 Ack=3986 Win=64128 Len=0 TSval=1821624368 TSecr=3759813530"
"323","15.053832380","2601:5cf:4100:3de0:53f4:479c:be9c:997d","2606:4700::6810:f9f9","TCP","86","","","32","","46712  >  443 [ACK] Seq=911 Ack=4049 Win=64128 Len=0 TSval=1821624369 TSecr=3759813530"
"324","15.054335392","2601:5cf:4100:3de0:53f4:479c:be9c:997d","2606:4700::6810:f9f9","HTTP2","117","SETTINGS","0","32","26","SETTINGS[0]"
"325","15.055082125","2601:5cf:4100:3de0:53f4:479c:be9c:997d","2606:4700::6810:f9f9","TCP","86","","","32","","46712  >  443 [FIN, ACK] Seq=942 Ack=4049 Win=64128 Len=0 TSval=1821624370 TSecr=3759813530"
"327","15.082047030","2601:5cf:4100:3de0:53f4:479c:be9c:997d","2606:4700::6810:f8f9","TCP","94","","","40","","35948  >  443 [SYN] Seq=0 Win=64800 Len=0 MSS=1440 SACK_PERM TSval=958459425 TSecr=0 WS=128"
"328","15.086197759","2606:4700::6810:f9f9","2601:5cf:4100:3de0:53f4:479c:be9c:997d","TCP","86","","","32","","443  >  46712 [ACK] Seq=4049 Ack=942 Win=65536 Len=0 TSval=3759813777 TSecr=1821624369"
"330","15.222507798","2606:4700::6810:f9f9","2601:5cf:4100:3de0:53f4:479c:be9c:997d","TCP","86","","","32","","443  >  46712 [FIN, ACK] Seq=4049 Ack=943 Win=65536 Len=0 TSval=3759813787 TSecr=1821624370"
"331","15.222508249","2606:4700::6810:f8f9","2601:5cf:4100:3de0:53f4:479c:be9c:997d","TCP","94","","","40","","443  >  35948 [SYN, ACK] Seq=0 Ack=1 Win=65535 Len=0 MSS=1360 SACK_PERM TSval=9643291 TSecr=958459425 WS=8192"
"332","15.222556642","2601:5cf:4100:3de0:53f4:479c:be9c:997d","2606:4700::6810:f9f9","TCP","86","","","32","","46712  >  443 [ACK] Seq=943 Ack=4050 Win=64128 Len=0 TSval=1821624537 TSecr=3759813787"
"333","15.222600156","2601:5cf:4100:3de0:53f4:479c:be9c:997d","2606:4700::6810:f8f9","TCP","86","","","32","","35948  >  443 [ACK] Seq=1 Ack=1 Win=64896 Len=0 TSval=958459565 TSecr=9643291"
"334","15.223269660","2601:5cf:4100:3de0:53f4:479c:be9c:997d","2606:4700::6810:f8f9","TLSv1.3","603","","","32","512","Client Hello (SNI=cloudflare-dns.com)"
"335","15.361095168","2606:4700::6810:f8f9","2601:5cf:4100:3de0:53f4:479c:be9c:997d","TCP","86","","","32","","443  >  35948 [ACK] Seq=1 Ack=518 Win=57344 Len=0 TSval=9643451 TSecr=958459566"
"336","15.361095669","2606:4700::6810:f8f9","2601:5cf:4100:3de0:53f4:479c:be9c:997d","TLSv1.3","3385","","","32","122,1,3161","Server Hello, Change Cipher Spec, Encrypted Extensions, Certificate, Certificate Verify, Finished"
"337","15.361150696","2601:5cf:4100:3de0:53f4:479c:be9c:997d","2606:4700::6810:f8f9","TCP","86","","","32","","35948  >  443 [ACK] Seq=518 Ack=3300 Win=62976 Len=0 TSval=958459704 TSecr=9643452"
"338","15.362293223","2601:5cf:4100:3de0:53f4:479c:be9c:997d","2606:4700::6810:f8f9","TLSv1.3","166","","","32","1,69","Change Cipher Spec, Finished"
"339","15.362564768","2601:5cf:4100:3de0:53f4:479c:be9c:997d","2606:4700::6810:f8f9","HTTP2","190","SETTINGS,WINDOW_UPDATE","36,4","32","99","Magic, SETTINGS[0], WINDOW_UPDATE[0]"
"340","15.370119533","2601:5cf:4100:3de0:53f4:479c:be9c:997d","2606:4700::6810:f8f9","DoH","289","HEADERS,WINDOW_UPDATE,DATA,DATA","71,4,26,0","32","110,52,26","Standard query 0x9578 NS 00px.net"
"341","15.667889115","2601:5cf:4100:3de0:53f4:479c:be9c:997d","2606:4700::6810:f8f9","TCP","289","","","32","","[TCP Retransmission] 35948  >  443 [PSH, ACK] Seq=702 Ack=3300 Win=64128 Len=203 TSval=958460011 TSecr=9643452"
"342","15.668109722","2606:4700::6810:f8f9","2601:5cf:4100:3de0:53f4:479c:be9c:997d","HTTP2","646","SETTINGS,WINDOW_UPDATE","18,4","32","493,57","SETTINGS[0], WINDOW_UPDATE[0]"
"343","15.668109992","2606:4700::6810:f8f9","2601:5cf:4100:3de0:53f4:479c:be9c:997d","HTTP2","117","SETTINGS","0","32","26","SETTINGS[0]"
"344","15.668110042","2606:4700::6810:f8f9","2601:5cf:4100:3de0:53f4:479c:be9c:997d","TCP","86","","","32","","443  >  35948 [ACK] Seq=3891 Ack=905 Win=65536 Len=0 TSval=9643629 TSecr=958459713"
"345","15.668110072","2606:4700::6810:f8f9","2601:5cf:4100:3de0:53f4:479c:be9c:997d","HTTP2","202","HEADERS","85","32","111","HEADERS[1]: 200 OK"
"346","15.668110112","2606:4700::6810:f8f9","2601:5cf:4100:3de0:53f4:479c:be9c:997d","DoH","213","DATA","96","32","122","Standard query response 0x9578 NS 00px.net NS ns2.digitalocean.com NS ns3.digitalocean.com NS ns1.digitalocean.com"
"347","15.668602183","2601:5cf:4100:3de0:53f4:479c:be9c:997d","2606:4700::6810:f8f9","HTTP2","117","SETTINGS","0","32","26","SETTINGS[0]"
"348","15.669590232","2601:5cf:4100:3de0:53f4:479c:be9c:997d","2606:4700::6810:f8f9","TCP","86","","","32","","35948  >  443 [FIN, ACK] Seq=936 Ack=4134 Win=64128 Len=0 TSval=958460012 TSecr=9643564"
"349","15.695980078","2601:5cf:4100:3de0:53f4:479c:be9c:997d","2606:4700::6810:f9f9","TCP","94","","","40","","46724  >  443 [SYN] Seq=0 Win=64800 Len=0 MSS=1440 SACK_PERM TSval=1821625011 TSecr=0 WS=128"
"350","15.703679984","2606:4700::6810:f8f9","2601:5cf:4100:3de0:53f4:479c:be9c:997d","TCP","98","","","44","","[TCP Dup ACK 344#1] 443  >  35948 [ACK] Seq=4134 Ack=905 Win=65536 Len=0 TSval=9643871 TSecr=958460011 SLE=702 SRE=905"
"351","15.703680435","2606:4700::6810:f8f9","2601:5cf:4100:3de0:53f4:479c:be9c:997d","TCP","86","","","32","","443  >  35948 [ACK] Seq=4134 Ack=936 Win=65536 Len=0 TSval=9643871 TSecr=958460011"
"352","15.975444083","2606:4700::6810:f8f9","2601:5cf:4100:3de0:53f4:479c:be9c:997d","TCP","86","","","32","","443  >  35948 [FIN, ACK] Seq=4134 Ack=937 Win=65536 Len=0 TSval=9643880 TSecr=958460012"
"353","15.975444323","2606:4700::6810:f9f9","2601:5cf:4100:3de0:53f4:479c:be9c:997d","TCP","94","","","40","","443  >  46724 [SYN, ACK] Seq=0 Ack=1 Win=65535 Len=0 MSS=1360 SACK_PERM TSval=1289753623 TSecr=1821625011 WS=8192"
"354","15.975472217","2601:5cf:4100:3de0:53f4:479c:be9c:997d","2606:4700::6810:f8f9","TCP","86","","","32","","35948  >  443 [ACK] Seq=937 Ack=4135 Win=64128 Len=0 TSval=958460318 TSecr=9643880"
"355","15.975493558","2601:5cf:4100:3de0:53f4:479c:be9c:997d","2606:4700::6810:f9f9","TCP","86","","","32","","46724  >  443 [ACK] Seq=1 Ack=1 Win=64896 Len=0 TSval=1821625290 TSecr=1289753623"
"356","15.976105530","2601:5cf:4100:3de0:53f4:479c:be9c:997d","2606:4700::6810:f9f9","TLSv1.3","603","","","32","512","Client Hello (SNI=cloudflare-dns.com)"
"357","16.188121746","2606:4700::6810:f9f9","2601:5cf:4100:3de0:53f4:479c:be9c:997d","TCP","86","","","32","","443  >  46724 [ACK] Seq=1 Ack=518 Win=57344 Len=0 TSval=1289753899 TSecr=1821625291"
"358","16.188121996","2606:4700::6810:f9f9","2601:5cf:4100:3de0:53f4:479c:be9c:997d","TLSv1.3","2782","","","32","122,1","Server Hello, Change Cipher Spec"
"359","16.188122046","2606:4700::6810:f9f9","2601:5cf:4100:3de0:53f4:479c:be9c:997d","TLSv1.3","690","","","32","3162","Encrypted Extensions, Certificate, Certificate Verify, Finished"
"360","16.188153246","2601:5cf:4100:3de0:53f4:479c:be9c:997d","2606:4700::6810:f9f9","TCP","86","","","32","","46724  >  443 [ACK] Seq=518 Ack=2697 Win=63488 Len=0 TSval=1821625503 TSecr=1289753900"
"361","16.188164729","2601:5cf:4100:3de0:53f4:479c:be9c:997d","2606:4700::6810:f9f9","TCP","86","","","32","","46724  >  443 [ACK] Seq=518 Ack=3301 Win=62976 Len=0 TSval=1821625503 TSecr=1289753900"
"362","16.189507774","2601:5cf:4100:3de0:53f4:479c:be9c:997d","2606:4700::6810:f9f9","TLSv1.3","166","","","32","1,69","Change Cipher Spec, Finished"
"363","16.189806711","2601:5cf:4100:3de0:53f4:479c:be9c:997d","2606:4700::6810:f9f9","HTTP2","190","SETTINGS,WINDOW_UPDATE","36,4","32","99","Magic, SETTINGS[0], WINDOW_UPDATE[0]"
"364","16.197041830","2601:5cf:4100:3de0:53f4:479c:be9c:997d","2606:4700::6810:f9f9","DoH","291","HEADERS,WINDOW_UPDATE,DATA,DATA","71,4,28,0","32","110,54,26","Standard query 0x22f4 NS 00xwin.com"
"365","16.487493158","2606:4700::6810:f9f9","2601:5cf:4100:3de0:53f4:479c:be9c:997d","TCP","86","","","32","","443  >  46724 [ACK] Seq=3301 Ack=702 Win=65536 Len=0 TSval=1289754103 TSecr=1821625504"
"366","16.487493389","2606:4700::6810:f9f9","2601:5cf:4100:3de0:53f4:479c:be9c:997d","HTTP2","655","SETTINGS,WINDOW_UPDATE,SETTINGS","18,4,0","32","493,66","SETTINGS[0], WINDOW_UPDATE[0], SETTINGS[0]"
"367","16.487493439","2606:4700::6810:f9f9","2601:5cf:4100:3de0:53f4:479c:be9c:997d","HTTP2","202","HEADERS","85","32","111","HEADERS[1]: 200 OK"
"368","16.487493469","2606:4700::6810:f9f9","2601:5cf:4100:3de0:53f4:479c:be9c:997d","DoH","197","DATA","80","32","106","Standard query response 0x22f4 NS 00xwin.com NS evan.ns.cloudflare.com NS kami.ns.cloudflare.com"
"369","16.488030947","2601:5cf:4100:3de0:53f4:479c:be9c:997d","2606:4700::6810:f9f9","HTTP2","117","SETTINGS","0","32","26","SETTINGS[0]"
"370","16.488939934","2601:5cf:4100:3de0:53f4:479c:be9c:997d","2606:4700::6810:f9f9","TCP","86","","","32","","46724  >  443 [FIN, ACK] Seq=938 Ack=4097 Win=64128 Len=0 TSval=1821625804 TSecr=1289754103"
"371","16.513134809","2601:5cf:4100:3de0:53f4:479c:be9c:997d","2606:4700::6810:f8f9","TCP","94","","","40","","39104  >  443 [SYN] Seq=0 Win=64800 Len=0 MSS=1440 SACK_PERM TSval=958460856 TSecr=0 WS=128"
"372","16.794739747","2606:4700::6810:f9f9","2601:5cf:4100:3de0:53f4:479c:be9c:997d","TCP","86","","","32","","443  >  46724 [FIN, ACK] Seq=4097 Ack=939 Win=65536 Len=0 TSval=1289754412 TSecr=1821625803"
"373","16.794739988","2606:4700::6810:f8f9","2601:5cf:4100:3de0:53f4:479c:be9c:997d","TCP","94","","","40","","443  >  39104 [SYN, ACK] Seq=0 Ack=1 Win=65535 Len=0 MSS=1360 SACK_PERM TSval=1323064336 TSecr=958460856 WS=8192"
"374","16.794768683","2601:5cf:4100:3de0:53f4:479c:be9c:997d","2606:4700::6810:f9f9","TCP","86","","","32","","46724  >  443 [ACK] Seq=939 Ack=4098 Win=64128 Len=0 TSval=1821626109 TSecr=1289754412"
"375","16.794789754","2601:5cf:4100:3de0:53f4:479c:be9c:997d","2606:4700::6810:f8f9","TCP","86","","","32","","39104  >  443 [ACK] Seq=1 Ack=1 Win=64896 Len=0 TSval=958461137 TSecr=1323064336"
"376","16.795126735","2601:5cf:4100:3de0:53f4:479c:be9c:997d","2606:4700::6810:f8f9","TLSv1.3","603","","","32","512","Client Hello (SNI=cloudflare-dns.com)"
"377","17.102054719","2606:4700::6810:f8f9","2601:5cf:4100:3de0:53f4:479c:be9c:997d","TCP","86","","","32","","443  >  39104 [ACK] Seq=1 Ack=518 Win=65536 Len=0 TSval=1323064616 TSecr=958461138"
"378","17.102055170","2606:4700::6810:f8f9","2601:5cf:4100:3de0:53f4:479c:be9c:997d","TLSv1.3","2782","","","32","122,1","Server Hello, Change Cipher Spec"
"379","17.102055290","2606:4700::6810:f8f9","2601:5cf:4100:3de0:53f4:479c:be9c:997d","TLSv1.3","689","","","32","3161","Encrypted Extensions, Certificate, Certificate Verify, Finished"
"380","17.102112000","2601:5cf:4100:3de0:53f4:479c:be9c:997d","2606:4700::6810:f8f9","TCP","86","","","32","","39104  >  443 [ACK] Seq=518 Ack=2697 Win=63488 Len=0 TSval=958461445 TSecr=1323064618"
"381","17.102136557","2601:5cf:4100:3de0:53f4:479c:be9c:997d","2606:4700::6810:f8f9","TCP","86","","","32","","39104  >  443 [ACK] Seq=518 Ack=3300 Win=62976 Len=0 TSval=958461445 TSecr=1323064618"
"382","17.103590026","2601:5cf:4100:3de0:53f4:479c:be9c:997d","2606:4700::6810:f8f9","TLSv1.3","166","","","32","1,69","Change Cipher Spec, Finished"
"383","17.103905485","2601:5cf:4100:3de0:53f4:479c:be9c:997d","2606:4700::6810:f8f9","HTTP2","190","SETTINGS,WINDOW_UPDATE","36,4","32","99","Magic, SETTINGS[0], WINDOW_UPDATE[0]"
"384","17.110613195","2601:5cf:4100:3de0:53f4:479c:be9c:997d","2606:4700::6810:f8f9","DoH","291","HEADERS,WINDOW_UPDATE,DATA,DATA","71,4,28,0","32","110,54,26","Standard query 0x1f54 NS 0101.co.jp"
"385","17.409135522","2606:4700::6810:f8f9","2601:5cf:4100:3de0:53f4:479c:be9c:997d","TCP","86","","","32","","443  >  39104 [ACK] Seq=3300 Ack=702 Win=65536 Len=0 TSval=1323064925 TSecr=958461446"
"386","17.409135753","2606:4700::6810:f8f9","2601:5cf:4100:3de0:53f4:479c:be9c:997d","HTTP2","655","SETTINGS,WINDOW_UPDATE,SETTINGS","18,4,0","32","493,66","SETTINGS[0], WINDOW_UPDATE[0], SETTINGS[0]"
"387","17.409135803","2606:4700::6810:f8f9","2601:5cf:4100:3de0:53f4:479c:be9c:997d","TCP","86","","","32","","443  >  39104 [ACK] Seq=3869 Ack=907 Win=65536 Len=0 TSval=1323064974 TSecr=958461453"
"388","17.409664975","2601:5cf:4100:3de0:53f4:479c:be9c:997d","2606:4700::6810:f8f9","HTTP2","117","SETTINGS","0","32","26","SETTINGS[0]"
"389","17.716279690","2606:4700::6810:f8f9","2601:5cf:4100:3de0:53f4:479c:be9c:997d","TCP","86","","","32","","443  >  39104 [ACK] Seq=3869 Ack=938 Win=65536 Len=0 TSval=1323065228 TSecr=958461752"
"390","18.024575254","2606:4700::6810:f8f9","2601:5cf:4100:3de0:53f4:479c:be9c:997d","HTTP2","202","HEADERS","85","32","111","HEADERS[1]: 200 OK"
"391","18.024575705","2606:4700::6810:f8f9","2601:5cf:4100:3de0:53f4:479c:be9c:997d","DoH","278","DATA","161","32","187","Standard query response 0x1f54 NS 0101.co.jp NS a26-64.akam.net NS a1-129.akam.net NS a14-66.akam.net NS a13-64.akam.net NS a3-64.akam.net NS a28-66.akam.net"
"392","18.025723352","2601:5cf:4100:3de0:53f4:479c:be9c:997d","2606:4700::6810:f8f9","TCP","86","","","32","","39104  >  443 [ACK] Seq=938 Ack=4177 Win=64128 Len=0 TSval=958462368 TSecr=1323065688"
"393","18.026485124","2601:5cf:4100:3de0:53f4:479c:be9c:997d","2606:4700::6810:f8f9","TCP","86","","","32","","39104  >  443 [FIN, ACK] Seq=938 Ack=4177 Win=64128 Len=0 TSval=958462369 TSecr=1323065688"
"394","18.048457645","2601:5cf:4100:3de0:53f4:479c:be9c:997d","2606:4700::6810:f9f9","TCP","94","","","40","","38984  >  443 [SYN] Seq=0 Win=64800 Len=0 MSS=1440 SACK_PERM TSval=1821627363 TSecr=0 WS=128"
"395","18.172140245","2606:4700::6810:f8f9","2601:5cf:4100:3de0:53f4:479c:be9c:997d","TCP","86","","","32","","443  >  39104 [FIN, ACK] Seq=4177 Ack=939 Win=65536 Len=0 TSval=1323065853 TSecr=958462369"
"396","18.172140516","2606:4700::6810:f9f9","2601:5cf:4100:3de0:53f4:479c:be9c:997d","TCP","94","","","40","","443  >  38984 [SYN, ACK] Seq=0 Ack=1 Win=65535 Len=0 MSS=1360 SACK_PERM TSval=1033408555 TSecr=1821627363 WS=8192"
"397","18.172168820","2601:5cf:4100:3de0:53f4:479c:be9c:997d","2606:4700::6810:f8f9","TCP","86","","","32","","39104  >  443 [ACK] Seq=939 Ack=4178 Win=64128 Len=0 TSval=958462515 TSecr=1323065853"
"398","18.172189440","2601:5cf:4100:3de0:53f4:479c:be9c:997d","2606:4700::6810:f9f9","TCP","86","","","32","","38984  >  443 [ACK] Seq=1 Ack=1 Win=64896 Len=0 TSval=1821627487 TSecr=1033408555"
"399","18.172771334","2601:5cf:4100:3de0:53f4:479c:be9c:997d","2606:4700::6810:f9f9","TLSv1.3","603","","","32","512","Client Hello (SNI=cloudflare-dns.com)"
"400","18.433200551","2606:4700::6810:f9f9","2601:5cf:4100:3de0:53f4:479c:be9c:997d","TCP","86","","","32","","443  >  38984 [ACK] Seq=1 Ack=518 Win=65536 Len=0 TSval=1033408688 TSecr=1821627487"
"401","18.433200791","2606:4700::6810:f9f9","2601:5cf:4100:3de0:53f4:479c:be9c:997d","TLSv1.3","3386","","","32","122,1,3162","Server Hello, Change Cipher Spec, Encrypted Extensions, Certificate, Certificate Verify, Finished"
"402","18.433233564","2601:5cf:4100:3de0:53f4:479c:be9c:997d","2606:4700::6810:f9f9","TCP","86","","","32","","38984  >  443 [ACK] Seq=518 Ack=3301 Win=62976 Len=0 TSval=1821627748 TSecr=1033408689"
"403","18.434942596","2601:5cf:4100:3de0:53f4:479c:be9c:997d","2606:4700::6810:f9f9","TLSv1.3","166","","","32","1,69","Change Cipher Spec, Finished"
"404","18.435230633","2601:5cf:4100:3de0:53f4:479c:be9c:997d","2606:4700::6810:f9f9","HTTP2","190","SETTINGS,WINDOW_UPDATE","36,4","32","99","Magic, SETTINGS[0], WINDOW_UPDATE[0]"
"405","18.441984171","2601:5cf:4100:3de0:53f4:479c:be9c:997d","2606:4700::6810:f9f9","DoH","292","HEADERS,WINDOW_UPDATE,DATA,DATA","71,4,29,0","32","110,55,26","Standard query 0xd01a NS 0109480.xyz"
"406","18.739890430","2601:5cf:4100:3de0:53f4:479c:be9c:997d","2606:4700::6810:f9f9","TCP","292","","","32","","[TCP Retransmission] 38984  >  443 [PSH, ACK] Seq=702 Ack=3301 Win=64128 Len=206 TSval=1821628055 TSecr=1033408689"
"407","18.740208765","2606:4700::6810:f9f9","2601:5cf:4100:3de0:53f4:479c:be9c:997d","TCP","86","","","32","","443  >  38984 [ACK] Seq=3301 Ack=702 Win=65536 Len=0 TSval=1033408947 TSecr=1821627750"
"408","18.740209105","2606:4700::6810:f9f9","2601:5cf:4100:3de0:53f4:479c:be9c:997d","HTTP2","655","SETTINGS,WINDOW_UPDATE,SETTINGS","18,4,0","32","493,66","SETTINGS[0], WINDOW_UPDATE[0], SETTINGS[0]"
"409","18.740209155","2606:4700::6810:f9f9","2601:5cf:4100:3de0:53f4:479c:be9c:997d","HTTP2","202","HEADERS","85","32","111","HEADERS[1]: 200 OK"
"410","18.740209186","2606:4700::6810:f9f9","2601:5cf:4100:3de0:53f4:479c:be9c:997d","DoH","200","DATA","83","32","109","Standard query response 0xd01a NS 0109480.xyz NS dora.ns.cloudflare.com NS sam.ns.cloudflare.com"
"411","18.740712658","2601:5cf:4100:3de0:53f4:479c:be9c:997d","2606:4700::6810:f9f9","HTTP2","117","SETTINGS","0","32","26","SETTINGS[0]"
"412","18.741603500","2601:5cf:4100:3de0:53f4:479c:be9c:997d","2606:4700::6810:f9f9","TCP","86","","","32","","38984  >  443 [FIN, ACK] Seq=939 Ack=4100 Win=64128 Len=0 TSval=1821628056 TSecr=1033408947"
"413","18.763324877","2601:5cf:4100:3de0:53f4:479c:be9c:997d","2606:4700::6810:f8f9","TCP","94","","","40","","39120  >  443 [SYN] Seq=0 Win=64800 Len=0 MSS=1440 SACK_PERM TSval=958463106 TSecr=0 WS=128"
"414","19.047806547","2606:4700::6810:f9f9","2601:5cf:4100:3de0:53f4:479c:be9c:997d","TCP","98","","","44","","[TCP Dup ACK 409#1] 443  >  38984 [ACK] Seq=4100 Ack=908 Win=65536 Len=0 TSval=1033409247 TSecr=1821628055 SLE=702 SRE=908"
"415","19.047807208","2606:4700::6810:f9f9","2601:5cf:4100:3de0:53f4:479c:be9c:997d","TCP","86","","","32","","443  >  38984 [ACK] Seq=4100 Ack=939 Win=65536 Len=0 TSval=1033409247 TSecr=1821628055"
"416","19.047807328","2606:4700::6810:f9f9","2601:5cf:4100:3de0:53f4:479c:be9c:997d","TCP","86","","","32","","443  >  38984 [FIN, ACK] Seq=4100 Ack=940 Win=65536 Len=0 TSval=1033409256 TSecr=1821628056"
"417","19.047807438","2606:4700::6810:f8f9","2601:5cf:4100:3de0:53f4:479c:be9c:997d","TCP","94","","","40","","443  >  39120 [SYN, ACK] Seq=0 Ack=1 Win=65535 Len=0 MSS=1360 SACK_PERM TSval=1193475778 TSecr=958463106 WS=8192"
"418","19.047889166","2601:5cf:4100:3de0:53f4:479c:be9c:997d","2606:4700::6810:f9f9","TCP","86","","","32","","38984  >  443 [ACK] Seq=940 Ack=4101 Win=64128 Len=0 TSval=1821628363 TSecr=1033409256"
"419","19.047929224","2601:5cf:4100:3de0:53f4:479c:be9c:997d","2606:4700::6810:f8f9","TCP","86","","","32","","39120  >  443 [ACK] Seq=1 Ack=1 Win=64896 Len=0 TSval=958463391 TSecr=1193475778"
"420","19.048563730","2601:5cf:4100:3de0:53f4:479c:be9c:997d","2606:4700::6810:f8f9","TLSv1.3","603","","","32","512","Client Hello (SNI=cloudflare-dns.com)"
"421","19.354942809","2606:4700::6810:f8f9","2601:5cf:4100:3de0:53f4:479c:be9c:997d","TCP","86","","","32","","443  >  39120 [ACK] Seq=1 Ack=518 Win=65536 Len=0 TSval=1193476078 TSecr=958463391"
"422","19.354943039","2606:4700::6810:f8f9","2601:5cf:4100:3de0:53f4:479c:be9c:997d","TLSv1.3","2782","","","32","122,1","Server Hello, Change Cipher Spec"
"423","19.354943079","2606:4700::6810:f8f9","2601:5cf:4100:3de0:53f4:479c:be9c:997d","TLSv1.3","690","","","32","3162","Encrypted Extensions, Certificate, Certificate Verify, Finished"
"424","19.354974530","2601:5cf:4100:3de0:53f4:479c:be9c:997d","2606:4700::6810:f8f9","TCP","86","","","32","","39120  >  443 [ACK] Seq=518 Ack=2697 Win=63488 Len=0 TSval=958463698 TSecr=1193476079"
"425","19.354985672","2601:5cf:4100:3de0:53f4:479c:be9c:997d","2606:4700::6810:f8f9","TCP","86","","","32","","39120  >  443 [ACK] Seq=518 Ack=3301 Win=62976 Len=0 TSval=958463698 TSecr=1193476079"
"426","19.356220678","2601:5cf:4100:3de0:53f4:479c:be9c:997d","2606:4700::6810:f8f9","TLSv1.3","166","","","32","1,69","Change Cipher Spec, Finished"
"427","19.356517121","2601:5cf:4100:3de0:53f4:479c:be9c:997d","2606:4700::6810:f8f9","HTTP2","190","SETTINGS,WINDOW_UPDATE","36,4","32","99","Magic, SETTINGS[0], WINDOW_UPDATE[0]"
"428","19.363740747","2601:5cf:4100:3de0:53f4:479c:be9c:997d","2606:4700::6810:f8f9","DoH","288","HEADERS,WINDOW_UPDATE,DATA,DATA","71,4,25,0","32","110,51,26","Standard query 0xc99b NS 011.com"
"429","19.662525039","2606:4700::6810:f8f9","2601:5cf:4100:3de0:53f4:479c:be9c:997d","TCP","86","","","32","","443  >  39120 [ACK] Seq=3301 Ack=702 Win=65536 Len=0 TSval=1193476374 TSecr=958463699"
"430","19.662525489","2606:4700::6810:f8f9","2601:5cf:4100:3de0:53f4:479c:be9c:997d","HTTP2","655","SETTINGS,WINDOW_UPDATE,SETTINGS","18,4,0","32","493,66","SETTINGS[0], WINDOW_UPDATE[0], SETTINGS[0]"
"431","19.662525620","2606:4700::6810:f8f9","2601:5cf:4100:3de0:53f4:479c:be9c:997d","TCP","86","","","32","","443  >  39120 [ACK] Seq=3870 Ack=904 Win=65536 Len=0 TSval=1193476423 TSecr=958463706"
"432","19.663197678","2601:5cf:4100:3de0:53f4:479c:be9c:997d","2606:4700::6810:f8f9","HTTP2","117","SETTINGS","0","32","26","SETTINGS[0]"
"433","19.969056940","2606:4700::6810:f8f9","2601:5cf:4100:3de0:53f4:479c:be9c:997d","TCP","86","","","32","","443  >  39120 [ACK] Seq=3870 Ack=935 Win=65536 Len=0 TSval=1193476674 TSecr=958464006"
"434","20.156105807","2606:4700::6810:f8f9","2601:5cf:4100:3de0:53f4:479c:be9c:997d","HTTP2","202","HEADERS","85","32","111","HEADERS[1]: 200 OK"
"435","20.156106057","2606:4700::6810:f8f9","2601:5cf:4100:3de0:53f4:479c:be9c:997d","DoH","188","DATA","71","32","97","Standard query response 0xc99b NS 011.com NS fog.dnspod.net NS len.dnspod.net"
"436","20.156764239","2601:5cf:4100:3de0:53f4:479c:be9c:997d","2606:4700::6810:f8f9","TCP","86","","","32","","39120  >  443 [ACK] Seq=935 Ack=4088 Win=64128 Len=0 TSval=958464499 TSecr=1193477074"
"437","20.157257282","2601:5cf:4100:3de0:53f4:479c:be9c:997d","2606:4700::6810:f8f9","TCP","86","","","32","","39120  >  443 [FIN, ACK] Seq=935 Ack=4088 Win=64128 Len=0 TSval=958464500 TSecr=1193477074"
"439","20.184093843","2601:5cf:4100:3de0:53f4:479c:be9c:997d","2606:4700::6810:f8f9","TCP","94","","","40","","39134  >  443 [SYN] Seq=0 Win=64800 Len=0 MSS=1440 SACK_PERM TSval=958464527 TSecr=0 WS=128"
"440","20.234316007","2606:4700::6810:f8f9","2601:5cf:4100:3de0:53f4:479c:be9c:997d","TCP","86","","","32","","443  >  39120 [FIN, ACK] Seq=4088 Ack=936 Win=65536 Len=0 TSval=1193477176 TSecr=958464500"
"441","20.234364351","2601:5cf:4100:3de0:53f4:479c:be9c:997d","2606:4700::6810:f8f9","TCP","86","","","32","","39120  >  443 [ACK] Seq=936 Ack=4089 Win=64128 Len=0 TSval=958464577 TSecr=1193477176"
"442","20.481132937","2606:4700::6810:f8f9","2601:5cf:4100:3de0:53f4:479c:be9c:997d","TCP","94","","","40","","443  >  39134 [SYN, ACK] Seq=0 Ack=1 Win=65535 Len=0 MSS=1360 SACK_PERM TSval=243307733 TSecr=958464527 WS=8192"
"443","20.481165801","2601:5cf:4100:3de0:53f4:479c:be9c:997d","2606:4700::6810:f8f9","TCP","86","","","32","","39134  >  443 [ACK] Seq=1 Ack=1 Win=64896 Len=0 TSval=958464824 TSecr=243307733"
"444","20.481484967","2601:5cf:4100:3de0:53f4:479c:be9c:997d","2606:4700::6810:f8f9","TLSv1.3","603","","","32","512","Client Hello (SNI=cloudflare-dns.com)"
"445","20.789153471","2606:4700::6810:f8f9","2601:5cf:4100:3de0:53f4:479c:be9c:997d","TCP","86","","","32","","443  >  39134 [ACK] Seq=1 Ack=518 Win=57344 Len=0 TSval=243307989 TSecr=958464824"
"446","20.790972505","2606:4700::6810:f8f9","2601:5cf:4100:3de0:53f4:479c:be9c:997d","TLSv1.3","2782","","","32","122,1","Server Hello, Change Cipher Spec"
"447","20.790972766","2606:4700::6810:f8f9","2601:5cf:4100:3de0:53f4:479c:be9c:997d","TLSv1.3","689","","","32","3161","Encrypted Extensions, Certificate, Certificate Verify, Finished"
"448","20.790998516","2601:5cf:4100:3de0:53f4:479c:be9c:997d","2606:4700::6810:f8f9","TCP","86","","","32","","39134  >  443 [ACK] Seq=518 Ack=2697 Win=63488 Len=0 TSval=958465134 TSecr=243307990"
"449","20.791012693","2601:5cf:4100:3de0:53f4:479c:be9c:997d","2606:4700::6810:f8f9","TCP","86","","","32","","39134  >  443 [ACK] Seq=518 Ack=3300 Win=62976 Len=0 TSval=958465134 TSecr=243307990"
"450","20.792160761","2601:5cf:4100:3de0:53f4:479c:be9c:997d","2606:4700::6810:f8f9","TLSv1.3","166","","","32","1,69","Change Cipher Spec, Finished"
"451","20.792452234","2601:5cf:4100:3de0:53f4:479c:be9c:997d","2606:4700::6810:f8f9","HTTP2","190","SETTINGS,WINDOW_UPDATE","36,4","32","99","Magic, SETTINGS[0], WINDOW_UPDATE[0]"
"452","20.799828196","2601:5cf:4100:3de0:53f4:479c:be9c:997d","2606:4700::6810:f8f9","DoH","290","HEADERS,WINDOW_UPDATE,DATA,DATA","71,4,27,0","32","110,53,26","Standard query 0xfde6 NS 011st.com"
"454","21.095595004","2606:4700::6810:f8f9","2601:5cf:4100:3de0:53f4:479c:be9c:997d","HTTP2","646","SETTINGS,WINDOW_UPDATE","18,4","32","493,57","SETTINGS[0], WINDOW_UPDATE[0]"
"455","21.095595314","2606:4700::6810:f8f9","2601:5cf:4100:3de0:53f4:479c:be9c:997d","TCP","86","","","32","","443  >  39134 [ACK] Seq=3860 Ack=906 Win=65536 Len=0 TSval=243308301 TSecr=958465135"
"456","21.095595445","2606:4700::6810:f8f9","2601:5cf:4100:3de0:53f4:479c:be9c:997d","HTTP2","117","SETTINGS","0","32","26","SETTINGS[0]"
"457","21.095595575","2606:4700::6810:f8f9","2601:5cf:4100:3de0:53f4:479c:be9c:997d","HTTP2","203","HEADERS","86","32","112","HEADERS[1]: 200 OK"
"458","21.095595715","2606:4700::6810:f8f9","2601:5cf:4100:3de0:53f4:479c:be9c:997d","DoH","281","DATA","164","32","190","Standard query response 0xfde6 NS 011st.com NS ns-1216.awsdns-24.org NS ns-1732.awsdns-24.co.uk NS ns-488.awsdns-61.com NS ns-583.awsdns-08.net"
"459","21.096224740","2601:5cf:4100:3de0:53f4:479c:be9c:997d","2606:4700::6810:f8f9","HTTP2","117","SETTINGS","0","32","26","SETTINGS[0]"
"460","21.097292033","2601:5cf:4100:3de0:53f4:479c:be9c:997d","2606:4700::6810:f8f9","TCP","86","","","32","","39134  >  443 [FIN, ACK] Seq=937 Ack=4203 Win=64128 Len=0 TSval=958465440 TSecr=243308293"
"463","21.259224366","2606:4700::6810:f8f9","2601:5cf:4100:3de0:53f4:479c:be9c:997d","TCP","86","","","32","","443  >  39134 [FIN, ACK] Seq=4203 Ack=938 Win=65536 Len=0 TSval=243308606 TSecr=958465439"
"464","21.259277428","2601:5cf:4100:3de0:53f4:479c:be9c:997d","2606:4700::6810:f8f9","TCP","86","","","32","","39134  >  443 [ACK] Seq=938 Ack=4204 Win=64128 Len=0 TSval=958465602 TSecr=243308606"
