"No.","Time","Source","Destination","Protocol","Length","Info"
"7","0.616927238","2601:5cf:4100:3de0:3d84:6c14:e3a4:affc","2606:4700::6810:f9f9","TCP","94","40962  >  443 [SYN] Seq=0 Win=64800 Len=0 MSS=1440 SACK_PERM TSval=3822454402 TSecr=0 WS=128"
"8","0.717944255","2606:4700::6810:f9f9","2601:5cf:4100:3de0:3d84:6c14:e3a4:affc","TCP","94","443  >  40962 [SYN, ACK] Seq=0 Ack=1 Win=65535 Len=0 MSS=1360 SACK_PERM TSval=1717996189 TSecr=3822454402 WS=8192"
"9","0.718005705","2601:5cf:4100:3de0:3d84:6c14:e3a4:affc","2606:4700::6810:f9f9","TCP","86","40962  >  443 [ACK] Seq=1 Ack=1 Win=64896 Len=0 TSval=3822454503 TSecr=1717996189"
"10","0.718810495","2601:5cf:4100:3de0:3d84:6c14:e3a4:affc","2606:4700::6810:f9f9","TLSv1.3","603","Client Hello (SNI=cloudflare-dns.com)"
"11","0.820438065","2606:4700::6810:f9f9","2601:5cf:4100:3de0:3d84:6c14:e3a4:affc","TCP","86","443  >  40962 [ACK] Seq=1 Ack=518 Win=65536 Len=0 TSval=1717996281 TSecr=3822454503"
"12","0.820438516","2606:4700::6810:f9f9","2601:5cf:4100:3de0:3d84:6c14:e3a4:affc","TLSv1.3","3385","Server Hello, Change Cipher Spec, Application Data"
"13","0.820493943","2601:5cf:4100:3de0:3d84:6c14:e3a4:affc","2606:4700::6810:f9f9","TCP","86","40962  >  443 [ACK] Seq=518 Ack=3300 Win=61696 Len=0 TSval=3822454605 TSecr=1717996282"
"14","0.821921912","2601:5cf:4100:3de0:3d84:6c14:e3a4:affc","2606:4700::6810:f9f9","TLSv1.3","166","Change Cipher Spec, Application Data"
"16","0.922000168","2606:4700::6810:f9f9","2601:5cf:4100:3de0:3d84:6c14:e3a4:affc","TLSv1.3","646","Application Data, Application Data"
"17","0.922030056","2601:5cf:4100:3de0:3d84:6c14:e3a4:affc","2606:4700::6810:f9f9","TLSv1.3","402","Application Data, Application Data, Application Data, Application Data"
"18","1.024929016","2606:4700::6810:f9f9","2601:5cf:4100:3de0:3d84:6c14:e3a4:affc","TLSv1.3","117","Application Data"
"19","1.024954005","2601:5cf:4100:3de0:3d84:6c14:e3a4:affc","2606:4700::6810:f9f9","TLSv1.3","117","Application Data"
"20","1.127259794","2606:4700::6810:f9f9","2601:5cf:4100:3de0:3d84:6c14:e3a4:affc","TCP","86","443  >  40962 [ACK] Seq=3891 Ack=945 Win=65536 Len=0 TSval=1717996626 TSecr=3822454810"
"21","1.332123262","2606:4700::6810:f9f9","2601:5cf:4100:3de0:3d84:6c14:e3a4:affc","TLSv1.3","202","Application Data"
"22","1.332123692","2606:4700::6810:f9f9","2601:5cf:4100:3de0:3d84:6c14:e3a4:affc","TLSv1.3","195","Application Data"
"23","1.333432811","2601:5cf:4100:3de0:3d84:6c14:e3a4:affc","2606:4700::6810:f9f9","TCP","86","40962  >  443 [ACK] Seq=945 Ack=4116 Win=64128 Len=0 TSval=3822455118 TSecr=1717996775"
"24","1.333678777","2601:5cf:4100:3de0:3d84:6c14:e3a4:affc","2606:4700::6810:f9f9","TCP","86","40962  >  443 [FIN, ACK] Seq=945 Ack=4116 Win=64128 Len=0 TSval=3822455118 TSecr=1717996775"
"25","1.434482345","2606:4700::6810:f9f9","2601:5cf:4100:3de0:3d84:6c14:e3a4:affc","TCP","86","443  >  40962 [FIN, ACK] Seq=4116 Ack=946 Win=65536 Len=0 TSval=1717996901 TSecr=3822455118"
"26","1.434532382","2601:5cf:4100:3de0:3d84:6c14:e3a4:affc","2606:4700::6810:f9f9","TCP","86","40962  >  443 [ACK] Seq=946 Ack=4117 Win=64128 Len=0 TSval=3822455219 TSecr=1717996901"
"27","1.459154837","2601:5cf:4100:3de0:3d84:6c14:e3a4:affc","2606:4700::6810:f9f9","TCP","94","40976  >  443 [SYN] Seq=0 Win=64800 Len=0 MSS=1440 SACK_PERM TSval=3822455244 TSecr=0 WS=128"
"28","1.537332910","2606:4700::6810:f9f9","2601:5cf:4100:3de0:3d84:6c14:e3a4:affc","TCP","94","443  >  40976 [SYN, ACK] Seq=0 Ack=1 Win=65535 Len=0 MSS=1360 SACK_PERM TSval=3666677851 TSecr=3822455244 WS=8192"
"29","1.537367227","2601:5cf:4100:3de0:3d84:6c14:e3a4:affc","2606:4700::6810:f9f9","TCP","86","40976  >  443 [ACK] Seq=1 Ack=1 Win=64896 Len=0 TSval=3822455322 TSecr=3666677851"
"30","1.537713728","2601:5cf:4100:3de0:3d84:6c14:e3a4:affc","2606:4700::6810:f9f9","TLSv1.3","603","Client Hello (SNI=cloudflare-dns.com)"
"31","1.639722012","2606:4700::6810:f9f9","2601:5cf:4100:3de0:3d84:6c14:e3a4:affc","TCP","86","443  >  40976 [ACK] Seq=1 Ack=518 Win=65536 Len=0 TSval=3666677935 TSecr=3822455322"
"32","1.639722513","2606:4700::6810:f9f9","2601:5cf:4100:3de0:3d84:6c14:e3a4:affc","TLSv1.3","3385","Server Hello, Change Cipher Spec, Application Data"
"33","1.639778060","2601:5cf:4100:3de0:3d84:6c14:e3a4:affc","2606:4700::6810:f9f9","TCP","86","40976  >  443 [ACK] Seq=518 Ack=3300 Win=61696 Len=0 TSval=3822455424 TSecr=3666677936"
"34","1.641165590","2601:5cf:4100:3de0:3d84:6c14:e3a4:affc","2606:4700::6810:f9f9","TLSv1.3","166","Change Cipher Spec, Application Data"
"35","1.741764219","2606:4700::6810:f9f9","2601:5cf:4100:3de0:3d84:6c14:e3a4:affc","TLSv1.3","646","Application Data, Application Data"
"36","1.741798375","2601:5cf:4100:3de0:3d84:6c14:e3a4:affc","2606:4700::6810:f9f9","TLSv1.3","417","Application Data, Application Data, Application Data, Application Data"
"37","1.844366133","2606:4700::6810:f9f9","2601:5cf:4100:3de0:3d84:6c14:e3a4:affc","TLSv1.3","117","Application Data"
"38","1.844366584","2606:4700::6810:f9f9","2601:5cf:4100:3de0:3d84:6c14:e3a4:affc","TLSv1.3","202","Application Data"
"39","1.844366714","2606:4700::6810:f9f9","2601:5cf:4100:3de0:3d84:6c14:e3a4:affc","TLSv1.3","213","Application Data"
"40","1.844413124","2601:5cf:4100:3de0:3d84:6c14:e3a4:affc","2606:4700::6810:f9f9","TLSv1.3","117","Application Data"
"41","1.845724166","2601:5cf:4100:3de0:3d84:6c14:e3a4:affc","2606:4700::6810:f9f9","TCP","86","40976  >  443 [ACK] Seq=960 Ack=4134 Win=64128 Len=0 TSval=3822455630 TSecr=3666678189"
"42","1.846136986","2601:5cf:4100:3de0:3d84:6c14:e3a4:affc","2606:4700::6810:f9f9","TCP","86","40976  >  443 [FIN, ACK] Seq=960 Ack=4134 Win=64128 Len=0 TSval=3822455631 TSecr=3666678189"
"43","1.946489749","2606:4700::6810:f9f9","2601:5cf:4100:3de0:3d84:6c14:e3a4:affc","TCP","86","443  >  40976 [FIN, ACK] Seq=4134 Ack=961 Win=65536 Len=0 TSval=3666678248 TSecr=3822455629"
"44","1.946517362","2601:5cf:4100:3de0:3d84:6c14:e3a4:affc","2606:4700::6810:f9f9","TCP","86","40976  >  443 [ACK] Seq=961 Ack=4135 Win=64128 Len=0 TSval=3822455731 TSecr=3666678248"
"45","1.971354062","2601:5cf:4100:3de0:3d84:6c14:e3a4:affc","2606:4700::6810:f8f9","TCP","94","39918  >  443 [SYN] Seq=0 Win=64800 Len=0 MSS=1440 SACK_PERM TSval=3726972515 TSecr=0 WS=128"
"46","2.049238551","2606:4700::6810:f8f9","2601:5cf:4100:3de0:3d84:6c14:e3a4:affc","TCP","94","443  >  39918 [SYN, ACK] Seq=0 Ack=1 Win=65535 Len=0 MSS=1360 SACK_PERM TSval=3596887161 TSecr=3726972515 WS=8192"
"47","2.049296053","2601:5cf:4100:3de0:3d84:6c14:e3a4:affc","2606:4700::6810:f8f9","TCP","86","39918  >  443 [ACK] Seq=1 Ack=1 Win=64896 Len=0 TSval=3726972593 TSecr=3596887161"
"48","2.049873763","2601:5cf:4100:3de0:3d84:6c14:e3a4:affc","2606:4700::6810:f8f9","TLSv1.3","603","Client Hello (SNI=cloudflare-dns.com)"
"49","2.151474640","2606:4700::6810:f8f9","2601:5cf:4100:3de0:3d84:6c14:e3a4:affc","TCP","86","443  >  39918 [ACK] Seq=1 Ack=518 Win=57344 Len=0 TSval=3596887242 TSecr=3726972594"
"50","2.151474881","2606:4700::6810:f8f9","2601:5cf:4100:3de0:3d84:6c14:e3a4:affc","TLSv1.3","3386","Server Hello, Change Cipher Spec, Application Data"
"51","2.151505360","2601:5cf:4100:3de0:3d84:6c14:e3a4:affc","2606:4700::6810:f8f9","TCP","86","39918  >  443 [ACK] Seq=518 Ack=3301 Win=61696 Len=0 TSval=3726972695 TSecr=3596887244"
"52","2.152955571","2601:5cf:4100:3de0:3d84:6c14:e3a4:affc","2606:4700::6810:f8f9","TLSv1.3","166","Change Cipher Spec, Application Data"
"53","2.253778089","2606:4700::6810:f8f9","2601:5cf:4100:3de0:3d84:6c14:e3a4:affc","TLSv1.3","646","Application Data, Application Data"
"54","2.253801625","2601:5cf:4100:3de0:3d84:6c14:e3a4:affc","2606:4700::6810:f8f9","TLSv1.3","412","Application Data, Application Data, Application Data, Application Data"
"55","2.356361530","2606:4700::6810:f8f9","2601:5cf:4100:3de0:3d84:6c14:e3a4:affc","TLSv1.3","117","Application Data"
"56","2.356361981","2606:4700::6810:f8f9","2601:5cf:4100:3de0:3d84:6c14:e3a4:affc","TLSv1.3","202","Application Data"
"57","2.356362101","2606:4700::6810:f8f9","2601:5cf:4100:3de0:3d84:6c14:e3a4:affc","TLSv1.3","203","Application Data"
"58","2.356407600","2601:5cf:4100:3de0:3d84:6c14:e3a4:affc","2606:4700::6810:f8f9","TLSv1.3","117","Application Data"
"59","2.357396066","2601:5cf:4100:3de0:3d84:6c14:e3a4:affc","2606:4700::6810:f8f9","TCP","86","39918  >  443 [ACK] Seq=955 Ack=4125 Win=64128 Len=0 TSval=3726972901 TSecr=3596887446"
"60","2.357628557","2601:5cf:4100:3de0:3d84:6c14:e3a4:affc","2606:4700::6810:f8f9","TCP","86","39918  >  443 [FIN, ACK] Seq=955 Ack=4125 Win=64128 Len=0 TSval=3726972901 TSecr=3596887446"
"61","2.446231656","2606:4700::6810:f8f9","2601:5cf:4100:3de0:3d84:6c14:e3a4:affc","TCP","86","443  >  39918 [FIN, ACK] Seq=4125 Ack=956 Win=65536 Len=0 TSval=3596887551 TSecr=3726972900"
"62","2.446269129","2601:5cf:4100:3de0:3d84:6c14:e3a4:affc","2606:4700::6810:f8f9","TCP","86","39918  >  443 [ACK] Seq=956 Ack=4126 Win=64128 Len=0 TSval=3726972990 TSecr=3596887551"
"64","2.480482205","2601:5cf:4100:3de0:3d84:6c14:e3a4:affc","2606:4700::6810:f8f9","TCP","94","39926  >  443 [SYN] Seq=0 Win=64800 Len=0 MSS=1440 SACK_PERM TSval=3726973024 TSecr=0 WS=128"
"65","2.663481084","2606:4700::6810:f8f9","2601:5cf:4100:3de0:3d84:6c14:e3a4:affc","TCP","94","443  >  39926 [SYN, ACK] Seq=0 Ack=1 Win=65535 Len=0 MSS=1360 SACK_PERM TSval=3139465121 TSecr=3726973024 WS=8192"
"68","2.663546631","2601:5cf:4100:3de0:3d84:6c14:e3a4:affc","2606:4700::6810:f8f9","TCP","86","39926  >  443 [ACK] Seq=1 Ack=1 Win=64896 Len=0 TSval=3726973207 TSecr=3139465121"
"69","2.664060658","2601:5cf:4100:3de0:3d84:6c14:e3a4:affc","2606:4700::6810:f8f9","TLSv1.3","603","Client Hello (SNI=cloudflare-dns.com)"
"70","2.765925686","2606:4700::6810:f8f9","2601:5cf:4100:3de0:3d84:6c14:e3a4:affc","TCP","86","443  >  39926 [ACK] Seq=1 Ack=518 Win=65536 Len=0 TSval=3139465232 TSecr=3726973208"
"71","2.765926137","2606:4700::6810:f8f9","2601:5cf:4100:3de0:3d84:6c14:e3a4:affc","TLSv1.3","3384","Server Hello, Change Cipher Spec, Application Data"
"72","2.766024047","2601:5cf:4100:3de0:3d84:6c14:e3a4:affc","2606:4700::6810:f8f9","TCP","86","39926  >  443 [ACK] Seq=518 Ack=3299 Win=61696 Len=0 TSval=3726973310 TSecr=3139465233"
"73","2.767365698","2601:5cf:4100:3de0:3d84:6c14:e3a4:affc","2606:4700::6810:f8f9","TLSv1.3","166","Change Cipher Spec, Application Data"
"74","2.868394045","2606:4700::6810:f8f9","2601:5cf:4100:3de0:3d84:6c14:e3a4:affc","TLSv1.3","646","Application Data, Application Data"
"75","2.868439042","2601:5cf:4100:3de0:3d84:6c14:e3a4:affc","2606:4700::6810:f8f9","TLSv1.3","415","Application Data, Application Data, Application Data, Application Data"
"76","2.970567268","2606:4700::6810:f8f9","2601:5cf:4100:3de0:3d84:6c14:e3a4:affc","TLSv1.3","117","Application Data"
"77","2.970567719","2606:4700::6810:f8f9","2601:5cf:4100:3de0:3d84:6c14:e3a4:affc","TLSv1.3","202","Application Data"
"78","2.970567839","2606:4700::6810:f8f9","2601:5cf:4100:3de0:3d84:6c14:e3a4:affc","TLSv1.3","201","Application Data"
"79","2.970610933","2601:5cf:4100:3de0:3d84:6c14:e3a4:affc","2606:4700::6810:f8f9","TLSv1.3","117","Application Data"
"80","2.971751875","2601:5cf:4100:3de0:3d84:6c14:e3a4:affc","2606:4700::6810:f8f9","TCP","86","39926  >  443 [ACK] Seq=958 Ack=4121 Win=64128 Len=0 TSval=3726973515 TSecr=3139465443"
"81","2.971957583","2601:5cf:4100:3de0:3d84:6c14:e3a4:affc","2606:4700::6810:f8f9","TCP","86","39926  >  443 [FIN, ACK] Seq=958 Ack=4121 Win=64128 Len=0 TSval=3726973516 TSecr=3139465443"
"83","3.072937140","2606:4700::6810:f8f9","2601:5cf:4100:3de0:3d84:6c14:e3a4:affc","TCP","86","443  >  39926 [FIN, ACK] Seq=4121 Ack=959 Win=65536 Len=0 TSval=3139465537 TSecr=3726973514"
"84","3.072956127","2601:5cf:4100:3de0:3d84:6c14:e3a4:affc","2606:4700::6810:f8f9","TCP","86","39926  >  443 [ACK] Seq=959 Ack=4122 Win=64128 Len=0 TSval=3726973617 TSecr=3139465537"
"86","3.094476466","2601:5cf:4100:3de0:3d84:6c14:e3a4:affc","2606:4700::6810:f8f9","TCP","94","39934  >  443 [SYN] Seq=0 Win=64800 Len=0 MSS=1440 SACK_PERM TSval=3726973638 TSecr=0 WS=128"
"87","3.175529443","2606:4700::6810:f8f9","2601:5cf:4100:3de0:3d84:6c14:e3a4:affc","TCP","94","443  >  39934 [SYN, ACK] Seq=0 Ack=1 Win=64704 Len=0 MSS=1360 SACK_PERM TSval=2322858601 TSecr=3726973638 WS=8192"
"88","3.175562828","2601:5cf:4100:3de0:3d84:6c14:e3a4:affc","2606:4700::6810:f8f9","TCP","86","39934  >  443 [ACK] Seq=1 Ack=1 Win=64896 Len=0 TSval=3726973719 TSecr=2322858601"
"89","3.176057537","2601:5cf:4100:3de0:3d84:6c14:e3a4:affc","2606:4700::6810:f8f9","TLSv1.3","603","Client Hello (SNI=cloudflare-dns.com)"
"90","3.278005468","2606:4700::6810:f8f9","2601:5cf:4100:3de0:3d84:6c14:e3a4:affc","TCP","86","443  >  39934 [ACK] Seq=1 Ack=518 Win=57344 Len=0 TSval=2322858677 TSecr=3726973720"
"91","3.278005879","2606:4700::6810:f8f9","2601:5cf:4100:3de0:3d84:6c14:e3a4:affc","TLSv1.3","3386","Server Hello, Change Cipher Spec, Application Data"
"92","3.278061286","2601:5cf:4100:3de0:3d84:6c14:e3a4:affc","2606:4700::6810:f8f9","TCP","86","39934  >  443 [ACK] Seq=518 Ack=3301 Win=61696 Len=0 TSval=3726973822 TSecr=2322858678"
"93","3.279084259","2601:5cf:4100:3de0:3d84:6c14:e3a4:affc","2606:4700::6810:f8f9","TLSv1.3","166","Change Cipher Spec, Application Data"
"95","3.379528740","2606:4700::6810:f8f9","2601:5cf:4100:3de0:3d84:6c14:e3a4:affc","TLSv1.3","646","Application Data, Application Data"
"96","3.379572736","2601:5cf:4100:3de0:3d84:6c14:e3a4:affc","2606:4700::6810:f8f9","TLSv1.3","410","Application Data, Application Data, Application Data, Application Data"
"97","3.482813947","2606:4700::6810:f8f9","2601:5cf:4100:3de0:3d84:6c14:e3a4:affc","TLSv1.3","117","Application Data"
"98","3.482858093","2601:5cf:4100:3de0:3d84:6c14:e3a4:affc","2606:4700::6810:f8f9","TLSv1.3","117","Application Data"
"99","3.585213106","2606:4700::6810:f8f9","2601:5cf:4100:3de0:3d84:6c14:e3a4:affc","TCP","86","443  >  39934 [ACK] Seq=3892 Ack=953 Win=65536 Len=0 TSval=2322859023 TSecr=3726974027"
"100","4.199820926","2606:4700::6810:f8f9","2601:5cf:4100:3de0:3d84:6c14:e3a4:affc","TLSv1.3","203","Application Data"
"101","4.199821377","2606:4700::6810:f8f9","2601:5cf:4100:3de0:3d84:6c14:e3a4:affc","TLSv1.3","294","Application Data"
"102","4.200895399","2601:5cf:4100:3de0:3d84:6c14:e3a4:affc","2606:4700::6810:f8f9","TCP","86","39934  >  443 [ACK] Seq=953 Ack=4217 Win=64128 Len=0 TSval=3726974745 TSecr=2322859569"
"103","4.201105967","2601:5cf:4100:3de0:3d84:6c14:e3a4:affc","2606:4700::6810:f8f9","TCP","86","39934  >  443 [FIN, ACK] Seq=953 Ack=4217 Win=64128 Len=0 TSval=3726974745 TSecr=2322859569"
"104","4.302192165","2606:4700::6810:f8f9","2601:5cf:4100:3de0:3d84:6c14:e3a4:affc","TCP","86","443  >  39934 [FIN, ACK] Seq=4217 Ack=954 Win=65536 Len=0 TSval=2322859701 TSecr=3726974745"
"105","4.302240740","2601:5cf:4100:3de0:3d84:6c14:e3a4:affc","2606:4700::6810:f8f9","TCP","86","39934  >  443 [ACK] Seq=954 Ack=4218 Win=64128 Len=0 TSval=3726974846 TSecr=2322859701"
"106","4.325108489","2601:5cf:4100:3de0:3d84:6c14:e3a4:affc","2606:4700::6810:f8f9","TCP","94","39950  >  443 [SYN] Seq=0 Win=64800 Len=0 MSS=1440 SACK_PERM TSval=3726974869 TSecr=0 WS=128"
"107","4.365868482","2606:4700::6810:f8f9","2601:5cf:4100:3de0:3d84:6c14:e3a4:affc","TCP","94","443  >  39950 [SYN, ACK] Seq=0 Ack=1 Win=65535 Len=0 MSS=1360 SACK_PERM TSval=410026323 TSecr=3726974869 WS=8192"
"108","4.365899763","2601:5cf:4100:3de0:3d84:6c14:e3a4:affc","2606:4700::6810:f8f9","TCP","86","39950  >  443 [ACK] Seq=1 Ack=1 Win=64896 Len=0 TSval=3726974910 TSecr=410026323"
"109","4.366486571","2601:5cf:4100:3de0:3d84:6c14:e3a4:affc","2606:4700::6810:f8f9","TLSv1.3","603","Client Hello (SNI=cloudflare-dns.com)"
"113","4.505713896","2606:4700::6810:f8f9","2601:5cf:4100:3de0:3d84:6c14:e3a4:affc","TCP","86","443  >  39950 [ACK] Seq=1 Ack=518 Win=65536 Len=0 TSval=410026379 TSecr=3726974910"
"114","4.505714357","2606:4700::6810:f8f9","2601:5cf:4100:3de0:3d84:6c14:e3a4:affc","TLSv1.3","3386","Server Hello, Change Cipher Spec, Application Data"
"115","4.505770746","2601:5cf:4100:3de0:3d84:6c14:e3a4:affc","2606:4700::6810:f8f9","TCP","86","39950  >  443 [ACK] Seq=518 Ack=3301 Win=61696 Len=0 TSval=3726975049 TSecr=410026381"
"116","4.507148988","2601:5cf:4100:3de0:3d84:6c14:e3a4:affc","2606:4700::6810:f8f9","TLSv1.3","166","Change Cipher Spec, Application Data"
"117","4.609153336","2606:4700::6810:f8f9","2601:5cf:4100:3de0:3d84:6c14:e3a4:affc","TCP","690","[TCP Spurious Retransmission] 443  >  39950 [PSH, ACK] Seq=2697 Ack=518 Win=65536 Len=604 TSval=410026502 TSecr=3726974910"
"118","4.609153576","2606:4700::6810:f8f9","2601:5cf:4100:3de0:3d84:6c14:e3a4:affc","TLSv1.3","646","Application Data, Application Data"
"120","4.609190698","2601:5cf:4100:3de0:3d84:6c14:e3a4:affc","2606:4700::6810:f8f9","TCP","98","[TCP Dup ACK 115#1] 39950  >  443 [ACK] Seq=598 Ack=3301 Win=64128 Len=0 TSval=3726975153 TSecr=410026502 SLE=2697 SRE=3301"
"121","4.609206018","2601:5cf:4100:3de0:3d84:6c14:e3a4:affc","2606:4700::6810:f8f9","TLSv1.3","411","Application Data, Application Data, Application Data, Application Data"
"124","4.710519074","2606:4700::6810:f8f9","2601:5cf:4100:3de0:3d84:6c14:e3a4:affc","TLSv1.3","117","Application Data"
"125","4.710563510","2601:5cf:4100:3de0:3d84:6c14:e3a4:affc","2606:4700::6810:f8f9","TLSv1.3","117","Application Data"
"129","4.812938707","2606:4700::6810:f8f9","2601:5cf:4100:3de0:3d84:6c14:e3a4:affc","TCP","86","443  >  39950 [ACK] Seq=3892 Ack=954 Win=65536 Len=0 TSval=410026745 TSecr=3726975254"
"131","4.839393650","2606:4700::6810:f8f9","2601:5cf:4100:3de0:3d84:6c14:e3a4:affc","TLSv1.3","202","Application Data"
"132","4.839394101","2606:4700::6810:f8f9","2601:5cf:4100:3de0:3d84:6c14:e3a4:affc","TLSv1.3","203","Application Data"
"133","4.840588487","2601:5cf:4100:3de0:3d84:6c14:e3a4:affc","2606:4700::6810:f8f9","TCP","86","39950  >  443 [ACK] Seq=954 Ack=4125 Win=64128 Len=0 TSval=3726975384 TSecr=410026799"
"134","4.841014512","2601:5cf:4100:3de0:3d84:6c14:e3a4:affc","2606:4700::6810:f8f9","TCP","86","39950  >  443 [FIN, ACK] Seq=954 Ack=4125 Win=64128 Len=0 TSval=3726975385 TSecr=410026799"
"135","4.916231212","2606:4700::6810:f8f9","2601:5cf:4100:3de0:3d84:6c14:e3a4:affc","TCP","86","443  >  39950 [FIN, ACK] Seq=4125 Ack=955 Win=65536 Len=0 TSval=410026843 TSecr=3726975385"
"136","4.916262232","2601:5cf:4100:3de0:3d84:6c14:e3a4:affc","2606:4700::6810:f8f9","TCP","86","39950  >  443 [ACK] Seq=955 Ack=4126 Win=64128 Len=0 TSval=3726975460 TSecr=410026843"
"138","4.964261478","2601:5cf:4100:3de0:3d84:6c14:e3a4:affc","2606:4700::6810:f9f9","TCP","94","40992  >  443 [SYN] Seq=0 Win=64800 Len=0 MSS=1440 SACK_PERM TSval=3822458749 TSecr=0 WS=128"
"139","5.121222322","2606:4700::6810:f9f9","2601:5cf:4100:3de0:3d84:6c14:e3a4:affc","TCP","94","443  >  40992 [SYN, ACK] Seq=0 Ack=1 Win=65535 Len=0 MSS=1360 SACK_PERM TSval=1908184960 TSecr=3822458749 WS=8192"
"140","5.121282128","2601:5cf:4100:3de0:3d84:6c14:e3a4:affc","2606:4700::6810:f9f9","TCP","86","40992  >  443 [ACK] Seq=1 Ack=1 Win=64896 Len=0 TSval=3822458906 TSecr=1908184960"
"141","5.121880218","2601:5cf:4100:3de0:3d84:6c14:e3a4:affc","2606:4700::6810:f9f9","TLSv1.3","603","Client Hello (SNI=cloudflare-dns.com)"
"142","5.223556671","2606:4700::6810:f9f9","2601:5cf:4100:3de0:3d84:6c14:e3a4:affc","TCP","86","443  >  40992 [ACK] Seq=1 Ack=518 Win=65536 Len=0 TSval=1908185067 TSecr=3822458907"
"143","5.223557122","2606:4700::6810:f9f9","2601:5cf:4100:3de0:3d84:6c14:e3a4:affc","TLSv1.3","3385","Server Hello, Change Cipher Spec, Application Data"
"144","5.223615225","2601:5cf:4100:3de0:3d84:6c14:e3a4:affc","2606:4700::6810:f9f9","TCP","86","40992  >  443 [ACK] Seq=518 Ack=3300 Win=61696 Len=0 TSval=3822459008 TSecr=1908185068"
"145","5.224806574","2601:5cf:4100:3de0:3d84:6c14:e3a4:affc","2606:4700::6810:f9f9","TLSv1.3","166","Change Cipher Spec, Application Data"
"146","5.325965618","2606:4700::6810:f9f9","2601:5cf:4100:3de0:3d84:6c14:e3a4:affc","TLSv1.3","646","Application Data, Application Data"
"147","5.325990887","2601:5cf:4100:3de0:3d84:6c14:e3a4:affc","2606:4700::6810:f9f9","TLSv1.3","404","Application Data, Application Data, Application Data, Application Data"
"148","5.428489688","2606:4700::6810:f9f9","2601:5cf:4100:3de0:3d84:6c14:e3a4:affc","TLSv1.3","117","Application Data"
"149","5.428533834","2601:5cf:4100:3de0:3d84:6c14:e3a4:affc","2606:4700::6810:f9f9","TLSv1.3","117","Application Data"
"150","5.530905577","2606:4700::6810:f9f9","2601:5cf:4100:3de0:3d84:6c14:e3a4:affc","TLSv1.3","202","Application Data"
"151","5.530906027","2606:4700::6810:f9f9","2601:5cf:4100:3de0:3d84:6c14:e3a4:affc","TLSv1.3","198","Application Data"
"152","5.531810170","2601:5cf:4100:3de0:3d84:6c14:e3a4:affc","2606:4700::6810:f9f9","TCP","86","40992  >  443 [ACK] Seq=947 Ack=4119 Win=64128 Len=0 TSval=3822459316 TSecr=1908185387"
"153","5.532041679","2601:5cf:4100:3de0:3d84:6c14:e3a4:affc","2606:4700::6810:f9f9","TCP","86","40992  >  443 [FIN, ACK] Seq=947 Ack=4119 Win=64128 Len=0 TSval=3822459317 TSecr=1908185387"
"154","5.633053127","2606:4700::6810:f9f9","2601:5cf:4100:3de0:3d84:6c14:e3a4:affc","TCP","86","443  >  40992 [FIN, ACK] Seq=4119 Ack=948 Win=65536 Len=0 TSval=1908185479 TSecr=3822459317"
"155","5.633079748","2601:5cf:4100:3de0:3d84:6c14:e3a4:affc","2606:4700::6810:f9f9","TCP","86","40992  >  443 [ACK] Seq=948 Ack=4120 Win=64128 Len=0 TSval=3822459418 TSecr=1908185479"
"156","5.654109313","2601:5cf:4100:3de0:3d84:6c14:e3a4:affc","2606:4700::6810:f8f9","TCP","94","39962  >  443 [SYN] Seq=0 Win=64800 Len=0 MSS=1440 SACK_PERM TSval=3726976198 TSecr=0 WS=128"
"158","5.735839945","2606:4700::6810:f8f9","2601:5cf:4100:3de0:3d84:6c14:e3a4:affc","TCP","94","443  >  39962 [SYN, ACK] Seq=0 Ack=1 Win=65535 Len=0 MSS=1360 SACK_PERM TSval=104475743 TSecr=3726976198 WS=8192"
"160","5.735936522","2601:5cf:4100:3de0:3d84:6c14:e3a4:affc","2606:4700::6810:f8f9","TCP","86","39962  >  443 [ACK] Seq=1 Ack=1 Win=64896 Len=0 TSval=3726976280 TSecr=104475743"
"161","5.736625908","2601:5cf:4100:3de0:3d84:6c14:e3a4:affc","2606:4700::6810:f8f9","TLSv1.3","603","Client Hello (SNI=cloudflare-dns.com)"
"162","5.838118668","2606:4700::6810:f8f9","2601:5cf:4100:3de0:3d84:6c14:e3a4:affc","TCP","86","443  >  39962 [ACK] Seq=1 Ack=518 Win=57344 Len=0 TSval=104475828 TSecr=3726976280"
"163","5.838119119","2606:4700::6810:f8f9","2601:5cf:4100:3de0:3d84:6c14:e3a4:affc","TLSv1.3","2782","Server Hello, Change Cipher Spec"
"164","5.838178324","2601:5cf:4100:3de0:3d84:6c14:e3a4:affc","2606:4700::6810:f8f9","TCP","86","39962  >  443 [ACK] Seq=518 Ack=2697 Win=62208 Len=0 TSval=3726976382 TSecr=104475829"
"165","5.838316191","2606:4700::6810:f8f9","2601:5cf:4100:3de0:3d84:6c14:e3a4:affc","TLSv1.3","689","Application Data"
"166","5.838349415","2601:5cf:4100:3de0:3d84:6c14:e3a4:affc","2606:4700::6810:f8f9","TCP","86","39962  >  443 [ACK] Seq=518 Ack=3300 Win=61696 Len=0 TSval=3726976382 TSecr=104475829"
"167","5.839479215","2601:5cf:4100:3de0:3d84:6c14:e3a4:affc","2606:4700::6810:f8f9","TLSv1.3","166","Change Cipher Spec, Application Data"
"168","5.940776666","2606:4700::6810:f8f9","2601:5cf:4100:3de0:3d84:6c14:e3a4:affc","TLSv1.3","646","Application Data, Application Data"
"169","5.940822084","2601:5cf:4100:3de0:3d84:6c14:e3a4:affc","2606:4700::6810:f8f9","TLSv1.3","406","Application Data, Application Data, Application Data, Application Data"
"171","6.042690427","2606:4700::6810:f8f9","2601:5cf:4100:3de0:3d84:6c14:e3a4:affc","TLSv1.3","117","Application Data"
"172","6.042714063","2601:5cf:4100:3de0:3d84:6c14:e3a4:affc","2606:4700::6810:f8f9","TLSv1.3","117","Application Data"
"174","6.145138544","2606:4700::6810:f8f9","2601:5cf:4100:3de0:3d84:6c14:e3a4:affc","TCP","86","443  >  39962 [ACK] Seq=3891 Ack=949 Win=65536 Len=0 TSval=104476168 TSecr=3726976586"
"176","6.862265149","2606:4700::6810:f8f9","2601:5cf:4100:3de0:3d84:6c14:e3a4:affc","TLSv1.3","202","Application Data"
"177","6.862265600","2606:4700::6810:f8f9","2601:5cf:4100:3de0:3d84:6c14:e3a4:affc","TLSv1.3","199","Application Data"
"178","6.863303121","2601:5cf:4100:3de0:3d84:6c14:e3a4:affc","2606:4700::6810:f8f9","TCP","86","39962  >  443 [ACK] Seq=949 Ack=4120 Win=64128 Len=0 TSval=3726977407 TSecr=104476835"
"179","6.863512326","2601:5cf:4100:3de0:3d84:6c14:e3a4:affc","2606:4700::6810:f8f9","TCP","86","39962  >  443 [FIN, ACK] Seq=949 Ack=4120 Win=64128 Len=0 TSval=3726977407 TSecr=104476835"
"180","6.964910866","2606:4700::6810:f8f9","2601:5cf:4100:3de0:3d84:6c14:e3a4:affc","TCP","86","443  >  39962 [FIN, ACK] Seq=4120 Ack=950 Win=65536 Len=0 TSval=104476961 TSecr=3726977407"
"181","6.964939461","2601:5cf:4100:3de0:3d84:6c14:e3a4:affc","2606:4700::6810:f8f9","TCP","86","39962  >  443 [ACK] Seq=950 Ack=4121 Win=64128 Len=0 TSval=3726977509 TSecr=104476961"
"182","6.986536895","2601:5cf:4100:3de0:3d84:6c14:e3a4:affc","2606:4700::6810:f9f9","TCP","94","54028  >  443 [SYN] Seq=0 Win=64800 Len=0 MSS=1440 SACK_PERM TSval=3822460771 TSecr=0 WS=128"
"183","7.066922690","2606:4700::6810:f9f9","2601:5cf:4100:3de0:3d84:6c14:e3a4:affc","TCP","94","443  >  54028 [SYN, ACK] Seq=0 Ack=1 Win=65535 Len=0 MSS=1360 SACK_PERM TSval=580930368 TSecr=3822460771 WS=8192"
"184","7.066954722","2601:5cf:4100:3de0:3d84:6c14:e3a4:affc","2606:4700::6810:f9f9","TCP","86","54028  >  443 [ACK] Seq=1 Ack=1 Win=64896 Len=0 TSval=3822460852 TSecr=580930368"
"185","7.067323827","2601:5cf:4100:3de0:3d84:6c14:e3a4:affc","2606:4700::6810:f9f9","TLSv1.3","603","Client Hello (SNI=cloudflare-dns.com)"
"186","7.169286327","2606:4700::6810:f9f9","2601:5cf:4100:3de0:3d84:6c14:e3a4:affc","TCP","86","443  >  54028 [ACK] Seq=1 Ack=518 Win=57344 Len=0 TSval=580930449 TSecr=3822460852"
"187","7.169286568","2606:4700::6810:f9f9","2601:5cf:4100:3de0:3d84:6c14:e3a4:affc","TLSv1.3","3385","Server Hello, Change Cipher Spec, Application Data"
"188","7.169316987","2601:5cf:4100:3de0:3d84:6c14:e3a4:affc","2606:4700::6810:f9f9","TCP","86","54028  >  443 [ACK] Seq=518 Ack=3300 Win=61696 Len=0 TSval=3822460954 TSecr=580930450"
"189","7.170863314","2601:5cf:4100:3de0:3d84:6c14:e3a4:affc","2606:4700::6810:f9f9","TLSv1.3","166","Change Cipher Spec, Application Data"
"190","7.271857267","2606:4700::6810:f9f9","2601:5cf:4100:3de0:3d84:6c14:e3a4:affc","TLSv1.3","646","Application Data, Application Data"
"191","7.271902384","2601:5cf:4100:3de0:3d84:6c14:e3a4:affc","2606:4700::6810:f9f9","TLSv1.3","408","Application Data, Application Data, Application Data, Application Data"
"192","7.374178821","2606:4700::6810:f9f9","2601:5cf:4100:3de0:3d84:6c14:e3a4:affc","TLSv1.3","117","Application Data"
"193","7.374179272","2606:4700::6810:f9f9","2601:5cf:4100:3de0:3d84:6c14:e3a4:affc","TLSv1.3","202","Application Data"
"194","7.374179402","2606:4700::6810:f9f9","2601:5cf:4100:3de0:3d84:6c14:e3a4:affc","TLSv1.3","198","Application Data"
"195","7.374223508","2601:5cf:4100:3de0:3d84:6c14:e3a4:affc","2606:4700::6810:f9f9","TLSv1.3","117","Application Data"
"196","7.375285266","2601:5cf:4100:3de0:3d84:6c14:e3a4:affc","2606:4700::6810:f9f9","TCP","86","54028  >  443 [ACK] Seq=951 Ack=4119 Win=64128 Len=0 TSval=3822461160 TSecr=580930673"
"197","7.375492187","2601:5cf:4100:3de0:3d84:6c14:e3a4:affc","2606:4700::6810:f9f9","TCP","86","54028  >  443 [FIN, ACK] Seq=951 Ack=4119 Win=64128 Len=0 TSval=3822461160 TSecr=580930673"
"198","7.476446002","2606:4700::6810:f9f9","2601:5cf:4100:3de0:3d84:6c14:e3a4:affc","TCP","86","443  >  54028 [FIN, ACK] Seq=4119 Ack=952 Win=65536 Len=0 TSval=580930762 TSecr=3822461159"
"199","7.476492702","2601:5cf:4100:3de0:3d84:6c14:e3a4:affc","2606:4700::6810:f9f9","TCP","86","54028  >  443 [ACK] Seq=952 Ack=4120 Win=64128 Len=0 TSval=3822461261 TSecr=580930762"
"200","7.502471619","2601:5cf:4100:3de0:3d84:6c14:e3a4:affc","2606:4700::6810:f8f9","TCP","94","33912  >  443 [SYN] Seq=0 Win=64800 Len=0 MSS=1440 SACK_PERM TSval=3726978046 TSecr=0 WS=128"
"201","7.578883652","2606:4700::6810:f8f9","2601:5cf:4100:3de0:3d84:6c14:e3a4:affc","TCP","94","443  >  33912 [SYN, ACK] Seq=0 Ack=1 Win=65535 Len=0 MSS=1360 SACK_PERM TSval=3561973525 TSecr=3726978046 WS=8192"
"202","7.578934581","2601:5cf:4100:3de0:3d84:6c14:e3a4:affc","2606:4700::6810:f8f9","TCP","86","33912  >  443 [ACK] Seq=1 Ack=1 Win=64896 Len=0 TSval=3726978123 TSecr=3561973525"
"203","7.579391146","2601:5cf:4100:3de0:3d84:6c14:e3a4:affc","2606:4700::6810:f8f9","TLSv1.3","603","Client Hello (SNI=cloudflare-dns.com)"
"204","7.682280511","2606:4700::6810:f8f9","2601:5cf:4100:3de0:3d84:6c14:e3a4:affc","TCP","86","443  >  33912 [ACK] Seq=1 Ack=518 Win=65536 Len=0 TSval=3561973609 TSecr=3726978123"
"205","7.682281082","2606:4700::6810:f8f9","2601:5cf:4100:3de0:3d84:6c14:e3a4:affc","TLSv1.3","3386","Server Hello, Change Cipher Spec, Application Data"
"206","7.682310980","2601:5cf:4100:3de0:3d84:6c14:e3a4:affc","2606:4700::6810:f8f9","TCP","86","33912  >  443 [ACK] Seq=518 Ack=3301 Win=61696 Len=0 TSval=3726978226 TSecr=3561973612"
"207","7.683292633","2601:5cf:4100:3de0:3d84:6c14:e3a4:affc","2606:4700::6810:f8f9","TLSv1.3","166","Change Cipher Spec, Application Data"
"208","7.783670651","2606:4700::6810:f8f9","2601:5cf:4100:3de0:3d84:6c14:e3a4:affc","TLSv1.3","646","Application Data, Application Data"
"209","7.783696501","2601:5cf:4100:3de0:3d84:6c14:e3a4:affc","2606:4700::6810:f8f9","TLSv1.3","411","Application Data, Application Data, Application Data, Application Data"
"210","7.886203296","2606:4700::6810:f8f9","2601:5cf:4100:3de0:3d84:6c14:e3a4:affc","TLSv1.3","117","Application Data"
"211","7.886247702","2601:5cf:4100:3de0:3d84:6c14:e3a4:affc","2606:4700::6810:f8f9","TLSv1.3","117","Application Data"
"212","7.988757720","2606:4700::6810:f8f9","2601:5cf:4100:3de0:3d84:6c14:e3a4:affc","TCP","86","443  >  33912 [ACK] Seq=3892 Ack=954 Win=65536 Len=0 TSval=3561973948 TSecr=3726978430"
"213","8.500637254","2606:4700::6810:f8f9","2601:5cf:4100:3de0:3d84:6c14:e3a4:affc","TLSv1.3","203","Application Data"
"214","8.500637495","2606:4700::6810:f8f9","2601:5cf:4100:3de0:3d84:6c14:e3a4:affc","TLSv1.3","295","Application Data"
"215","8.501272426","2601:5cf:4100:3de0:3d84:6c14:e3a4:affc","2606:4700::6810:f8f9","TCP","86","33912  >  443 [ACK] Seq=954 Ack=4218 Win=64128 Len=0 TSval=3726979045 TSecr=3561974450"
"216","8.501516439","2601:5cf:4100:3de0:3d84:6c14:e3a4:affc","2606:4700::6810:f8f9","TCP","86","33912  >  443 [FIN, ACK] Seq=954 Ack=4218 Win=64128 Len=0 TSval=3726979045 TSecr=3561974450"
"217","8.602799104","2606:4700::6810:f8f9","2601:5cf:4100:3de0:3d84:6c14:e3a4:affc","TCP","86","443  >  33912 [FIN, ACK] Seq=4218 Ack=955 Win=65536 Len=0 TSval=3561974531 TSecr=3726979045"
"218","8.602845274","2601:5cf:4100:3de0:3d84:6c14:e3a4:affc","2606:4700::6810:f8f9","TCP","86","33912  >  443 [ACK] Seq=955 Ack=4219 Win=64128 Len=0 TSval=3726979146 TSecr=3561974531"
"219","8.624165098","2601:5cf:4100:3de0:3d84:6c14:e3a4:affc","2606:4700::6810:f8f9","TCP","94","33918  >  443 [SYN] Seq=0 Win=64800 Len=0 MSS=1440 SACK_PERM TSval=3726979168 TSecr=0 WS=128"
"220","8.705320772","2606:4700::6810:f8f9","2601:5cf:4100:3de0:3d84:6c14:e3a4:affc","TCP","94","443  >  33918 [SYN, ACK] Seq=0 Ack=1 Win=64704 Len=0 MSS=1360 SACK_PERM TSval=2604001328 TSecr=3726979168 WS=8192"
"221","8.705352493","2601:5cf:4100:3de0:3d84:6c14:e3a4:affc","2606:4700::6810:f8f9","TCP","86","33918  >  443 [ACK] Seq=1 Ack=1 Win=64896 Len=0 TSval=3726979249 TSecr=2604001328"
"222","8.705901257","2601:5cf:4100:3de0:3d84:6c14:e3a4:affc","2606:4700::6810:f8f9","TLSv1.3","603","Client Hello (SNI=cloudflare-dns.com)"
"223","8.807975538","2606:4700::6810:f8f9","2601:5cf:4100:3de0:3d84:6c14:e3a4:affc","TCP","86","443  >  33918 [ACK] Seq=1 Ack=518 Win=57344 Len=0 TSval=2604001420 TSecr=3726979250"
"224","8.807975989","2606:4700::6810:f8f9","2601:5cf:4100:3de0:3d84:6c14:e3a4:affc","TLSv1.3","3386","Server Hello, Change Cipher Spec, Application Data"
"225","8.808031527","2601:5cf:4100:3de0:3d84:6c14:e3a4:affc","2606:4700::6810:f8f9","TCP","86","33918  >  443 [ACK] Seq=518 Ack=3301 Win=61696 Len=0 TSval=3726979352 TSecr=2604001422"
"226","8.809332318","2601:5cf:4100:3de0:3d84:6c14:e3a4:affc","2606:4700::6810:f8f9","TLSv1.3","166","Change Cipher Spec, Application Data"
"227","8.910518597","2606:4700::6810:f8f9","2601:5cf:4100:3de0:3d84:6c14:e3a4:affc","TLSv1.3","646","Application Data, Application Data"
"228","8.910543956","2601:5cf:4100:3de0:3d84:6c14:e3a4:affc","2606:4700::6810:f8f9","TLSv1.3","408","Application Data, Application Data, Application Data, Application Data"
"229","9.012666997","2606:4700::6810:f8f9","2601:5cf:4100:3de0:3d84:6c14:e3a4:affc","TLSv1.3","117","Application Data"
"230","9.012667448","2606:4700::6810:f8f9","2601:5cf:4100:3de0:3d84:6c14:e3a4:affc","TLSv1.3","202","Application Data"
"231","9.012667578","2606:4700::6810:f8f9","2601:5cf:4100:3de0:3d84:6c14:e3a4:affc","TLSv1.3","201","Application Data"
"232","9.012712695","2601:5cf:4100:3de0:3d84:6c14:e3a4:affc","2606:4700::6810:f8f9","TLSv1.3","117","Application Data"
"233","9.013641375","2601:5cf:4100:3de0:3d84:6c14:e3a4:affc","2606:4700::6810:f8f9","TCP","86","33918  >  443 [ACK] Seq=951 Ack=4123 Win=64128 Len=0 TSval=3726979557 TSecr=2604001659"
"234","9.013887743","2601:5cf:4100:3de0:3d84:6c14:e3a4:affc","2606:4700::6810:f8f9","TCP","86","33918  >  443 [FIN, ACK] Seq=951 Ack=4123 Win=64128 Len=0 TSval=3726979558 TSecr=2604001659"
"236","9.114799434","2606:4700::6810:f8f9","2601:5cf:4100:3de0:3d84:6c14:e3a4:affc","TCP","86","443  >  33918 [FIN, ACK] Seq=4123 Ack=952 Win=65536 Len=0 TSval=2604001725 TSecr=3726979556"
"237","9.114834082","2601:5cf:4100:3de0:3d84:6c14:e3a4:affc","2606:4700::6810:f8f9","TCP","86","33918  >  443 [ACK] Seq=952 Ack=4124 Win=64128 Len=0 TSval=3726979658 TSecr=2604001725"
"239","9.137017198","2601:5cf:4100:3de0:3d84:6c14:e3a4:affc","2606:4700::6810:f9f9","TCP","94","54040  >  443 [SYN] Seq=0 Win=64800 Len=0 MSS=1440 SACK_PERM TSval=3822462922 TSecr=0 WS=128"
"241","9.217610347","2606:4700::6810:f9f9","2601:5cf:4100:3de0:3d84:6c14:e3a4:affc","TCP","94","443  >  54040 [SYN, ACK] Seq=0 Ack=1 Win=65535 Len=0 MSS=1360 SACK_PERM TSval=2207588856 TSecr=3822462922 WS=8192"
"242","9.217643621","2601:5cf:4100:3de0:3d84:6c14:e3a4:affc","2606:4700::6810:f9f9","TCP","86","54040  >  443 [ACK] Seq=1 Ack=1 Win=64896 Len=0 TSval=3822463002 TSecr=2207588856"
"243","9.218235989","2601:5cf:4100:3de0:3d84:6c14:e3a4:affc","2606:4700::6810:f9f9","TLSv1.3","603","Client Hello (SNI=cloudflare-dns.com)"
"244","9.319905810","2606:4700::6810:f9f9","2601:5cf:4100:3de0:3d84:6c14:e3a4:affc","TCP","86","443  >  54040 [ACK] Seq=1 Ack=518 Win=57344 Len=0 TSval=2207588929 TSecr=3822463003"
"245","9.319906260","2606:4700::6810:f9f9","2601:5cf:4100:3de0:3d84:6c14:e3a4:affc","TLSv1.3","3385","Server Hello, Change Cipher Spec, Application Data"
"246","9.319963762","2601:5cf:4100:3de0:3d84:6c14:e3a4:affc","2606:4700::6810:f9f9","TCP","86","54040  >  443 [ACK] Seq=518 Ack=3300 Win=61696 Len=0 TSval=3822463105 TSecr=2207588930"
"247","9.321260966","2601:5cf:4100:3de0:3d84:6c14:e3a4:affc","2606:4700::6810:f9f9","TLSv1.3","166","Change Cipher Spec, Application Data"
"248","9.422260758","2606:4700::6810:f9f9","2601:5cf:4100:3de0:3d84:6c14:e3a4:affc","TLSv1.3","646","Application Data, Application Data"
"249","9.422305294","2601:5cf:4100:3de0:3d84:6c14:e3a4:affc","2606:4700::6810:f9f9","TLSv1.3","407","Application Data, Application Data, Application Data, Application Data"
"250","9.524691974","2606:4700::6810:f9f9","2601:5cf:4100:3de0:3d84:6c14:e3a4:affc","TLSv1.3","117","Application Data"
"251","9.524692425","2606:4700::6810:f9f9","2601:5cf:4100:3de0:3d84:6c14:e3a4:affc","TLSv1.3","202","Application Data"
"252","9.524692555","2606:4700::6810:f9f9","2601:5cf:4100:3de0:3d84:6c14:e3a4:affc","TLSv1.3","203","Application Data"
"253","9.524737633","2601:5cf:4100:3de0:3d84:6c14:e3a4:affc","2606:4700::6810:f9f9","TLSv1.3","117","Application Data"
"254","9.525665972","2601:5cf:4100:3de0:3d84:6c14:e3a4:affc","2606:4700::6810:f9f9","TCP","86","54040  >  443 [ACK] Seq=950 Ack=4124 Win=64128 Len=0 TSval=3822463310 TSecr=2207589137"
"255","9.525921708","2601:5cf:4100:3de0:3d84:6c14:e3a4:affc","2606:4700::6810:f9f9","TCP","86","54040  >  443 [FIN, ACK] Seq=950 Ack=4124 Win=64128 Len=0 TSval=3822463311 TSecr=2207589137"
"256","9.626913555","2606:4700::6810:f9f9","2601:5cf:4100:3de0:3d84:6c14:e3a4:affc","TCP","86","443  >  54040 [FIN, ACK] Seq=4124 Ack=951 Win=65536 Len=0 TSval=2207589246 TSecr=3822463309"
"257","9.626941739","2601:5cf:4100:3de0:3d84:6c14:e3a4:affc","2606:4700::6810:f9f9","TCP","86","54040  >  443 [ACK] Seq=951 Ack=4125 Win=64128 Len=0 TSval=3822463412 TSecr=2207589246"
"258","9.648832549","2601:5cf:4100:3de0:3d84:6c14:e3a4:affc","2606:4700::6810:f9f9","TCP","94","54042  >  443 [SYN] Seq=0 Win=64800 Len=0 MSS=1440 SACK_PERM TSval=3822463433 TSecr=0 WS=128"
"259","9.729418784","2606:4700::6810:f9f9","2601:5cf:4100:3de0:3d84:6c14:e3a4:affc","TCP","94","443  >  54042 [SYN, ACK] Seq=0 Ack=1 Win=65535 Len=0 MSS=1360 SACK_PERM TSval=4129466862 TSecr=3822463433 WS=8192"
"260","9.729451307","2601:5cf:4100:3de0:3d84:6c14:e3a4:affc","2606:4700::6810:f9f9","TCP","86","54042  >  443 [ACK] Seq=1 Ack=1 Win=64896 Len=0 TSval=3822463514 TSecr=4129466862"
"261","9.730013307","2601:5cf:4100:3de0:3d84:6c14:e3a4:affc","2606:4700::6810:f9f9","TLSv1.3","603","Client Hello (SNI=cloudflare-dns.com)"
"262","9.831924194","2606:4700::6810:f9f9","2601:5cf:4100:3de0:3d84:6c14:e3a4:affc","TCP","86","443  >  54042 [ACK] Seq=1 Ack=518 Win=65536 Len=0 TSval=4129466954 TSecr=3822463515"
"263","9.831924645","2606:4700::6810:f9f9","2601:5cf:4100:3de0:3d84:6c14:e3a4:affc","TLSv1.3","3385","Server Hello, Change Cipher Spec, Application Data"
"264","9.831979501","2601:5cf:4100:3de0:3d84:6c14:e3a4:affc","2606:4700::6810:f9f9","TCP","86","54042  >  443 [ACK] Seq=518 Ack=3300 Win=61696 Len=0 TSval=3822463617 TSecr=4129466956"
"265","9.833274922","2601:5cf:4100:3de0:3d84:6c14:e3a4:affc","2606:4700::6810:f9f9","TLSv1.3","166","Change Cipher Spec, Application Data"
"266","9.934237071","2606:4700::6810:f9f9","2601:5cf:4100:3de0:3d84:6c14:e3a4:affc","TLSv1.3","646","Application Data, Application Data"
"267","9.934282068","2601:5cf:4100:3de0:3d84:6c14:e3a4:affc","2606:4700::6810:f9f9","TLSv1.3","415","Application Data, Application Data, Application Data, Application Data"
"268","10.036694912","2606:4700::6810:f9f9","2601:5cf:4100:3de0:3d84:6c14:e3a4:affc","TLSv1.3","117","Application Data"
"269","10.036695363","2606:4700::6810:f9f9","2601:5cf:4100:3de0:3d84:6c14:e3a4:affc","TLSv1.3","202","Application Data"
"270","10.036695493","2606:4700::6810:f9f9","2601:5cf:4100:3de0:3d84:6c14:e3a4:affc","TLSv1.3","209","Application Data"
"271","10.036740941","2601:5cf:4100:3de0:3d84:6c14:e3a4:affc","2606:4700::6810:f9f9","TLSv1.3","117","Application Data"
"272","10.037660965","2601:5cf:4100:3de0:3d84:6c14:e3a4:affc","2606:4700::6810:f9f9","TCP","86","54042  >  443 [ACK] Seq=958 Ack=4130 Win=64128 Len=0 TSval=3822463822 TSecr=4129467187"
"273","10.037937350","2601:5cf:4100:3de0:3d84:6c14:e3a4:affc","2606:4700::6810:f9f9","TCP","86","54042  >  443 [FIN, ACK] Seq=958 Ack=4130 Win=64128 Len=0 TSval=3822463823 TSecr=4129467187"
"274","10.138862091","2606:4700::6810:f9f9","2601:5cf:4100:3de0:3d84:6c14:e3a4:affc","TCP","86","443  >  54042 [FIN, ACK] Seq=4130 Ack=959 Win=65536 Len=0 TSval=4129467263 TSecr=3822463821"
"275","10.138909403","2601:5cf:4100:3de0:3d84:6c14:e3a4:affc","2606:4700::6810:f9f9","TCP","86","54042  >  443 [ACK] Seq=959 Ack=4131 Win=64128 Len=0 TSval=3822463924 TSecr=4129467263"
"276","10.161650148","2601:5cf:4100:3de0:3d84:6c14:e3a4:affc","2606:4700::6810:f9f9","TCP","94","54054  >  443 [SYN] Seq=0 Win=64800 Len=0 MSS=1440 SACK_PERM TSval=3822463946 TSecr=0 WS=128"
"277","10.241410729","2606:4700::6810:f9f9","2601:5cf:4100:3de0:3d84:6c14:e3a4:affc","TCP","94","443  >  54054 [SYN, ACK] Seq=0 Ack=1 Win=64704 Len=0 MSS=1360 SACK_PERM TSval=3004989031 TSecr=3822463946 WS=8192"
"278","10.241466177","2601:5cf:4100:3de0:3d84:6c14:e3a4:affc","2606:4700::6810:f9f9","TCP","86","54054  >  443 [ACK] Seq=1 Ack=1 Win=64896 Len=0 TSval=3822464026 TSecr=3004989031"
"279","10.241979001","2601:5cf:4100:3de0:3d84:6c14:e3a4:affc","2606:4700::6810:f9f9","TLSv1.3","603","Client Hello (SNI=cloudflare-dns.com)"
"280","10.447831060","2606:4700::6810:f9f9","2601:5cf:4100:3de0:3d84:6c14:e3a4:affc","TCP","86","443  >  54054 [ACK] Seq=1 Ack=518 Win=57344 Len=0 TSval=3004989112 TSecr=3822464027"
"281","10.447831300","2606:4700::6810:f9f9","2601:5cf:4100:3de0:3d84:6c14:e3a4:affc","TLSv1.3","3385","Server Hello, Change Cipher Spec, Application Data"
"282","10.447831330","2606:4700::6810:f9f9","2601:5cf:4100:3de0:3d84:6c14:e3a4:affc","TCP","689","[TCP Retransmission] 443  >  54054 [PSH, ACK] Seq=2697 Ack=518 Win=65536 Len=603 TSval=3004989277 TSecr=3822464027"
"283","10.447861499","2601:5cf:4100:3de0:3d84:6c14:e3a4:affc","2606:4700::6810:f9f9","TCP","86","54054  >  443 [ACK] Seq=518 Ack=3300 Win=61696 Len=0 TSval=3822464233 TSecr=3004989113"
"284","10.447870617","2601:5cf:4100:3de0:3d84:6c14:e3a4:affc","2606:4700::6810:f9f9","TCP","98","[TCP Dup ACK 283#1] 54054  >  443 [ACK] Seq=518 Ack=3300 Win=61696 Len=0 TSval=3822464233 TSecr=3004989277 SLE=2697 SRE=3300"
"285","10.448843141","2601:5cf:4100:3de0:3d84:6c14:e3a4:affc","2606:4700::6810:f9f9","TLSv1.3","166","Change Cipher Spec, Application Data"
"286","10.548825365","2606:4700::6810:f9f9","2601:5cf:4100:3de0:3d84:6c14:e3a4:affc","TLSv1.3","646","Application Data, Application Data"
"287","10.548870583","2601:5cf:4100:3de0:3d84:6c14:e3a4:affc","2606:4700::6810:f9f9","TLSv1.3","412","Application Data, Application Data, Application Data, Application Data"
"288","10.638160361","2606:4700::6810:f9f9","2601:5cf:4100:3de0:3d84:6c14:e3a4:affc","TLSv1.3","117","Application Data"
"289","10.638160622","2606:4700::6810:f9f9","2601:5cf:4100:3de0:3d84:6c14:e3a4:affc","TLSv1.3","202","Application Data"
"290","10.638160682","2606:4700::6810:f9f9","2601:5cf:4100:3de0:3d84:6c14:e3a4:affc","TLSv1.3","149","Application Data"
"291","10.638185200","2601:5cf:4100:3de0:3d84:6c14:e3a4:affc","2606:4700::6810:f9f9","TLSv1.3","117","Application Data"
"292","10.638858464","2601:5cf:4100:3de0:3d84:6c14:e3a4:affc","2606:4700::6810:f9f9","TCP","86","54054  >  443 [ACK] Seq=955 Ack=4070 Win=64128 Len=0 TSval=3822464424 TSecr=3004989450"
"293","10.639093169","2601:5cf:4100:3de0:3d84:6c14:e3a4:affc","2606:4700::6810:f9f9","TCP","86","54054  >  443 [FIN, ACK] Seq=955 Ack=4070 Win=64128 Len=0 TSval=3822464424 TSecr=3004989450"
"294","10.753254396","2606:4700::6810:f9f9","2601:5cf:4100:3de0:3d84:6c14:e3a4:affc","TCP","86","443  >  54054 [FIN, ACK] Seq=4070 Ack=956 Win=65536 Len=0 TSval=3004989513 TSecr=3822464423"
"295","10.753282040","2601:5cf:4100:3de0:3d84:6c14:e3a4:affc","2606:4700::6810:f9f9","TCP","86","54054  >  443 [ACK] Seq=956 Ack=4071 Win=64128 Len=0 TSval=3822464538 TSecr=3004989513"
"296","10.762217779","2601:5cf:4100:3de0:3d84:6c14:e3a4:affc","2606:4700::6810:f8f9","TCP","94","33924  >  443 [SYN] Seq=0 Win=64800 Len=0 MSS=1440 SACK_PERM TSval=3726981306 TSecr=0 WS=128"
"297","10.855965018","2606:4700::6810:f8f9","2601:5cf:4100:3de0:3d84:6c14:e3a4:affc","TCP","94","443  >  33924 [SYN, ACK] Seq=0 Ack=1 Win=65535 Len=0 MSS=1360 SACK_PERM TSval=2270669620 TSecr=3726981306 WS=8192"
"298","10.856022319","2601:5cf:4100:3de0:3d84:6c14:e3a4:affc","2606:4700::6810:f8f9","TCP","86","33924  >  443 [ACK] Seq=1 Ack=1 Win=64896 Len=0 TSval=3726981400 TSecr=2270669620"
"299","10.856712898","2601:5cf:4100:3de0:3d84:6c14:e3a4:affc","2606:4700::6810:f8f9","TLSv1.3","603","Client Hello (SNI=cloudflare-dns.com)"
"300","10.958617386","2606:4700::6810:f8f9","2601:5cf:4100:3de0:3d84:6c14:e3a4:affc","TCP","86","443  >  33924 [ACK] Seq=1 Ack=518 Win=65536 Len=0 TSval=2270669712 TSecr=3726981400"
"301","10.958617626","2606:4700::6810:f8f9","2601:5cf:4100:3de0:3d84:6c14:e3a4:affc","TLSv1.3","3386","Server Hello, Change Cipher Spec, Application Data"
"302","10.958648005","2601:5cf:4100:3de0:3d84:6c14:e3a4:affc","2606:4700::6810:f8f9","TCP","86","33924  >  443 [ACK] Seq=518 Ack=3301 Win=61696 Len=0 TSval=3726981502 TSecr=2270669713"
"303","10.959623035","2601:5cf:4100:3de0:3d84:6c14:e3a4:affc","2606:4700::6810:f8f9","TLSv1.3","166","Change Cipher Spec, Application Data"
"304","11.060690498","2606:4700::6810:f8f9","2601:5cf:4100:3de0:3d84:6c14:e3a4:affc","TLSv1.3","646","Application Data, Application Data"
"305","11.060715737","2601:5cf:4100:3de0:3d84:6c14:e3a4:affc","2606:4700::6810:f8f9","TLSv1.3","406","Application Data, Application Data, Application Data, Application Data"
"306","11.163156088","2606:4700::6810:f8f9","2601:5cf:4100:3de0:3d84:6c14:e3a4:affc","TLSv1.3","117","Application Data"
"307","11.163156539","2606:4700::6810:f8f9","2601:5cf:4100:3de0:3d84:6c14:e3a4:affc","TLSv1.3","202","Application Data"
"308","11.163156669","2606:4700::6810:f8f9","2601:5cf:4100:3de0:3d84:6c14:e3a4:affc","TLSv1.3","213","Application Data"
"309","11.163202678","2601:5cf:4100:3de0:3d84:6c14:e3a4:affc","2606:4700::6810:f8f9","TLSv1.3","117","Application Data"
"310","11.164293363","2601:5cf:4100:3de0:3d84:6c14:e3a4:affc","2606:4700::6810:f8f9","TCP","86","33924  >  443 [ACK] Seq=949 Ack=4135 Win=64128 Len=0 TSval=3726981708 TSecr=2270669939"
"311","11.164553156","2601:5cf:4100:3de0:3d84:6c14:e3a4:affc","2606:4700::6810:f8f9","TCP","86","33924  >  443 [FIN, ACK] Seq=949 Ack=4135 Win=64128 Len=0 TSval=3726981708 TSecr=2270669939"
"312","11.265399820","2606:4700::6810:f8f9","2601:5cf:4100:3de0:3d84:6c14:e3a4:affc","TCP","86","443  >  33924 [FIN, ACK] Seq=4135 Ack=950 Win=65536 Len=0 TSval=2270670026 TSecr=3726981707"
"313","11.265447352","2601:5cf:4100:3de0:3d84:6c14:e3a4:affc","2606:4700::6810:f8f9","TCP","86","33924  >  443 [ACK] Seq=950 Ack=4136 Win=64128 Len=0 TSval=3726981809 TSecr=2270670026"
"314","11.287254387","2601:5cf:4100:3de0:3d84:6c14:e3a4:affc","2606:4700::6810:f8f9","TCP","94","33940  >  443 [SYN] Seq=0 Win=64800 Len=0 MSS=1440 SACK_PERM TSval=3726981831 TSecr=0 WS=128"
"315","11.368001977","2606:4700::6810:f8f9","2601:5cf:4100:3de0:3d84:6c14:e3a4:affc","TCP","94","443  >  33940 [SYN, ACK] Seq=0 Ack=1 Win=65535 Len=0 MSS=1360 SACK_PERM TSval=3400668828 TSecr=3726981831 WS=8192"
"316","11.368059478","2601:5cf:4100:3de0:3d84:6c14:e3a4:affc","2606:4700::6810:f8f9","TCP","86","33940  >  443 [ACK] Seq=1 Ack=1 Win=64896 Len=0 TSval=3726981912 TSecr=3400668828"
"317","11.368735679","2601:5cf:4100:3de0:3d84:6c14:e3a4:affc","2606:4700::6810:f8f9","TLSv1.3","603","Client Hello (SNI=cloudflare-dns.com)"
"318","11.470356372","2606:4700::6810:f8f9","2601:5cf:4100:3de0:3d84:6c14:e3a4:affc","TCP","86","443  >  33940 [ACK] Seq=1 Ack=518 Win=65536 Len=0 TSval=3400668912 TSecr=3726981912"
"319","11.470356823","2606:4700::6810:f8f9","2601:5cf:4100:3de0:3d84:6c14:e3a4:affc","TLSv1.3","3384","Server Hello, Change Cipher Spec, Application Data"
"320","11.470410978","2601:5cf:4100:3de0:3d84:6c14:e3a4:affc","2606:4700::6810:f8f9","TCP","86","33940  >  443 [ACK] Seq=518 Ack=3299 Win=61696 Len=0 TSval=3726982014 TSecr=3400668913"
"321","11.471745614","2601:5cf:4100:3de0:3d84:6c14:e3a4:affc","2606:4700::6810:f8f9","TLSv1.3","166","Change Cipher Spec, Application Data"
"322","11.572742789","2606:4700::6810:f8f9","2601:5cf:4100:3de0:3d84:6c14:e3a4:affc","TLSv1.3","646","Application Data, Application Data"
"323","11.572768579","2601:5cf:4100:3de0:3d84:6c14:e3a4:affc","2606:4700::6810:f8f9","TLSv1.3","408","Application Data, Application Data, Application Data, Application Data"
"324","11.675063832","2606:4700::6810:f8f9","2601:5cf:4100:3de0:3d84:6c14:e3a4:affc","TLSv1.3","117","Application Data"
"325","11.675064082","2606:4700::6810:f8f9","2601:5cf:4100:3de0:3d84:6c14:e3a4:affc","TLSv1.3","202","Application Data"
"326","11.675064122","2606:4700::6810:f8f9","2601:5cf:4100:3de0:3d84:6c14:e3a4:affc","TLSv1.3","197","Application Data"
"327","11.675088980","2601:5cf:4100:3de0:3d84:6c14:e3a4:affc","2606:4700::6810:f8f9","TLSv1.3","117","Application Data"
"328","11.675773748","2601:5cf:4100:3de0:3d84:6c14:e3a4:affc","2606:4700::6810:f8f9","TCP","86","33940  >  443 [ACK] Seq=951 Ack=4117 Win=64128 Len=0 TSval=3726982219 TSecr=3400669133"
"329","11.676003633","2601:5cf:4100:3de0:3d84:6c14:e3a4:affc","2606:4700::6810:f8f9","TCP","86","33940  >  443 [FIN, ACK] Seq=951 Ack=4117 Win=64128 Len=0 TSval=3726982220 TSecr=3400669133"
"330","11.777301572","2606:4700::6810:f8f9","2601:5cf:4100:3de0:3d84:6c14:e3a4:affc","TCP","86","443  >  33940 [FIN, ACK] Seq=4117 Ack=952 Win=65536 Len=0 TSval=3400669224 TSecr=3726982219"
"331","11.777327762","2601:5cf:4100:3de0:3d84:6c14:e3a4:affc","2606:4700::6810:f8f9","TCP","86","33940  >  443 [ACK] Seq=952 Ack=4118 Win=64128 Len=0 TSval=3726982321 TSecr=3400669224"
"332","11.798829385","2601:5cf:4100:3de0:3d84:6c14:e3a4:affc","2606:4700::6810:f9f9","TCP","94","54056  >  443 [SYN] Seq=0 Win=64800 Len=0 MSS=1440 SACK_PERM TSval=3822465583 TSecr=0 WS=128"
"333","11.880678869","2606:4700::6810:f9f9","2601:5cf:4100:3de0:3d84:6c14:e3a4:affc","TCP","94","443  >  54056 [SYN, ACK] Seq=0 Ack=1 Win=65535 Len=0 MSS=1360 SACK_PERM TSval=980307530 TSecr=3822465583 WS=8192"
"334","11.880735780","2601:5cf:4100:3de0:3d84:6c14:e3a4:affc","2606:4700::6810:f9f9","TCP","86","54056  >  443 [ACK] Seq=1 Ack=1 Win=64896 Len=0 TSval=3822465665 TSecr=980307530"
"335","11.881302368","2601:5cf:4100:3de0:3d84:6c14:e3a4:affc","2606:4700::6810:f9f9","TLSv1.3","603","Client Hello (SNI=cloudflare-dns.com)"
"336","11.982467616","2606:4700::6810:f9f9","2601:5cf:4100:3de0:3d84:6c14:e3a4:affc","TCP","86","443  >  54056 [ACK] Seq=1 Ack=518 Win=65536 Len=0 TSval=980307605 TSecr=3822465666"
"337","11.982467856","2606:4700::6810:f9f9","2601:5cf:4100:3de0:3d84:6c14:e3a4:affc","TLSv1.3","3384","Server Hello, Change Cipher Spec, Application Data"
"338","11.982498726","2601:5cf:4100:3de0:3d84:6c14:e3a4:affc","2606:4700::6810:f9f9","TCP","86","54056  >  443 [ACK] Seq=518 Ack=3299 Win=61696 Len=0 TSval=3822465767 TSecr=980307606"
"339","11.983390294","2601:5cf:4100:3de0:3d84:6c14:e3a4:affc","2606:4700::6810:f9f9","TLSv1.3","166","Change Cipher Spec, Application Data"
"341","12.084537756","2606:4700::6810:f9f9","2601:5cf:4100:3de0:3d84:6c14:e3a4:affc","TLSv1.3","646","Application Data, Application Data"
"342","12.084559748","2601:5cf:4100:3de0:3d84:6c14:e3a4:affc","2606:4700::6810:f9f9","TLSv1.3","408","Application Data, Application Data, Application Data, Application Data"
"344","12.187078378","2606:4700::6810:f9f9","2601:5cf:4100:3de0:3d84:6c14:e3a4:affc","TLSv1.3","117","Application Data"
"345","12.187103927","2601:5cf:4100:3de0:3d84:6c14:e3a4:affc","2606:4700::6810:f9f9","TLSv1.3","117","Application Data"
"346","12.289478286","2606:4700::6810:f9f9","2601:5cf:4100:3de0:3d84:6c14:e3a4:affc","TCP","86","443  >  54056 [ACK] Seq=3890 Ack=951 Win=65536 Len=0 TSval=980307954 TSecr=3822465972"
"348","12.801507387","2606:4700::6810:f9f9","2601:5cf:4100:3de0:3d84:6c14:e3a4:affc","TLSv1.3","202","Application Data"
"349","12.801507628","2606:4700::6810:f9f9","2601:5cf:4100:3de0:3d84:6c14:e3a4:affc","TLSv1.3","278","Application Data"
"350","12.802582801","2601:5cf:4100:3de0:3d84:6c14:e3a4:affc","2606:4700::6810:f9f9","TCP","86","54056  >  443 [ACK] Seq=951 Ack=4198 Win=64128 Len=0 TSval=3822466587 TSecr=980308456"
"351","12.802853957","2601:5cf:4100:3de0:3d84:6c14:e3a4:affc","2606:4700::6810:f9f9","TCP","86","54056  >  443 [FIN, ACK] Seq=951 Ack=4198 Win=64128 Len=0 TSval=3822466588 TSecr=980308456"
"352","12.904079359","2606:4700::6810:f9f9","2601:5cf:4100:3de0:3d84:6c14:e3a4:affc","TCP","86","443  >  54056 [FIN, ACK] Seq=4198 Ack=952 Win=65536 Len=0 TSval=980308533 TSecr=3822466588"
"353","12.904124547","2601:5cf:4100:3de0:3d84:6c14:e3a4:affc","2606:4700::6810:f9f9","TCP","86","54056  >  443 [ACK] Seq=952 Ack=4199 Win=64128 Len=0 TSval=3822466689 TSecr=980308533"
"354","12.928385276","2601:5cf:4100:3de0:3d84:6c14:e3a4:affc","2606:4700::6810:f8f9","TCP","94","33956  >  443 [SYN] Seq=0 Win=64800 Len=0 MSS=1440 SACK_PERM TSval=3726983472 TSecr=0 WS=128"
"355","13.006231382","2606:4700::6810:f8f9","2601:5cf:4100:3de0:3d84:6c14:e3a4:affc","TCP","94","443  >  33956 [SYN, ACK] Seq=0 Ack=1 Win=65535 Len=0 MSS=1360 SACK_PERM TSval=1166596281 TSecr=3726983472 WS=8192"
"356","13.006288914","2601:5cf:4100:3de0:3d84:6c14:e3a4:affc","2606:4700::6810:f8f9","TCP","86","33956  >  443 [ACK] Seq=1 Ack=1 Win=64896 Len=0 TSval=3726983550 TSecr=1166596281"
"357","13.006980534","2601:5cf:4100:3de0:3d84:6c14:e3a4:affc","2606:4700::6810:f8f9","TLSv1.3","603","Client Hello (SNI=cloudflare-dns.com)"
"359","13.108768089","2606:4700::6810:f8f9","2601:5cf:4100:3de0:3d84:6c14:e3a4:affc","TCP","86","443  >  33956 [ACK] Seq=1 Ack=518 Win=65536 Len=0 TSval=1166596368 TSecr=3726983551"
"360","13.108768329","2606:4700::6810:f8f9","2601:5cf:4100:3de0:3d84:6c14:e3a4:affc","TLSv1.3","3384","Server Hello, Change Cipher Spec, Application Data"
"361","13.108800201","2601:5cf:4100:3de0:3d84:6c14:e3a4:affc","2606:4700::6810:f8f9","TCP","86","33956  >  443 [ACK] Seq=518 Ack=3299 Win=61696 Len=0 TSval=3726983652 TSecr=1166596369"
"362","13.109772024","2601:5cf:4100:3de0:3d84:6c14:e3a4:affc","2606:4700::6810:f8f9","TLSv1.3","166","Change Cipher Spec, Application Data"
"363","13.211025567","2606:4700::6810:f8f9","2601:5cf:4100:3de0:3d84:6c14:e3a4:affc","TLSv1.3","646","Application Data, Application Data"
"364","13.211068059","2601:5cf:4100:3de0:3d84:6c14:e3a4:affc","2606:4700::6810:f8f9","TLSv1.3","409","Application Data, Application Data, Application Data, Application Data"
"365","13.313519660","2606:4700::6810:f8f9","2601:5cf:4100:3de0:3d84:6c14:e3a4:affc","TLSv1.3","117","Application Data"
"366","13.313519901","2606:4700::6810:f8f9","2601:5cf:4100:3de0:3d84:6c14:e3a4:affc","TLSv1.3","202","Application Data"
"367","13.313519941","2606:4700::6810:f8f9","2601:5cf:4100:3de0:3d84:6c14:e3a4:affc","TLSv1.3","200","Application Data"
"368","13.313545270","2601:5cf:4100:3de0:3d84:6c14:e3a4:affc","2606:4700::6810:f8f9","TLSv1.3","117","Application Data"
"369","13.314733593","2601:5cf:4100:3de0:3d84:6c14:e3a4:affc","2606:4700::6810:f8f9","TCP","86","33956  >  443 [ACK] Seq=952 Ack=4120 Win=64128 Len=0 TSval=3726983858 TSecr=1166596595"
"370","13.315002374","2601:5cf:4100:3de0:3d84:6c14:e3a4:affc","2606:4700::6810:f8f9","TCP","86","33956  >  443 [FIN, ACK] Seq=952 Ack=4120 Win=64128 Len=0 TSval=3726983859 TSecr=1166596595"
"371","13.415807647","2606:4700::6810:f8f9","2601:5cf:4100:3de0:3d84:6c14:e3a4:affc","TCP","86","443  >  33956 [FIN, ACK] Seq=4120 Ack=953 Win=65536 Len=0 TSval=1166596677 TSecr=3726983857"
"372","13.415854899","2601:5cf:4100:3de0:3d84:6c14:e3a4:affc","2606:4700::6810:f8f9","TCP","86","33956  >  443 [ACK] Seq=953 Ack=4121 Win=64128 Len=0 TSval=3726983959 TSecr=1166596677"
"373","13.437454088","2601:5cf:4100:3de0:3d84:6c14:e3a4:affc","2606:4700::6810:f8f9","TCP","94","33958  >  443 [SYN] Seq=0 Win=64800 Len=0 MSS=1440 SACK_PERM TSval=3726983981 TSecr=0 WS=128"
"374","13.518474999","2606:4700::6810:f8f9","2601:5cf:4100:3de0:3d84:6c14:e3a4:affc","TCP","94","443  >  33958 [SYN, ACK] Seq=0 Ack=1 Win=65535 Len=0 MSS=1360 SACK_PERM TSval=187770801 TSecr=3726983981 WS=8192"
"375","13.518551767","2601:5cf:4100:3de0:3d84:6c14:e3a4:affc","2606:4700::6810:f8f9","TCP","86","33958  >  443 [ACK] Seq=1 Ack=1 Win=64896 Len=0 TSval=3726984062 TSecr=187770801"
"376","13.519373239","2601:5cf:4100:3de0:3d84:6c14:e3a4:affc","2606:4700::6810:f8f9","TLSv1.3","603","Client Hello (SNI=cloudflare-dns.com)"
"377","13.620783714","2606:4700::6810:f8f9","2601:5cf:4100:3de0:3d84:6c14:e3a4:affc","TCP","86","443  >  33958 [ACK] Seq=1 Ack=518 Win=65536 Len=0 TSval=187770881 TSecr=3726984063"
"378","13.620783955","2606:4700::6810:f8f9","2601:5cf:4100:3de0:3d84:6c14:e3a4:affc","TLSv1.3","3384","Server Hello, Change Cipher Spec, Application Data"
"379","13.620815867","2601:5cf:4100:3de0:3d84:6c14:e3a4:affc","2606:4700::6810:f8f9","TCP","86","33958  >  443 [ACK] Seq=518 Ack=3299 Win=61696 Len=0 TSval=3726984164 TSecr=187770883"
"380","13.621773733","2601:5cf:4100:3de0:3d84:6c14:e3a4:affc","2606:4700::6810:f8f9","TLSv1.3","166","Change Cipher Spec, Application Data"
"381","13.723022364","2606:4700::6810:f8f9","2601:5cf:4100:3de0:3d84:6c14:e3a4:affc","TLSv1.3","646","Application Data, Application Data"
"382","13.723050128","2601:5cf:4100:3de0:3d84:6c14:e3a4:affc","2606:4700::6810:f8f9","TLSv1.3","405","Application Data, Application Data, Application Data, Application Data"
"383","13.825544242","2606:4700::6810:f8f9","2601:5cf:4100:3de0:3d84:6c14:e3a4:affc","TLSv1.3","117","Application Data"
"384","13.825569491","2601:5cf:4100:3de0:3d84:6c14:e3a4:affc","2606:4700::6810:f8f9","TLSv1.3","117","Application Data"
"385","13.928287339","2606:4700::6810:f8f9","2601:5cf:4100:3de0:3d84:6c14:e3a4:affc","TCP","86","443  >  33958 [ACK] Seq=3890 Ack=948 Win=65536 Len=0 TSval=187771230 TSecr=3726984369"
"386","14.955642654","2606:4700::6810:f8f9","2601:5cf:4100:3de0:3d84:6c14:e3a4:affc","TLSv1.3","202","Application Data"
"387","14.955642895","2606:4700::6810:f8f9","2601:5cf:4100:3de0:3d84:6c14:e3a4:affc","TLSv1.3","188","Application Data"
"388","14.956619648","2601:5cf:4100:3de0:3d84:6c14:e3a4:affc","2606:4700::6810:f8f9","TCP","86","33958  >  443 [ACK] Seq=948 Ack=4108 Win=64128 Len=0 TSval=3726985500 TSecr=187772197"
"389","14.957024743","2601:5cf:4100:3de0:3d84:6c14:e3a4:affc","2606:4700::6810:f8f9","TCP","86","33958  >  443 [FIN, ACK] Seq=948 Ack=4108 Win=64128 Len=0 TSval=3726985501 TSecr=187772197"
"390","15.054265205","2606:4700::6810:f8f9","2601:5cf:4100:3de0:3d84:6c14:e3a4:affc","TCP","86","443  >  33958 [FIN, ACK] Seq=4108 Ack=949 Win=65536 Len=0 TSval=187772329 TSecr=3726985501"
"391","15.054307186","2601:5cf:4100:3de0:3d84:6c14:e3a4:affc","2606:4700::6810:f8f9","TCP","86","33958  >  443 [ACK] Seq=949 Ack=4109 Win=64128 Len=0 TSval=3726985598 TSecr=187772329"
"392","15.080731595","2601:5cf:4100:3de0:3d84:6c14:e3a4:affc","2606:4700::6810:f9f9","TCP","94","54068  >  443 [SYN] Seq=0 Win=64800 Len=0 MSS=1440 SACK_PERM TSval=3822468865 TSecr=0 WS=128"
"394","15.156615069","2606:4700::6810:f9f9","2601:5cf:4100:3de0:3d84:6c14:e3a4:affc","TCP","94","443  >  54068 [SYN, ACK] Seq=0 Ack=1 Win=65535 Len=0 MSS=1360 SACK_PERM TSval=1929228590 TSecr=3822468865 WS=8192"
"395","15.156636370","2601:5cf:4100:3de0:3d84:6c14:e3a4:affc","2606:4700::6810:f9f9","TCP","86","54068  >  443 [ACK] Seq=1 Ack=1 Win=64896 Len=0 TSval=3822468941 TSecr=1929228590"
"396","15.156978473","2601:5cf:4100:3de0:3d84:6c14:e3a4:affc","2606:4700::6810:f9f9","TLSv1.3","603","Client Hello (SNI=cloudflare-dns.com)"
"399","15.259189258","2606:4700::6810:f9f9","2601:5cf:4100:3de0:3d84:6c14:e3a4:affc","TCP","86","443  >  54068 [ACK] Seq=1 Ack=518 Win=65536 Len=0 TSval=1929228667 TSecr=3822468942"
"400","15.259189499","2606:4700::6810:f9f9","2601:5cf:4100:3de0:3d84:6c14:e3a4:affc","TLSv1.3","3384","Server Hello, Change Cipher Spec, Application Data"
"401","15.259219717","2601:5cf:4100:3de0:3d84:6c14:e3a4:affc","2606:4700::6810:f9f9","TCP","86","54068  >  443 [ACK] Seq=518 Ack=3299 Win=61696 Len=0 TSval=3822469044 TSecr=1929228668"
"402","15.260183595","2601:5cf:4100:3de0:3d84:6c14:e3a4:affc","2606:4700::6810:f9f9","TLSv1.3","166","Change Cipher Spec, Application Data"
"403","15.361585813","2606:4700::6810:f9f9","2601:5cf:4100:3de0:3d84:6c14:e3a4:affc","TLSv1.3","646","Application Data, Application Data"
"404","15.361611733","2601:5cf:4100:3de0:3d84:6c14:e3a4:affc","2606:4700::6810:f9f9","TLSv1.3","407","Application Data, Application Data, Application Data, Application Data"
"405","15.464117439","2606:4700::6810:f9f9","2601:5cf:4100:3de0:3d84:6c14:e3a4:affc","TLSv1.3","117","Application Data"
"406","15.464117890","2606:4700::6810:f9f9","2601:5cf:4100:3de0:3d84:6c14:e3a4:affc","TLSv1.3","203","Application Data"
"407","15.464118020","2606:4700::6810:f9f9","2601:5cf:4100:3de0:3d84:6c14:e3a4:affc","TLSv1.3","281","Application Data"
"408","15.464164310","2601:5cf:4100:3de0:3d84:6c14:e3a4:affc","2606:4700::6810:f9f9","TLSv1.3","117","Application Data"
"409","15.465197933","2601:5cf:4100:3de0:3d84:6c14:e3a4:affc","2606:4700::6810:f9f9","TCP","86","54068  >  443 [ACK] Seq=950 Ack=4202 Win=64128 Len=0 TSval=3822469250 TSecr=1929228895"
"410","15.465400465","2601:5cf:4100:3de0:3d84:6c14:e3a4:affc","2606:4700::6810:f9f9","TCP","86","54068  >  443 [FIN, ACK] Seq=950 Ack=4202 Win=64128 Len=0 TSval=3822469250 TSecr=1929228895"
"411","15.566259751","2606:4700::6810:f9f9","2601:5cf:4100:3de0:3d84:6c14:e3a4:affc","TCP","86","443  >  54068 [FIN, ACK] Seq=4202 Ack=951 Win=65536 Len=0 TSval=1929228976 TSecr=3822469249"
"412","15.566305730","2601:5cf:4100:3de0:3d84:6c14:e3a4:affc","2606:4700::6810:f9f9","TCP","86","54068  >  443 [ACK] Seq=951 Ack=4203 Win=64128 Len=0 TSval=3822469351 TSecr=1929228976"
