"No.","Time","Source","Destination","Protocol","Length","Type","HTTP2 Length","TCP Header Length","TLS Length","Info"
"25","6.807287090","2601:5cf:4100:3de0:53f4:479c:be9c:997d","2606:4700::6810:f9f9","TCP","94","","","40","","37386  >  443 [SYN] Seq=0 Win=64800 Len=0 MSS=1440 SACK_PERM TSval=1819412494 TSecr=0 WS=128"
"26","7.114601742","2606:4700::6810:f9f9","2601:5cf:4100:3de0:53f4:479c:be9c:997d","TCP","94","","","40","","443  >  37386 [SYN, ACK] Seq=0 Ack=1 Win=65535 Len=0 MSS=1360 SACK_PERM TSval=4215856274 TSecr=1819412494 WS=8192"
"27","7.114636249","2601:5cf:4100:3de0:53f4:479c:be9c:997d","2606:4700::6810:f9f9","TCP","86","","","32","","37386  >  443 [ACK] Seq=1 Ack=1 Win=64896 Len=0 TSval=1819412801 TSecr=4215856274"
"28","7.115028102","2601:5cf:4100:3de0:53f4:479c:be9c:997d","2606:4700::6810:f9f9","TLSv1.3","603","","","32","512","Client Hello (SNI=cloudflare-dns.com)"
"29","7.421643518","2606:4700::6810:f9f9","2601:5cf:4100:3de0:53f4:479c:be9c:997d","TCP","86","","","32","","443  >  37386 [ACK] Seq=1 Ack=518 Win=57344 Len=0 TSval=4215856585 TSecr=1819412802"
"30","7.421643779","2606:4700::6810:f9f9","2601:5cf:4100:3de0:53f4:479c:be9c:997d","TLSv1.3","2782","","","32","122,1","Server Hello, Change Cipher Spec"
"31","7.421643829","2606:4700::6810:f9f9","2601:5cf:4100:3de0:53f4:479c:be9c:997d","TLSv1.3","690","","","32","3162","Encrypted Extensions, Certificate, Certificate Verify, Finished"
"32","7.421673336","2601:5cf:4100:3de0:53f4:479c:be9c:997d","2606:4700::6810:f9f9","TCP","86","","","32","","37386  >  443 [ACK] Seq=518 Ack=2697 Win=63488 Len=0 TSval=1819413108 TSecr=4215856586"
"33","7.421683606","2601:5cf:4100:3de0:53f4:479c:be9c:997d","2606:4700::6810:f9f9","TCP","86","","","32","","37386  >  443 [ACK] Seq=518 Ack=3301 Win=62976 Len=0 TSval=1819413108 TSecr=4215856586"
"34","7.429722252","2601:5cf:4100:3de0:53f4:479c:be9c:997d","2606:4700::6810:f9f9","TLSv1.3","166","","","32","1,69","Change Cipher Spec, Finished"
"35","7.430052224","2601:5cf:4100:3de0:53f4:479c:be9c:997d","2606:4700::6810:f9f9","HTTP2","190","SETTINGS,WINDOW_UPDATE","36,4","32","99","Magic, SETTINGS[0], WINDOW_UPDATE[0]"
"36","7.441279514","2601:5cf:4100:3de0:53f4:479c:be9c:997d","2606:4700::6810:f9f9","DoH","298","HEADERS,WINDOW_UPDATE,DATA,DATA","84,4,22,0","32","123,48,26","Standard query 0x1273 NS 0.sb"
"37","7.728846508","2606:4700::6810:f9f9","2601:5cf:4100:3de0:53f4:479c:be9c:997d","HTTP2","646","SETTINGS,WINDOW_UPDATE","18,4","32","493,57","SETTINGS[0], WINDOW_UPDATE[0]"
"38","7.728846779","2606:4700::6810:f9f9","2601:5cf:4100:3de0:53f4:479c:be9c:997d","TCP","86","","","32","","443  >  37386 [ACK] Seq=3861 Ack=914 Win=65536 Len=0 TSval=4215856902 TSecr=1819413117"
"39","7.729377913","2601:5cf:4100:3de0:53f4:479c:be9c:997d","2606:4700::6810:f9f9","HTTP2","117","SETTINGS","0","32","26","SETTINGS[0]"
"40","7.729489500","2606:4700::6810:f9f9","2601:5cf:4100:3de0:53f4:479c:be9c:997d","HTTP2","117","SETTINGS","0","32","26","SETTINGS[0]"
"41","7.729489610","2606:4700::6810:f9f9","2601:5cf:4100:3de0:53f4:479c:be9c:997d","HTTP2","202","HEADERS","85","32","111","HEADERS[1]: 200 OK"
"42","7.729489700","2606:4700::6810:f9f9","2601:5cf:4100:3de0:53f4:479c:be9c:997d","DoH","195","DATA","78","32","104","Standard query response 0x1273 NS 0.sb NS ns1.xiufeng.de NS ns2.xiufeng.nl"
"43","7.730299406","2601:5cf:4100:3de0:53f4:479c:be9c:997d","2606:4700::6810:f9f9","TCP","86","","","32","","37386  >  443 [ACK] Seq=945 Ack=4117 Win=64128 Len=0 TSval=1819413417 TSecr=4215856902"
"44","7.753820684","2601:5cf:4100:3de0:53f4:479c:be9c:997d","2606:4700::6810:f9f9","HTTP2","142","HEADERS,WINDOW_UPDATE","12,4","32","51","HEADERS[3]: POST /dns-query, WINDOW_UPDATE[3]"
"45","7.753892804","2601:5cf:4100:3de0:53f4:479c:be9c:997d","2606:4700::6810:f9f9","HTTP2","154","DATA","37","32","63","DATA[3]"
"46","7.765359421","2601:5cf:4100:3de0:53f4:479c:be9c:997d","2606:4700::6810:f9f9","DoH","117","DATA","0","32","26","Standard query 0xc913 NS 0000000000.download"
"47","7.797031803","2606:4700::6810:f9f9","2601:5cf:4100:3de0:53f4:479c:be9c:997d","TCP","86","","","32","","443  >  37386 [ACK] Seq=4117 Ack=1001 Win=65536 Len=0 TSval=4215857218 TSecr=1819413416"
"48","7.797032074","2606:4700::6810:f9f9","2601:5cf:4100:3de0:53f4:479c:be9c:997d","HTTP2","121","WINDOW_UPDATE","4","32","30","WINDOW_UPDATE[3]"
"49","7.839969089","2601:5cf:4100:3de0:53f4:479c:be9c:997d","2606:4700::6810:f9f9","TCP","86","","","32","","37386  >  443 [ACK] Seq=1100 Ack=4152 Win=64128 Len=0 TSval=1819413527 TSecr=4215857218"
"50","7.891411368","2606:4700::6810:f9f9","2601:5cf:4100:3de0:53f4:479c:be9c:997d","HTTP2","144","HEADERS","27","32","53","HEADERS[3]: 200 OK"
"51","7.891411759","2606:4700::6810:f9f9","2601:5cf:4100:3de0:53f4:479c:be9c:997d","DoH","213","DATA","96","32","122","Standard query response 0xc913 NS 0000000000.download NS coleman.ns.cloudflare.com NS meera.ns.cloudflare.com"
"52","7.891447589","2601:5cf:4100:3de0:53f4:479c:be9c:997d","2606:4700::6810:f9f9","TCP","86","","","32","","37386  >  443 [ACK] Seq=1100 Ack=4210 Win=64128 Len=0 TSval=1819413578 TSecr=4215857308"
"53","7.891461907","2601:5cf:4100:3de0:53f4:479c:be9c:997d","2606:4700::6810:f9f9","TCP","86","","","32","","37386  >  443 [ACK] Seq=1100 Ack=4337 Win=64128 Len=0 TSval=1819413578 TSecr=4215857308"
"54","7.915864325","2601:5cf:4100:3de0:53f4:479c:be9c:997d","2606:4700::6810:f9f9","HTTP2","142","HEADERS,WINDOW_UPDATE","12,4","32","51","HEADERS[5]: POST /dns-query, WINDOW_UPDATE[5]"
"55","7.916041179","2601:5cf:4100:3de0:53f4:479c:be9c:997d","2606:4700::6810:f9f9","HTTP2","149","DATA","32","32","58","DATA[5]"
"56","7.924938890","2601:5cf:4100:3de0:53f4:479c:be9c:997d","2606:4700::6810:f9f9","DoH","117","DATA","0","32","26","Standard query 0x6395 NS 000webhost.com"
"57","7.993808291","2606:4700::6810:f9f9","2601:5cf:4100:3de0:53f4:479c:be9c:997d","TCP","86","","","32","","443  >  37386 [ACK] Seq=4337 Ack=1219 Win=65536 Len=0 TSval=4215857378 TSecr=1819413602"
"58","7.993808482","2606:4700::6810:f9f9","2601:5cf:4100:3de0:53f4:479c:be9c:997d","HTTP2","121","WINDOW_UPDATE","4","32","30","WINDOW_UPDATE[5]"
"59","8.035971447","2601:5cf:4100:3de0:53f4:479c:be9c:997d","2606:4700::6810:f9f9","TCP","86","","","32","","37386  >  443 [ACK] Seq=1250 Ack=4372 Win=64128 Len=0 TSval=1819413723 TSecr=4215857378"
"60","8.096223083","2606:4700::6810:f9f9","2601:5cf:4100:3de0:53f4:479c:be9c:997d","HTTP2","167","HEADERS","50","32","76","HEADERS[5]: 200 OK"
"61","8.096223343","2606:4700::6810:f9f9","2601:5cf:4100:3de0:53f4:479c:be9c:997d","DoH","203","DATA","86","32","112","Standard query response 0x6395 NS 000webhost.com NS emily.ns.cloudflare.com NS terin.ns.cloudflare.com"
"62","8.096244294","2601:5cf:4100:3de0:53f4:479c:be9c:997d","2606:4700::6810:f9f9","TCP","86","","","32","","37386  >  443 [ACK] Seq=1250 Ack=4453 Win=64128 Len=0 TSval=1819413783 TSecr=4215857457"
"63","8.096254824","2601:5cf:4100:3de0:53f4:479c:be9c:997d","2606:4700::6810:f9f9","TCP","86","","","32","","37386  >  443 [ACK] Seq=1250 Ack=4570 Win=64128 Len=0 TSval=1819413783 TSecr=4215857457"
"64","8.121985091","2601:5cf:4100:3de0:53f4:479c:be9c:997d","2606:4700::6810:f9f9","HTTP2","142","HEADERS,WINDOW_UPDATE","12,4","32","51","HEADERS[7]: POST /dns-query, WINDOW_UPDATE[7]"
"65","8.122077301","2601:5cf:4100:3de0:53f4:479c:be9c:997d","2606:4700::6810:f9f9","HTTP2","152","DATA","35","32","61","DATA[7]"
"66","8.130739323","2601:5cf:4100:3de0:53f4:479c:be9c:997d","2606:4700::6810:f9f9","DoH","117","DATA","0","32","26","Standard query 0xf0c1 NS 000webhostapp.com"
"69","8.198789770","2606:4700::6810:f9f9","2601:5cf:4100:3de0:53f4:479c:be9c:997d","TCP","86","","","32","","443  >  37386 [ACK] Seq=4570 Ack=1372 Win=65536 Len=0 TSval=4215857582 TSecr=1819413809"
"70","8.198789880","2606:4700::6810:f9f9","2601:5cf:4100:3de0:53f4:479c:be9c:997d","HTTP2","121","WINDOW_UPDATE","4","32","30","WINDOW_UPDATE[7]"
"71","8.239969310","2601:5cf:4100:3de0:53f4:479c:be9c:997d","2606:4700::6810:f9f9","TCP","86","","","32","","37386  >  443 [ACK] Seq=1403 Ack=4605 Win=64128 Len=0 TSval=1819413927 TSecr=4215857582"
"72","8.301035022","2606:4700::6810:f9f9","2601:5cf:4100:3de0:53f4:479c:be9c:997d","HTTP2","144","HEADERS","27","32","53","HEADERS[7]: 200 OK"
"73","8.301035272","2606:4700::6810:f9f9","2601:5cf:4100:3de0:53f4:479c:be9c:997d","DoH","201","DATA","84","32","110","Standard query response 0xf0c1 NS 000webhostapp.com NS dns2.000webhost.com NS dns1.000webhost.com"
"74","8.301052876","2601:5cf:4100:3de0:53f4:479c:be9c:997d","2606:4700::6810:f9f9","TCP","86","","","32","","37386  >  443 [ACK] Seq=1403 Ack=4663 Win=64128 Len=0 TSval=1819413988 TSecr=4215857670"
"75","8.301061453","2601:5cf:4100:3de0:53f4:479c:be9c:997d","2606:4700::6810:f9f9","TCP","86","","","32","","37386  >  443 [ACK] Seq=1403 Ack=4778 Win=64128 Len=0 TSval=1819413988 TSecr=4215857670"
"76","8.324296793","2601:5cf:4100:3de0:53f4:479c:be9c:997d","2606:4700::6810:f9f9","HTTP2","142","HEADERS,WINDOW_UPDATE","12,4","32","51","HEADERS[9]: POST /dns-query, WINDOW_UPDATE[9]"
"77","8.324409512","2601:5cf:4100:3de0:53f4:479c:be9c:997d","2606:4700::6810:f9f9","HTTP2","147","DATA","30","32","56","DATA[9]"
"78","8.333910517","2601:5cf:4100:3de0:53f4:479c:be9c:997d","2606:4700::6810:f9f9","DoH","117","DATA","0","32","26","Standard query 0xc995 NS 00117163.xyz"
"79","8.650747685","2606:4700::6810:f9f9","2601:5cf:4100:3de0:53f4:479c:be9c:997d","TCP","86","","","32","","443  >  37386 [ACK] Seq=4778 Ack=1520 Win=65536 Len=0 TSval=4215857785 TSecr=1819414011"
"80","8.650747945","2606:4700::6810:f9f9","2601:5cf:4100:3de0:53f4:479c:be9c:997d","HTTP2","121","WINDOW_UPDATE","4","32","30","WINDOW_UPDATE[9]"
"81","8.650747996","2606:4700::6810:f9f9","2601:5cf:4100:3de0:53f4:479c:be9c:997d","TCP","86","","","32","","443  >  37386 [ACK] Seq=4813 Ack=1551 Win=65536 Len=0 TSval=4215857837 TSecr=1819414020"
"82","8.692199606","2601:5cf:4100:3de0:53f4:479c:be9c:997d","2606:4700::6810:f9f9","TCP","86","","","32","","37386  >  443 [ACK] Seq=1551 Ack=4813 Win=64128 Len=0 TSval=1819414379 TSecr=4215857786"
"83","9.470088548","2606:4700::6810:f9f9","2601:5cf:4100:3de0:53f4:479c:be9c:997d","HTTP2","168","HEADERS","51","32","77","HEADERS[9]: 200 OK"
"84","9.470088999","2606:4700::6810:f9f9","2601:5cf:4100:3de0:53f4:479c:be9c:997d","DoH","294","DATA","177","32","203","Standard query response 0xc995 NS 00117163.xyz NS ns1.huaweicloud-dns.net NS ns1.huaweicloud-dns.org NS ns1.huaweicloud-dns.cn NS ns1.huaweicloud-dns.com"
"85","9.470131411","2601:5cf:4100:3de0:53f4:479c:be9c:997d","2606:4700::6810:f9f9","TCP","86","","","32","","37386  >  443 [ACK] Seq=1551 Ack=4895 Win=64128 Len=0 TSval=1819415157 TSecr=4215858597"
"86","9.470151901","2601:5cf:4100:3de0:53f4:479c:be9c:997d","2606:4700::6810:f9f9","TCP","86","","","32","","37386  >  443 [ACK] Seq=1551 Ack=5103 Win=64128 Len=0 TSval=1819415157 TSecr=4215858597"
"87","9.493370668","2601:5cf:4100:3de0:53f4:479c:be9c:997d","2606:4700::6810:f9f9","HTTP2","142","HEADERS,WINDOW_UPDATE","12,4","32","51","HEADERS[11]: POST /dns-query, WINDOW_UPDATE[11]"
"88","9.493437878","2601:5cf:4100:3de0:53f4:479c:be9c:997d","2606:4700::6810:f9f9","HTTP2","148","DATA","31","32","57","DATA[11]"
"89","9.502123249","2601:5cf:4100:3de0:53f4:479c:be9c:997d","2606:4700::6810:f9f9","DoH","117","DATA","0","32","26","Standard query 0x3e14 NS 001k.exchange"
"90","9.529943264","2606:4700::6810:f9f9","2601:5cf:4100:3de0:53f4:479c:be9c:997d","TCP","86","","","32","","443  >  37386 [ACK] Seq=5103 Ack=1607 Win=65536 Len=0 TSval=4215858954 TSecr=1819415180"
"91","9.529943514","2606:4700::6810:f9f9","2601:5cf:4100:3de0:53f4:479c:be9c:997d","TCP","86","","","32","","443  >  37386 [ACK] Seq=5103 Ack=1669 Win=65536 Len=0 TSval=4215858954 TSecr=1819415180"
"92","9.529943554","2606:4700::6810:f9f9","2601:5cf:4100:3de0:53f4:479c:be9c:997d","HTTP2","121","WINDOW_UPDATE","4","32","30","WINDOW_UPDATE[11]"
"93","9.572041157","2601:5cf:4100:3de0:53f4:479c:be9c:997d","2606:4700::6810:f9f9","TCP","86","","","32","","37386  >  443 [ACK] Seq=1700 Ack=5138 Win=64128 Len=0 TSval=1819415259 TSecr=4215858954"
"94","9.632851183","2606:4700::6810:f9f9","2601:5cf:4100:3de0:53f4:479c:be9c:997d","HTTP2","141","HEADERS","24","32","50","HEADERS[11]: 200 OK"
"95","9.632851644","2606:4700::6810:f9f9","2601:5cf:4100:3de0:53f4:479c:be9c:997d","DoH","203","DATA","86","32","112","Standard query response 0x3e14 NS 001k.exchange NS chin.ns.cloudflare.com NS gabe.ns.cloudflare.com"
"96","9.632893225","2601:5cf:4100:3de0:53f4:479c:be9c:997d","2606:4700::6810:f9f9","TCP","86","","","32","","37386  >  443 [ACK] Seq=1700 Ack=5193 Win=64128 Len=0 TSval=1819415319 TSecr=4215859038"
"97","9.632918865","2601:5cf:4100:3de0:53f4:479c:be9c:997d","2606:4700::6810:f9f9","TCP","86","","","32","","37386  >  443 [ACK] Seq=1700 Ack=5310 Win=64128 Len=0 TSval=1819415319 TSecr=4215859038"
"98","9.656489136","2601:5cf:4100:3de0:53f4:479c:be9c:997d","2606:4700::6810:f9f9","HTTP2","142","HEADERS,WINDOW_UPDATE","12,4","32","51","HEADERS[13]: POST /dns-query, WINDOW_UPDATE[13]"
"99","9.656579632","2601:5cf:4100:3de0:53f4:479c:be9c:997d","2606:4700::6810:f9f9","DoH","172","DATA,DATA","24,0","32","50,26","Standard query 0x5d8e NS 003.cx"
"100","9.777014566","2606:4700::6810:f9f9","2601:5cf:4100:3de0:53f4:479c:be9c:997d","TCP","86","","","32","","443  >  37386 [ACK] Seq=5310 Ack=1842 Win=65536 Len=0 TSval=4215859118 TSecr=1819415343"
"101","10.084220377","2606:4700::6810:f9f9","2601:5cf:4100:3de0:53f4:479c:be9c:997d","HTTP2","144","HEADERS","27","32","53","HEADERS[13]: 200 OK"
"102","10.084220647","2606:4700::6810:f9f9","2601:5cf:4100:3de0:53f4:479c:be9c:997d","DoH","198","DATA","81","32","107","Standard query response 0x5d8e NS 003.cx NS jerome.ns.cloudflare.com NS sima.ns.cloudflare.com"
"103","10.084792461","2601:5cf:4100:3de0:53f4:479c:be9c:997d","2606:4700::6810:f9f9","TCP","86","","","32","","37386  >  443 [ACK] Seq=1842 Ack=5480 Win=64128 Len=0 TSval=1819415771 TSecr=4215859244"
"104","10.106658642","2601:5cf:4100:3de0:53f4:479c:be9c:997d","2606:4700::6810:f9f9","HTTP2","142","HEADERS,WINDOW_UPDATE","12,4","32","51","HEADERS[15]: POST /dns-query, WINDOW_UPDATE[15]"
"105","10.106727897","2601:5cf:4100:3de0:53f4:479c:be9c:997d","2606:4700::6810:f9f9","HTTP2","143","DATA","26","32","52","DATA[15]"
"106","10.115421155","2601:5cf:4100:3de0:53f4:479c:be9c:997d","2606:4700::6810:f9f9","DoH","117","DATA","0","32","26","Standard query 0xf3a0 NS 003ms.ru"
"107","10.144448020","2606:4700::6810:f9f9","2601:5cf:4100:3de0:53f4:479c:be9c:997d","TCP","86","","","32","","443  >  37386 [ACK] Seq=5480 Ack=1955 Win=65536 Len=0 TSval=4215859566 TSecr=1819415793"
"108","10.144448411","2606:4700::6810:f9f9","2601:5cf:4100:3de0:53f4:479c:be9c:997d","HTTP2","121","WINDOW_UPDATE","4","32","30","WINDOW_UPDATE[15]"
"109","10.187961015","2601:5cf:4100:3de0:53f4:479c:be9c:997d","2606:4700::6810:f9f9","TCP","86","","","32","","37386  >  443 [ACK] Seq=1986 Ack=5515 Win=64128 Len=0 TSval=1819415875 TSecr=4215859566"
"110","10.247080942","2606:4700::6810:f9f9","2601:5cf:4100:3de0:53f4:479c:be9c:997d","TCP","86","","","32","","443  >  37386 [ACK] Seq=5515 Ack=1986 Win=65536 Len=0 TSval=4215859660 TSecr=1819415802"
"111","10.698847046","2606:4700::6810:f9f9","2601:5cf:4100:3de0:53f4:479c:be9c:997d","HTTP2","167","HEADERS","50","32","76","HEADERS[15]: 200 OK"
"112","10.698847286","2606:4700::6810:f9f9","2601:5cf:4100:3de0:53f4:479c:be9c:997d","DoH","199","DATA","82","32","108","Standard query response 0xf3a0 NS 003ms.ru NS micah.ns.cloudflare.com NS rose.ns.cloudflare.com"
"113","10.698873868","2601:5cf:4100:3de0:53f4:479c:be9c:997d","2606:4700::6810:f9f9","TCP","86","","","32","","37386  >  443 [ACK] Seq=1986 Ack=5596 Win=64128 Len=0 TSval=1819416385 TSecr=4215859878"
"114","10.698882896","2601:5cf:4100:3de0:53f4:479c:be9c:997d","2606:4700::6810:f9f9","TCP","86","","","32","","37386  >  443 [ACK] Seq=1986 Ack=5709 Win=64128 Len=0 TSval=1819416385 TSecr=4215859878"
"115","10.722667292","2601:5cf:4100:3de0:53f4:479c:be9c:997d","2606:4700::6810:f9f9","HTTP2","142","HEADERS,WINDOW_UPDATE","12,4","32","51","HEADERS[17]: POST /dns-query, WINDOW_UPDATE[17]"
"116","10.722739122","2601:5cf:4100:3de0:53f4:479c:be9c:997d","2606:4700::6810:f9f9","HTTP2","145","DATA","28","32","54","DATA[17]"
"117","10.731430157","2601:5cf:4100:3de0:53f4:479c:be9c:997d","2606:4700::6810:f9f9","DoH","117","DATA","0","32","26","Standard query 0x3c1c NS 004307.com"
"118","10.758864431","2606:4700::6810:f9f9","2601:5cf:4100:3de0:53f4:479c:be9c:997d","TCP","86","","","32","","443  >  37386 [ACK] Seq=5709 Ack=2042 Win=65536 Len=0 TSval=4215860181 TSecr=1819416409"
"119","10.758864872","2606:4700::6810:f9f9","2601:5cf:4100:3de0:53f4:479c:be9c:997d","TCP","86","","","32","","443  >  37386 [ACK] Seq=5709 Ack=2101 Win=65536 Len=0 TSval=4215860181 TSecr=1819416409"
"120","10.758864992","2606:4700::6810:f9f9","2601:5cf:4100:3de0:53f4:479c:be9c:997d","HTTP2","121","WINDOW_UPDATE","4","32","30","WINDOW_UPDATE[17]"
"121","10.800185617","2601:5cf:4100:3de0:53f4:479c:be9c:997d","2606:4700::6810:f9f9","TCP","86","","","32","","37386  >  443 [ACK] Seq=2132 Ack=5744 Win=64128 Len=0 TSval=1819416487 TSecr=4215860182"
"122","10.861798498","2606:4700::6810:f9f9","2601:5cf:4100:3de0:53f4:479c:be9c:997d","HTTP2","141","HEADERS","24","32","50","HEADERS[17]: 200 OK"
"123","10.861798949","2606:4700::6810:f9f9","2601:5cf:4100:3de0:53f4:479c:be9c:997d","DoH","198","DATA","81","32","107","Standard query response 0x3c1c NS 004307.com NS bella.ns.cloudflare.com NS dion.ns.cloudflare.com"
"124","10.861841212","2601:5cf:4100:3de0:53f4:479c:be9c:997d","2606:4700::6810:f9f9","TCP","86","","","32","","37386  >  443 [ACK] Seq=2132 Ack=5799 Win=64128 Len=0 TSval=1819416548 TSecr=4215860230"
"125","10.861866451","2601:5cf:4100:3de0:53f4:479c:be9c:997d","2606:4700::6810:f9f9","TCP","86","","","32","","37386  >  443 [ACK] Seq=2132 Ack=5911 Win=64128 Len=0 TSval=1819416548 TSecr=4215860230"
"126","10.888131348","2601:5cf:4100:3de0:53f4:479c:be9c:997d","2606:4700::6810:f9f9","HTTP2","139","HEADERS,WINDOW_UPDATE","9,4","32","48","HEADERS[19]: POST /dns-query, WINDOW_UPDATE[19]"
"127","10.888213117","2601:5cf:4100:3de0:53f4:479c:be9c:997d","2606:4700::6810:f9f9","HTTP2","148","DATA","31","32","57","DATA[19]"
"128","10.896903400","2601:5cf:4100:3de0:53f4:479c:be9c:997d","2606:4700::6810:f9f9","DoH","117","DATA","0","32","26","Standard query 0xcdf5 NS 004837963.xyz"
"129","10.963827598","2606:4700::6810:f9f9","2601:5cf:4100:3de0:53f4:479c:be9c:997d","TCP","86","","","32","","443  >  37386 [ACK] Seq=5911 Ack=2247 Win=65536 Len=0 TSval=4215860350 TSecr=1819416575"
"130","10.963828058","2606:4700::6810:f9f9","2601:5cf:4100:3de0:53f4:479c:be9c:997d","HTTP2","121","WINDOW_UPDATE","4","32","30","WINDOW_UPDATE[19]"
"131","11.004022505","2601:5cf:4100:3de0:53f4:479c:be9c:997d","2606:4700::6810:f9f9","TCP","86","","","32","","37386  >  443 [ACK] Seq=2278 Ack=5946 Win=64128 Len=0 TSval=1819416691 TSecr=4215860350"
"132","11.066388216","2606:4700::6810:f9f9","2601:5cf:4100:3de0:53f4:479c:be9c:997d","TCP","86","","","32","","443  >  37386 [ACK] Seq=5946 Ack=2278 Win=65536 Len=0 TSval=4215860463 TSecr=1819416583"
"133","12.030223895","2606:4700::6810:f9f9","2601:5cf:4100:3de0:53f4:479c:be9c:997d","HTTP2","168","HEADERS","51","32","77","HEADERS[19]: 200 OK"
"134","12.030224135","2606:4700::6810:f9f9","2601:5cf:4100:3de0:53f4:479c:be9c:997d","DoH","295","DATA","178","32","204","Standard query response 0xcdf5 NS 004837963.xyz NS ns1.huaweicloud-dns.cn NS ns1.huaweicloud-dns.com NS ns1.huaweicloud-dns.net NS ns1.huaweicloud-dns.org"
"135","12.030249424","2601:5cf:4100:3de0:53f4:479c:be9c:997d","2606:4700::6810:f9f9","TCP","86","","","32","","37386  >  443 [ACK] Seq=2278 Ack=6028 Win=64128 Len=0 TSval=1819417717 TSecr=4215861242"
"136","12.030258642","2601:5cf:4100:3de0:53f4:479c:be9c:997d","2606:4700::6810:f9f9","TCP","86","","","32","","37386  >  443 [ACK] Seq=2278 Ack=6237 Win=64128 Len=0 TSval=1819417717 TSecr=4215861242"
"137","12.052934366","2601:5cf:4100:3de0:53f4:479c:be9c:997d","2606:4700::6810:f9f9","HTTP2","139","HEADERS,WINDOW_UPDATE","9,4","32","48","HEADERS[21]: POST /dns-query, WINDOW_UPDATE[21]"
"138","12.053025854","2601:5cf:4100:3de0:53f4:479c:be9c:997d","2606:4700::6810:f9f9","HTTP2","145","DATA","28","32","54","DATA[21]"
"139","12.061663701","2601:5cf:4100:3de0:53f4:479c:be9c:997d","2606:4700::6810:f9f9","DoH","117","DATA","0","32","26","Standard query 0x448e NS 006622.xyz"
"140","12.090552078","2606:4700::6810:f9f9","2601:5cf:4100:3de0:53f4:479c:be9c:997d","TCP","86","","","32","","443  >  37386 [ACK] Seq=6237 Ack=2331 Win=65536 Len=0 TSval=4215861517 TSecr=1819417739"
"141","12.090552318","2606:4700::6810:f9f9","2601:5cf:4100:3de0:53f4:479c:be9c:997d","TCP","86","","","32","","443  >  37386 [ACK] Seq=6237 Ack=2390 Win=65536 Len=0 TSval=4215861518 TSecr=1819417740"
"142","12.092075125","2606:4700::6810:f9f9","2601:5cf:4100:3de0:53f4:479c:be9c:997d","HTTP2","121","WINDOW_UPDATE","4","32","30","WINDOW_UPDATE[21]"
"143","12.136185325","2601:5cf:4100:3de0:53f4:479c:be9c:997d","2606:4700::6810:f9f9","TCP","86","","","32","","37386  >  443 [ACK] Seq=2421 Ack=6272 Win=64128 Len=0 TSval=1819417823 TSecr=4215861518"
"144","12.192844000","2606:4700::6810:f9f9","2601:5cf:4100:3de0:53f4:479c:be9c:997d","HTTP2","164","HEADERS","47","32","73","HEADERS[21]: 200 OK"
"145","12.192844451","2606:4700::6810:f9f9","2601:5cf:4100:3de0:53f4:479c:be9c:997d","DoH","201","DATA","84","32","110","Standard query response 0x448e NS 006622.xyz NS isabel.ns.cloudflare.com NS jay.ns.cloudflare.com"
"146","12.192885662","2601:5cf:4100:3de0:53f4:479c:be9c:997d","2606:4700::6810:f9f9","TCP","86","","","32","","37386  >  443 [ACK] Seq=2421 Ack=6350 Win=64128 Len=0 TSval=1819417879 TSecr=4215861584"
"147","12.192910770","2601:5cf:4100:3de0:53f4:479c:be9c:997d","2606:4700::6810:f9f9","TCP","86","","","32","","37386  >  443 [ACK] Seq=2421 Ack=6465 Win=64128 Len=0 TSval=1819417879 TSecr=4215861584"
"148","12.215424749","2601:5cf:4100:3de0:53f4:479c:be9c:997d","2606:4700::6810:f9f9","HTTP2","142","HEADERS,WINDOW_UPDATE","12,4","32","51","HEADERS[23]: POST /dns-query, WINDOW_UPDATE[23]"
"149","12.215499254","2601:5cf:4100:3de0:53f4:479c:be9c:997d","2606:4700::6810:f9f9","HTTP2","144","DATA","27","32","53","DATA[23]"
"150","12.224237787","2601:5cf:4100:3de0:53f4:479c:be9c:997d","2606:4700::6810:f9f9","DoH","117","DATA","0","32","26","Standard query 0xcdcd NS 00a4g.top"
"151","12.295189074","2606:4700::6810:f9f9","2601:5cf:4100:3de0:53f4:479c:be9c:997d","TCP","86","","","32","","443  >  37386 [ACK] Seq=6465 Ack=2535 Win=65536 Len=0 TSval=4215861681 TSecr=1819417902"
"152","12.295189555","2606:4700::6810:f9f9","2601:5cf:4100:3de0:53f4:479c:be9c:997d","HTTP2","121","WINDOW_UPDATE","4","32","30","WINDOW_UPDATE[23]"
"153","12.336245906","2601:5cf:4100:3de0:53f4:479c:be9c:997d","2606:4700::6810:f9f9","TCP","86","","","32","","37386  >  443 [ACK] Seq=2566 Ack=6500 Win=64128 Len=0 TSval=1819418023 TSecr=4215861682"
"154","12.397610418","2606:4700::6810:f9f9","2601:5cf:4100:3de0:53f4:479c:be9c:997d","HTTP2","141","HEADERS","24","32","50","HEADERS[23]: 200 OK"
"155","12.397610869","2606:4700::6810:f9f9","2601:5cf:4100:3de0:53f4:479c:be9c:997d","DoH","203","DATA","86","32","112","Standard query response 0xcdcd NS 00a4g.top NS oaklyn.ns.cloudflare.com NS yevgen.ns.cloudflare.com"
"156","12.397653392","2601:5cf:4100:3de0:53f4:479c:be9c:997d","2606:4700::6810:f9f9","TCP","86","","","32","","37386  >  443 [ACK] Seq=2566 Ack=6555 Win=64128 Len=0 TSval=1819418084 TSecr=4215861757"
"157","12.397679012","2601:5cf:4100:3de0:53f4:479c:be9c:997d","2606:4700::6810:f9f9","TCP","86","","","32","","37386  >  443 [ACK] Seq=2566 Ack=6672 Win=64128 Len=0 TSval=1819418084 TSecr=4215861757"
"158","12.420626054","2601:5cf:4100:3de0:53f4:479c:be9c:997d","2606:4700::6810:f9f9","HTTP2","139","HEADERS,WINDOW_UPDATE","9,4","32","48","HEADERS[25]: POST /dns-query, WINDOW_UPDATE[25]"
"159","12.420696301","2601:5cf:4100:3de0:53f4:479c:be9c:997d","2606:4700::6810:f9f9","HTTP2","152","DATA","35","32","61","DATA[25]"
"160","12.430028370","2601:5cf:4100:3de0:53f4:479c:be9c:997d","2606:4700::6810:f9f9","DoH","117","DATA","0","32","26","Standard query 0xd00e NS 00b5dxgbkl.online"
"161","12.499735885","2606:4700::6810:f9f9","2601:5cf:4100:3de0:53f4:479c:be9c:997d","TCP","86","","","32","","443  >  37386 [ACK] Seq=6672 Ack=2685 Win=65536 Len=0 TSval=4215861890 TSecr=1819418107"
"162","12.499736176","2606:4700::6810:f9f9","2601:5cf:4100:3de0:53f4:479c:be9c:997d","HTTP2","121","WINDOW_UPDATE","4","32","30","WINDOW_UPDATE[25]"
"163","12.540091251","2601:5cf:4100:3de0:53f4:479c:be9c:997d","2606:4700::6810:f9f9","TCP","86","","","32","","37386  >  443 [ACK] Seq=2716 Ack=6707 Win=64128 Len=0 TSval=1819418227 TSecr=4215861890"
"164","12.602783109","2606:4700::6810:f9f9","2601:5cf:4100:3de0:53f4:479c:be9c:997d","TCP","86","","","32","","443  >  37386 [ACK] Seq=6707 Ack=2716 Win=65536 Len=0 TSval=4215862003 TSecr=1819418117"
"165","12.602783339","2606:4700::6810:f9f9","2601:5cf:4100:3de0:53f4:479c:be9c:997d","HTTP2","144","HEADERS","27","32","53","HEADERS[25]: 200 OK"
"166","12.602783389","2606:4700::6810:f9f9","2601:5cf:4100:3de0:53f4:479c:be9c:997d","DoH","209","DATA","92","32","118","Standard query response 0xd00e NS 00b5dxgbkl.online NS hadlee.ns.cloudflare.com NS sean.ns.cloudflare.com"
"167","12.602815983","2601:5cf:4100:3de0:53f4:479c:be9c:997d","2606:4700::6810:f9f9","TCP","86","","","32","","37386  >  443 [ACK] Seq=2716 Ack=6765 Win=64128 Len=0 TSval=1819418289 TSecr=4215862006"
"168","12.602827696","2601:5cf:4100:3de0:53f4:479c:be9c:997d","2606:4700::6810:f9f9","TCP","86","","","32","","37386  >  443 [ACK] Seq=2716 Ack=6888 Win=64128 Len=0 TSval=1819418289 TSecr=4215862006"
"169","12.627192881","2601:5cf:4100:3de0:53f4:479c:be9c:997d","2606:4700::6810:f9f9","HTTP2","139","HEADERS,WINDOW_UPDATE","9,4","32","48","HEADERS[27]: POST /dns-query, WINDOW_UPDATE[27]"
"170","12.627261194","2601:5cf:4100:3de0:53f4:479c:be9c:997d","2606:4700::6810:f9f9","HTTP2","149","DATA","32","32","58","DATA[27]"
"171","12.635968206","2601:5cf:4100:3de0:53f4:479c:be9c:997d","2606:4700::6810:f9f9","DoH","117","DATA","0","32","26","Standard query 0xbb97 NS 00hgmaq6yv.com"
"172","12.744218014","2606:4700::6810:f9f9","2601:5cf:4100:3de0:53f4:479c:be9c:997d","TCP","86","","","32","","443  >  37386 [ACK] Seq=6888 Ack=2769 Win=65536 Len=0 TSval=4215862086 TSecr=1819418314"
"173","12.744218264","2606:4700::6810:f9f9","2601:5cf:4100:3de0:53f4:479c:be9c:997d","HTTP2","121","WINDOW_UPDATE","4","32","30","WINDOW_UPDATE[27]"
"174","12.744218325","2606:4700::6810:f9f9","2601:5cf:4100:3de0:53f4:479c:be9c:997d","TCP","86","","","32","","443  >  37386 [ACK] Seq=6923 Ack=2863 Win=65536 Len=0 TSval=4215862098 TSecr=1819418314"
"175","12.744218375","2606:4700::6810:f9f9","2601:5cf:4100:3de0:53f4:479c:be9c:997d","HTTP2","144","HEADERS","27","32","53","HEADERS[27]: 200 OK"
"176","12.744218415","2606:4700::6810:f9f9","2601:5cf:4100:3de0:53f4:479c:be9c:997d","DoH","149","DATA","32","32","58","Standard query response 0xbb97 Server failure NS 00hgmaq6yv.com"
"177","12.744895323","2601:5cf:4100:3de0:53f4:479c:be9c:997d","2606:4700::6810:f9f9","TCP","86","","","32","","37386  >  443 [ACK] Seq=2863 Ack=7044 Win=64128 Len=0 TSval=1819418431 TSecr=4215862086"
"178","12.767388902","2601:5cf:4100:3de0:53f4:479c:be9c:997d","2606:4700::6810:f9f9","HTTP2","139","HEADERS,WINDOW_UPDATE","9,4","32","48","HEADERS[29]: POST /dns-query, WINDOW_UPDATE[29]"
"179","12.767465632","2601:5cf:4100:3de0:53f4:479c:be9c:997d","2606:4700::6810:f9f9","HTTP2","143","DATA","26","32","52","DATA[29]"
"180","12.778752700","2601:5cf:4100:3de0:53f4:479c:be9c:997d","2606:4700::6810:f9f9","DoH","117","DATA","0","32","26","Standard query 0x5209 NS 00px.net"
"181","13.016257356","2601:5cf:4100:3de0:53f4:479c:be9c:997d","2606:4700::6810:f9f9","TCP","117","","","32","","[TCP Retransmission] 37386  >  443 [PSH, ACK] Seq=2973 Ack=7044 Win=64128 Len=31 TSval=1819418703 TSecr=4215862086"
"182","13.018106028","2606:4700::6810:f9f9","2601:5cf:4100:3de0:53f4:479c:be9c:997d","TCP","86","","","32","","443  >  37386 [ACK] Seq=7044 Ack=2973 Win=65536 Len=0 TSval=4215862234 TSecr=1819418454"
"183","13.018106479","2606:4700::6810:f9f9","2601:5cf:4100:3de0:53f4:479c:be9c:997d","HTTP2","121","WINDOW_UPDATE","4","32","30","WINDOW_UPDATE[29]"
"184","13.018106599","2606:4700::6810:f9f9","2601:5cf:4100:3de0:53f4:479c:be9c:997d","HTTP2","141","HEADERS","24","32","50","HEADERS[29]: 200 OK"
"185","13.018106709","2606:4700::6810:f9f9","2601:5cf:4100:3de0:53f4:479c:be9c:997d","DoH","213","DATA","96","32","122","Standard query response 0x5209 NS 00px.net NS ns1.digitalocean.com NS ns3.digitalocean.com NS ns2.digitalocean.com"
"186","13.019113360","2601:5cf:4100:3de0:53f4:479c:be9c:997d","2606:4700::6810:f9f9","TCP","86","","","32","","37386  >  443 [ACK] Seq=3004 Ack=7261 Win=64128 Len=0 TSval=1819418706 TSecr=4215862234"
"187","13.041400405","2601:5cf:4100:3de0:53f4:479c:be9c:997d","2606:4700::6810:f9f9","HTTP2","139","HEADERS,WINDOW_UPDATE","9,4","32","48","HEADERS[31]: POST /dns-query, WINDOW_UPDATE[31]"
"188","13.041480601","2601:5cf:4100:3de0:53f4:479c:be9c:997d","2606:4700::6810:f9f9","HTTP2","145","DATA","28","32","54","DATA[31]"
"189","13.050341957","2601:5cf:4100:3de0:53f4:479c:be9c:997d","2606:4700::6810:f9f9","DoH","117","DATA","0","32","26","Standard query 0x8299 NS 00xwin.com"
"190","13.055143703","2606:4700::6810:f9f9","2601:5cf:4100:3de0:53f4:479c:be9c:997d","TCP","98","","","44","","[TCP Dup ACK 184#1] 443  >  37386 [ACK] Seq=7261 Ack=3004 Win=65536 Len=0 TSval=4215862481 TSecr=1819418703 SLE=2973 SRE=3004"
"191","13.079741370","2606:4700::6810:f9f9","2601:5cf:4100:3de0:53f4:479c:be9c:997d","TCP","86","","","32","","443  >  37386 [ACK] Seq=7261 Ack=3057 Win=65536 Len=0 TSval=4215862506 TSecr=1819418728"
"192","13.079741811","2606:4700::6810:f9f9","2601:5cf:4100:3de0:53f4:479c:be9c:997d","TCP","86","","","32","","443  >  37386 [ACK] Seq=7261 Ack=3116 Win=65536 Len=0 TSval=4215862506 TSecr=1819418728"
"193","13.079741941","2606:4700::6810:f9f9","2601:5cf:4100:3de0:53f4:479c:be9c:997d","HTTP2","121","WINDOW_UPDATE","4","32","30","WINDOW_UPDATE[31]"
"194","13.120355403","2601:5cf:4100:3de0:53f4:479c:be9c:997d","2606:4700::6810:f9f9","TCP","86","","","32","","37386  >  443 [ACK] Seq=3147 Ack=7296 Win=64128 Len=0 TSval=1819418807 TSecr=4215862506"
"195","13.216597664","2606:4700::6810:f9f9","2601:5cf:4100:3de0:53f4:479c:be9c:997d","HTTP2","167","HEADERS","50","32","76","HEADERS[31]: 200 OK"
"196","13.216598115","2606:4700::6810:f9f9","2601:5cf:4100:3de0:53f4:479c:be9c:997d","DoH","197","DATA","80","32","106","Standard query response 0x8299 NS 00xwin.com NS evan.ns.cloudflare.com NS kami.ns.cloudflare.com"
"197","13.216639626","2601:5cf:4100:3de0:53f4:479c:be9c:997d","2606:4700::6810:f9f9","TCP","86","","","32","","37386  >  443 [ACK] Seq=3147 Ack=7377 Win=64128 Len=0 TSval=1819418903 TSecr=4215862544"
"198","13.216664044","2601:5cf:4100:3de0:53f4:479c:be9c:997d","2606:4700::6810:f9f9","TCP","86","","","32","","37386  >  443 [ACK] Seq=3147 Ack=7488 Win=64128 Len=0 TSval=1819418903 TSecr=4215862544"
"199","13.240477623","2601:5cf:4100:3de0:53f4:479c:be9c:997d","2606:4700::6810:f9f9","HTTP2","139","HEADERS,WINDOW_UPDATE","9,4","32","48","HEADERS[33]: POST /dns-query, WINDOW_UPDATE[33]"
"200","13.240543501","2601:5cf:4100:3de0:53f4:479c:be9c:997d","2606:4700::6810:f9f9","HTTP2","145","DATA","28","32","54","DATA[33]"
"201","13.249197042","2601:5cf:4100:3de0:53f4:479c:be9c:997d","2606:4700::6810:f9f9","DoH","117","DATA","0","32","26","Standard query 0x80c9 NS 0101.co.jp"
"202","13.319331934","2606:4700::6810:f9f9","2601:5cf:4100:3de0:53f4:479c:be9c:997d","TCP","86","","","32","","443  >  37386 [ACK] Seq=7488 Ack=3259 Win=65536 Len=0 TSval=4215862702 TSecr=1819418927"
"203","13.319332385","2606:4700::6810:f9f9","2601:5cf:4100:3de0:53f4:479c:be9c:997d","HTTP2","121","WINDOW_UPDATE","4","32","30","WINDOW_UPDATE[33]"
"204","13.359995224","2601:5cf:4100:3de0:53f4:479c:be9c:997d","2606:4700::6810:f9f9","TCP","86","","","32","","37386  >  443 [ACK] Seq=3290 Ack=7523 Win=64128 Len=0 TSval=1819419047 TSecr=4215862702"
"205","13.668588045","2606:4700::6810:f9f9","2601:5cf:4100:3de0:53f4:479c:be9c:997d","TCP","86","","","32","","443  >  37386 [ACK] Seq=7523 Ack=3290 Win=65536 Len=0 TSval=4215862823 TSecr=1819418936"
"206","14.283416911","2606:4700::6810:f9f9","2601:5cf:4100:3de0:53f4:479c:be9c:997d","HTTP2","167","HEADERS","50","32","76","HEADERS[33]: 200 OK"
"207","14.283417362","2606:4700::6810:f9f9","2601:5cf:4100:3de0:53f4:479c:be9c:997d","DoH","278","DATA","161","32","187","Standard query response 0x80c9 NS 0101.co.jp NS a3-64.akam.net NS a26-64.akam.net NS a13-64.akam.net NS a28-66.akam.net NS a1-129.akam.net NS a14-66.akam.net"
"208","14.283461858","2601:5cf:4100:3de0:53f4:479c:be9c:997d","2606:4700::6810:f9f9","TCP","86","","","32","","37386  >  443 [ACK] Seq=3290 Ack=7604 Win=64128 Len=0 TSval=1819419970 TSecr=4215863420"
"209","14.283482308","2601:5cf:4100:3de0:53f4:479c:be9c:997d","2606:4700::6810:f9f9","TCP","86","","","32","","37386  >  443 [ACK] Seq=3290 Ack=7796 Win=64128 Len=0 TSval=1819419970 TSecr=4215863420"
"210","14.307626720","2601:5cf:4100:3de0:53f4:479c:be9c:997d","2606:4700::6810:f9f9","HTTP2","142","HEADERS,WINDOW_UPDATE","12,4","32","51","HEADERS[35]: POST /dns-query, WINDOW_UPDATE[35]"
"211","14.307706085","2601:5cf:4100:3de0:53f4:479c:be9c:997d","2606:4700::6810:f9f9","HTTP2","146","DATA","29","32","55","DATA[35]"
"212","14.316432511","2601:5cf:4100:3de0:53f4:479c:be9c:997d","2606:4700::6810:f9f9","DoH","117","DATA","0","32","26","Standard query 0xcf33 NS 0109480.xyz"
"213","14.343327974","2606:4700::6810:f9f9","2601:5cf:4100:3de0:53f4:479c:be9c:997d","TCP","86","","","32","","443  >  37386 [ACK] Seq=7796 Ack=3346 Win=65536 Len=0 TSval=4215863766 TSecr=1819419994"
"214","14.343328455","2606:4700::6810:f9f9","2601:5cf:4100:3de0:53f4:479c:be9c:997d","HTTP2","121","WINDOW_UPDATE","4","32","30","WINDOW_UPDATE[35]"
"215","14.384171780","2601:5cf:4100:3de0:53f4:479c:be9c:997d","2606:4700::6810:f9f9","TCP","86","","","32","","37386  >  443 [ACK] Seq=3437 Ack=7831 Win=64128 Len=0 TSval=1819420071 TSecr=4215863766"
"216","14.445752157","2606:4700::6810:f9f9","2601:5cf:4100:3de0:53f4:479c:be9c:997d","TCP","86","","","32","","443  >  37386 [ACK] Seq=7831 Ack=3437 Win=65536 Len=0 TSval=4215863802 TSecr=1819419994"
"217","14.445752608","2606:4700::6810:f9f9","2601:5cf:4100:3de0:53f4:479c:be9c:997d","HTTP2","144","HEADERS","27","32","53","HEADERS[35]: 200 OK"
"218","14.445752728","2606:4700::6810:f9f9","2601:5cf:4100:3de0:53f4:479c:be9c:997d","DoH","200","DATA","83","32","109","Standard query response 0xcf33 NS 0109480.xyz NS dora.ns.cloudflare.com NS sam.ns.cloudflare.com"
"219","14.445808336","2601:5cf:4100:3de0:53f4:479c:be9c:997d","2606:4700::6810:f9f9","TCP","86","","","32","","37386  >  443 [ACK] Seq=3437 Ack=7889 Win=64128 Len=0 TSval=1819420132 TSecr=4215863830"
"220","14.445828295","2601:5cf:4100:3de0:53f4:479c:be9c:997d","2606:4700::6810:f9f9","TCP","86","","","32","","37386  >  443 [ACK] Seq=3437 Ack=8003 Win=64128 Len=0 TSval=1819420132 TSecr=4215863830"
"221","14.470167166","2601:5cf:4100:3de0:53f4:479c:be9c:997d","2606:4700::6810:f9f9","HTTP2","142","HEADERS,WINDOW_UPDATE","12,4","32","51","HEADERS[37]: POST /dns-query, WINDOW_UPDATE[37]"
"222","14.470291328","2601:5cf:4100:3de0:53f4:479c:be9c:997d","2606:4700::6810:f9f9","DoH","173","DATA,DATA","25,0","32","51,26","Standard query 0x33f9 NS 011.com"
"223","14.590368924","2606:4700::6810:f9f9","2601:5cf:4100:3de0:53f4:479c:be9c:997d","TCP","86","","","32","","443  >  37386 [ACK] Seq=8003 Ack=3580 Win=65536 Len=0 TSval=4215863929 TSecr=1819420157"
"224","15.102565917","2606:4700::6810:f9f9","2601:5cf:4100:3de0:53f4:479c:be9c:997d","HTTP2","167","HEADERS","50","32","76","HEADERS[37]: 200 OK"
"225","15.102566157","2606:4700::6810:f9f9","2601:5cf:4100:3de0:53f4:479c:be9c:997d","DoH","188","DATA","71","32","97","Standard query response 0x33f9 NS 011.com NS fog.dnspod.net NS len.dnspod.net"
"226","15.103172248","2601:5cf:4100:3de0:53f4:479c:be9c:997d","2606:4700::6810:f9f9","TCP","86","","","32","","37386  >  443 [ACK] Seq=3580 Ack=8186 Win=64128 Len=0 TSval=1819420790 TSecr=4215864460"
"227","15.125972168","2601:5cf:4100:3de0:53f4:479c:be9c:997d","2606:4700::6810:f9f9","HTTP2","139","HEADERS,WINDOW_UPDATE","9,4","32","48","HEADERS[39]: POST /dns-query, WINDOW_UPDATE[39]"
"228","15.126040251","2601:5cf:4100:3de0:53f4:479c:be9c:997d","2606:4700::6810:f9f9","HTTP2","144","DATA","27","32","53","DATA[39]"
"229","15.135422028","2601:5cf:4100:3de0:53f4:479c:be9c:997d","2606:4700::6810:f9f9","DoH","117","DATA","0","32","26","Standard query 0xe092 NS 011st.com"
"230","15.162905026","2606:4700::6810:f9f9","2601:5cf:4100:3de0:53f4:479c:be9c:997d","TCP","86","","","32","","443  >  37386 [ACK] Seq=8186 Ack=3691 Win=65536 Len=0 TSval=4215864590 TSecr=1819420813"
"231","15.162905477","2606:4700::6810:f9f9","2601:5cf:4100:3de0:53f4:479c:be9c:997d","HTTP2","121","WINDOW_UPDATE","4","32","30","WINDOW_UPDATE[39]"
"232","15.204114499","2601:5cf:4100:3de0:53f4:479c:be9c:997d","2606:4700::6810:f9f9","TCP","86","","","32","","37386  >  443 [ACK] Seq=3722 Ack=8221 Win=64128 Len=0 TSval=1819420891 TSecr=4215864590"
"233","15.264746207","2606:4700::6810:f9f9","2601:5cf:4100:3de0:53f4:479c:be9c:997d","HTTP2","145","HEADERS","28","32","54","HEADERS[39]: 200 OK"
"234","15.264746658","2606:4700::6810:f9f9","2601:5cf:4100:3de0:53f4:479c:be9c:997d","DoH","281","DATA","164","32","190","Standard query response 0xe092 NS 011st.com NS ns-1216.awsdns-24.org NS ns-1732.awsdns-24.co.uk NS ns-488.awsdns-61.com NS ns-583.awsdns-08.net"
"235","15.264788750","2601:5cf:4100:3de0:53f4:479c:be9c:997d","2606:4700::6810:f9f9","TCP","86","","","32","","37386  >  443 [ACK] Seq=3722 Ack=8280 Win=64128 Len=0 TSval=1819420951 TSecr=4215864626"
"236","15.264813338","2601:5cf:4100:3de0:53f4:479c:be9c:997d","2606:4700::6810:f9f9","TCP","86","","","32","","37386  >  443 [ACK] Seq=3722 Ack=8475 Win=64128 Len=0 TSval=1819420951 TSecr=4215864626"
"237","15.267146966","2601:5cf:4100:3de0:53f4:479c:be9c:997d","2606:4700::6810:f9f9","TCP","86","","","32","","37386  >  443 [FIN, ACK] Seq=3722 Ack=8475 Win=64128 Len=0 TSval=1819420954 TSecr=4215864626"
"238","15.409930831","2606:4700::6810:f9f9","2601:5cf:4100:3de0:53f4:479c:be9c:997d","TCP","86","","","32","","443  >  37386 [FIN, ACK] Seq=8475 Ack=3723 Win=65536 Len=0 TSval=4215864742 TSecr=1819420954"
"239","15.409976561","2601:5cf:4100:3de0:53f4:479c:be9c:997d","2606:4700::6810:f9f9","TCP","86","","","32","","37386  >  443 [ACK] Seq=3723 Ack=8476 Win=64128 Len=0 TSval=1819421097 TSecr=4215864742"
