"No.","Time","Source","Destination","Protocol","Length","Info"
"35","1.846684665","2601:5cf:4100:3de0:71ad:d37e:96b9:4fe2","2001:4860:4860::8844","TCP","94","35854  >  443 [SYN] Seq=0 Win=64800 Len=0 MSS=1440 SACK_PERM TSval=4010463742 TSecr=0 WS=128"
"36","1.870009675","2001:4860:4860::8844","2601:5cf:4100:3de0:71ad:d37e:96b9:4fe2","TCP","94","443  >  35854 [SYN, ACK] Seq=0 Ack=1 Win=65535 Len=0 MSS=1440 SACK_PERM TSval=3432402772 TSecr=4010463742 WS=256"
"37","1.870043818","2601:5cf:4100:3de0:71ad:d37e:96b9:4fe2","2001:4860:4860::8844","TCP","86","35854  >  443 [ACK] Seq=1 Ack=1 Win=64896 Len=0 TSval=4010463765 TSecr=3432402772"
"38","1.870561590","2601:5cf:4100:3de0:71ad:d37e:96b9:4fe2","2001:4860:4860::8844","TLSv1.3","603","Client Hello (SNI=dns.google)"
"39","1.946531615","2001:4860:4860::8844","2601:5cf:4100:3de0:71ad:d37e:96b9:4fe2","TCP","86","443  >  35854 [ACK] Seq=1 Ack=518 Win=66816 Len=0 TSval=3432402804 TSecr=4010463766"
"40","1.946532046","2001:4860:4860::8844","2601:5cf:4100:3de0:71ad:d37e:96b9:4fe2","TLSv1.3","2502","Server Hello, Change Cipher Spec"
"41","1.946532146","2001:4860:4860::8844","2601:5cf:4100:3de0:71ad:d37e:96b9:4fe2","TLSv1.3","2117","Application Data"
"42","1.946587778","2601:5cf:4100:3de0:71ad:d37e:96b9:4fe2","2001:4860:4860::8844","TCP","86","35854  >  443 [ACK] Seq=518 Ack=2417 Win=62592 Len=0 TSval=4010463842 TSecr=3432402805"
"43","1.946610300","2601:5cf:4100:3de0:71ad:d37e:96b9:4fe2","2001:4860:4860::8844","TCP","86","35854  >  443 [ACK] Seq=518 Ack=4448 Win=60672 Len=0 TSval=4010463842 TSecr=3432402805"
"44","1.948110089","2601:5cf:4100:3de0:71ad:d37e:96b9:4fe2","2001:4860:4860::8844","TLSv1.3","166","Change Cipher Spec, Application Data"
"45","1.953739676","2001:4860:4860::8844","2601:5cf:4100:3de0:71ad:d37e:96b9:4fe2","TCP","909","[TCP Spurious Retransmission] 443  >  35854 [PSH, ACK] Seq=3625 Ack=518 Win=66816 Len=823 TSval=3432402855 TSecr=4010463766 [TCP segment of a reassembled PDU]"
"46","1.953778808","2601:5cf:4100:3de0:71ad:d37e:96b9:4fe2","2001:4860:4860::8844","TCP","98","[TCP Dup ACK 43#1] 35854  >  443 [ACK] Seq=598 Ack=4448 Win=64128 Len=0 TSval=4010463849 TSecr=3432402855 SLE=3625 SRE=4448"
"47","2.048963280","2001:4860:4860::8844","2601:5cf:4100:3de0:71ad:d37e:96b9:4fe2","TLSv1.3","734","Application Data, Application Data"
"48","2.048989408","2601:5cf:4100:3de0:71ad:d37e:96b9:4fe2","2001:4860:4860::8844","TLSv1.3","396","Application Data, Application Data, Application Data, Application Data"
"49","2.071588281","2001:4860:4860::8844","2601:5cf:4100:3de0:71ad:d37e:96b9:4fe2","TLSv1.3","117","Application Data"
"50","2.071638013","2601:5cf:4100:3de0:71ad:d37e:96b9:4fe2","2001:4860:4860::8844","TLSv1.3","117","Application Data"
"51","2.073741993","2001:4860:4860::8844","2601:5cf:4100:3de0:71ad:d37e:96b9:4fe2","TLSv1.3","368","Application Data"
"52","2.073742424","2001:4860:4860::8844","2601:5cf:4100:3de0:71ad:d37e:96b9:4fe2","TLSv1.3","195","Application Data"
"53","2.073742534","2001:4860:4860::8844","2601:5cf:4100:3de0:71ad:d37e:96b9:4fe2","TLSv1.3","117","Application Data"
"54","2.073742634","2001:4860:4860::8844","2601:5cf:4100:3de0:71ad:d37e:96b9:4fe2","TLSv1.3","125","Application Data"
"55","2.075366051","2601:5cf:4100:3de0:71ad:d37e:96b9:4fe2","2001:4860:4860::8844","TCP","86","35854  >  443 [RST, ACK] Seq=939 Ack=5588 Win=64128 Len=0 TSval=4010463971 TSecr=3432402977"
"56","2.102336105","2601:5cf:4100:3de0:71ad:d37e:96b9:4fe2","2001:4860:4860::8844","TCP","94","35858  >  443 [SYN] Seq=0 Win=64800 Len=0 MSS=1440 SACK_PERM TSval=4010463998 TSecr=0 WS=128"
"57","2.150312483","2001:4860:4860::8844","2601:5cf:4100:3de0:71ad:d37e:96b9:4fe2","TCP","86","443  >  35854 [ACK] Seq=5588 Ack=939 Win=67840 Len=0 TSval=3432403000 TSecr=4010463967"
"58","2.150352507","2601:5cf:4100:3de0:71ad:d37e:96b9:4fe2","2001:4860:4860::8844","TCP","74","35854  >  443 [RST] Seq=939 Win=0 Len=0"
"59","2.172878096","2001:4860:4860::8844","2601:5cf:4100:3de0:71ad:d37e:96b9:4fe2","TCP","94","443  >  35858 [SYN, ACK] Seq=0 Ack=1 Win=65535 Len=0 MSS=1440 SACK_PERM TSval=4198631479 TSecr=4010463998 WS=256"
"60","2.172935442","2601:5cf:4100:3de0:71ad:d37e:96b9:4fe2","2001:4860:4860::8844","TCP","86","35858  >  443 [ACK] Seq=1 Ack=1 Win=64896 Len=0 TSval=4010464068 TSecr=4198631479"
"61","2.173429541","2601:5cf:4100:3de0:71ad:d37e:96b9:4fe2","2001:4860:4860::8844","TLSv1.3","603","Client Hello (SNI=dns.google)"
"62","2.252693635","2001:4860:4860::8844","2601:5cf:4100:3de0:71ad:d37e:96b9:4fe2","TCP","86","443  >  35858 [ACK] Seq=1 Ack=518 Win=66816 Len=0 TSval=4198631503 TSecr=4010464069"
"63","2.252694126","2001:4860:4860::8844","2601:5cf:4100:3de0:71ad:d37e:96b9:4fe2","TLSv1.3","2502","Server Hello, Change Cipher Spec"
"64","2.252694226","2001:4860:4860::8844","2601:5cf:4100:3de0:71ad:d37e:96b9:4fe2","TLSv1.3","2118","Application Data"
"65","2.252694327","2001:4860:4860::8844","2601:5cf:4100:3de0:71ad:d37e:96b9:4fe2","TCP","910","[TCP Retransmission] 443  >  35858 [PSH, ACK] Seq=3625 Ack=518 Win=66816 Len=824 TSval=4198631557 TSecr=4010464069 [TCP segment of a reassembled PDU]"
"66","2.252761160","2601:5cf:4100:3de0:71ad:d37e:96b9:4fe2","2001:4860:4860::8844","TCP","86","35858  >  443 [ACK] Seq=518 Ack=2417 Win=62592 Len=0 TSval=4010464148 TSecr=4198631504"
"67","2.252782629","2601:5cf:4100:3de0:71ad:d37e:96b9:4fe2","2001:4860:4860::8844","TCP","86","35858  >  443 [ACK] Seq=518 Ack=4449 Win=60672 Len=0 TSval=4010464148 TSecr=4198631504"
"68","2.252792738","2601:5cf:4100:3de0:71ad:d37e:96b9:4fe2","2001:4860:4860::8844","TCP","98","[TCP Dup ACK 67#1] 35858  >  443 [ACK] Seq=518 Ack=4449 Win=60672 Len=0 TSval=4010464148 TSecr=4198631557 SLE=3625 SRE=4449"
"69","2.254192242","2601:5cf:4100:3de0:71ad:d37e:96b9:4fe2","2001:4860:4860::8844","TLSv1.3","166","Change Cipher Spec, Application Data"
"70","2.276076902","2001:4860:4860::8844","2601:5cf:4100:3de0:71ad:d37e:96b9:4fe2","TLSv1.3","734","Application Data, Application Data"
"71","2.276122015","2601:5cf:4100:3de0:71ad:d37e:96b9:4fe2","2001:4860:4860::8844","TLSv1.3","411","Application Data, Application Data, Application Data, Application Data"
"72","2.297105456","2001:4860:4860::8844","2601:5cf:4100:3de0:71ad:d37e:96b9:4fe2","TLSv1.3","117","Application Data"
"73","2.297157482","2601:5cf:4100:3de0:71ad:d37e:96b9:4fe2","2001:4860:4860::8844","TLSv1.3","117","Application Data"
"74","2.298620112","2001:4860:4860::8844","2601:5cf:4100:3de0:71ad:d37e:96b9:4fe2","TLSv1.3","368","Application Data"
"75","2.298620353","2001:4860:4860::8844","2601:5cf:4100:3de0:71ad:d37e:96b9:4fe2","TLSv1.3","213","Application Data"
"76","2.298620393","2001:4860:4860::8844","2601:5cf:4100:3de0:71ad:d37e:96b9:4fe2","TLSv1.3","117","Application Data"
"77","2.298620423","2001:4860:4860::8844","2601:5cf:4100:3de0:71ad:d37e:96b9:4fe2","TLSv1.3","125","Application Data"
"78","2.299594415","2601:5cf:4100:3de0:71ad:d37e:96b9:4fe2","2001:4860:4860::8844","TCP","86","35858  >  443 [RST, ACK] Seq=954 Ack=5607 Win=64128 Len=0 TSval=4010464195 TSecr=4198631606"
"79","2.323557438","2001:4860:4860::8844","2601:5cf:4100:3de0:71ad:d37e:96b9:4fe2","TCP","86","443  >  35858 [ACK] Seq=5607 Ack=954 Win=67840 Len=0 TSval=4198631631 TSecr=4010464192"
"80","2.323587202","2601:5cf:4100:3de0:71ad:d37e:96b9:4fe2","2001:4860:4860::8844","TCP","74","35858  >  443 [RST] Seq=954 Win=0 Len=0"
"100","2.639181208","2601:5cf:4100:3de0:71ad:d37e:96b9:4fe2","2001:4860:4860::8844","TCP","94","35864  >  443 [SYN] Seq=0 Win=64800 Len=0 MSS=1440 SACK_PERM TSval=4010464535 TSecr=0 WS=128"
"106","2.765562165","2001:4860:4860::8844","2601:5cf:4100:3de0:71ad:d37e:96b9:4fe2","TCP","94","443  >  35864 [SYN, ACK] Seq=0 Ack=1 Win=65535 Len=0 MSS=1440 SACK_PERM TSval=600830872 TSecr=4010464535 WS=256"
"108","2.765617968","2601:5cf:4100:3de0:71ad:d37e:96b9:4fe2","2001:4860:4860::8844","TCP","86","35864  >  443 [ACK] Seq=1 Ack=1 Win=64896 Len=0 TSval=4010464661 TSecr=600830872"
"112","2.765985574","2601:5cf:4100:3de0:71ad:d37e:96b9:4fe2","2001:4860:4860::8844","TLSv1.3","603","Client Hello (SNI=dns.google)"
"116","2.867908224","2001:4860:4860::8844","2601:5cf:4100:3de0:71ad:d37e:96b9:4fe2","TCP","86","443  >  35864 [ACK] Seq=1 Ack=518 Win=66816 Len=0 TSval=600830972 TSecr=4010464661"
"117","2.867908255","2001:4860:4860::8844","2601:5cf:4100:3de0:71ad:d37e:96b9:4fe2","TLSv1.3","2502","Server Hello, Change Cipher Spec"
"118","2.867908295","2001:4860:4860::8844","2601:5cf:4100:3de0:71ad:d37e:96b9:4fe2","TLSv1.3","2116","Application Data"
"119","2.867964648","2601:5cf:4100:3de0:71ad:d37e:96b9:4fe2","2001:4860:4860::8844","TCP","86","35864  >  443 [ACK] Seq=518 Ack=2417 Win=62592 Len=0 TSval=4010464763 TSecr=600830973"
"120","2.867975608","2601:5cf:4100:3de0:71ad:d37e:96b9:4fe2","2001:4860:4860::8844","TCP","86","35864  >  443 [ACK] Seq=518 Ack=4447 Win=60672 Len=0 TSval=4010464763 TSecr=600830973"
"122","2.869578417","2601:5cf:4100:3de0:71ad:d37e:96b9:4fe2","2001:4860:4860::8844","TLSv1.3","166","Change Cipher Spec, Application Data"
"123","2.893427212","2001:4860:4860::8844","2601:5cf:4100:3de0:71ad:d37e:96b9:4fe2","TLSv1.3","734","Application Data, Application Data"
"124","2.893471664","2601:5cf:4100:3de0:71ad:d37e:96b9:4fe2","2001:4860:4860::8844","TLSv1.3","409","Application Data, Application Data, Application Data, Application Data"
"125","2.915840467","2001:4860:4860::8844","2601:5cf:4100:3de0:71ad:d37e:96b9:4fe2","TLSv1.3","117","Application Data"
"126","2.915892052","2601:5cf:4100:3de0:71ad:d37e:96b9:4fe2","2001:4860:4860::8844","TLSv1.3","117","Application Data"
"127","2.917994439","2001:4860:4860::8844","2601:5cf:4100:3de0:71ad:d37e:96b9:4fe2","TLSv1.3","367","Application Data"
"128","2.917994670","2001:4860:4860::8844","2601:5cf:4100:3de0:71ad:d37e:96b9:4fe2","TLSv1.3","201","Application Data"
"129","2.917994700","2001:4860:4860::8844","2601:5cf:4100:3de0:71ad:d37e:96b9:4fe2","TLSv1.3","117","Application Data"
"130","2.917994740","2001:4860:4860::8844","2601:5cf:4100:3de0:71ad:d37e:96b9:4fe2","TLSv1.3","125","Application Data"
"131","2.919436042","2601:5cf:4100:3de0:71ad:d37e:96b9:4fe2","2001:4860:4860::8844","TCP","86","35864  >  443 [RST, ACK] Seq=952 Ack=5592 Win=64128 Len=0 TSval=4010464815 TSecr=600831090"
"161","3.158336644","2601:5cf:4100:3de0:71ad:d37e:96b9:4fe2","2001:4860:4860::8844","TCP","94","35870  >  443 [SYN] Seq=0 Win=64800 Len=0 MSS=1440 SACK_PERM TSval=4010465054 TSecr=0 WS=128"
"170","3.197069022","2001:4860:4860::8844","2601:5cf:4100:3de0:71ad:d37e:96b9:4fe2","TCP","94","443  >  35870 [SYN, ACK] Seq=0 Ack=1 Win=65535 Len=0 MSS=1440 SACK_PERM TSval=789184672 TSecr=4010465054 WS=256"
"171","3.197095550","2601:5cf:4100:3de0:71ad:d37e:96b9:4fe2","2001:4860:4860::8844","TCP","86","35870  >  443 [ACK] Seq=1 Ack=1 Win=64896 Len=0 TSval=4010465092 TSecr=789184672"
"172","3.197922832","2601:5cf:4100:3de0:71ad:d37e:96b9:4fe2","2001:4860:4860::8844","TLSv1.3","603","Client Hello (SNI=dns.google)"
"173","3.277454640","2001:4860:4860::8844","2601:5cf:4100:3de0:71ad:d37e:96b9:4fe2","TCP","86","443  >  35870 [ACK] Seq=1 Ack=518 Win=66816 Len=0 TSval=789184707 TSecr=4010465093"
"174","3.277454870","2001:4860:4860::8844","2601:5cf:4100:3de0:71ad:d37e:96b9:4fe2","TLSv1.3","2502","Server Hello, Change Cipher Spec"
"175","3.277454910","2001:4860:4860::8844","2601:5cf:4100:3de0:71ad:d37e:96b9:4fe2","TLSv1.3","2117","Application Data"
"177","3.277498560","2601:5cf:4100:3de0:71ad:d37e:96b9:4fe2","2001:4860:4860::8844","TCP","86","35870  >  443 [ACK] Seq=518 Ack=2417 Win=62592 Len=0 TSval=4010465173 TSecr=789184708"
"178","3.277508439","2601:5cf:4100:3de0:71ad:d37e:96b9:4fe2","2001:4860:4860::8844","TCP","86","35870  >  443 [ACK] Seq=518 Ack=4448 Win=60672 Len=0 TSval=4010465173 TSecr=789184708"
"183","3.278731479","2601:5cf:4100:3de0:71ad:d37e:96b9:4fe2","2001:4860:4860::8844","TLSv1.3","166","Change Cipher Spec, Application Data"
"184","3.284800494","2001:4860:4860::8844","2601:5cf:4100:3de0:71ad:d37e:96b9:4fe2","TCP","909","[TCP Spurious Retransmission] 443  >  35870 [PSH, ACK] Seq=3625 Ack=518 Win=66816 Len=823 TSval=789184759 TSecr=4010465093 [TCP segment of a reassembled PDU]"
"185","3.284839686","2601:5cf:4100:3de0:71ad:d37e:96b9:4fe2","2001:4860:4860::8844","TCP","98","[TCP Dup ACK 178#1] 35870  >  443 [ACK] Seq=598 Ack=4448 Win=64128 Len=0 TSval=4010465180 TSecr=789184759 SLE=3625 SRE=4448"
"186","3.303626639","2001:4860:4860::8844","2601:5cf:4100:3de0:71ad:d37e:96b9:4fe2","TLSv1.3","734","Application Data, Application Data"
"187","3.303671301","2601:5cf:4100:3de0:71ad:d37e:96b9:4fe2","2001:4860:4860::8844","TLSv1.3","405","Application Data, Application Data, Application Data, Application Data"
"188","3.380044146","2001:4860:4860::8844","2601:5cf:4100:3de0:71ad:d37e:96b9:4fe2","TLSv1.3","117","Application Data"
"189","3.380044587","2001:4860:4860::8844","2601:5cf:4100:3de0:71ad:d37e:96b9:4fe2","TLSv1.3","368","Application Data"
"190","3.380044687","2001:4860:4860::8844","2601:5cf:4100:3de0:71ad:d37e:96b9:4fe2","TLSv1.3","203","Application Data"
"191","3.380044787","2001:4860:4860::8844","2601:5cf:4100:3de0:71ad:d37e:96b9:4fe2","TLSv1.3","117","Application Data"
"192","3.380044888","2001:4860:4860::8844","2601:5cf:4100:3de0:71ad:d37e:96b9:4fe2","TLSv1.3","125","Application Data"
"194","3.380124354","2601:5cf:4100:3de0:71ad:d37e:96b9:4fe2","2001:4860:4860::8844","TLSv1.3","117","Application Data"
"195","3.381629984","2601:5cf:4100:3de0:71ad:d37e:96b9:4fe2","2001:4860:4860::8844","TCP","86","35870  >  443 [RST, ACK] Seq=948 Ack=5596 Win=64128 Len=0 TSval=4010465277 TSecr=789184802"
"197","3.401691151","2001:4860:4860::8844","2601:5cf:4100:3de0:71ad:d37e:96b9:4fe2","TCP","125","[TCP Spurious Retransmission] 443  >  35870 [PSH, ACK] Seq=5557 Ack=917 Win=67840 Len=39 TSval=789184878 TSecr=4010465199"
"198","3.401719894","2601:5cf:4100:3de0:71ad:d37e:96b9:4fe2","2001:4860:4860::8844","TCP","74","35870  >  443 [RST] Seq=917 Win=0 Len=0"
"199","3.404358248","2601:5cf:4100:3de0:71ad:d37e:96b9:4fe2","2001:4860:4860::8844","TCP","94","35878  >  443 [SYN] Seq=0 Win=64800 Len=0 MSS=1440 SACK_PERM TSval=4010465300 TSecr=0 WS=128"
"200","3.408073853","2001:4860:4860::8844","2601:5cf:4100:3de0:71ad:d37e:96b9:4fe2","TCP","86","443  >  35870 [ACK] Seq=5596 Ack=948 Win=67840 Len=0 TSval=789184884 TSecr=4010465275"
"201","3.408093670","2601:5cf:4100:3de0:71ad:d37e:96b9:4fe2","2001:4860:4860::8844","TCP","74","35870  >  443 [RST] Seq=948 Win=0 Len=0"
"204","3.482275846","2001:4860:4860::8844","2601:5cf:4100:3de0:71ad:d37e:96b9:4fe2","TCP","94","443  >  35878 [SYN, ACK] Seq=0 Ack=1 Win=65535 Len=0 MSS=1440 SACK_PERM TSval=3465406673 TSecr=4010465300 WS=256"
"205","3.482304969","2601:5cf:4100:3de0:71ad:d37e:96b9:4fe2","2001:4860:4860::8844","TCP","86","35878  >  443 [ACK] Seq=1 Ack=1 Win=64896 Len=0 TSval=4010465378 TSecr=3465406673"
"206","3.482647510","2601:5cf:4100:3de0:71ad:d37e:96b9:4fe2","2001:4860:4860::8844","TLSv1.3","603","Client Hello (SNI=dns.google)"
"207","3.584917878","2001:4860:4860::8844","2601:5cf:4100:3de0:71ad:d37e:96b9:4fe2","TCP","86","443  >  35878 [ACK] Seq=1 Ack=518 Win=66816 Len=0 TSval=3465406754 TSecr=4010465378"
"208","3.584918109","2001:4860:4860::8844","2601:5cf:4100:3de0:71ad:d37e:96b9:4fe2","TLSv1.3","2502","Server Hello, Change Cipher Spec"
"209","3.584918149","2001:4860:4860::8844","2601:5cf:4100:3de0:71ad:d37e:96b9:4fe2","TLSv1.3","2116","Application Data"
"210","3.584948745","2601:5cf:4100:3de0:71ad:d37e:96b9:4fe2","2001:4860:4860::8844","TCP","86","35878  >  443 [ACK] Seq=518 Ack=2417 Win=62592 Len=0 TSval=4010465480 TSecr=3465406755"
"211","3.584958894","2601:5cf:4100:3de0:71ad:d37e:96b9:4fe2","2001:4860:4860::8844","TCP","86","35878  >  443 [ACK] Seq=518 Ack=4447 Win=60672 Len=0 TSval=4010465480 TSecr=3465406755"
"212","3.586036797","2601:5cf:4100:3de0:71ad:d37e:96b9:4fe2","2001:4860:4860::8844","TLSv1.3","166","Change Cipher Spec, Application Data"
"213","3.610496407","2001:4860:4860::8844","2601:5cf:4100:3de0:71ad:d37e:96b9:4fe2","TLSv1.3","734","Application Data, Application Data"
"214","3.610541570","2601:5cf:4100:3de0:71ad:d37e:96b9:4fe2","2001:4860:4860::8844","TLSv1.3","398","Application Data, Application Data, Application Data, Application Data"
"215","3.687127637","2001:4860:4860::8844","2601:5cf:4100:3de0:71ad:d37e:96b9:4fe2","TLSv1.3","117","Application Data"
"216","3.687127878","2001:4860:4860::8844","2601:5cf:4100:3de0:71ad:d37e:96b9:4fe2","TLSv1.3","368","Application Data"
"217","3.687127918","2001:4860:4860::8844","2601:5cf:4100:3de0:71ad:d37e:96b9:4fe2","TLSv1.3","198","Application Data"
"218","3.687127948","2001:4860:4860::8844","2601:5cf:4100:3de0:71ad:d37e:96b9:4fe2","TLSv1.3","117","Application Data"
"219","3.687127978","2001:4860:4860::8844","2601:5cf:4100:3de0:71ad:d37e:96b9:4fe2","TLSv1.3","125","Application Data"
"220","3.687158163","2601:5cf:4100:3de0:71ad:d37e:96b9:4fe2","2001:4860:4860::8844","TLSv1.3","117","Application Data"
"221","3.688174593","2601:5cf:4100:3de0:71ad:d37e:96b9:4fe2","2001:4860:4860::8844","TCP","86","35878  >  443 [RST, ACK] Seq=941 Ack=5590 Win=64128 Len=0 TSval=4010465584 TSecr=3465406882"
"263","4.259475139","2601:5cf:4100:3de0:71ad:d37e:96b9:4fe2","2001:4860:4860::8844","TCP","94","35894  >  443 [SYN] Seq=0 Win=64800 Len=0 MSS=1440 SACK_PERM TSval=4010466155 TSecr=0 WS=128"
"264","4.403972161","2001:4860:4860::8844","2601:5cf:4100:3de0:71ad:d37e:96b9:4fe2","TCP","94","443  >  35894 [SYN, ACK] Seq=0 Ack=1 Win=65535 Len=0 MSS=1440 SACK_PERM TSval=289467738 TSecr=4010466155 WS=256"
"265","4.404028825","2601:5cf:4100:3de0:71ad:d37e:96b9:4fe2","2001:4860:4860::8844","TCP","86","35894  >  443 [ACK] Seq=1 Ack=1 Win=64896 Len=0 TSval=4010466299 TSecr=289467738"
"266","4.404719336","2601:5cf:4100:3de0:71ad:d37e:96b9:4fe2","2001:4860:4860::8844","TLSv1.3","603","Client Hello (SNI=dns.google)"
"267","4.506206818","2001:4860:4860::8844","2601:5cf:4100:3de0:71ad:d37e:96b9:4fe2","TCP","86","443  >  35894 [ACK] Seq=1 Ack=518 Win=66816 Len=0 TSval=289467882 TSecr=4010466300"
"268","4.506207049","2001:4860:4860::8844","2601:5cf:4100:3de0:71ad:d37e:96b9:4fe2","TLSv1.3","2502","Server Hello, Change Cipher Spec"
"269","4.506207079","2001:4860:4860::8844","2601:5cf:4100:3de0:71ad:d37e:96b9:4fe2","TLSv1.3","2118","Application Data"
"270","4.506234329","2601:5cf:4100:3de0:71ad:d37e:96b9:4fe2","2001:4860:4860::8844","TCP","86","35894  >  443 [ACK] Seq=518 Ack=2417 Win=62592 Len=0 TSval=4010466402 TSecr=289467883"
"271","4.506243185","2601:5cf:4100:3de0:71ad:d37e:96b9:4fe2","2001:4860:4860::8844","TCP","86","35894  >  443 [ACK] Seq=518 Ack=4449 Win=60672 Len=0 TSval=4010466402 TSecr=289467883"
"272","4.507352536","2601:5cf:4100:3de0:71ad:d37e:96b9:4fe2","2001:4860:4860::8844","TLSv1.3","166","Change Cipher Spec, Application Data"
"273","4.529286070","2001:4860:4860::8844","2601:5cf:4100:3de0:71ad:d37e:96b9:4fe2","TLSv1.3","734","Application Data, Application Data"
"274","4.529310485","2601:5cf:4100:3de0:71ad:d37e:96b9:4fe2","2001:4860:4860::8844","TLSv1.3","405","Application Data, Application Data, Application Data, Application Data"
"275","4.551672208","2001:4860:4860::8844","2601:5cf:4100:3de0:71ad:d37e:96b9:4fe2","TLSv1.3","117","Application Data"
"276","4.551723572","2601:5cf:4100:3de0:71ad:d37e:96b9:4fe2","2001:4860:4860::8844","TLSv1.3","117","Application Data"
"277","4.553617427","2001:4860:4860::8844","2601:5cf:4100:3de0:71ad:d37e:96b9:4fe2","TLSv1.3","369","Application Data"
"278","4.553617677","2001:4860:4860::8844","2601:5cf:4100:3de0:71ad:d37e:96b9:4fe2","TLSv1.3","295","Application Data"
"279","4.553617717","2001:4860:4860::8844","2601:5cf:4100:3de0:71ad:d37e:96b9:4fe2","TLSv1.3","117","Application Data"
"280","4.553617767","2001:4860:4860::8844","2601:5cf:4100:3de0:71ad:d37e:96b9:4fe2","TLSv1.3","125","Application Data"
"281","4.554538481","2601:5cf:4100:3de0:71ad:d37e:96b9:4fe2","2001:4860:4860::8844","TCP","86","35894  >  443 [RST, ACK] Seq=948 Ack=5690 Win=64128 Len=0 TSval=4010466450 TSecr=289468000"
"282","4.575903439","2001:4860:4860::8844","2601:5cf:4100:3de0:71ad:d37e:96b9:4fe2","TCP","86","443  >  35894 [ACK] Seq=5690 Ack=948 Win=67840 Len=0 TSval=289468023 TSecr=4010466447"
"283","4.575968139","2601:5cf:4100:3de0:71ad:d37e:96b9:4fe2","2001:4860:4860::8844","TCP","74","35894  >  443 [RST] Seq=948 Win=0 Len=0"
"303","4.940277621","2601:5cf:4100:3de0:71ad:d37e:96b9:4fe2","2001:4860:4860::8844","TCP","94","35896  >  443 [SYN] Seq=0 Win=64800 Len=0 MSS=1440 SACK_PERM TSval=4010466836 TSecr=0 WS=128"
"306","5.018302103","2001:4860:4860::8844","2601:5cf:4100:3de0:71ad:d37e:96b9:4fe2","TCP","94","443  >  35896 [SYN, ACK] Seq=0 Ack=1 Win=65535 Len=0 MSS=1440 SACK_PERM TSval=2239501748 TSecr=4010466836 WS=256"
"307","5.018384064","2601:5cf:4100:3de0:71ad:d37e:96b9:4fe2","2001:4860:4860::8844","TCP","86","35896  >  443 [ACK] Seq=1 Ack=1 Win=64896 Len=0 TSval=4010466914 TSecr=2239501748"
"308","5.019046894","2601:5cf:4100:3de0:71ad:d37e:96b9:4fe2","2001:4860:4860::8844","TLSv1.3","603","Client Hello (SNI=dns.google)"
"309","5.120625174","2001:4860:4860::8844","2601:5cf:4100:3de0:71ad:d37e:96b9:4fe2","TCP","86","443  >  35896 [ACK] Seq=1 Ack=518 Win=66816 Len=0 TSval=2239501834 TSecr=4010466914"
"310","5.120625615","2001:4860:4860::8844","2601:5cf:4100:3de0:71ad:d37e:96b9:4fe2","TLSv1.3","2502","Server Hello, Change Cipher Spec"
"311","5.120625725","2001:4860:4860::8844","2601:5cf:4100:3de0:71ad:d37e:96b9:4fe2","TLSv1.3","2117","Application Data"
"312","5.120682109","2601:5cf:4100:3de0:71ad:d37e:96b9:4fe2","2001:4860:4860::8844","TCP","86","35896  >  443 [ACK] Seq=518 Ack=2417 Win=62592 Len=0 TSval=4010467016 TSecr=2239501835"
"313","5.120723485","2601:5cf:4100:3de0:71ad:d37e:96b9:4fe2","2001:4860:4860::8844","TCP","86","35896  >  443 [ACK] Seq=518 Ack=4448 Win=60672 Len=0 TSval=4010467016 TSecr=2239501835"
"314","5.122091913","2601:5cf:4100:3de0:71ad:d37e:96b9:4fe2","2001:4860:4860::8844","TLSv1.3","166","Change Cipher Spec, Application Data"
"315","5.145314402","2001:4860:4860::8844","2601:5cf:4100:3de0:71ad:d37e:96b9:4fe2","TLSv1.3","734","Application Data, Application Data"
"316","5.145358573","2601:5cf:4100:3de0:71ad:d37e:96b9:4fe2","2001:4860:4860::8844","TLSv1.3","401","Application Data, Application Data, Application Data, Application Data"
"317","5.223099023","2001:4860:4860::8844","2601:5cf:4100:3de0:71ad:d37e:96b9:4fe2","TLSv1.3","117","Application Data"
"318","5.223099453","2001:4860:4860::8844","2601:5cf:4100:3de0:71ad:d37e:96b9:4fe2","TLSv1.3","368","Application Data"
"319","5.223099564","2001:4860:4860::8844","2601:5cf:4100:3de0:71ad:d37e:96b9:4fe2","TLSv1.3","203","Application Data"
"320","5.223099664","2001:4860:4860::8844","2601:5cf:4100:3de0:71ad:d37e:96b9:4fe2","TLSv1.3","117","Application Data"
"321","5.223099764","2001:4860:4860::8844","2601:5cf:4100:3de0:71ad:d37e:96b9:4fe2","TLSv1.3","125","Application Data"
"322","5.223153984","2601:5cf:4100:3de0:71ad:d37e:96b9:4fe2","2001:4860:4860::8844","TLSv1.3","117","Application Data"
"323","5.224433959","2601:5cf:4100:3de0:71ad:d37e:96b9:4fe2","2001:4860:4860::8844","TCP","86","35896  >  443 [RST, ACK] Seq=944 Ack=5596 Win=64128 Len=0 TSval=4010467120 TSecr=2239501954"
"324","5.247968271","2001:4860:4860::8844","2601:5cf:4100:3de0:71ad:d37e:96b9:4fe2","TCP","86","443  >  35896 [ACK] Seq=5596 Ack=944 Win=67840 Len=0 TSval=2239502033 TSecr=4010467118"
"325","5.248000701","2601:5cf:4100:3de0:71ad:d37e:96b9:4fe2","2001:4860:4860::8844","TCP","74","35896  >  443 [RST] Seq=944 Win=0 Len=0"
"345","5.451734674","2601:5cf:4100:3de0:71ad:d37e:96b9:4fe2","2001:4860:4860::8844","TCP","94","35904  >  443 [SYN] Seq=0 Win=64800 Len=0 MSS=1440 SACK_PERM TSval=4010467347 TSecr=0 WS=128"
"347","5.530248987","2001:4860:4860::8844","2601:5cf:4100:3de0:71ad:d37e:96b9:4fe2","TCP","94","443  >  35904 [SYN, ACK] Seq=0 Ack=1 Win=65535 Len=0 MSS=1440 SACK_PERM TSval=3624720829 TSecr=4010467347 WS=256"
"349","5.530335326","2601:5cf:4100:3de0:71ad:d37e:96b9:4fe2","2001:4860:4860::8844","TCP","86","35904  >  443 [ACK] Seq=1 Ack=1 Win=64896 Len=0 TSval=4010467426 TSecr=3624720829"
"350","5.531009506","2601:5cf:4100:3de0:71ad:d37e:96b9:4fe2","2001:4860:4860::8844","TLSv1.3","603","Client Hello (SNI=dns.google)"
"351","5.632673047","2001:4860:4860::8844","2601:5cf:4100:3de0:71ad:d37e:96b9:4fe2","TCP","86","443  >  35904 [ACK] Seq=1 Ack=518 Win=66816 Len=0 TSval=3624720917 TSecr=4010467426"
"352","5.632673488","2001:4860:4860::8844","2601:5cf:4100:3de0:71ad:d37e:96b9:4fe2","TLSv1.3","2502","Server Hello, Change Cipher Spec"
"353","5.632673588","2001:4860:4860::8844","2601:5cf:4100:3de0:71ad:d37e:96b9:4fe2","TLSv1.3","2117","Application Data"
"354","5.632733859","2601:5cf:4100:3de0:71ad:d37e:96b9:4fe2","2001:4860:4860::8844","TCP","86","35904  >  443 [ACK] Seq=518 Ack=2417 Win=62592 Len=0 TSval=4010467528 TSecr=3624720918"
"355","5.632756250","2601:5cf:4100:3de0:71ad:d37e:96b9:4fe2","2001:4860:4860::8844","TCP","86","35904  >  443 [ACK] Seq=518 Ack=4448 Win=60672 Len=0 TSval=4010467528 TSecr=3624720918"
"356","5.634200027","2601:5cf:4100:3de0:71ad:d37e:96b9:4fe2","2001:4860:4860::8844","TLSv1.3","166","Change Cipher Spec, Application Data"
"357","5.659134559","2001:4860:4860::8844","2601:5cf:4100:3de0:71ad:d37e:96b9:4fe2","TLSv1.3","734","Application Data, Application Data"
"358","5.659179001","2601:5cf:4100:3de0:71ad:d37e:96b9:4fe2","2001:4860:4860::8844","TLSv1.3","406","Application Data, Application Data, Application Data, Application Data"
"359","5.735063824","2001:4860:4860::8844","2601:5cf:4100:3de0:71ad:d37e:96b9:4fe2","TLSv1.3","117","Application Data"
"360","5.735114387","2601:5cf:4100:3de0:71ad:d37e:96b9:4fe2","2001:4860:4860::8844","TLSv1.3","117","Application Data"
"363","5.760340244","2001:4860:4860::8844","2601:5cf:4100:3de0:71ad:d37e:96b9:4fe2","TCP","86","443  >  35904 [ACK] Seq=5127 Ack=949 Win=67840 Len=0 TSval=3624721112 TSecr=4010467630"
"364","5.837328339","2001:4860:4860::8844","2601:5cf:4100:3de0:71ad:d37e:96b9:4fe2","TLSv1.3","365","Application Data"
"365","5.837328580","2001:4860:4860::8844","2601:5cf:4100:3de0:71ad:d37e:96b9:4fe2","TLSv1.3","149","Application Data"
"366","5.837328610","2001:4860:4860::8844","2601:5cf:4100:3de0:71ad:d37e:96b9:4fe2","TLSv1.3","117","Application Data"
"367","5.837328650","2001:4860:4860::8844","2601:5cf:4100:3de0:71ad:d37e:96b9:4fe2","TLSv1.3","125","Application Data"
"368","5.838346783","2601:5cf:4100:3de0:71ad:d37e:96b9:4fe2","2001:4860:4860::8844","TCP","86","35904  >  443 [RST, ACK] Seq=949 Ack=5539 Win=64128 Len=0 TSval=4010467734 TSecr=3624721149"
"391","6.271067943","2601:5cf:4100:3de0:71ad:d37e:96b9:4fe2","2001:4860:4860::8844","TCP","94","35912  >  443 [SYN] Seq=0 Win=64800 Len=0 MSS=1440 SACK_PERM TSval=4010468166 TSecr=0 WS=128"
"392","6.349133450","2001:4860:4860::8844","2601:5cf:4100:3de0:71ad:d37e:96b9:4fe2","TCP","94","443  >  35912 [SYN, ACK] Seq=0 Ack=1 Win=65535 Len=0 MSS=1440 SACK_PERM TSval=1142750001 TSecr=4010468166 WS=256"
"393","6.349162674","2601:5cf:4100:3de0:71ad:d37e:96b9:4fe2","2001:4860:4860::8844","TCP","86","35912  >  443 [ACK] Seq=1 Ack=1 Win=64896 Len=0 TSval=4010468244 TSecr=1142750001"
"394","6.349613052","2601:5cf:4100:3de0:71ad:d37e:96b9:4fe2","2001:4860:4860::8844","TLSv1.3","603","Client Hello (SNI=dns.google)"
"395","6.401547676","2001:4860:4860::8844","2601:5cf:4100:3de0:71ad:d37e:96b9:4fe2","TCP","86","443  >  35912 [ACK] Seq=1 Ack=518 Win=66816 Len=0 TSval=1142750089 TSecr=4010468245"
"396","6.401547977","2001:4860:4860::8844","2601:5cf:4100:3de0:71ad:d37e:96b9:4fe2","TLSv1.3","2502","Server Hello, Change Cipher Spec"
"397","6.401548027","2001:4860:4860::8844","2601:5cf:4100:3de0:71ad:d37e:96b9:4fe2","TLSv1.3","2117","Application Data"
"398","6.401580246","2601:5cf:4100:3de0:71ad:d37e:96b9:4fe2","2001:4860:4860::8844","TCP","86","35912  >  443 [ACK] Seq=518 Ack=2417 Win=62592 Len=0 TSval=4010468297 TSecr=1142750090"
"399","6.401590074","2601:5cf:4100:3de0:71ad:d37e:96b9:4fe2","2001:4860:4860::8844","TCP","86","35912  >  443 [ACK] Seq=518 Ack=4448 Win=60672 Len=0 TSval=4010468297 TSecr=1142750090"
"400","6.402994579","2601:5cf:4100:3de0:71ad:d37e:96b9:4fe2","2001:4860:4860::8844","TLSv1.3","166","Change Cipher Spec, Application Data"
"401","6.450781761","2001:4860:4860::8844","2601:5cf:4100:3de0:71ad:d37e:96b9:4fe2","TLSv1.3","734","Application Data, Application Data"
"402","6.450824760","2601:5cf:4100:3de0:71ad:d37e:96b9:4fe2","2001:4860:4860::8844","TLSv1.3","402","Application Data, Application Data, Application Data, Application Data"
"403","6.471202296","2001:4860:4860::8844","2601:5cf:4100:3de0:71ad:d37e:96b9:4fe2","TLSv1.3","117","Application Data"
"404","6.471252659","2601:5cf:4100:3de0:71ad:d37e:96b9:4fe2","2001:4860:4860::8844","TLSv1.3","117","Application Data"
"405","6.473588527","2001:4860:4860::8844","2601:5cf:4100:3de0:71ad:d37e:96b9:4fe2","TLSv1.3","368","Application Data"
"406","6.473589148","2001:4860:4860::8844","2601:5cf:4100:3de0:71ad:d37e:96b9:4fe2","TLSv1.3","197","Application Data"
"407","6.473589258","2001:4860:4860::8844","2601:5cf:4100:3de0:71ad:d37e:96b9:4fe2","TLSv1.3","117","Application Data"
"408","6.473589359","2001:4860:4860::8844","2601:5cf:4100:3de0:71ad:d37e:96b9:4fe2","TLSv1.3","125","Application Data"
"409","6.474757248","2601:5cf:4100:3de0:71ad:d37e:96b9:4fe2","2001:4860:4860::8844","TCP","86","35912  >  443 [RST, ACK] Seq=945 Ack=5590 Win=64128 Len=0 TSval=4010468370 TSecr=1142750175"
"410","6.495795500","2001:4860:4860::8844","2601:5cf:4100:3de0:71ad:d37e:96b9:4fe2","TCP","86","443  >  35912 [ACK] Seq=5590 Ack=945 Win=67840 Len=0 TSval=1142750198 TSecr=4010468367"
"411","6.495821288","2601:5cf:4100:3de0:71ad:d37e:96b9:4fe2","2001:4860:4860::8844","TCP","74","35912  >  443 [RST] Seq=945 Win=0 Len=0"
"434","6.811341815","2601:5cf:4100:3de0:71ad:d37e:96b9:4fe2","2001:4860:4860::8844","TCP","94","35928  >  443 [SYN] Seq=0 Win=64800 Len=0 MSS=1440 SACK_PERM TSval=4010468707 TSecr=0 WS=128"
"439","6.963866930","2001:4860:4860::8844","2601:5cf:4100:3de0:71ad:d37e:96b9:4fe2","TCP","94","443  >  35928 [SYN, ACK] Seq=0 Ack=1 Win=65535 Len=0 MSS=1440 SACK_PERM TSval=88323788 TSecr=4010468707 WS=256"
"440","6.963924727","2601:5cf:4100:3de0:71ad:d37e:96b9:4fe2","2001:4860:4860::8844","TCP","86","35928  >  443 [ACK] Seq=1 Ack=1 Win=64896 Len=0 TSval=4010468859 TSecr=88323788"
"441","6.964611230","2601:5cf:4100:3de0:71ad:d37e:96b9:4fe2","2001:4860:4860::8844","TLSv1.3","603","Client Hello (SNI=dns.google)"
"442","6.988989391","2001:4860:4860::8844","2601:5cf:4100:3de0:71ad:d37e:96b9:4fe2","TCP","86","443  >  35928 [ACK] Seq=1 Ack=518 Win=66816 Len=0 TSval=88323884 TSecr=4010468860"
"443","6.990930824","2001:4860:4860::8844","2601:5cf:4100:3de0:71ad:d37e:96b9:4fe2","TLSv1.3","1294","Server Hello, Change Cipher Spec"
"444","6.990974164","2601:5cf:4100:3de0:71ad:d37e:96b9:4fe2","2001:4860:4860::8844","TCP","86","35928  >  443 [ACK] Seq=518 Ack=1209 Win=64128 Len=0 TSval=4010468886 TSecr=88323886"
"445","6.991616887","2001:4860:4860::8844","2601:5cf:4100:3de0:71ad:d37e:96b9:4fe2","TCP","1294","443  >  35928 [PSH, ACK] Seq=1209 Ack=518 Win=66816 Len=1208 TSval=88323886 TSecr=4010468860 [TCP segment of a reassembled PDU]"
"446","6.991617167","2001:4860:4860::8844","2601:5cf:4100:3de0:71ad:d37e:96b9:4fe2","TLSv1.3","2116","Application Data"
"447","6.991642083","2601:5cf:4100:3de0:71ad:d37e:96b9:4fe2","2001:4860:4860::8844","TCP","86","35928  >  443 [ACK] Seq=518 Ack=2417 Win=63872 Len=0 TSval=4010468887 TSecr=88323886"
"448","6.991663643","2601:5cf:4100:3de0:71ad:d37e:96b9:4fe2","2001:4860:4860::8844","TCP","86","35928  >  443 [ACK] Seq=518 Ack=4447 Win=61952 Len=0 TSval=4010468887 TSecr=88323886"
"449","6.992637174","2601:5cf:4100:3de0:71ad:d37e:96b9:4fe2","2001:4860:4860::8844","TLSv1.3","166","Change Cipher Spec, Application Data"
"450","7.066261186","2001:4860:4860::8844","2601:5cf:4100:3de0:71ad:d37e:96b9:4fe2","TLSv1.3","734","Application Data, Application Data"
"451","7.066305748","2601:5cf:4100:3de0:71ad:d37e:96b9:4fe2","2001:4860:4860::8844","TLSv1.3","403","Application Data, Application Data, Application Data, Application Data"
"452","7.094457703","2001:4860:4860::8844","2601:5cf:4100:3de0:71ad:d37e:96b9:4fe2","TLSv1.3","117","Application Data"
"453","7.094508927","2601:5cf:4100:3de0:71ad:d37e:96b9:4fe2","2001:4860:4860::8844","TLSv1.3","117","Application Data"
"454","7.105888648","2001:4860:4860::8844","2601:5cf:4100:3de0:71ad:d37e:96b9:4fe2","TLSv1.3","368","Application Data"
"455","7.105889069","2001:4860:4860::8844","2601:5cf:4100:3de0:71ad:d37e:96b9:4fe2","TLSv1.3","200","Application Data"
"456","7.105889179","2001:4860:4860::8844","2601:5cf:4100:3de0:71ad:d37e:96b9:4fe2","TLSv1.3","156","Application Data, Application Data"
"457","7.107149338","2601:5cf:4100:3de0:71ad:d37e:96b9:4fe2","2001:4860:4860::8844","TCP","86","35928  >  443 [RST, ACK] Seq=946 Ack=5592 Win=64128 Len=0 TSval=4010469002 TSecr=88324003"
"458","7.120285992","2001:4860:4860::8844","2601:5cf:4100:3de0:71ad:d37e:96b9:4fe2","TCP","86","443  >  35928 [ACK] Seq=5592 Ack=946 Win=67840 Len=0 TSval=88324017 TSecr=4010468990"
"459","7.120309996","2601:5cf:4100:3de0:71ad:d37e:96b9:4fe2","2001:4860:4860::8844","TCP","74","35928  >  443 [RST] Seq=946 Win=0 Len=0"
"478","7.320211475","2601:5cf:4100:3de0:71ad:d37e:96b9:4fe2","2001:4860:4860::8844","TCP","94","39778  >  443 [SYN] Seq=0 Win=64800 Len=0 MSS=1440 SACK_PERM TSval=4010469216 TSecr=0 WS=128"
"481","7.400992187","2001:4860:4860::8844","2601:5cf:4100:3de0:71ad:d37e:96b9:4fe2","TCP","94","443  >  39778 [SYN, ACK] Seq=0 Ack=1 Win=65535 Len=0 MSS=1440 SACK_PERM TSval=3011862062 TSecr=4010469216 WS=256"
"482","7.401026330","2601:5cf:4100:3de0:71ad:d37e:96b9:4fe2","2001:4860:4860::8844","TCP","86","39778  >  443 [ACK] Seq=1 Ack=1 Win=64896 Len=0 TSval=4010469296 TSecr=3011862062"
"483","7.401397733","2601:5cf:4100:3de0:71ad:d37e:96b9:4fe2","2001:4860:4860::8844","TLSv1.3","603","Client Hello (SNI=dns.google)"
"484","7.475791864","2001:4860:4860::8844","2601:5cf:4100:3de0:71ad:d37e:96b9:4fe2","TCP","86","443  >  39778 [ACK] Seq=1 Ack=518 Win=66816 Len=0 TSval=3011862098 TSecr=4010469297"
"485","7.475792305","2001:4860:4860::8844","2601:5cf:4100:3de0:71ad:d37e:96b9:4fe2","TLSv1.3","2502","Server Hello, Change Cipher Spec"
"486","7.475792405","2001:4860:4860::8844","2601:5cf:4100:3de0:71ad:d37e:96b9:4fe2","TLSv1.3","2117","Application Data"
"487","7.475848528","2601:5cf:4100:3de0:71ad:d37e:96b9:4fe2","2001:4860:4860::8844","TCP","86","39778  >  443 [ACK] Seq=518 Ack=2417 Win=62592 Len=0 TSval=4010469371 TSecr=3011862099"
"488","7.475875157","2601:5cf:4100:3de0:71ad:d37e:96b9:4fe2","2001:4860:4860::8844","TCP","86","39778  >  443 [ACK] Seq=518 Ack=4448 Win=60672 Len=0 TSval=4010469371 TSecr=3011862099"
"489","7.477367363","2601:5cf:4100:3de0:71ad:d37e:96b9:4fe2","2001:4860:4860::8844","TLSv1.3","166","Change Cipher Spec, Application Data"
"490","7.488667888","2001:4860:4860::8844","2601:5cf:4100:3de0:71ad:d37e:96b9:4fe2","TCP","909","[TCP Spurious Retransmission] 443  >  39778 [PSH, ACK] Seq=3625 Ack=518 Win=66816 Len=823 TSval=3011862151 TSecr=4010469297 [TCP segment of a reassembled PDU]"
"491","7.488707511","2601:5cf:4100:3de0:71ad:d37e:96b9:4fe2","2001:4860:4860::8844","TCP","98","[TCP Dup ACK 488#1] 39778  >  443 [ACK] Seq=598 Ack=4448 Win=64128 Len=0 TSval=4010469384 TSecr=3011862151 SLE=3625 SRE=4448"
"492","7.499186635","2001:4860:4860::8844","2601:5cf:4100:3de0:71ad:d37e:96b9:4fe2","TLSv1.3","734","Application Data, Application Data"
"493","7.499230896","2601:5cf:4100:3de0:71ad:d37e:96b9:4fe2","2001:4860:4860::8844","TLSv1.3","401","Application Data, Application Data, Application Data, Application Data"
"494","7.519575002","2001:4860:4860::8844","2601:5cf:4100:3de0:71ad:d37e:96b9:4fe2","TLSv1.3","117","Application Data"
"495","7.519625315","2601:5cf:4100:3de0:71ad:d37e:96b9:4fe2","2001:4860:4860::8844","TLSv1.3","117","Application Data"
"496","7.522619094","2001:4860:4860::8844","2601:5cf:4100:3de0:71ad:d37e:96b9:4fe2","TLSv1.3","368","Application Data"
"497","7.522619525","2001:4860:4860::8844","2601:5cf:4100:3de0:71ad:d37e:96b9:4fe2","TLSv1.3","281","Application Data"
"498","7.522619635","2001:4860:4860::8844","2601:5cf:4100:3de0:71ad:d37e:96b9:4fe2","TLSv1.3","117","Application Data"
"499","7.522619735","2001:4860:4860::8844","2601:5cf:4100:3de0:71ad:d37e:96b9:4fe2","TLSv1.3","125","Application Data"
"500","7.524173074","2601:5cf:4100:3de0:71ad:d37e:96b9:4fe2","2001:4860:4860::8844","TCP","86","39778  >  443 [RST, ACK] Seq=944 Ack=5674 Win=64128 Len=0 TSval=4010469419 TSecr=3011862185"
"501","7.547305372","2001:4860:4860::8844","2601:5cf:4100:3de0:71ad:d37e:96b9:4fe2","TCP","86","443  >  39778 [ACK] Seq=5674 Ack=944 Win=67840 Len=0 TSval=3011862210 TSecr=4010469415"
"502","7.547333203","2601:5cf:4100:3de0:71ad:d37e:96b9:4fe2","2001:4860:4860::8844","TCP","74","39778  >  443 [RST] Seq=944 Win=0 Len=0"
