"No.","Time","Source","Destination","Protocol","Length","Info"
"24","4.403505402","2601:5cf:4100:3de0:3d84:6c14:e3a4:affc","2001:4860:4860::8888","TCP","94","48748  >  443 [SYN] Seq=0 Win=64800 Len=0 MSS=1440 SACK_PERM TSval=1773011827 TSecr=0 WS=128"
"25","4.608778834","2001:4860:4860::8888","2601:5cf:4100:3de0:3d84:6c14:e3a4:affc","TCP","94","443  >  48748 [SYN, ACK] Seq=0 Ack=1 Win=65535 Len=0 MSS=1440 SACK_PERM TSval=1364532968 TSecr=1773011827 WS=256"
"26","4.608835172","2601:5cf:4100:3de0:3d84:6c14:e3a4:affc","2001:4860:4860::8888","TCP","86","48748  >  443 [ACK] Seq=1 Ack=1 Win=64896 Len=0 TSval=1773012032 TSecr=1364532968"
"27","4.609364622","2601:5cf:4100:3de0:3d84:6c14:e3a4:affc","2001:4860:4860::8888","TLSv1.3","603","Client Hello (SNI=dns.google)"
"28","4.711282272","2001:4860:4860::8888","2601:5cf:4100:3de0:3d84:6c14:e3a4:affc","TCP","86","443  >  48748 [ACK] Seq=1 Ack=518 Win=66816 Len=0 TSval=1364533084 TSecr=1773012032"
"29","4.711282512","2001:4860:4860::8888","2601:5cf:4100:3de0:3d84:6c14:e3a4:affc","TLSv1.3","2502","Server Hello, Change Cipher Spec"
"30","4.711282552","2001:4860:4860::8888","2601:5cf:4100:3de0:3d84:6c14:e3a4:affc","TLSv1.3","2118","Application Data"
"31","4.711313942","2601:5cf:4100:3de0:3d84:6c14:e3a4:affc","2001:4860:4860::8888","TCP","86","48748  >  443 [ACK] Seq=518 Ack=2417 Win=62592 Len=0 TSval=1773012134 TSecr=1364533085"
"32","4.711326637","2601:5cf:4100:3de0:3d84:6c14:e3a4:affc","2001:4860:4860::8888","TCP","86","48748  >  443 [ACK] Seq=518 Ack=4449 Win=60672 Len=0 TSval=1773012134 TSecr=1364533085"
"33","4.712596800","2601:5cf:4100:3de0:3d84:6c14:e3a4:affc","2001:4860:4860::8888","TLSv1.3","166","Change Cipher Spec, Application Data"
"34","4.739613998","2001:4860:4860::8888","2601:5cf:4100:3de0:3d84:6c14:e3a4:affc","TLSv1.3","734","Application Data, Application Data"
"35","4.739659274","2601:5cf:4100:3de0:3d84:6c14:e3a4:affc","2001:4860:4860::8888","TLSv1.3","396","Application Data, Application Data, Application Data, Application Data"
"36","4.814134293","2001:4860:4860::8888","2601:5cf:4100:3de0:3d84:6c14:e3a4:affc","TLSv1.3","117","Application Data"
"37","4.814181924","2601:5cf:4100:3de0:3d84:6c14:e3a4:affc","2001:4860:4860::8888","TLSv1.3","117","Application Data"
"40","4.916026294","2001:4860:4860::8888","2601:5cf:4100:3de0:3d84:6c14:e3a4:affc","TCP","86","443  >  48748 [ACK] Seq=5128 Ack=939 Win=67840 Len=0 TSval=1364533289 TSecr=1773012237"
"41","4.916026374","2001:4860:4860::8888","2601:5cf:4100:3de0:3d84:6c14:e3a4:affc","TLSv1.3","368","Application Data"
"42","4.916026535","2001:4860:4860::8888","2601:5cf:4100:3de0:3d84:6c14:e3a4:affc","TLSv1.3","195","Application Data"
"43","4.916026575","2001:4860:4860::8888","2601:5cf:4100:3de0:3d84:6c14:e3a4:affc","TLSv1.3","117","Application Data"
"44","4.916026605","2001:4860:4860::8888","2601:5cf:4100:3de0:3d84:6c14:e3a4:affc","TLSv1.3","125","Application Data"
"45","4.917698114","2601:5cf:4100:3de0:3d84:6c14:e3a4:affc","2001:4860:4860::8888","TCP","86","48748  >  443 [RST, ACK] Seq=939 Ack=5589 Win=64128 Len=0 TSval=1773012341 TSecr=1364533298"
"46","5.041254140","2601:5cf:4100:3de0:3d84:6c14:e3a4:affc","2001:4860:4860::8844","TCP","94","41092  >  443 [SYN] Seq=0 Win=64800 Len=0 MSS=1440 SACK_PERM TSval=2580581309 TSecr=0 WS=128"
"49","5.147459189","2001:4860:4860::8844","2601:5cf:4100:3de0:3d84:6c14:e3a4:affc","TCP","94","443  >  41092 [SYN, ACK] Seq=0 Ack=1 Win=65535 Len=0 MSS=1440 SACK_PERM TSval=1262750830 TSecr=2580581309 WS=256"
"50","5.147491621","2601:5cf:4100:3de0:3d84:6c14:e3a4:affc","2001:4860:4860::8844","TCP","86","41092  >  443 [ACK] Seq=1 Ack=1 Win=64896 Len=0 TSval=2580581416 TSecr=1262750830"
"51","5.147872729","2601:5cf:4100:3de0:3d84:6c14:e3a4:affc","2001:4860:4860::8844","TLSv1.3","603","Client Hello (SNI=dns.google)"
"52","5.223362322","2001:4860:4860::8844","2601:5cf:4100:3de0:3d84:6c14:e3a4:affc","TCP","86","443  >  41092 [ACK] Seq=1 Ack=518 Win=66816 Len=0 TSval=1262750866 TSecr=2580581416"
"53","5.223362563","2001:4860:4860::8844","2601:5cf:4100:3de0:3d84:6c14:e3a4:affc","TLSv1.3","2502","Server Hello, Change Cipher Spec"
"54","5.223362603","2001:4860:4860::8844","2601:5cf:4100:3de0:3d84:6c14:e3a4:affc","TLSv1.3","2117","Application Data"
"55","5.223395937","2601:5cf:4100:3de0:3d84:6c14:e3a4:affc","2001:4860:4860::8844","TCP","86","41092  >  443 [ACK] Seq=518 Ack=2417 Win=62592 Len=0 TSval=2580581492 TSecr=1262750867"
"56","5.223406316","2601:5cf:4100:3de0:3d84:6c14:e3a4:affc","2001:4860:4860::8844","TCP","86","41092  >  443 [ACK] Seq=518 Ack=4448 Win=60672 Len=0 TSval=2580581492 TSecr=1262750867"
"57","5.224609312","2601:5cf:4100:3de0:3d84:6c14:e3a4:affc","2001:4860:4860::8844","TLSv1.3","166","Change Cipher Spec, Application Data"
"58","5.239310141","2001:4860:4860::8844","2601:5cf:4100:3de0:3d84:6c14:e3a4:affc","TCP","909","[TCP Spurious Retransmission] 443  >  41092 [PSH, ACK] Seq=3625 Ack=518 Win=66816 Len=823 TSval=1262750921 TSecr=2580581416 [TCP segment of a reassembled PDU]"
"59","5.239337844","2601:5cf:4100:3de0:3d84:6c14:e3a4:affc","2001:4860:4860::8844","TCP","98","[TCP Dup ACK 56#1] 41092  >  443 [ACK] Seq=598 Ack=4448 Win=64128 Len=0 TSval=2580581507 TSecr=1262750921 SLE=3625 SRE=4448"
"60","5.246088274","2001:4860:4860::8844","2601:5cf:4100:3de0:3d84:6c14:e3a4:affc","TLSv1.3","734","Application Data, Application Data"
"61","5.246100297","2601:5cf:4100:3de0:3d84:6c14:e3a4:affc","2001:4860:4860::8844","TLSv1.3","411","Application Data, Application Data, Application Data, Application Data"
"62","5.265435609","2001:4860:4860::8844","2601:5cf:4100:3de0:3d84:6c14:e3a4:affc","TLSv1.3","117","Application Data"
"63","5.265464784","2601:5cf:4100:3de0:3d84:6c14:e3a4:affc","2001:4860:4860::8844","TLSv1.3","117","Application Data"
"64","5.274653065","2001:4860:4860::8844","2601:5cf:4100:3de0:3d84:6c14:e3a4:affc","TLSv1.3","368","Application Data"
"65","5.274653316","2001:4860:4860::8844","2601:5cf:4100:3de0:3d84:6c14:e3a4:affc","TLSv1.3","213","Application Data"
"66","5.274806628","2001:4860:4860::8844","2601:5cf:4100:3de0:3d84:6c14:e3a4:affc","TLSv1.3","156","Application Data, Application Data"
"67","5.275715362","2601:5cf:4100:3de0:3d84:6c14:e3a4:affc","2001:4860:4860::8844","TCP","86","41092  >  443 [RST, ACK] Seq=954 Ack=5606 Win=64128 Len=0 TSval=2580581544 TSecr=1262750959"
"68","5.290100299","2001:4860:4860::8844","2601:5cf:4100:3de0:3d84:6c14:e3a4:affc","TCP","86","443  >  41092 [ACK] Seq=5606 Ack=954 Win=67840 Len=0 TSval=1262750975 TSecr=2580581534"
"69","5.290128903","2601:5cf:4100:3de0:3d84:6c14:e3a4:affc","2001:4860:4860::8844","TCP","74","41092  >  443 [RST] Seq=954 Win=0 Len=0"
"70","5.400386365","2601:5cf:4100:3de0:3d84:6c14:e3a4:affc","2001:4860:4860::8844","TCP","94","41104  >  443 [SYN] Seq=0 Win=64800 Len=0 MSS=1440 SACK_PERM TSval=2580581669 TSecr=0 WS=128"
"71","5.530998855","2001:4860:4860::8844","2601:5cf:4100:3de0:3d84:6c14:e3a4:affc","TCP","94","443  >  41104 [SYN, ACK] Seq=0 Ack=1 Win=65535 Len=0 MSS=1440 SACK_PERM TSval=3853678478 TSecr=2580581669 WS=256"
"72","5.531029964","2601:5cf:4100:3de0:3d84:6c14:e3a4:affc","2001:4860:4860::8844","TCP","86","41104  >  443 [ACK] Seq=1 Ack=1 Win=64896 Len=0 TSval=2580581799 TSecr=3853678478"
"73","5.531421140","2601:5cf:4100:3de0:3d84:6c14:e3a4:affc","2001:4860:4860::8844","TLSv1.3","603","Client Hello (SNI=dns.google)"
"74","5.560001461","2001:4860:4860::8844","2601:5cf:4100:3de0:3d84:6c14:e3a4:affc","TCP","86","443  >  41104 [ACK] Seq=1 Ack=518 Win=66816 Len=0 TSval=3853678583 TSecr=2580581800"
"75","5.560800265","2001:4860:4860::8844","2601:5cf:4100:3de0:3d84:6c14:e3a4:affc","TLSv1.3","1294","Server Hello, Change Cipher Spec"
"76","5.560813721","2601:5cf:4100:3de0:3d84:6c14:e3a4:affc","2001:4860:4860::8844","TCP","86","41104  >  443 [ACK] Seq=518 Ack=1209 Win=64128 Len=0 TSval=2580581829 TSecr=3853678584"
"77","5.562148348","2001:4860:4860::8844","2601:5cf:4100:3de0:3d84:6c14:e3a4:affc","TCP","1294","443  >  41104 [PSH, ACK] Seq=1209 Ack=518 Win=66816 Len=1208 TSval=3853678584 TSecr=2580581800 [TCP segment of a reassembled PDU]"
"78","5.562155381","2601:5cf:4100:3de0:3d84:6c14:e3a4:affc","2001:4860:4860::8844","TCP","86","41104  >  443 [ACK] Seq=518 Ack=2417 Win=64128 Len=0 TSval=2580581830 TSecr=3853678584"
"79","5.562967941","2001:4860:4860::8844","2601:5cf:4100:3de0:3d84:6c14:e3a4:affc","TCP","1294","443  >  41104 [ACK] Seq=2417 Ack=518 Win=66816 Len=1208 TSval=3853678584 TSecr=2580581800 [TCP segment of a reassembled PDU]"
"80","5.562972360","2601:5cf:4100:3de0:3d84:6c14:e3a4:affc","2001:4860:4860::8844","TCP","86","41104  >  443 [ACK] Seq=518 Ack=3625 Win=64128 Len=0 TSval=2580581831 TSecr=3853678584"
"81","5.563828784","2001:4860:4860::8844","2601:5cf:4100:3de0:3d84:6c14:e3a4:affc","TLSv1.3","911","Application Data"
"82","5.563834866","2601:5cf:4100:3de0:3d84:6c14:e3a4:affc","2001:4860:4860::8844","TCP","86","41104  >  443 [ACK] Seq=518 Ack=4450 Win=64128 Len=0 TSval=2580581832 TSecr=3853678584"
"83","5.565218405","2601:5cf:4100:3de0:3d84:6c14:e3a4:affc","2001:4860:4860::8844","TLSv1.3","166","Change Cipher Spec, Application Data"
"84","5.592590291","2001:4860:4860::8844","2601:5cf:4100:3de0:3d84:6c14:e3a4:affc","TLSv1.3","734","Application Data, Application Data"
"85","5.592608806","2601:5cf:4100:3de0:3d84:6c14:e3a4:affc","2001:4860:4860::8844","TLSv1.3","406","Application Data, Application Data, Application Data, Application Data"
"86","5.632833395","2001:4860:4860::8844","2601:5cf:4100:3de0:3d84:6c14:e3a4:affc","TLSv1.3","117","Application Data"
"87","5.632833966","2001:4860:4860::8844","2601:5cf:4100:3de0:3d84:6c14:e3a4:affc","TLSv1.3","368","Application Data"
"88","5.632834006","2001:4860:4860::8844","2601:5cf:4100:3de0:3d84:6c14:e3a4:affc","TLSv1.3","203","Application Data"
"89","5.632834056","2001:4860:4860::8844","2601:5cf:4100:3de0:3d84:6c14:e3a4:affc","TLSv1.3","117","Application Data"
"90","5.632834106","2001:4860:4860::8844","2601:5cf:4100:3de0:3d84:6c14:e3a4:affc","TLSv1.3","125","Application Data"
"91","5.632886175","2601:5cf:4100:3de0:3d84:6c14:e3a4:affc","2001:4860:4860::8844","TLSv1.3","117","Application Data"
"92","5.634225691","2601:5cf:4100:3de0:3d84:6c14:e3a4:affc","2001:4860:4860::8844","TCP","86","41104  >  443 [RST, ACK] Seq=949 Ack=5598 Win=64128 Len=0 TSval=2580581902 TSecr=3853678650"
"93","5.758187809","2601:5cf:4100:3de0:3d84:6c14:e3a4:affc","2001:4860:4860::8888","TCP","94","48764  >  443 [SYN] Seq=0 Win=64800 Len=0 MSS=1440 SACK_PERM TSval=1773013181 TSecr=0 WS=128"
"94","5.940064649","2001:4860:4860::8888","2601:5cf:4100:3de0:3d84:6c14:e3a4:affc","TCP","94","443  >  48764 [SYN, ACK] Seq=0 Ack=1 Win=65535 Len=0 MSS=1440 SACK_PERM TSval=3356923170 TSecr=1773013181 WS=256"
"95","5.940103614","2601:5cf:4100:3de0:3d84:6c14:e3a4:affc","2001:4860:4860::8888","TCP","86","48764  >  443 [ACK] Seq=1 Ack=1 Win=64896 Len=0 TSval=1773013363 TSecr=3356923170"
"96","5.940475984","2601:5cf:4100:3de0:3d84:6c14:e3a4:affc","2001:4860:4860::8888","TLSv1.3","603","Client Hello (SNI=dns.google)"
"97","6.045153899","2001:4860:4860::8888","2601:5cf:4100:3de0:3d84:6c14:e3a4:affc","TCP","86","443  >  48764 [ACK] Seq=1 Ack=518 Win=66816 Len=0 TSval=3356923277 TSecr=1773013364"
"98","6.045154230","2001:4860:4860::8888","2601:5cf:4100:3de0:3d84:6c14:e3a4:affc","TLSv1.3","2502","Server Hello, Change Cipher Spec"
"99","6.045154270","2001:4860:4860::8888","2601:5cf:4100:3de0:3d84:6c14:e3a4:affc","TLSv1.3","2119","Application Data"
"100","6.045184658","2601:5cf:4100:3de0:3d84:6c14:e3a4:affc","2001:4860:4860::8888","TCP","86","48764  >  443 [ACK] Seq=518 Ack=2417 Win=62592 Len=0 TSval=1773013468 TSecr=3356923278"
"101","6.045194777","2601:5cf:4100:3de0:3d84:6c14:e3a4:affc","2001:4860:4860::8888","TCP","86","48764  >  443 [ACK] Seq=518 Ack=4450 Win=60672 Len=0 TSval=1773013468 TSecr=3356923278"
"102","6.046270851","2601:5cf:4100:3de0:3d84:6c14:e3a4:affc","2001:4860:4860::8888","TLSv1.3","166","Change Cipher Spec, Application Data"
"103","6.145043148","2001:4860:4860::8888","2601:5cf:4100:3de0:3d84:6c14:e3a4:affc","TLSv1.3","734","Application Data, Application Data"
"104","6.145069328","2601:5cf:4100:3de0:3d84:6c14:e3a4:affc","2001:4860:4860::8888","TLSv1.3","409","Application Data, Application Data, Application Data, Application Data"
"105","6.257523901","2001:4860:4860::8888","2601:5cf:4100:3de0:3d84:6c14:e3a4:affc","TLSv1.3","117","Application Data"
"106","6.257574828","2601:5cf:4100:3de0:3d84:6c14:e3a4:affc","2001:4860:4860::8888","TLSv1.3","117","Application Data"
"107","6.276561214","2001:4860:4860::8888","2601:5cf:4100:3de0:3d84:6c14:e3a4:affc","TLSv1.3","367","Application Data"
"108","6.276561866","2001:4860:4860::8888","2601:5cf:4100:3de0:3d84:6c14:e3a4:affc","TLSv1.3","201","Application Data"
"109","6.276561986","2001:4860:4860::8888","2601:5cf:4100:3de0:3d84:6c14:e3a4:affc","TLSv1.3","117","Application Data"
"110","6.276562106","2001:4860:4860::8888","2601:5cf:4100:3de0:3d84:6c14:e3a4:affc","TLSv1.3","125","Application Data"
"111","6.277746686","2601:5cf:4100:3de0:3d84:6c14:e3a4:affc","2001:4860:4860::8888","TCP","86","48764  >  443 [RST, ACK] Seq=952 Ack=5595 Win=64128 Len=0 TSval=1773013701 TSecr=3356923573"
"112","6.349723277","2001:4860:4860::8888","2601:5cf:4100:3de0:3d84:6c14:e3a4:affc","TCP","86","443  >  48764 [ACK] Seq=5595 Ack=952 Win=67840 Len=0 TSval=3356923609 TSecr=1773013681"
"113","6.349745981","2601:5cf:4100:3de0:3d84:6c14:e3a4:affc","2001:4860:4860::8888","TCP","74","48764  >  443 [RST] Seq=952 Win=0 Len=0"
"114","6.400186521","2601:5cf:4100:3de0:3d84:6c14:e3a4:affc","2001:4860:4860::8888","TCP","94","48776  >  443 [SYN] Seq=0 Win=64800 Len=0 MSS=1440 SACK_PERM TSval=1773013823 TSecr=0 WS=128"
"115","6.554597154","2001:4860:4860::8888","2601:5cf:4100:3de0:3d84:6c14:e3a4:affc","TCP","94","443  >  48776 [SYN, ACK] Seq=0 Ack=1 Win=65535 Len=0 MSS=1440 SACK_PERM TSval=3678610147 TSecr=1773013823 WS=256"
"116","6.554656007","2601:5cf:4100:3de0:3d84:6c14:e3a4:affc","2001:4860:4860::8888","TCP","86","48776  >  443 [ACK] Seq=1 Ack=1 Win=64896 Len=0 TSval=1773013978 TSecr=3678610147"
"117","6.555382252","2601:5cf:4100:3de0:3d84:6c14:e3a4:affc","2001:4860:4860::8888","TLSv1.3","603","Client Hello (SNI=dns.google)"
"118","6.657040515","2001:4860:4860::8888","2601:5cf:4100:3de0:3d84:6c14:e3a4:affc","TCP","86","443  >  48776 [ACK] Seq=1 Ack=518 Win=66816 Len=0 TSval=3678610259 TSecr=1773013979"
"119","6.657040775","2001:4860:4860::8888","2601:5cf:4100:3de0:3d84:6c14:e3a4:affc","TLSv1.3","2502","Server Hello, Change Cipher Spec"
"120","6.657040805","2001:4860:4860::8888","2601:5cf:4100:3de0:3d84:6c14:e3a4:affc","TLSv1.3","2117","Application Data"
"121","6.657071714","2601:5cf:4100:3de0:3d84:6c14:e3a4:affc","2001:4860:4860::8888","TCP","86","48776  >  443 [ACK] Seq=518 Ack=2417 Win=62592 Len=0 TSval=1773014080 TSecr=3678610260"
"122","6.657083878","2601:5cf:4100:3de0:3d84:6c14:e3a4:affc","2001:4860:4860::8888","TCP","86","48776  >  443 [ACK] Seq=518 Ack=4448 Win=60672 Len=0 TSval=1773014080 TSecr=3678610260"
"123","6.658277345","2601:5cf:4100:3de0:3d84:6c14:e3a4:affc","2001:4860:4860::8888","TLSv1.3","166","Change Cipher Spec, Application Data"
"124","6.685758088","2001:4860:4860::8888","2601:5cf:4100:3de0:3d84:6c14:e3a4:affc","TLSv1.3","734","Application Data, Application Data"
"125","6.685802492","2601:5cf:4100:3de0:3d84:6c14:e3a4:affc","2001:4860:4860::8888","TLSv1.3","404","Application Data, Application Data, Application Data, Application Data"
"126","6.759357083","2001:4860:4860::8888","2601:5cf:4100:3de0:3d84:6c14:e3a4:affc","TLSv1.3","117","Application Data"
"127","6.759386208","2601:5cf:4100:3de0:3d84:6c14:e3a4:affc","2001:4860:4860::8888","TLSv1.3","117","Application Data"
"128","6.787072214","2001:4860:4860::8888","2601:5cf:4100:3de0:3d84:6c14:e3a4:affc","TCP","86","443  >  48776 [ACK] Seq=5127 Ack=947 Win=67840 Len=0 TSval=3678610457 TSecr=1773014183"
"129","6.964063351","2001:4860:4860::8888","2601:5cf:4100:3de0:3d84:6c14:e3a4:affc","TLSv1.3","369","Application Data"
"130","6.964063792","2001:4860:4860::8888","2601:5cf:4100:3de0:3d84:6c14:e3a4:affc","TLSv1.3","294","Application Data"
"131","6.964063922","2001:4860:4860::8888","2601:5cf:4100:3de0:3d84:6c14:e3a4:affc","TLSv1.3","156","Application Data, Application Data"
"132","6.965600384","2601:5cf:4100:3de0:3d84:6c14:e3a4:affc","2001:4860:4860::8888","TCP","86","48776  >  443 [RST, ACK] Seq=947 Ack=5688 Win=64128 Len=0 TSval=1773014389 TSecr=3678610582"
"133","7.090376486","2601:5cf:4100:3de0:3d84:6c14:e3a4:affc","2001:4860:4860::8888","TCP","94","48784  >  443 [SYN] Seq=0 Win=64800 Len=0 MSS=1440 SACK_PERM TSval=1773014514 TSecr=0 WS=128"
"135","7.224464904","2001:4860:4860::8888","2601:5cf:4100:3de0:3d84:6c14:e3a4:affc","TCP","94","443  >  48784 [SYN, ACK] Seq=0 Ack=1 Win=65535 Len=0 MSS=1440 SACK_PERM TSval=1773910524 TSecr=1773014514 WS=256"
"136","7.224512335","2601:5cf:4100:3de0:3d84:6c14:e3a4:affc","2001:4860:4860::8888","TCP","86","48784  >  443 [ACK] Seq=1 Ack=1 Win=64896 Len=0 TSval=1773014648 TSecr=1773910524"
"137","7.225443752","2601:5cf:4100:3de0:3d84:6c14:e3a4:affc","2001:4860:4860::8888","TLSv1.3","603","Client Hello (SNI=dns.google)"
"139","7.270687867","2001:4860:4860::8888","2601:5cf:4100:3de0:3d84:6c14:e3a4:affc","TCP","86","443  >  48784 [ACK] Seq=1 Ack=518 Win=66816 Len=0 TSval=1773910585 TSecr=1773014649"
"140","7.270687997","2001:4860:4860::8888","2601:5cf:4100:3de0:3d84:6c14:e3a4:affc","TLSv1.3","2502","Server Hello, Change Cipher Spec"
"141","7.270688117","2001:4860:4860::8888","2601:5cf:4100:3de0:3d84:6c14:e3a4:affc","TLSv1.3","2117","Application Data"
"142","7.270762479","2601:5cf:4100:3de0:3d84:6c14:e3a4:affc","2001:4860:4860::8888","TCP","86","48784  >  443 [ACK] Seq=518 Ack=2417 Win=63104 Len=0 TSval=1773014694 TSecr=1773910585"
"143","7.270783509","2601:5cf:4100:3de0:3d84:6c14:e3a4:affc","2001:4860:4860::8888","TCP","86","48784  >  443 [ACK] Seq=518 Ack=4448 Win=61184 Len=0 TSval=1773014694 TSecr=1773910585"
"144","7.271987727","2601:5cf:4100:3de0:3d84:6c14:e3a4:affc","2001:4860:4860::8888","TLSv1.3","166","Change Cipher Spec, Application Data"
"145","7.373986699","2001:4860:4860::8888","2601:5cf:4100:3de0:3d84:6c14:e3a4:affc","TLSv1.3","734","Application Data, Application Data"
"146","7.374031494","2601:5cf:4100:3de0:3d84:6c14:e3a4:affc","2001:4860:4860::8888","TLSv1.3","405","Application Data, Application Data, Application Data, Application Data"
"147","7.476219026","2001:4860:4860::8888","2601:5cf:4100:3de0:3d84:6c14:e3a4:affc","TLSv1.3","117","Application Data"
"148","7.476219477","2001:4860:4860::8888","2601:5cf:4100:3de0:3d84:6c14:e3a4:affc","TLSv1.3","368","Application Data"
"149","7.476219587","2001:4860:4860::8888","2601:5cf:4100:3de0:3d84:6c14:e3a4:affc","TLSv1.3","203","Application Data"
"150","7.476219708","2001:4860:4860::8888","2601:5cf:4100:3de0:3d84:6c14:e3a4:affc","TLSv1.3","117","Application Data"
"151","7.476219808","2001:4860:4860::8888","2601:5cf:4100:3de0:3d84:6c14:e3a4:affc","TLSv1.3","125","Application Data"
"152","7.476273490","2601:5cf:4100:3de0:3d84:6c14:e3a4:affc","2001:4860:4860::8888","TLSv1.3","117","Application Data"
"153","7.477749496","2601:5cf:4100:3de0:3d84:6c14:e3a4:affc","2001:4860:4860::8888","TCP","86","48784  >  443 [RST, ACK] Seq=948 Ack=5596 Win=64128 Len=0 TSval=1773014901 TSecr=1773910744"
"154","7.599903825","2601:5cf:4100:3de0:3d84:6c14:e3a4:affc","2001:4860:4860::8888","TCP","94","48788  >  443 [SYN] Seq=0 Win=64800 Len=0 MSS=1440 SACK_PERM TSval=1773015023 TSecr=0 WS=128"
"155","7.783421822","2001:4860:4860::8888","2601:5cf:4100:3de0:3d84:6c14:e3a4:affc","TCP","94","443  >  48788 [SYN, ACK] Seq=0 Ack=1 Win=65535 Len=0 MSS=1440 SACK_PERM TSval=3406600653 TSecr=1773015023 WS=256"
"156","7.783453783","2601:5cf:4100:3de0:3d84:6c14:e3a4:affc","2001:4860:4860::8888","TCP","86","48788  >  443 [ACK] Seq=1 Ack=1 Win=64896 Len=0 TSval=1773015207 TSecr=3406600653"
"157","7.783808570","2601:5cf:4100:3de0:3d84:6c14:e3a4:affc","2001:4860:4860::8888","TLSv1.3","603","Client Hello (SNI=dns.google)"
"158","7.811018247","2001:4860:4860::8888","2601:5cf:4100:3de0:3d84:6c14:e3a4:affc","TCP","86","443  >  48788 [ACK] Seq=1 Ack=518 Win=66816 Len=0 TSval=3406600758 TSecr=1773015207"
"159","7.812795427","2001:4860:4860::8888","2601:5cf:4100:3de0:3d84:6c14:e3a4:affc","TLSv1.3","2502","Server Hello, Change Cipher Spec"
"160","7.812795878","2001:4860:4860::8888","2601:5cf:4100:3de0:3d84:6c14:e3a4:affc","TLSv1.3","2118","Application Data"
"161","7.812839622","2601:5cf:4100:3de0:3d84:6c14:e3a4:affc","2001:4860:4860::8888","TCP","86","48788  >  443 [ACK] Seq=518 Ack=2417 Win=62592 Len=0 TSval=1773015236 TSecr=3406600760"
"162","7.812862646","2601:5cf:4100:3de0:3d84:6c14:e3a4:affc","2001:4860:4860::8888","TCP","86","48788  >  443 [ACK] Seq=518 Ack=4449 Win=60672 Len=0 TSval=1773015236 TSecr=3406600760"
"163","7.814425097","2601:5cf:4100:3de0:3d84:6c14:e3a4:affc","2001:4860:4860::8888","TLSv1.3","166","Change Cipher Spec, Application Data"
"164","7.885768499","2001:4860:4860::8888","2601:5cf:4100:3de0:3d84:6c14:e3a4:affc","TLSv1.3","734","Application Data, Application Data"
"165","7.885794839","2601:5cf:4100:3de0:3d84:6c14:e3a4:affc","2001:4860:4860::8888","TLSv1.3","398","Application Data, Application Data, Application Data, Application Data"
"166","7.913473299","2001:4860:4860::8888","2601:5cf:4100:3de0:3d84:6c14:e3a4:affc","TLSv1.3","117","Application Data"
"167","7.913524677","2601:5cf:4100:3de0:3d84:6c14:e3a4:affc","2001:4860:4860::8888","TLSv1.3","117","Application Data"
"168","7.923501814","2001:4860:4860::8888","2601:5cf:4100:3de0:3d84:6c14:e3a4:affc","TLSv1.3","368","Application Data"
"169","7.923502435","2001:4860:4860::8888","2601:5cf:4100:3de0:3d84:6c14:e3a4:affc","TLSv1.3","198","Application Data"
"170","7.923502565","2001:4860:4860::8888","2601:5cf:4100:3de0:3d84:6c14:e3a4:affc","TLSv1.3","156","Application Data, Application Data"
"171","7.924750987","2601:5cf:4100:3de0:3d84:6c14:e3a4:affc","2001:4860:4860::8888","TCP","86","48788  >  443 [RST, ACK] Seq=941 Ack=5592 Win=64128 Len=0 TSval=1773015348 TSecr=3406600871"
"172","7.941245979","2001:4860:4860::8888","2601:5cf:4100:3de0:3d84:6c14:e3a4:affc","TCP","86","443  >  48788 [ACK] Seq=5592 Ack=941 Win=67840 Len=0 TSval=3406600890 TSecr=1773015337"
"173","7.941277098","2601:5cf:4100:3de0:3d84:6c14:e3a4:affc","2001:4860:4860::8888","TCP","74","48788  >  443 [RST] Seq=941 Win=0 Len=0"
"174","8.046855260","2601:5cf:4100:3de0:3d84:6c14:e3a4:affc","2001:4860:4860::8844","TCP","94","41114  >  443 [SYN] Seq=0 Win=64800 Len=0 MSS=1440 SACK_PERM TSval=2580584315 TSecr=0 WS=128"
"175","8.193211805","2001:4860:4860::8844","2601:5cf:4100:3de0:3d84:6c14:e3a4:affc","TCP","94","443  >  41114 [SYN, ACK] Seq=0 Ack=1 Win=65535 Len=0 MSS=1440 SACK_PERM TSval=2096370580 TSecr=2580584315 WS=256"
"176","8.193270407","2601:5cf:4100:3de0:3d84:6c14:e3a4:affc","2001:4860:4860::8844","TCP","86","41114  >  443 [ACK] Seq=1 Ack=1 Win=64896 Len=0 TSval=2580584461 TSecr=2096370580"
"177","8.193739161","2601:5cf:4100:3de0:3d84:6c14:e3a4:affc","2001:4860:4860::8844","TLSv1.3","603","Client Hello (SNI=dns.google)"
"178","8.220169169","2001:4860:4860::8844","2601:5cf:4100:3de0:3d84:6c14:e3a4:affc","TCP","86","443  >  41114 [ACK] Seq=1 Ack=518 Win=66816 Len=0 TSval=2096370685 TSecr=2580584462"
"179","8.221171862","2001:4860:4860::8844","2601:5cf:4100:3de0:3d84:6c14:e3a4:affc","TLSv1.3","2502","Server Hello, Change Cipher Spec"
"180","8.221199395","2601:5cf:4100:3de0:3d84:6c14:e3a4:affc","2001:4860:4860::8844","TCP","86","41114  >  443 [ACK] Seq=518 Ack=2417 Win=62592 Len=0 TSval=2580584489 TSecr=2096370686"
"181","8.222145189","2001:4860:4860::8844","2601:5cf:4100:3de0:3d84:6c14:e3a4:affc","TLSv1.3","2117","Application Data"
"182","8.222170417","2601:5cf:4100:3de0:3d84:6c14:e3a4:affc","2001:4860:4860::8844","TCP","86","41114  >  443 [ACK] Seq=518 Ack=4448 Win=62976 Len=0 TSval=2580584490 TSecr=2096370686"
"183","8.223100642","2601:5cf:4100:3de0:3d84:6c14:e3a4:affc","2001:4860:4860::8844","TLSv1.3","166","Change Cipher Spec, Application Data"
"184","8.295296250","2001:4860:4860::8844","2601:5cf:4100:3de0:3d84:6c14:e3a4:affc","TLSv1.3","734","Application Data, Application Data"
"185","8.295321959","2601:5cf:4100:3de0:3d84:6c14:e3a4:affc","2001:4860:4860::8844","TLSv1.3","400","Application Data, Application Data, Application Data, Application Data"
"186","8.318621834","2001:4860:4860::8844","2601:5cf:4100:3de0:3d84:6c14:e3a4:affc","TLSv1.3","117","Application Data"
"187","8.318673463","2601:5cf:4100:3de0:3d84:6c14:e3a4:affc","2001:4860:4860::8844","TLSv1.3","117","Application Data"
"188","8.324459342","2001:4860:4860::8844","2601:5cf:4100:3de0:3d84:6c14:e3a4:affc","TLSv1.3","368","Application Data"
"189","8.324459583","2001:4860:4860::8844","2601:5cf:4100:3de0:3d84:6c14:e3a4:affc","TLSv1.3","199","Application Data"
"190","8.324459623","2001:4860:4860::8844","2601:5cf:4100:3de0:3d84:6c14:e3a4:affc","TLSv1.3","117","Application Data"
"191","8.324459663","2001:4860:4860::8844","2601:5cf:4100:3de0:3d84:6c14:e3a4:affc","TLSv1.3","125","Application Data"
"192","8.325479198","2601:5cf:4100:3de0:3d84:6c14:e3a4:affc","2001:4860:4860::8844","TCP","86","41114  >  443 [RST, ACK] Seq=943 Ack=5592 Win=64128 Len=0 TSval=2580584594 TSecr=2096370791"
"193","8.397706977","2001:4860:4860::8844","2601:5cf:4100:3de0:3d84:6c14:e3a4:affc","TCP","86","443  >  41114 [ACK] Seq=5592 Ack=943 Win=67840 Len=0 TSval=2096370819 TSecr=2580584587"
"194","8.397729260","2601:5cf:4100:3de0:3d84:6c14:e3a4:affc","2001:4860:4860::8844","TCP","74","41114  >  443 [RST] Seq=943 Win=0 Len=0"
"195","8.448179529","2601:5cf:4100:3de0:3d84:6c14:e3a4:affc","2001:4860:4860::8844","TCP","94","41126  >  443 [SYN] Seq=0 Win=64800 Len=0 MSS=1440 SACK_PERM TSval=2580584716 TSecr=0 WS=128"
"196","8.602625307","2001:4860:4860::8844","2601:5cf:4100:3de0:3d84:6c14:e3a4:affc","TCP","94","443  >  41126 [SYN, ACK] Seq=0 Ack=1 Win=65535 Len=0 MSS=1440 SACK_PERM TSval=1190544585 TSecr=2580584716 WS=256"
"197","8.602681234","2601:5cf:4100:3de0:3d84:6c14:e3a4:affc","2001:4860:4860::8844","TCP","86","41126  >  443 [ACK] Seq=1 Ack=1 Win=64896 Len=0 TSval=2580584871 TSecr=1190544585"
"198","8.603426005","2601:5cf:4100:3de0:3d84:6c14:e3a4:affc","2001:4860:4860::8844","TLSv1.3","603","Client Hello (SNI=dns.google)"
"199","8.627426317","2001:4860:4860::8844","2601:5cf:4100:3de0:3d84:6c14:e3a4:affc","TCP","86","443  >  41126 [ACK] Seq=1 Ack=518 Win=66816 Len=0 TSval=1190544688 TSecr=2580584872"
"200","8.628536766","2001:4860:4860::8844","2601:5cf:4100:3de0:3d84:6c14:e3a4:affc","TLSv1.3","1294","Server Hello, Change Cipher Spec"
"201","8.628583485","2601:5cf:4100:3de0:3d84:6c14:e3a4:affc","2001:4860:4860::8844","TCP","86","41126  >  443 [ACK] Seq=518 Ack=1209 Win=64128 Len=0 TSval=2580584897 TSecr=1190544689"
"202","8.629880880","2001:4860:4860::8844","2601:5cf:4100:3de0:3d84:6c14:e3a4:affc","TCP","1294","443  >  41126 [PSH, ACK] Seq=1209 Ack=518 Win=66816 Len=1208 TSval=1190544689 TSecr=2580584872 [TCP segment of a reassembled PDU]"
"203","8.629881131","2001:4860:4860::8844","2601:5cf:4100:3de0:3d84:6c14:e3a4:affc","TCP","1294","443  >  41126 [ACK] Seq=2417 Ack=518 Win=66816 Len=1208 TSval=1190544689 TSecr=2580584872 [TCP segment of a reassembled PDU]"
"204","8.629907010","2601:5cf:4100:3de0:3d84:6c14:e3a4:affc","2001:4860:4860::8844","TCP","86","41126  >  443 [ACK] Seq=518 Ack=2417 Win=63872 Len=0 TSval=2580584898 TSecr=1190544689"
"205","8.629917971","2601:5cf:4100:3de0:3d84:6c14:e3a4:affc","2001:4860:4860::8844","TCP","86","41126  >  443 [ACK] Seq=518 Ack=3625 Win=62720 Len=0 TSval=2580584898 TSecr=1190544689"
"206","8.630343914","2001:4860:4860::8844","2601:5cf:4100:3de0:3d84:6c14:e3a4:affc","TLSv1.3","910","Application Data"
"207","8.630372638","2601:5cf:4100:3de0:3d84:6c14:e3a4:affc","2001:4860:4860::8844","TCP","86","41126  >  443 [ACK] Seq=518 Ack=4449 Win=64128 Len=0 TSval=2580584898 TSecr=1190544689"
"208","8.631315848","2601:5cf:4100:3de0:3d84:6c14:e3a4:affc","2001:4860:4860::8844","TLSv1.3","166","Change Cipher Spec, Application Data"
"209","8.704989004","2001:4860:4860::8844","2601:5cf:4100:3de0:3d84:6c14:e3a4:affc","TLSv1.3","734","Application Data, Application Data"
"210","8.705014582","2601:5cf:4100:3de0:3d84:6c14:e3a4:affc","2001:4860:4860::8844","TLSv1.3","402","Application Data, Application Data, Application Data, Application Data"
"211","8.726617943","2001:4860:4860::8844","2601:5cf:4100:3de0:3d84:6c14:e3a4:affc","TLSv1.3","117","Application Data"
"212","8.726670182","2601:5cf:4100:3de0:3d84:6c14:e3a4:affc","2001:4860:4860::8844","TLSv1.3","117","Application Data"
"213","8.736324131","2001:4860:4860::8844","2601:5cf:4100:3de0:3d84:6c14:e3a4:affc","TLSv1.3","368","Application Data"
"214","8.736324582","2001:4860:4860::8844","2601:5cf:4100:3de0:3d84:6c14:e3a4:affc","TLSv1.3","198","Application Data"
"215","8.736324712","2001:4860:4860::8844","2601:5cf:4100:3de0:3d84:6c14:e3a4:affc","TLSv1.3","117","Application Data"
"216","8.736324832","2001:4860:4860::8844","2601:5cf:4100:3de0:3d84:6c14:e3a4:affc","TLSv1.3","125","Application Data"
"217","8.740683128","2601:5cf:4100:3de0:3d84:6c14:e3a4:affc","2001:4860:4860::8844","TCP","86","41126  >  443 [RST, ACK] Seq=945 Ack=5592 Win=64128 Len=0 TSval=2580585009 TSecr=1190544799"
"218","8.762030408","2001:4860:4860::8844","2601:5cf:4100:3de0:3d84:6c14:e3a4:affc","TCP","86","443  >  41126 [ACK] Seq=5592 Ack=945 Win=67840 Len=0 TSval=1190544825 TSecr=2580584995"
"219","8.762060365","2601:5cf:4100:3de0:3d84:6c14:e3a4:affc","2001:4860:4860::8844","TCP","74","41126  >  443 [RST] Seq=945 Win=0 Len=0"
"220","8.863034711","2601:5cf:4100:3de0:3d84:6c14:e3a4:affc","2001:4860:4860::8888","TCP","94","48800  >  443 [SYN] Seq=0 Win=64800 Len=0 MSS=1440 SACK_PERM TSval=1773016286 TSecr=0 WS=128"
"221","9.012277511","2001:4860:4860::8888","2601:5cf:4100:3de0:3d84:6c14:e3a4:affc","TCP","94","443  >  48800 [SYN, ACK] Seq=0 Ack=1 Win=65535 Len=0 MSS=1440 SACK_PERM TSval=1822194847 TSecr=1773016286 WS=256"
"222","9.012337876","2601:5cf:4100:3de0:3d84:6c14:e3a4:affc","2001:4860:4860::8888","TCP","86","48800  >  443 [ACK] Seq=1 Ack=1 Win=64896 Len=0 TSval=1773016435 TSecr=1822194847"
"223","9.013063771","2601:5cf:4100:3de0:3d84:6c14:e3a4:affc","2001:4860:4860::8888","TLSv1.3","603","Client Hello (SNI=dns.google)"
"224","9.080732632","2001:4860:4860::8888","2601:5cf:4100:3de0:3d84:6c14:e3a4:affc","TCP","86","443  >  48800 [ACK] Seq=1 Ack=518 Win=66816 Len=0 TSval=1822194956 TSecr=1773016436"
"225","9.080732893","2001:4860:4860::8888","2601:5cf:4100:3de0:3d84:6c14:e3a4:affc","TLSv1.3","2502","Server Hello, Change Cipher Spec"
"226","9.080732933","2001:4860:4860::8888","2601:5cf:4100:3de0:3d84:6c14:e3a4:affc","TLSv1.3","2119","Application Data"
"227","9.080762429","2601:5cf:4100:3de0:3d84:6c14:e3a4:affc","2001:4860:4860::8888","TCP","86","48800  >  443 [ACK] Seq=518 Ack=2417 Win=62592 Len=0 TSval=1773016504 TSecr=1822194957"
"228","9.080774522","2601:5cf:4100:3de0:3d84:6c14:e3a4:affc","2001:4860:4860::8888","TCP","86","48800  >  443 [ACK] Seq=518 Ack=4450 Win=60672 Len=0 TSval=1773016504 TSecr=1822194957"
"229","9.082146289","2601:5cf:4100:3de0:3d84:6c14:e3a4:affc","2001:4860:4860::8888","TLSv1.3","166","Change Cipher Spec, Application Data"
"232","9.215620253","2001:4860:4860::8888","2601:5cf:4100:3de0:3d84:6c14:e3a4:affc","TLSv1.3","734","Application Data, Application Data"
"233","9.215650982","2601:5cf:4100:3de0:3d84:6c14:e3a4:affc","2001:4860:4860::8888","TLSv1.3","405","Application Data, Application Data, Application Data, Application Data"
"234","9.241457660","2001:4860:4860::8888","2601:5cf:4100:3de0:3d84:6c14:e3a4:affc","TLSv1.3","117","Application Data"
"235","9.241510541","2601:5cf:4100:3de0:3d84:6c14:e3a4:affc","2001:4860:4860::8888","TLSv1.3","117","Application Data"
"236","9.243656786","2001:4860:4860::8888","2601:5cf:4100:3de0:3d84:6c14:e3a4:affc","TLSv1.3","369","Application Data"
"237","9.243657237","2001:4860:4860::8888","2601:5cf:4100:3de0:3d84:6c14:e3a4:affc","TLSv1.3","295","Application Data"
"238","9.243657357","2001:4860:4860::8888","2601:5cf:4100:3de0:3d84:6c14:e3a4:affc","TLSv1.3","117","Application Data"
"239","9.243657477","2001:4860:4860::8888","2601:5cf:4100:3de0:3d84:6c14:e3a4:affc","TLSv1.3","125","Application Data"
"240","9.245128223","2601:5cf:4100:3de0:3d84:6c14:e3a4:affc","2001:4860:4860::8888","TCP","86","48800  >  443 [RST, ACK] Seq=948 Ack=5691 Win=64128 Len=0 TSval=1773016668 TSecr=1822195158"
"241","9.319440889","2001:4860:4860::8888","2601:5cf:4100:3de0:3d84:6c14:e3a4:affc","TCP","86","443  >  48800 [ACK] Seq=5691 Ack=948 Win=67840 Len=0 TSval=1822195185 TSecr=1773016665"
"242","9.319480896","2601:5cf:4100:3de0:3d84:6c14:e3a4:affc","2001:4860:4860::8888","TCP","74","48800  >  443 [RST] Seq=948 Win=0 Len=0"
"243","9.366763270","2601:5cf:4100:3de0:3d84:6c14:e3a4:affc","2001:4860:4860::8888","TCP","94","48812  >  443 [SYN] Seq=0 Win=64800 Len=0 MSS=1440 SACK_PERM TSval=1773016790 TSecr=0 WS=128"
"245","9.523095708","2001:4860:4860::8888","2601:5cf:4100:3de0:3d84:6c14:e3a4:affc","TCP","94","443  >  48812 [SYN, ACK] Seq=0 Ack=1 Win=65535 Len=0 MSS=1440 SACK_PERM TSval=4102749289 TSecr=1773016790 WS=256"
"246","9.523149721","2601:5cf:4100:3de0:3d84:6c14:e3a4:affc","2001:4860:4860::8888","TCP","86","48812  >  443 [ACK] Seq=1 Ack=1 Win=64896 Len=0 TSval=1773016946 TSecr=4102749289"
"247","9.523832664","2601:5cf:4100:3de0:3d84:6c14:e3a4:affc","2001:4860:4860::8888","TLSv1.3","603","Client Hello (SNI=dns.google)"
"248","9.626794582","2001:4860:4860::8888","2601:5cf:4100:3de0:3d84:6c14:e3a4:affc","TCP","86","443  >  48812 [ACK] Seq=1 Ack=518 Win=66816 Len=0 TSval=4102749408 TSecr=1773016947"
"249","9.626795032","2001:4860:4860::8888","2601:5cf:4100:3de0:3d84:6c14:e3a4:affc","TLSv1.3","2502","Server Hello, Change Cipher Spec"
"250","9.626795163","2001:4860:4860::8888","2601:5cf:4100:3de0:3d84:6c14:e3a4:affc","TLSv1.3","2118","Application Data"
"251","9.626851831","2601:5cf:4100:3de0:3d84:6c14:e3a4:affc","2001:4860:4860::8888","TCP","86","48812  >  443 [ACK] Seq=518 Ack=2417 Win=62592 Len=0 TSval=1773017050 TSecr=4102749409"
"252","9.626874574","2601:5cf:4100:3de0:3d84:6c14:e3a4:affc","2001:4860:4860::8888","TCP","86","48812  >  443 [ACK] Seq=518 Ack=4449 Win=60672 Len=0 TSval=1773017050 TSecr=4102749409"
"253","9.628237324","2601:5cf:4100:3de0:3d84:6c14:e3a4:affc","2001:4860:4860::8888","TLSv1.3","166","Change Cipher Spec, Application Data"
"254","9.655957573","2001:4860:4860::8888","2601:5cf:4100:3de0:3d84:6c14:e3a4:affc","TLSv1.3","734","Application Data, Application Data"
"255","9.656003341","2601:5cf:4100:3de0:3d84:6c14:e3a4:affc","2001:4860:4860::8888","TLSv1.3","402","Application Data, Application Data, Application Data, Application Data"
"256","9.729164991","2001:4860:4860::8888","2601:5cf:4100:3de0:3d84:6c14:e3a4:affc","TLSv1.3","117","Application Data"
"257","9.729165241","2001:4860:4860::8888","2601:5cf:4100:3de0:3d84:6c14:e3a4:affc","TLSv1.3","368","Application Data"
"258","9.729165271","2001:4860:4860::8888","2601:5cf:4100:3de0:3d84:6c14:e3a4:affc","TLSv1.3","201","Application Data"
"259","9.729165312","2001:4860:4860::8888","2601:5cf:4100:3de0:3d84:6c14:e3a4:affc","TLSv1.3","156","Application Data, Application Data"
"260","9.729195309","2601:5cf:4100:3de0:3d84:6c14:e3a4:affc","2001:4860:4860::8888","TLSv1.3","117","Application Data"
"261","9.730211237","2601:5cf:4100:3de0:3d84:6c14:e3a4:affc","2001:4860:4860::8888","TCP","86","48812  >  443 [RST, ACK] Seq=945 Ack=5595 Win=64128 Len=0 TSval=1773017153 TSecr=4102749538"
"262","9.852655535","2601:5cf:4100:3de0:3d84:6c14:e3a4:affc","2001:4860:4860::8888","TCP","94","48818  >  443 [SYN] Seq=0 Win=64800 Len=0 MSS=1440 SACK_PERM TSval=1773017276 TSecr=0 WS=128"
"263","10.036256529","2001:4860:4860::8888","2601:5cf:4100:3de0:3d84:6c14:e3a4:affc","TCP","94","443  >  48818 [SYN, ACK] Seq=0 Ack=1 Win=65535 Len=0 MSS=1440 SACK_PERM TSval=493309163 TSecr=1773017276 WS=256"
"264","10.036312546","2601:5cf:4100:3de0:3d84:6c14:e3a4:affc","2001:4860:4860::8888","TCP","86","48818  >  443 [ACK] Seq=1 Ack=1 Win=64896 Len=0 TSval=1773017459 TSecr=493309163"
"265","10.037041888","2601:5cf:4100:3de0:3d84:6c14:e3a4:affc","2001:4860:4860::8888","TLSv1.3","603","Client Hello (SNI=dns.google)"
"266","10.138668457","2001:4860:4860::8888","2601:5cf:4100:3de0:3d84:6c14:e3a4:affc","TCP","86","443  >  48818 [ACK] Seq=1 Ack=518 Win=66816 Len=0 TSval=493309283 TSecr=1773017460"
"267","10.138668697","2001:4860:4860::8888","2601:5cf:4100:3de0:3d84:6c14:e3a4:affc","TLSv1.3","2502","Server Hello, Change Cipher Spec"
"268","10.138668738","2001:4860:4860::8888","2601:5cf:4100:3de0:3d84:6c14:e3a4:affc","TLSv1.3","2117","Application Data"
"269","10.138701500","2601:5cf:4100:3de0:3d84:6c14:e3a4:affc","2001:4860:4860::8888","TCP","86","48818  >  443 [ACK] Seq=518 Ack=2417 Win=62592 Len=0 TSval=1773017562 TSecr=493309283"
"270","10.138712070","2601:5cf:4100:3de0:3d84:6c14:e3a4:affc","2001:4860:4860::8888","TCP","86","48818  >  443 [ACK] Seq=518 Ack=4448 Win=60672 Len=0 TSval=1773017562 TSecr=493309283"
"271","10.139768506","2601:5cf:4100:3de0:3d84:6c14:e3a4:affc","2001:4860:4860::8888","TLSv1.3","166","Change Cipher Spec, Application Data"
"272","10.167723774","2001:4860:4860::8888","2601:5cf:4100:3de0:3d84:6c14:e3a4:affc","TLSv1.3","734","Application Data, Application Data"
"273","10.167769281","2601:5cf:4100:3de0:3d84:6c14:e3a4:affc","2001:4860:4860::8888","TLSv1.3","401","Application Data, Application Data, Application Data, Application Data"
"274","10.240859724","2001:4860:4860::8888","2601:5cf:4100:3de0:3d84:6c14:e3a4:affc","TLSv1.3","117","Application Data"
"275","10.240860145","2001:4860:4860::8888","2601:5cf:4100:3de0:3d84:6c14:e3a4:affc","TLSv1.3","368","Application Data"
"276","10.240860235","2001:4860:4860::8888","2601:5cf:4100:3de0:3d84:6c14:e3a4:affc","TLSv1.3","203","Application Data"
"277","10.240860325","2001:4860:4860::8888","2601:5cf:4100:3de0:3d84:6c14:e3a4:affc","TLSv1.3","117","Application Data"
"278","10.240860395","2001:4860:4860::8888","2601:5cf:4100:3de0:3d84:6c14:e3a4:affc","TLSv1.3","125","Application Data"
"279","10.240898909","2601:5cf:4100:3de0:3d84:6c14:e3a4:affc","2001:4860:4860::8888","TLSv1.3","117","Application Data"
"280","10.242046007","2601:5cf:4100:3de0:3d84:6c14:e3a4:affc","2001:4860:4860::8888","TCP","86","48818  >  443 [RST, ACK] Seq=944 Ack=5596 Win=64128 Len=0 TSval=1773017665 TSecr=493309409"
"281","10.270438078","2001:4860:4860::8888","2601:5cf:4100:3de0:3d84:6c14:e3a4:affc","TCP","86","443  >  48818 [ACK] Seq=5596 Ack=944 Win=67840 Len=0 TSval=493309480 TSecr=1773017664"
"282","10.270486651","2601:5cf:4100:3de0:3d84:6c14:e3a4:affc","2001:4860:4860::8888","TCP","74","48818  >  443 [RST] Seq=944 Win=0 Len=0"
"283","10.365737115","2601:5cf:4100:3de0:3d84:6c14:e3a4:affc","2001:4860:4860::8888","TCP","94","48834  >  443 [SYN] Seq=0 Win=64800 Len=0 MSS=1440 SACK_PERM TSval=1773017789 TSecr=0 WS=128"
"284","10.548020254","2001:4860:4860::8888","2601:5cf:4100:3de0:3d84:6c14:e3a4:affc","TCP","94","443  >  48834 [SYN, ACK] Seq=0 Ack=1 Win=65535 Len=0 MSS=1440 SACK_PERM TSval=1718717838 TSecr=1773017789 WS=256"
"285","10.548075860","2601:5cf:4100:3de0:3d84:6c14:e3a4:affc","2001:4860:4860::8888","TCP","86","48834  >  443 [ACK] Seq=1 Ack=1 Win=64896 Len=0 TSval=1773017971 TSecr=1718717838"
"286","10.548753573","2601:5cf:4100:3de0:3d84:6c14:e3a4:affc","2001:4860:4860::8888","TLSv1.3","603","Client Hello (SNI=dns.google)"
"287","10.575553316","2001:4860:4860::8888","2601:5cf:4100:3de0:3d84:6c14:e3a4:affc","TCP","86","443  >  48834 [ACK] Seq=1 Ack=518 Win=66816 Len=0 TSval=1718717927 TSecr=1773017972"
"288","10.576903873","2001:4860:4860::8888","2601:5cf:4100:3de0:3d84:6c14:e3a4:affc","TLSv1.3","1294","Server Hello, Change Cipher Spec"
"289","10.576947366","2601:5cf:4100:3de0:3d84:6c14:e3a4:affc","2001:4860:4860::8888","TCP","86","48834  >  443 [ACK] Seq=518 Ack=1209 Win=64128 Len=0 TSval=1773018000 TSecr=1718717928"
"290","10.577805934","2001:4860:4860::8888","2601:5cf:4100:3de0:3d84:6c14:e3a4:affc","TCP","1294","443  >  48834 [PSH, ACK] Seq=1209 Ack=518 Win=66816 Len=1208 TSval=1718717928 TSecr=1773017972 [TCP segment of a reassembled PDU]"
"291","10.577806175","2001:4860:4860::8888","2601:5cf:4100:3de0:3d84:6c14:e3a4:affc","TCP","1294","443  >  48834 [ACK] Seq=2417 Ack=518 Win=66816 Len=1208 TSval=1718717928 TSecr=1773017972 [TCP segment of a reassembled PDU]"
"292","10.577831543","2601:5cf:4100:3de0:3d84:6c14:e3a4:affc","2001:4860:4860::8888","TCP","86","48834  >  443 [ACK] Seq=518 Ack=2417 Win=63872 Len=0 TSval=1773018001 TSecr=1718717928"
"293","10.577841953","2601:5cf:4100:3de0:3d84:6c14:e3a4:affc","2001:4860:4860::8888","TCP","86","48834  >  443 [ACK] Seq=518 Ack=3625 Win=62720 Len=0 TSval=1773018001 TSecr=1718717928"
"294","10.578661106","2001:4860:4860::8888","2601:5cf:4100:3de0:3d84:6c14:e3a4:affc","TLSv1.3","910","Application Data"
"295","10.578686504","2601:5cf:4100:3de0:3d84:6c14:e3a4:affc","2001:4860:4860::8888","TCP","86","48834  >  443 [ACK] Seq=518 Ack=4449 Win=64128 Len=0 TSval=1773018002 TSecr=1718717928"
"296","10.580173090","2601:5cf:4100:3de0:3d84:6c14:e3a4:affc","2001:4860:4860::8888","TLSv1.3","166","Change Cipher Spec, Application Data"
"297","10.650653264","2001:4860:4860::8888","2601:5cf:4100:3de0:3d84:6c14:e3a4:affc","TLSv1.3","734","Application Data, Application Data"
"298","10.650698080","2601:5cf:4100:3de0:3d84:6c14:e3a4:affc","2001:4860:4860::8888","TLSv1.3","409","Application Data, Application Data, Application Data, Application Data"
"299","10.753015697","2001:4860:4860::8888","2601:5cf:4100:3de0:3d84:6c14:e3a4:affc","TLSv1.3","117","Application Data"
"300","10.753015948","2001:4860:4860::8888","2601:5cf:4100:3de0:3d84:6c14:e3a4:affc","TLSv1.3","368","Application Data"
"301","10.753015988","2001:4860:4860::8888","2601:5cf:4100:3de0:3d84:6c14:e3a4:affc","TLSv1.3","209","Application Data"
"302","10.753016028","2001:4860:4860::8888","2601:5cf:4100:3de0:3d84:6c14:e3a4:affc","TLSv1.3","117","Application Data"
"303","10.753016058","2001:4860:4860::8888","2601:5cf:4100:3de0:3d84:6c14:e3a4:affc","TLSv1.3","125","Application Data"
"304","10.753045494","2601:5cf:4100:3de0:3d84:6c14:e3a4:affc","2001:4860:4860::8888","TLSv1.3","117","Application Data"
"305","10.754104074","2601:5cf:4100:3de0:3d84:6c14:e3a4:affc","2001:4860:4860::8888","TCP","86","48834  >  443 [RST, ACK] Seq=952 Ack=5603 Win=64128 Len=0 TSval=1773018177 TSecr=1718718053"
"306","10.876970708","2601:5cf:4100:3de0:3d84:6c14:e3a4:affc","2001:4860:4860::8888","TCP","94","48844  >  443 [SYN] Seq=0 Win=64800 Len=0 MSS=1440 SACK_PERM TSval=1773018300 TSecr=0 WS=128"
"307","11.000665601","2001:4860:4860::8888","2601:5cf:4100:3de0:3d84:6c14:e3a4:affc","TCP","94","443  >  48844 [SYN, ACK] Seq=0 Ack=1 Win=65535 Len=0 MSS=1440 SACK_PERM TSval=3525612385 TSecr=1773018300 WS=256"
"308","11.000697933","2601:5cf:4100:3de0:3d84:6c14:e3a4:affc","2001:4860:4860::8888","TCP","86","48844  >  443 [ACK] Seq=1 Ack=1 Win=64896 Len=0 TSval=1773018424 TSecr=3525612385"
"309","11.001563684","2601:5cf:4100:3de0:3d84:6c14:e3a4:affc","2001:4860:4860::8888","TLSv1.3","603","Client Hello (SNI=dns.google)"
"310","11.059191275","2001:4860:4860::8888","2601:5cf:4100:3de0:3d84:6c14:e3a4:affc","TCP","86","443  >  48844 [ACK] Seq=1 Ack=518 Win=66816 Len=0 TSval=3525612430 TSecr=1773018425"
"311","11.059191736","2001:4860:4860::8888","2601:5cf:4100:3de0:3d84:6c14:e3a4:affc","TLSv1.3","2502","Server Hello, Change Cipher Spec"
"312","11.059191856","2001:4860:4860::8888","2601:5cf:4100:3de0:3d84:6c14:e3a4:affc","TLSv1.3","2118","Application Data"
"313","11.059245889","2601:5cf:4100:3de0:3d84:6c14:e3a4:affc","2001:4860:4860::8888","TCP","86","48844  >  443 [ACK] Seq=518 Ack=2417 Win=62592 Len=0 TSval=1773018482 TSecr=3525612430"
"314","11.059266258","2601:5cf:4100:3de0:3d84:6c14:e3a4:affc","2001:4860:4860::8888","TCP","86","48844  >  443 [ACK] Seq=518 Ack=4449 Win=60672 Len=0 TSval=1773018482 TSecr=3525612430"
"315","11.060795195","2601:5cf:4100:3de0:3d84:6c14:e3a4:affc","2001:4860:4860::8888","TLSv1.3","166","Change Cipher Spec, Application Data"
"316","11.087729665","2001:4860:4860::8888","2601:5cf:4100:3de0:3d84:6c14:e3a4:affc","TLSv1.3","734","Application Data, Application Data"
"317","11.087774330","2601:5cf:4100:3de0:3d84:6c14:e3a4:affc","2001:4860:4860::8888","TLSv1.3","406","Application Data, Application Data, Application Data, Application Data"
"318","11.162881240","2001:4860:4860::8888","2601:5cf:4100:3de0:3d84:6c14:e3a4:affc","TLSv1.3","117","Application Data"
"319","11.162910356","2601:5cf:4100:3de0:3d84:6c14:e3a4:affc","2001:4860:4860::8888","TLSv1.3","117","Application Data"
"320","11.190668137","2001:4860:4860::8888","2601:5cf:4100:3de0:3d84:6c14:e3a4:affc","TCP","86","443  >  48844 [ACK] Seq=5128 Ack=949 Win=67840 Len=0 TSval=3525612591 TSecr=1773018586"
"321","11.265063401","2001:4860:4860::8888","2601:5cf:4100:3de0:3d84:6c14:e3a4:affc","TLSv1.3","365","Application Data"
"322","11.265063852","2001:4860:4860::8888","2601:5cf:4100:3de0:3d84:6c14:e3a4:affc","TLSv1.3","149","Application Data"
"323","11.265063952","2001:4860:4860::8888","2601:5cf:4100:3de0:3d84:6c14:e3a4:affc","TLSv1.3","117","Application Data"
"324","11.265064082","2001:4860:4860::8888","2601:5cf:4100:3de0:3d84:6c14:e3a4:affc","TLSv1.3","125","Application Data"
"325","11.266276656","2601:5cf:4100:3de0:3d84:6c14:e3a4:affc","2001:4860:4860::8888","TCP","86","48844  >  443 [RST, ACK] Seq=949 Ack=5540 Win=64128 Len=0 TSval=1773018689 TSecr=3525612631"
"326","11.387811359","2601:5cf:4100:3de0:3d84:6c14:e3a4:affc","2001:4860:4860::8888","TCP","94","48854  >  443 [SYN] Seq=0 Win=64800 Len=0 MSS=1440 SACK_PERM TSval=1773018811 TSecr=0 WS=128"
"327","11.571999630","2001:4860:4860::8888","2601:5cf:4100:3de0:3d84:6c14:e3a4:affc","TCP","94","443  >  48854 [SYN, ACK] Seq=0 Ack=1 Win=65535 Len=0 MSS=1440 SACK_PERM TSval=2358826237 TSecr=1773018811 WS=256"
"328","11.572029147","2601:5cf:4100:3de0:3d84:6c14:e3a4:affc","2001:4860:4860::8888","TCP","86","48854  >  443 [ACK] Seq=1 Ack=1 Win=64896 Len=0 TSval=1773018995 TSecr=2358826237"
"329","11.572347624","2601:5cf:4100:3de0:3d84:6c14:e3a4:affc","2001:4860:4860::8888","TLSv1.3","603","Client Hello (SNI=dns.google)"
"330","11.674689777","2001:4860:4860::8888","2601:5cf:4100:3de0:3d84:6c14:e3a4:affc","TCP","86","443  >  48854 [ACK] Seq=1 Ack=518 Win=66816 Len=0 TSval=2358826345 TSecr=1773018995"
"331","11.674690018","2001:4860:4860::8888","2601:5cf:4100:3de0:3d84:6c14:e3a4:affc","TLSv1.3","2502","Server Hello, Change Cipher Spec"
"332","11.674690058","2001:4860:4860::8888","2601:5cf:4100:3de0:3d84:6c14:e3a4:affc","TLSv1.3","2117","Application Data"
"333","11.674720767","2601:5cf:4100:3de0:3d84:6c14:e3a4:affc","2001:4860:4860::8888","TCP","86","48854  >  443 [ACK] Seq=518 Ack=2417 Win=62592 Len=0 TSval=1773019098 TSecr=2358826346"
"334","11.674731146","2601:5cf:4100:3de0:3d84:6c14:e3a4:affc","2001:4860:4860::8888","TCP","86","48854  >  443 [ACK] Seq=518 Ack=4448 Win=60672 Len=0 TSval=1773019098 TSecr=2358826346"
"335","11.675794175","2601:5cf:4100:3de0:3d84:6c14:e3a4:affc","2001:4860:4860::8888","TLSv1.3","166","Change Cipher Spec, Application Data"
"336","11.703690849","2001:4860:4860::8888","2601:5cf:4100:3de0:3d84:6c14:e3a4:affc","TLSv1.3","734","Application Data, Application Data"
"337","11.703735996","2601:5cf:4100:3de0:3d84:6c14:e3a4:affc","2001:4860:4860::8888","TLSv1.3","400","Application Data, Application Data, Application Data, Application Data"
"338","11.776873699","2001:4860:4860::8888","2601:5cf:4100:3de0:3d84:6c14:e3a4:affc","TLSv1.3","117","Application Data"
"339","11.776874150","2001:4860:4860::8888","2601:5cf:4100:3de0:3d84:6c14:e3a4:affc","TLSv1.3","368","Application Data"
"340","11.776874281","2001:4860:4860::8888","2601:5cf:4100:3de0:3d84:6c14:e3a4:affc","TLSv1.3","213","Application Data"
"341","11.776874381","2001:4860:4860::8888","2601:5cf:4100:3de0:3d84:6c14:e3a4:affc","TLSv1.3","117","Application Data"
"342","11.776874481","2001:4860:4860::8888","2601:5cf:4100:3de0:3d84:6c14:e3a4:affc","TLSv1.3","125","Application Data"
"343","11.776927923","2601:5cf:4100:3de0:3d84:6c14:e3a4:affc","2001:4860:4860::8888","TLSv1.3","117","Application Data"
"344","11.778205430","2601:5cf:4100:3de0:3d84:6c14:e3a4:affc","2001:4860:4860::8888","TCP","86","48854  >  443 [RST, ACK] Seq=943 Ack=5606 Win=64128 Len=0 TSval=1773019201 TSecr=2358826484"
"345","11.801435812","2001:4860:4860::8888","2601:5cf:4100:3de0:3d84:6c14:e3a4:affc","TCP","86","443  >  48854 [ACK] Seq=5606 Ack=943 Win=67840 Len=0 TSval=2358826546 TSecr=1773019200"
"346","11.801469005","2601:5cf:4100:3de0:3d84:6c14:e3a4:affc","2001:4860:4860::8888","TCP","74","48854  >  443 [RST] Seq=943 Win=0 Len=0"
"347","11.900114085","2601:5cf:4100:3de0:3d84:6c14:e3a4:affc","2001:4860:4860::8844","TCP","94","41130  >  443 [SYN] Seq=0 Win=64800 Len=0 MSS=1440 SACK_PERM TSval=2580588168 TSecr=0 WS=128"
"349","12.084006732","2001:4860:4860::8844","2601:5cf:4100:3de0:3d84:6c14:e3a4:affc","TCP","94","443  >  41130 [SYN, ACK] Seq=0 Ack=1 Win=65535 Len=0 MSS=1440 SACK_PERM TSval=3141220188 TSecr=2580588168 WS=256"
"350","12.084034145","2601:5cf:4100:3de0:3d84:6c14:e3a4:affc","2001:4860:4860::8844","TCP","86","41130  >  443 [ACK] Seq=1 Ack=1 Win=64896 Len=0 TSval=2580588352 TSecr=3141220188"
"351","12.084392949","2601:5cf:4100:3de0:3d84:6c14:e3a4:affc","2001:4860:4860::8844","TLSv1.3","603","Client Hello (SNI=dns.google)"
"353","12.112877967","2001:4860:4860::8844","2601:5cf:4100:3de0:3d84:6c14:e3a4:affc","TCP","86","443  >  41130 [ACK] Seq=1 Ack=518 Win=66816 Len=0 TSval=3141220297 TSecr=2580588353"
"354","12.113762745","2001:4860:4860::8844","2601:5cf:4100:3de0:3d84:6c14:e3a4:affc","TLSv1.3","1294","Server Hello, Change Cipher Spec"
"355","12.113803473","2601:5cf:4100:3de0:3d84:6c14:e3a4:affc","2001:4860:4860::8844","TCP","86","41130  >  443 [ACK] Seq=518 Ack=1209 Win=64128 Len=0 TSval=2580588382 TSecr=3141220298"
"356","12.114942165","2001:4860:4860::8844","2601:5cf:4100:3de0:3d84:6c14:e3a4:affc","TCP","1294","443  >  41130 [PSH, ACK] Seq=1209 Ack=518 Win=66816 Len=1208 TSval=3141220298 TSecr=2580588353 [TCP segment of a reassembled PDU]"
"357","12.114942416","2001:4860:4860::8844","2601:5cf:4100:3de0:3d84:6c14:e3a4:affc","TCP","1294","443  >  41130 [ACK] Seq=2417 Ack=518 Win=66816 Len=1208 TSval=3141220298 TSecr=2580588353 [TCP segment of a reassembled PDU]"
"358","12.114967884","2601:5cf:4100:3de0:3d84:6c14:e3a4:affc","2001:4860:4860::8844","TCP","86","41130  >  443 [ACK] Seq=518 Ack=2417 Win=63872 Len=0 TSval=2580588383 TSecr=3141220298"
"359","12.114978535","2601:5cf:4100:3de0:3d84:6c14:e3a4:affc","2001:4860:4860::8844","TCP","86","41130  >  443 [ACK] Seq=518 Ack=3625 Win=62720 Len=0 TSval=2580588383 TSecr=3141220298"
"360","12.115803449","2001:4860:4860::8844","2601:5cf:4100:3de0:3d84:6c14:e3a4:affc","TLSv1.3","911","Application Data"
"361","12.115829338","2601:5cf:4100:3de0:3d84:6c14:e3a4:affc","2001:4860:4860::8844","TCP","86","41130  >  443 [ACK] Seq=518 Ack=4450 Win=64128 Len=0 TSval=2580588384 TSecr=3141220298"
"362","12.117342595","2601:5cf:4100:3de0:3d84:6c14:e3a4:affc","2001:4860:4860::8844","TLSv1.3","166","Change Cipher Spec, Application Data"
"363","12.143767393","2001:4860:4860::8844","2601:5cf:4100:3de0:3d84:6c14:e3a4:affc","TLSv1.3","734","Application Data, Application Data"
"364","12.143812018","2601:5cf:4100:3de0:3d84:6c14:e3a4:affc","2001:4860:4860::8844","TLSv1.3","402","Application Data, Application Data, Application Data, Application Data"
"365","12.186666422","2001:4860:4860::8844","2601:5cf:4100:3de0:3d84:6c14:e3a4:affc","TLSv1.3","117","Application Data"
"366","12.186717519","2601:5cf:4100:3de0:3d84:6c14:e3a4:affc","2001:4860:4860::8844","TLSv1.3","117","Application Data"
"367","12.212437471","2001:4860:4860::8844","2601:5cf:4100:3de0:3d84:6c14:e3a4:affc","TLSv1.3","368","Application Data"
"368","12.212437962","2001:4860:4860::8844","2601:5cf:4100:3de0:3d84:6c14:e3a4:affc","TLSv1.3","197","Application Data"
"369","12.212684041","2001:4860:4860::8844","2601:5cf:4100:3de0:3d84:6c14:e3a4:affc","TLSv1.3","117","Application Data"
"370","12.212684372","2001:4860:4860::8844","2601:5cf:4100:3de0:3d84:6c14:e3a4:affc","TLSv1.3","125","Application Data"
"371","12.213965156","2601:5cf:4100:3de0:3d84:6c14:e3a4:affc","2001:4860:4860::8844","TCP","86","41130  >  443 [RST, ACK] Seq=945 Ack=5592 Win=64128 Len=0 TSval=2580588482 TSecr=3141220399"
"372","12.219127545","2001:4860:4860::8844","2601:5cf:4100:3de0:3d84:6c14:e3a4:affc","TCP","86","443  >  41130 [ACK] Seq=5592 Ack=945 Win=67840 Len=0 TSval=3141220406 TSecr=2580588455"
"373","12.219168343","2601:5cf:4100:3de0:3d84:6c14:e3a4:affc","2001:4860:4860::8844","TCP","74","41130  >  443 [RST] Seq=945 Win=0 Len=0"
"374","12.338584782","2601:5cf:4100:3de0:3d84:6c14:e3a4:affc","2001:4860:4860::8844","TCP","94","41142  >  443 [SYN] Seq=0 Win=64800 Len=0 MSS=1440 SACK_PERM TSval=2580588607 TSecr=0 WS=128"
"376","12.494005817","2001:4860:4860::8844","2601:5cf:4100:3de0:3d84:6c14:e3a4:affc","TCP","94","443  >  41142 [SYN, ACK] Seq=0 Ack=1 Win=65535 Len=0 MSS=1440 SACK_PERM TSval=2238951283 TSecr=2580588607 WS=256"
"377","12.494061843","2601:5cf:4100:3de0:3d84:6c14:e3a4:affc","2001:4860:4860::8844","TCP","86","41142  >  443 [ACK] Seq=1 Ack=1 Win=64896 Len=0 TSval=2580588762 TSecr=2238951283"
"378","12.494754124","2601:5cf:4100:3de0:3d84:6c14:e3a4:affc","2001:4860:4860::8844","TLSv1.3","603","Client Hello (SNI=dns.google)"
"379","12.523041946","2001:4860:4860::8844","2601:5cf:4100:3de0:3d84:6c14:e3a4:affc","TCP","86","443  >  41142 [ACK] Seq=1 Ack=518 Win=66816 Len=0 TSval=2238951391 TSecr=2580588763"
"380","12.524917484","2001:4860:4860::8844","2601:5cf:4100:3de0:3d84:6c14:e3a4:affc","TLSv1.3","2502","Server Hello, Change Cipher Spec"
"381","12.524917925","2001:4860:4860::8844","2601:5cf:4100:3de0:3d84:6c14:e3a4:affc","TLSv1.3","2119","Application Data"
"382","12.524963081","2601:5cf:4100:3de0:3d84:6c14:e3a4:affc","2001:4860:4860::8844","TCP","86","41142  >  443 [ACK] Seq=518 Ack=2417 Win=62592 Len=0 TSval=2580588793 TSecr=2238951392"
"383","12.524985915","2601:5cf:4100:3de0:3d84:6c14:e3a4:affc","2001:4860:4860::8844","TCP","86","41142  >  443 [ACK] Seq=518 Ack=4450 Win=60672 Len=0 TSval=2580588793 TSecr=2238951392"
"384","12.526602510","2601:5cf:4100:3de0:3d84:6c14:e3a4:affc","2001:4860:4860::8844","TLSv1.3","166","Change Cipher Spec, Application Data"
"385","12.596265121","2001:4860:4860::8844","2601:5cf:4100:3de0:3d84:6c14:e3a4:affc","TLSv1.3","734","Application Data, Application Data"
"386","12.596310348","2601:5cf:4100:3de0:3d84:6c14:e3a4:affc","2001:4860:4860::8844","TLSv1.3","402","Application Data, Application Data, Application Data, Application Data"
"387","12.625514879","2001:4860:4860::8844","2601:5cf:4100:3de0:3d84:6c14:e3a4:affc","TLSv1.3","117","Application Data"
"388","12.625550707","2601:5cf:4100:3de0:3d84:6c14:e3a4:affc","2001:4860:4860::8844","TLSv1.3","117","Application Data"
"389","12.698665435","2001:4860:4860::8844","2601:5cf:4100:3de0:3d84:6c14:e3a4:affc","TCP","86","443  >  41142 [ACK] Seq=5129 Ack=945 Win=67840 Len=0 TSval=2238951524 TSecr=2580588894"
"390","12.708567207","2001:4860:4860::8844","2601:5cf:4100:3de0:3d84:6c14:e3a4:affc","TLSv1.3","367","Application Data"
"391","12.708567668","2001:4860:4860::8844","2601:5cf:4100:3de0:3d84:6c14:e3a4:affc","TLSv1.3","278","Application Data"
"392","12.708567788","2001:4860:4860::8844","2601:5cf:4100:3de0:3d84:6c14:e3a4:affc","TLSv1.3","117","Application Data"
"393","12.708567898","2001:4860:4860::8844","2601:5cf:4100:3de0:3d84:6c14:e3a4:affc","TLSv1.3","125","Application Data"
"394","12.709963932","2601:5cf:4100:3de0:3d84:6c14:e3a4:affc","2001:4860:4860::8844","TCP","86","41142  >  443 [RST, ACK] Seq=945 Ack=5672 Win=64128 Len=0 TSval=2580588978 TSecr=2238951578"
"395","12.832155695","2601:5cf:4100:3de0:3d84:6c14:e3a4:affc","2001:4860:4860::8888","TCP","94","48866  >  443 [SYN] Seq=0 Win=64800 Len=0 MSS=1440 SACK_PERM TSval=1773020255 TSecr=0 WS=128"
"396","13.005920567","2001:4860:4860::8888","2601:5cf:4100:3de0:3d84:6c14:e3a4:affc","TCP","94","443  >  48866 [SYN, ACK] Seq=0 Ack=1 Win=65535 Len=0 MSS=1440 SACK_PERM TSval=3990038210 TSecr=1773020255 WS=256"
"397","13.005977375","2601:5cf:4100:3de0:3d84:6c14:e3a4:affc","2001:4860:4860::8888","TCP","86","48866  >  443 [ACK] Seq=1 Ack=1 Win=64896 Len=0 TSval=1773020429 TSecr=3990038210"
"398","13.006663424","2601:5cf:4100:3de0:3d84:6c14:e3a4:affc","2001:4860:4860::8888","TLSv1.3","603","Client Hello (SNI=dns.google)"
"399","13.035059101","2001:4860:4860::8888","2601:5cf:4100:3de0:3d84:6c14:e3a4:affc","TCP","86","443  >  48866 [ACK] Seq=1 Ack=518 Win=66816 Len=0 TSval=3990038310 TSecr=1773020430"
"400","13.036170622","2001:4860:4860::8888","2601:5cf:4100:3de0:3d84:6c14:e3a4:affc","TLSv1.3","1294","Server Hello, Change Cipher Spec"
"401","13.036214806","2601:5cf:4100:3de0:3d84:6c14:e3a4:affc","2001:4860:4860::8888","TCP","86","48866  >  443 [ACK] Seq=518 Ack=1209 Win=64128 Len=0 TSval=1773020459 TSecr=3990038311"
"402","13.037485761","2001:4860:4860::8888","2601:5cf:4100:3de0:3d84:6c14:e3a4:affc","TCP","1294","443  >  48866 [PSH, ACK] Seq=1209 Ack=518 Win=66816 Len=1208 TSval=3990038311 TSecr=1773020430 [TCP segment of a reassembled PDU]"
"403","13.037486011","2001:4860:4860::8888","2601:5cf:4100:3de0:3d84:6c14:e3a4:affc","TCP","1294","443  >  48866 [ACK] Seq=2417 Ack=518 Win=66816 Len=1208 TSval=3990038311 TSecr=1773020430 [TCP segment of a reassembled PDU]"
"404","13.037511831","2601:5cf:4100:3de0:3d84:6c14:e3a4:affc","2001:4860:4860::8888","TCP","86","48866  >  443 [ACK] Seq=518 Ack=2417 Win=63872 Len=0 TSval=1773020461 TSecr=3990038311"
"405","13.037522411","2601:5cf:4100:3de0:3d84:6c14:e3a4:affc","2001:4860:4860::8888","TCP","86","48866  >  443 [ACK] Seq=518 Ack=3625 Win=62720 Len=0 TSval=1773020461 TSecr=3990038311"
"406","13.037932333","2001:4860:4860::8888","2601:5cf:4100:3de0:3d84:6c14:e3a4:affc","TLSv1.3","910","Application Data"
"407","13.037957691","2601:5cf:4100:3de0:3d84:6c14:e3a4:affc","2001:4860:4860::8888","TCP","86","48866  >  443 [ACK] Seq=518 Ack=4449 Win=64128 Len=0 TSval=1773020461 TSecr=3990038311"
"408","13.038886434","2601:5cf:4100:3de0:3d84:6c14:e3a4:affc","2001:4860:4860::8888","TLSv1.3","166","Change Cipher Spec, Application Data"
"409","13.107025969","2001:4860:4860::8888","2601:5cf:4100:3de0:3d84:6c14:e3a4:affc","TLSv1.3","734","Application Data, Application Data"
"410","13.107070203","2601:5cf:4100:3de0:3d84:6c14:e3a4:affc","2001:4860:4860::8888","TLSv1.3","403","Application Data, Application Data, Application Data, Application Data"
"411","13.209695086","2001:4860:4860::8888","2601:5cf:4100:3de0:3d84:6c14:e3a4:affc","TLSv1.3","117","Application Data"
"412","13.209695536","2001:4860:4860::8888","2601:5cf:4100:3de0:3d84:6c14:e3a4:affc","TLSv1.3","368","Application Data"
"413","13.209695667","2001:4860:4860::8888","2601:5cf:4100:3de0:3d84:6c14:e3a4:affc","TLSv1.3","200","Application Data"
"414","13.209695787","2001:4860:4860::8888","2601:5cf:4100:3de0:3d84:6c14:e3a4:affc","TLSv1.3","117","Application Data"
"415","13.209695887","2001:4860:4860::8888","2601:5cf:4100:3de0:3d84:6c14:e3a4:affc","TLSv1.3","125","Application Data"
"416","13.209746694","2601:5cf:4100:3de0:3d84:6c14:e3a4:affc","2001:4860:4860::8888","TLSv1.3","117","Application Data"
"417","13.211048748","2601:5cf:4100:3de0:3d84:6c14:e3a4:affc","2001:4860:4860::8888","TCP","86","48866  >  443 [RST, ACK] Seq=946 Ack=5594 Win=64128 Len=0 TSval=1773020634 TSecr=3990038426"
"418","13.332572907","2601:5cf:4100:3de0:3d84:6c14:e3a4:affc","2001:4860:4860::8888","TCP","94","56634  >  443 [SYN] Seq=0 Win=64800 Len=0 MSS=1440 SACK_PERM TSval=1773020756 TSecr=0 WS=128"
"420","13.443177523","2001:4860:4860::8888","2601:5cf:4100:3de0:3d84:6c14:e3a4:affc","TCP","94","443  >  56634 [SYN, ACK] Seq=0 Ack=1 Win=65535 Len=0 MSS=1440 SACK_PERM TSval=2391134563 TSecr=1773020756 WS=256"
"421","13.443235674","2601:5cf:4100:3de0:3d84:6c14:e3a4:affc","2001:4860:4860::8888","TCP","86","56634  >  443 [ACK] Seq=1 Ack=1 Win=64896 Len=0 TSval=1773020866 TSecr=2391134563"
"422","13.443877558","2601:5cf:4100:3de0:3d84:6c14:e3a4:affc","2001:4860:4860::8888","TLSv1.3","603","Client Hello (SNI=dns.google)"
"423","13.517821449","2001:4860:4860::8888","2601:5cf:4100:3de0:3d84:6c14:e3a4:affc","TCP","86","443  >  56634 [ACK] Seq=1 Ack=518 Win=66816 Len=0 TSval=2391134591 TSecr=1773020867"
"424","13.517821900","2001:4860:4860::8888","2601:5cf:4100:3de0:3d84:6c14:e3a4:affc","TLSv1.3","2502","Server Hello, Change Cipher Spec"
"425","13.517822020","2001:4860:4860::8888","2601:5cf:4100:3de0:3d84:6c14:e3a4:affc","TLSv1.3","2119","Application Data"
"426","13.517879019","2601:5cf:4100:3de0:3d84:6c14:e3a4:affc","2001:4860:4860::8888","TCP","86","56634  >  443 [ACK] Seq=518 Ack=2417 Win=62592 Len=0 TSval=1773020941 TSecr=2391134592"
"427","13.517901492","2601:5cf:4100:3de0:3d84:6c14:e3a4:affc","2001:4860:4860::8888","TCP","86","56634  >  443 [ACK] Seq=518 Ack=4450 Win=60672 Len=0 TSval=1773020941 TSecr=2391134592"
"428","13.519514810","2601:5cf:4100:3de0:3d84:6c14:e3a4:affc","2001:4860:4860::8888","TLSv1.3","166","Change Cipher Spec, Application Data"
"429","13.531240082","2001:4860:4860::8888","2601:5cf:4100:3de0:3d84:6c14:e3a4:affc","TCP","911","[TCP Spurious Retransmission] 443  >  56634 [PSH, ACK] Seq=3625 Ack=518 Win=66816 Len=825 TSval=2391134652 TSecr=1773020867 [TCP segment of a reassembled PDU]"
"430","13.531279717","2601:5cf:4100:3de0:3d84:6c14:e3a4:affc","2001:4860:4860::8888","TCP","98","[TCP Dup ACK 427#1] 56634  >  443 [ACK] Seq=598 Ack=4450 Win=64128 Len=0 TSval=1773020954 TSecr=2391134652 SLE=3625 SRE=4450"
"431","13.541727942","2001:4860:4860::8888","2601:5cf:4100:3de0:3d84:6c14:e3a4:affc","TLSv1.3","734","Application Data, Application Data"
"432","13.541753781","2601:5cf:4100:3de0:3d84:6c14:e3a4:affc","2001:4860:4860::8888","TLSv1.3","399","Application Data, Application Data, Application Data, Application Data"
"433","13.620268821","2001:4860:4860::8888","2601:5cf:4100:3de0:3d84:6c14:e3a4:affc","TLSv1.3","117","Application Data"
"434","13.620320009","2601:5cf:4100:3de0:3d84:6c14:e3a4:affc","2001:4860:4860::8888","TLSv1.3","117","Application Data"
"435","13.650193816","2001:4860:4860::8888","2601:5cf:4100:3de0:3d84:6c14:e3a4:affc","TCP","86","443  >  56634 [ACK] Seq=5129 Ack=942 Win=67840 Len=0 TSval=2391134772 TSecr=1773021043"
"437","13.823904914","2001:4860:4860::8888","2601:5cf:4100:3de0:3d84:6c14:e3a4:affc","TLSv1.3","368","Application Data"
"438","13.823905365","2001:4860:4860::8888","2601:5cf:4100:3de0:3d84:6c14:e3a4:affc","TLSv1.3","188","Application Data"
"439","13.823905486","2001:4860:4860::8888","2601:5cf:4100:3de0:3d84:6c14:e3a4:affc","TLSv1.3","117","Application Data"
"440","13.823905596","2001:4860:4860::8888","2601:5cf:4100:3de0:3d84:6c14:e3a4:affc","TLSv1.3","125","Application Data"
"441","13.825030893","2601:5cf:4100:3de0:3d84:6c14:e3a4:affc","2001:4860:4860::8888","TCP","86","56634  >  443 [RST, ACK] Seq=942 Ack=5583 Win=64128 Len=0 TSval=1773021248 TSecr=2391134924"
"449","13.948034515","2601:5cf:4100:3de0:3d84:6c14:e3a4:affc","2001:4860:4860::8844","TCP","94","39080  >  443 [SYN] Seq=0 Win=64800 Len=0 MSS=1440 SACK_PERM TSval=2580590216 TSecr=0 WS=128"
"450","14.132011810","2001:4860:4860::8844","2601:5cf:4100:3de0:3d84:6c14:e3a4:affc","TCP","94","443  >  39080 [SYN, ACK] Seq=0 Ack=1 Win=65535 Len=0 MSS=1440 SACK_PERM TSval=4193894868 TSecr=2580590216 WS=256"
"451","14.132044071","2601:5cf:4100:3de0:3d84:6c14:e3a4:affc","2001:4860:4860::8844","TCP","86","39080  >  443 [ACK] Seq=1 Ack=1 Win=64896 Len=0 TSval=2580590400 TSecr=4193894868"
"452","14.132401022","2601:5cf:4100:3de0:3d84:6c14:e3a4:affc","2001:4860:4860::8844","TLSv1.3","603","Client Hello (SNI=dns.google)"
"453","14.234645227","2001:4860:4860::8844","2601:5cf:4100:3de0:3d84:6c14:e3a4:affc","TCP","86","443  >  39080 [ACK] Seq=1 Ack=518 Win=66816 Len=0 TSval=4193894976 TSecr=2580590401"
"454","14.234645678","2001:4860:4860::8844","2601:5cf:4100:3de0:3d84:6c14:e3a4:affc","TLSv1.3","2502","Server Hello, Change Cipher Spec"
"455","14.234645798","2001:4860:4860::8844","2601:5cf:4100:3de0:3d84:6c14:e3a4:affc","TLSv1.3","2118","Application Data"
"456","14.234701965","2601:5cf:4100:3de0:3d84:6c14:e3a4:affc","2001:4860:4860::8844","TCP","86","39080  >  443 [ACK] Seq=518 Ack=2417 Win=62592 Len=0 TSval=2580590503 TSecr=4193894977"
"457","14.234724368","2601:5cf:4100:3de0:3d84:6c14:e3a4:affc","2001:4860:4860::8844","TCP","86","39080  >  443 [ACK] Seq=518 Ack=4449 Win=60672 Len=0 TSval=2580590503 TSecr=4193894977"
"458","14.236055437","2601:5cf:4100:3de0:3d84:6c14:e3a4:affc","2001:4860:4860::8844","TLSv1.3","166","Change Cipher Spec, Application Data"
"459","14.263123050","2001:4860:4860::8844","2601:5cf:4100:3de0:3d84:6c14:e3a4:affc","TLSv1.3","734","Application Data, Application Data"
"460","14.263168427","2601:5cf:4100:3de0:3d84:6c14:e3a4:affc","2001:4860:4860::8844","TLSv1.3","401","Application Data, Application Data, Application Data, Application Data"
"461","14.337026493","2001:4860:4860::8844","2601:5cf:4100:3de0:3d84:6c14:e3a4:affc","TLSv1.3","117","Application Data"
"462","14.337026814","2001:4860:4860::8844","2601:5cf:4100:3de0:3d84:6c14:e3a4:affc","TLSv1.3","368","Application Data"
"463","14.337026854","2001:4860:4860::8844","2601:5cf:4100:3de0:3d84:6c14:e3a4:affc","TLSv1.3","281","Application Data"
"464","14.337026894","2001:4860:4860::8844","2601:5cf:4100:3de0:3d84:6c14:e3a4:affc","TLSv1.3","117","Application Data"
"465","14.337026924","2001:4860:4860::8844","2601:5cf:4100:3de0:3d84:6c14:e3a4:affc","TLSv1.3","125","Application Data"
"466","14.337057242","2601:5cf:4100:3de0:3d84:6c14:e3a4:affc","2001:4860:4860::8844","TLSv1.3","117","Application Data"
"467","14.338127614","2601:5cf:4100:3de0:3d84:6c14:e3a4:affc","2001:4860:4860::8844","TCP","86","39080  >  443 [RST, ACK] Seq=944 Ack=5675 Win=64128 Len=0 TSval=2580590606 TSecr=4193895113"
"468","14.361919858","2001:4860:4860::8844","2601:5cf:4100:3de0:3d84:6c14:e3a4:affc","TCP","86","443  >  39080 [ACK] Seq=5675 Ack=944 Win=67840 Len=0 TSval=4193895177 TSecr=2580590605"
"469","14.361959874","2601:5cf:4100:3de0:3d84:6c14:e3a4:affc","2001:4860:4860::8844","TCP","74","39080  >  443 [RST] Seq=944 Win=0 Len=0"
