"No.","Time","Source","Destination","Protocol","Length","Type","HTTP2 Length","TCP Header Length","TLS Length","Info"
"6","1.477839387","2601:5cf:4100:3de0:53f4:479c:be9c:997d","2001:4860:4860::8844","TCP","94","","","40","","51196  >  443 [SYN] Seq=0 Win=64800 Len=0 MSS=1440 SACK_PERM TSval=3232756124 TSecr=0 WS=128"
"7","1.501744484","2001:4860:4860::8844","2601:5cf:4100:3de0:53f4:479c:be9c:997d","TCP","94","","","40","","443  >  51196 [SYN, ACK] Seq=0 Ack=1 Win=65535 Len=0 MSS=1440 SACK_PERM TSval=364778256 TSecr=3232756124 WS=256"
"8","1.501778641","2601:5cf:4100:3de0:53f4:479c:be9c:997d","2001:4860:4860::8844","TCP","86","","","32","","51196  >  443 [ACK] Seq=1 Ack=1 Win=64896 Len=0 TSval=3232756148 TSecr=364778256"
"9","1.502217162","2601:5cf:4100:3de0:53f4:479c:be9c:997d","2001:4860:4860::8844","TLSv1.3","603","","","32","512","Client Hello (SNI=dns.google)"
"10","1.739993581","2601:5cf:4100:3de0:53f4:479c:be9c:997d","2001:4860:4860::8844","TCP","603","","","32","","[TCP Retransmission] 51196  >  443 [PSH, ACK] Seq=1 Ack=1 Win=64896 Len=517 TSval=3232756387 TSecr=364778256"
"11","1.747563454","2001:4860:4860::8844","2601:5cf:4100:3de0:53f4:479c:be9c:997d","TCP","86","","","32","","443  >  51196 [ACK] Seq=1 Ack=518 Win=66816 Len=0 TSval=364778293 TSecr=3232756149"
"12","1.747563715","2001:4860:4860::8844","2601:5cf:4100:3de0:53f4:479c:be9c:997d","TLSv1.3","2502","","","32","122,1","Server Hello, Change Cipher Spec"
"13","1.747563765","2001:4860:4860::8844","2601:5cf:4100:3de0:53f4:479c:be9c:997d","TCP","1294","","","32","","443  >  51196 [ACK] Seq=2417 Ack=518 Win=66816 Len=1208 TSval=364778293 TSecr=3232756149 [TCP segment of a reassembled PDU]"
"14","1.747599014","2601:5cf:4100:3de0:53f4:479c:be9c:997d","2001:4860:4860::8844","TCP","86","","","32","","51196  >  443 [ACK] Seq=518 Ack=2417 Win=63744 Len=0 TSval=3232756394 TSecr=364778293"
"15","1.747612551","2601:5cf:4100:3de0:53f4:479c:be9c:997d","2001:4860:4860::8844","TCP","86","","","32","","51196  >  443 [ACK] Seq=518 Ack=3625 Win=62848 Len=0 TSval=3232756394 TSecr=364778293"
"16","1.747742987","2001:4860:4860::8844","2601:5cf:4100:3de0:53f4:479c:be9c:997d","TLSv1.3","910","","","32","4310","Encrypted Extensions, Certificate, Certificate Verify, Finished"
"17","1.747743187","2001:4860:4860::8844","2601:5cf:4100:3de0:53f4:479c:be9c:997d","TCP","910","","","32","","[TCP Retransmission] 443  >  51196 [PSH, ACK] Seq=3625 Ack=518 Win=66816 Len=824 TSval=364778346 TSecr=3232756149 [TCP segment of a reassembled PDU]"
"18","1.747750261","2601:5cf:4100:3de0:53f4:479c:be9c:997d","2001:4860:4860::8844","TCP","86","","","32","","51196  >  443 [ACK] Seq=518 Ack=4449 Win=62208 Len=0 TSval=3232756394 TSecr=364778293"
"19","1.747758337","2601:5cf:4100:3de0:53f4:479c:be9c:997d","2001:4860:4860::8844","TCP","98","","","44","","[TCP Dup ACK 18#1] 51196  >  443 [ACK] Seq=518 Ack=4449 Win=62208 Len=0 TSval=3232756394 TSecr=364778346 SLE=3625 SRE=4449"
"20","1.755846177","2601:5cf:4100:3de0:53f4:479c:be9c:997d","2001:4860:4860::8844","TLSv1.3","166","","","32","1,69","Change Cipher Spec, Finished"
"21","1.756243256","2601:5cf:4100:3de0:53f4:479c:be9c:997d","2001:4860:4860::8844","HTTP2","190","SETTINGS,WINDOW_UPDATE","36,4","32","99","Magic, SETTINGS[0], WINDOW_UPDATE[0]"
"22","1.764848834","2601:5cf:4100:3de0:53f4:479c:be9c:997d","2001:4860:4860::8844","DoH","279","HEADERS,WINDOW_UPDATE,DATA,DATA","65,4,22,0","32","104,48,26","Standard query 0xb228 NS 0.sb"
"23","1.769720148","2001:4860:4860::8844","2601:5cf:4100:3de0:53f4:479c:be9c:997d","TCP","98","","","44","","[TCP Dup ACK 11#1] 443  >  51196 [ACK] Seq=4449 Ack=518 Win=66816 Len=0 TSval=364778526 TSecr=3232756387 SLE=1 SRE=518"
"24","1.780270914","2001:4860:4860::8844","2601:5cf:4100:3de0:53f4:479c:be9c:997d","TCP","86","","","32","","443  >  51196 [ACK] Seq=4449 Ack=598 Win=66816 Len=0 TSval=364778536 TSecr=3232756402"
"25","1.780271395","2001:4860:4860::8844","2601:5cf:4100:3de0:53f4:479c:be9c:997d","TCP","86","","","32","","443  >  51196 [ACK] Seq=4449 Ack=702 Win=66816 Len=0 TSval=364778536 TSecr=3232756403"
"26","1.780271515","2001:4860:4860::8844","2601:5cf:4100:3de0:53f4:479c:be9c:997d","HTTP2","734","SETTINGS,WINDOW_UPDATE","18,4","32","581,57","SETTINGS[0], WINDOW_UPDATE[0]"
"27","1.780271616","2001:4860:4860::8844","2601:5cf:4100:3de0:53f4:479c:be9c:997d","HTTP2","117","SETTINGS","0","32","26","SETTINGS[0]"
"28","1.781231070","2601:5cf:4100:3de0:53f4:479c:be9c:997d","2001:4860:4860::8844","HTTP2","117","SETTINGS","0","32","26","SETTINGS[0]"
"29","1.791366189","2001:4860:4860::8844","2601:5cf:4100:3de0:53f4:479c:be9c:997d","HTTP2","368","HEADERS","251","32","277","HEADERS[1]: 200 OK"
"30","1.791366640","2001:4860:4860::8844","2601:5cf:4100:3de0:53f4:479c:be9c:997d","HTTP2","195","DATA","78","32","104","DATA[1]"
"31","1.791366770","2001:4860:4860::8844","2601:5cf:4100:3de0:53f4:479c:be9c:997d","HTTP2","156","DATA,PING","0,8","32","26,34","Standard query response 0xb228 NS 0.sb NS ns2.xiufeng.nl NS ns1.xiufeng.de, PING[0]"
"32","1.793966705","2601:5cf:4100:3de0:53f4:479c:be9c:997d","2001:4860:4860::8844","TCP","86","","","32","","51196  >  443 [RST, ACK] Seq=926 Ack=5589 Win=64128 Len=0 TSval=3232756441 TSecr=364778547"
"33","1.808887132","2001:4860:4860::8844","2601:5cf:4100:3de0:53f4:479c:be9c:997d","TCP","86","","","32","","443  >  51196 [ACK] Seq=5589 Ack=926 Win=67840 Len=0 TSval=364778565 TSecr=3232756428"
"34","1.808936869","2601:5cf:4100:3de0:53f4:479c:be9c:997d","2001:4860:4860::8844","TCP","74","","","20","","51196  >  443 [RST] Seq=926 Win=0 Len=0"
"35","1.815106693","2601:5cf:4100:3de0:53f4:479c:be9c:997d","2001:4860:4860::8844","TCP","94","","","40","","51202  >  443 [SYN] Seq=0 Win=64800 Len=0 MSS=1440 SACK_PERM TSval=3232756462 TSecr=0 WS=128"
"37","2.090633017","2001:4860:4860::8844","2601:5cf:4100:3de0:53f4:479c:be9c:997d","TCP","94","","","40","","443  >  51202 [SYN, ACK] Seq=0 Ack=1 Win=65535 Len=0 MSS=1440 SACK_PERM TSval=1021155427 TSecr=3232756462 WS=256"
"38","2.090659509","2601:5cf:4100:3de0:53f4:479c:be9c:997d","2001:4860:4860::8844","TCP","86","","","32","","51202  >  443 [ACK] Seq=1 Ack=1 Win=64896 Len=0 TSval=3232756737 TSecr=1021155427"
"39","2.090966953","2601:5cf:4100:3de0:53f4:479c:be9c:997d","2001:4860:4860::8844","TLSv1.3","603","","","32","512","Client Hello (SNI=dns.google)"
"41","2.397900467","2001:4860:4860::8844","2601:5cf:4100:3de0:53f4:479c:be9c:997d","TCP","86","","","32","","443  >  51202 [ACK] Seq=1 Ack=518 Win=66816 Len=0 TSval=1021155708 TSecr=3232756738"
"42","2.397900718","2001:4860:4860::8844","2601:5cf:4100:3de0:53f4:479c:be9c:997d","TLSv1.3","2502","","","32","122,1","Server Hello, Change Cipher Spec"
"43","2.397900768","2001:4860:4860::8844","2601:5cf:4100:3de0:53f4:479c:be9c:997d","TLSv1.3","2119","","","32","4311","Encrypted Extensions, Certificate, Certificate Verify, Finished"
"44","2.397933201","2601:5cf:4100:3de0:53f4:479c:be9c:997d","2001:4860:4860::8844","TCP","86","","","32","","51202  >  443 [ACK] Seq=518 Ack=2417 Win=63744 Len=0 TSval=3232757044 TSecr=1021155709"
"45","2.397946137","2601:5cf:4100:3de0:53f4:479c:be9c:997d","2001:4860:4860::8844","TCP","86","","","32","","51202  >  443 [ACK] Seq=518 Ack=4450 Win=62208 Len=0 TSval=3232757045 TSecr=1021155709"
"46","2.399381515","2601:5cf:4100:3de0:53f4:479c:be9c:997d","2001:4860:4860::8844","TLSv1.3","166","","","32","1,69","Change Cipher Spec, Finished"
"47","2.399729679","2601:5cf:4100:3de0:53f4:479c:be9c:997d","2001:4860:4860::8844","HTTP2","190","SETTINGS,WINDOW_UPDATE","36,4","32","99","Magic, SETTINGS[0], WINDOW_UPDATE[0]"
"48","2.406903284","2601:5cf:4100:3de0:53f4:479c:be9c:997d","2001:4860:4860::8844","DoH","294","HEADERS,WINDOW_UPDATE,DATA,DATA","65,4,37,0","32","104,63,26","Standard query 0xde56 NS 0000000000.download"
"49","2.421782519","2001:4860:4860::8844","2601:5cf:4100:3de0:53f4:479c:be9c:997d","HTTP2","734","SETTINGS,WINDOW_UPDATE","18,4","32","581,57","SETTINGS[0], WINDOW_UPDATE[0]"
"50","2.421782780","2001:4860:4860::8844","2601:5cf:4100:3de0:53f4:479c:be9c:997d","HTTP2","117","SETTINGS","0","32","26","SETTINGS[0]"
"51","2.422231230","2601:5cf:4100:3de0:53f4:479c:be9c:997d","2001:4860:4860::8844","HTTP2","117","SETTINGS","0","32","26","SETTINGS[0]"
"52","2.433029643","2001:4860:4860::8844","2601:5cf:4100:3de0:53f4:479c:be9c:997d","TCP","86","","","32","","443  >  51202 [ACK] Seq=5129 Ack=910 Win=67840 Len=0 TSval=1021156017 TSecr=3232757053"
"53","2.438009461","2001:4860:4860::8844","2601:5cf:4100:3de0:53f4:479c:be9c:997d","HTTP2","368","HEADERS","251","32","277","HEADERS[1]: 200 OK"
"54","2.438009581","2001:4860:4860::8844","2601:5cf:4100:3de0:53f4:479c:be9c:997d","HTTP2","213","DATA","96","32","122","DATA[1]"
"55","2.438009671","2001:4860:4860::8844","2601:5cf:4100:3de0:53f4:479c:be9c:997d","DoH","117","DATA","0","32","26","Standard query response 0xde56 NS 0000000000.download NS coleman.ns.cloudflare.com NS meera.ns.cloudflare.com"
"56","2.438009711","2001:4860:4860::8844","2601:5cf:4100:3de0:53f4:479c:be9c:997d","HTTP2","125","PING","8","32","34","PING[0]"
"57","2.439336246","2601:5cf:4100:3de0:53f4:479c:be9c:997d","2001:4860:4860::8844","TCP","86","","","32","","51202  >  443 [RST, ACK] Seq=941 Ack=5608 Win=64128 Len=0 TSval=3232757086 TSecr=1021156021"
"58","2.448069143","2001:4860:4860::8844","2601:5cf:4100:3de0:53f4:479c:be9c:997d","TCP","86","","","32","","443  >  51202 [ACK] Seq=5608 Ack=941 Win=67840 Len=0 TSval=1021156032 TSecr=3232757069"
"59","2.448088862","2601:5cf:4100:3de0:53f4:479c:be9c:997d","2001:4860:4860::8844","TCP","74","","","20","","51202  >  443 [RST] Seq=941 Win=0 Len=0"
"60","2.460815130","2601:5cf:4100:3de0:53f4:479c:be9c:997d","2001:4860:4860::8888","TCP","94","","","40","","50986  >  443 [SYN] Seq=0 Win=64800 Len=0 MSS=1440 SACK_PERM TSval=3903971733 TSecr=0 WS=128"
"61","2.705073441","2001:4860:4860::8888","2601:5cf:4100:3de0:53f4:479c:be9c:997d","TCP","94","","","40","","443  >  50986 [SYN, ACK] Seq=0 Ack=1 Win=65535 Len=0 MSS=1440 SACK_PERM TSval=2199158047 TSecr=3903971733 WS=256"
"62","2.705108640","2601:5cf:4100:3de0:53f4:479c:be9c:997d","2001:4860:4860::8888","TCP","86","","","32","","50986  >  443 [ACK] Seq=1 Ack=1 Win=64896 Len=0 TSval=3903971978 TSecr=2199158047"
"63","2.705499738","2601:5cf:4100:3de0:53f4:479c:be9c:997d","2001:4860:4860::8888","TLSv1.3","603","","","32","512","Client Hello (SNI=dns.google)"
"64","2.730199886","2001:4860:4860::8888","2601:5cf:4100:3de0:53f4:479c:be9c:997d","TCP","86","","","32","","443  >  50986 [ACK] Seq=1 Ack=518 Win=66816 Len=0 TSval=2199158287 TSecr=3903971978"
"65","2.731200441","2001:4860:4860::8888","2601:5cf:4100:3de0:53f4:479c:be9c:997d","TLSv1.3","1294","","","32","122,1","Server Hello, Change Cipher Spec"
"66","2.731210941","2601:5cf:4100:3de0:53f4:479c:be9c:997d","2001:4860:4860::8888","TCP","86","","","32","","50986  >  443 [ACK] Seq=518 Ack=1209 Win=64128 Len=0 TSval=3903972004 TSecr=2199158288"
"67","2.732340669","2001:4860:4860::8888","2601:5cf:4100:3de0:53f4:479c:be9c:997d","TCP","1294","","","32","","443  >  50986 [PSH, ACK] Seq=1209 Ack=518 Win=66816 Len=1208 TSval=2199158288 TSecr=3903971978 [TCP segment of a reassembled PDU]"
"68","2.732340770","2001:4860:4860::8888","2601:5cf:4100:3de0:53f4:479c:be9c:997d","TCP","1294","","","32","","443  >  50986 [ACK] Seq=2417 Ack=518 Win=66816 Len=1208 TSval=2199158288 TSecr=3903971978 [TCP segment of a reassembled PDU]"
"69","2.732349517","2601:5cf:4100:3de0:53f4:479c:be9c:997d","2001:4860:4860::8888","TCP","86","","","32","","50986  >  443 [ACK] Seq=518 Ack=2417 Win=63872 Len=0 TSval=3903972005 TSecr=2199158288"
"70","2.732357863","2601:5cf:4100:3de0:53f4:479c:be9c:997d","2001:4860:4860::8888","TCP","86","","","32","","50986  >  443 [ACK] Seq=518 Ack=3625 Win=62720 Len=0 TSval=3903972005 TSecr=2199158288"
"71","2.733312117","2001:4860:4860::8888","2601:5cf:4100:3de0:53f4:479c:be9c:997d","TLSv1.3","910","","","32","4310","Encrypted Extensions, Certificate, Certificate Verify, Finished"
"72","2.733321796","2601:5cf:4100:3de0:53f4:479c:be9c:997d","2001:4860:4860::8888","TCP","86","","","32","","50986  >  443 [ACK] Seq=518 Ack=4449 Win=64128 Len=0 TSval=3903972006 TSecr=2199158288"
"73","2.734468487","2601:5cf:4100:3de0:53f4:479c:be9c:997d","2001:4860:4860::8888","TLSv1.3","166","","","32","1,69","Change Cipher Spec, Finished"
"74","2.734748768","2601:5cf:4100:3de0:53f4:479c:be9c:997d","2001:4860:4860::8888","HTTP2","190","SETTINGS,WINDOW_UPDATE","36,4","32","99","Magic, SETTINGS[0], WINDOW_UPDATE[0]"
"75","2.739836758","2601:5cf:4100:3de0:53f4:479c:be9c:997d","2001:4860:4860::8888","DoH","289","HEADERS,WINDOW_UPDATE,DATA,DATA","65,4,32,0","32","104,58,26","Standard query 0x982d NS 000webhost.com"
"76","2.824055021","2001:4860:4860::8888","2601:5cf:4100:3de0:53f4:479c:be9c:997d","HTTP2","734","SETTINGS,WINDOW_UPDATE","18,4","32","581,57","SETTINGS[0], WINDOW_UPDATE[0]"
"77","2.824055282","2001:4860:4860::8888","2601:5cf:4100:3de0:53f4:479c:be9c:997d","HTTP2","117","SETTINGS","0","32","26","SETTINGS[0]"
"78","2.824055332","2001:4860:4860::8888","2601:5cf:4100:3de0:53f4:479c:be9c:997d","TCP","86","","","32","","443  >  50986 [ACK] Seq=5128 Ack=905 Win=67840 Len=0 TSval=2199158327 TSecr=3903972012"
"79","2.824055392","2001:4860:4860::8888","2601:5cf:4100:3de0:53f4:479c:be9c:997d","HTTP2","368","HEADERS","251","32","277","HEADERS[1]: 200 OK"
"80","2.824055432","2001:4860:4860::8888","2601:5cf:4100:3de0:53f4:479c:be9c:997d","HTTP2","203","DATA","86","32","112","DATA[1]"
"81","2.824055482","2001:4860:4860::8888","2601:5cf:4100:3de0:53f4:479c:be9c:997d","DoH","117","DATA","0","32","26","Standard query response 0x982d NS 000webhost.com NS emily.ns.cloudflare.com NS terin.ns.cloudflare.com"
"82","2.824055522","2001:4860:4860::8888","2601:5cf:4100:3de0:53f4:479c:be9c:997d","HTTP2","125","PING","8","32","34","PING[0]"
"83","2.824579711","2601:5cf:4100:3de0:53f4:479c:be9c:997d","2001:4860:4860::8888","HTTP2","117","SETTINGS","0","32","26","SETTINGS[0]"
"84","2.825781351","2601:5cf:4100:3de0:53f4:479c:be9c:997d","2001:4860:4860::8888","TCP","86","","","32","","50986  >  443 [RST, ACK] Seq=936 Ack=5597 Win=64128 Len=0 TSval=3903972098 TSecr=2199158315"
"85","2.847017117","2601:5cf:4100:3de0:53f4:479c:be9c:997d","2001:4860:4860::8844","TCP","94","","","40","","51212  >  443 [SYN] Seq=0 Win=64800 Len=0 MSS=1440 SACK_PERM TSval=3232757494 TSecr=0 WS=128"
"86","2.852594658","2001:4860:4860::8888","2601:5cf:4100:3de0:53f4:479c:be9c:997d","TCP","86","","","32","","443  >  50986 [ACK] Seq=5597 Ack=936 Win=67840 Len=0 TSval=2199158411 TSecr=3903972097"
"87","2.852611892","2601:5cf:4100:3de0:53f4:479c:be9c:997d","2001:4860:4860::8888","TCP","74","","","20","","50986  >  443 [RST] Seq=936 Win=0 Len=0"
"88","2.874844757","2001:4860:4860::8844","2601:5cf:4100:3de0:53f4:479c:be9c:997d","TCP","94","","","40","","443  >  51212 [SYN, ACK] Seq=0 Ack=1 Win=65535 Len=0 MSS=1440 SACK_PERM TSval=2740113227 TSecr=3232757494 WS=256"
"89","2.874884094","2601:5cf:4100:3de0:53f4:479c:be9c:997d","2001:4860:4860::8844","TCP","86","","","32","","51212  >  443 [ACK] Seq=1 Ack=1 Win=64896 Len=0 TSval=3232757521 TSecr=2740113227"
"90","2.875300662","2601:5cf:4100:3de0:53f4:479c:be9c:997d","2001:4860:4860::8844","TLSv1.3","603","","","32","512","Client Hello (SNI=dns.google)"
"93","2.977143572","2001:4860:4860::8844","2601:5cf:4100:3de0:53f4:479c:be9c:997d","TCP","86","","","32","","443  >  51212 [ACK] Seq=1 Ack=518 Win=66816 Len=0 TSval=2740113263 TSecr=3232757522"
"94","2.977143922","2001:4860:4860::8844","2601:5cf:4100:3de0:53f4:479c:be9c:997d","TLSv1.3","2502","","","32","122,1","Server Hello, Change Cipher Spec"
"95","2.977144013","2001:4860:4860::8844","2601:5cf:4100:3de0:53f4:479c:be9c:997d","TCP","1294","","","32","","443  >  51212 [ACK] Seq=2417 Ack=518 Win=66816 Len=1208 TSval=2740113264 TSecr=3232757522 [TCP segment of a reassembled PDU]"
"96","2.977177959","2601:5cf:4100:3de0:53f4:479c:be9c:997d","2001:4860:4860::8844","TCP","86","","","32","","51212  >  443 [ACK] Seq=518 Ack=2417 Win=63744 Len=0 TSval=3232757624 TSecr=2740113264"
"97","2.977194381","2601:5cf:4100:3de0:53f4:479c:be9c:997d","2001:4860:4860::8844","TCP","86","","","32","","51212  >  443 [ACK] Seq=518 Ack=3625 Win=62848 Len=0 TSval=3232757624 TSecr=2740113264"
"98","2.977566402","2001:4860:4860::8844","2601:5cf:4100:3de0:53f4:479c:be9c:997d","TLSv1.3","909","","","32","4309","Encrypted Extensions, Certificate, Certificate Verify, Finished"
"99","2.977566612","2001:4860:4860::8844","2601:5cf:4100:3de0:53f4:479c:be9c:997d","TCP","909","","","32","","[TCP Retransmission] 443  >  51212 [PSH, ACK] Seq=3625 Ack=518 Win=66816 Len=823 TSval=2740113321 TSecr=3232757522 [TCP segment of a reassembled PDU]"
"100","2.977583686","2601:5cf:4100:3de0:53f4:479c:be9c:997d","2001:4860:4860::8844","TCP","86","","","32","","51212  >  443 [ACK] Seq=518 Ack=4448 Win=63232 Len=0 TSval=3232757624 TSecr=2740113264"
"101","2.977597914","2601:5cf:4100:3de0:53f4:479c:be9c:997d","2001:4860:4860::8844","TCP","98","","","44","","[TCP Dup ACK 100#1] 51212  >  443 [ACK] Seq=518 Ack=4448 Win=63232 Len=0 TSval=3232757624 TSecr=2740113321 SLE=3625 SRE=4448"
"102","2.978983504","2601:5cf:4100:3de0:53f4:479c:be9c:997d","2001:4860:4860::8844","TLSv1.3","166","","","32","1,69","Change Cipher Spec, Finished"
"103","2.979257001","2601:5cf:4100:3de0:53f4:479c:be9c:997d","2001:4860:4860::8844","HTTP2","190","SETTINGS,WINDOW_UPDATE","36,4","32","99","Magic, SETTINGS[0], WINDOW_UPDATE[0]"
"104","2.985227745","2601:5cf:4100:3de0:53f4:479c:be9c:997d","2001:4860:4860::8844","DoH","292","HEADERS,WINDOW_UPDATE,DATA,DATA","65,4,35,0","32","104,61,26","Standard query 0x7c9c NS 000webhostapp.com"
"105","3.068181507","2601:5cf:4100:3de0:53f4:479c:be9c:997d","2001:4860:4860::8844","TCP","292","","","32","","[TCP Retransmission] 51212  >  443 [PSH, ACK] Seq=702 Ack=4448 Win=64128 Len=206 TSval=3232757715 TSecr=2740113321"
"106","3.079576261","2001:4860:4860::8844","2601:5cf:4100:3de0:53f4:479c:be9c:997d","HTTP2","734","SETTINGS,WINDOW_UPDATE","18,4","32","581,57","SETTINGS[0], WINDOW_UPDATE[0]"
"107","3.079576492","2001:4860:4860::8844","2601:5cf:4100:3de0:53f4:479c:be9c:997d","HTTP2","117","SETTINGS","0","32","26","SETTINGS[0]"
"110","3.080455778","2601:5cf:4100:3de0:53f4:479c:be9c:997d","2001:4860:4860::8844","HTTP2","117","SETTINGS","0","32","26","SETTINGS[0]"
"111","3.095502092","2001:4860:4860::8844","2601:5cf:4100:3de0:53f4:479c:be9c:997d","TCP","117","","","32","","[TCP Spurious Retransmission] 443  >  51212 [PSH, ACK] Seq=5096 Ack=908 Win=67840 Len=31 TSval=2740113449 TSecr=3232757626"
"112","3.095523905","2601:5cf:4100:3de0:53f4:479c:be9c:997d","2001:4860:4860::8844","TCP","98","","","44","","[TCP Dup ACK 110#1] 51212  >  443 [ACK] Seq=939 Ack=5127 Win=64128 Len=0 TSval=3232757742 TSecr=2740113449 SLE=5096 SRE=5127"
"113","3.099991186","2001:4860:4860::8844","2601:5cf:4100:3de0:53f4:479c:be9c:997d","TCP","98","","","44","","[TCP Dup ACK 106#1] 443  >  51212 [ACK] Seq=5127 Ack=908 Win=67840 Len=0 TSval=2740113454 TSecr=3232757715 SLE=702 SRE=908"
"114","3.105146749","2001:4860:4860::8844","2601:5cf:4100:3de0:53f4:479c:be9c:997d","HTTP2","367","HEADERS","250","32","276","HEADERS[1]: 200 OK"
"115","3.105146940","2001:4860:4860::8844","2601:5cf:4100:3de0:53f4:479c:be9c:997d","HTTP2","201","DATA","84","32","110","DATA[1]"
"116","3.105146990","2001:4860:4860::8844","2601:5cf:4100:3de0:53f4:479c:be9c:997d","HTTP2","156","DATA,PING","0,8","32","26,34","Standard query response 0x7c9c NS 000webhostapp.com NS dns2.000webhost.com NS dns1.000webhost.com, PING[0]"
"117","3.105165706","2601:5cf:4100:3de0:53f4:479c:be9c:997d","2001:4860:4860::8844","TCP","86","","","32","","51212  >  443 [ACK] Seq=939 Ack=5408 Win=64128 Len=0 TSval=3232757752 TSecr=2740113459"
"118","3.105183201","2601:5cf:4100:3de0:53f4:479c:be9c:997d","2001:4860:4860::8844","TCP","86","","","32","","51212  >  443 [ACK] Seq=939 Ack=5523 Win=64128 Len=0 TSval=3232757752 TSecr=2740113459"
"119","3.105189433","2601:5cf:4100:3de0:53f4:479c:be9c:997d","2001:4860:4860::8844","TCP","86","","","32","","51212  >  443 [ACK] Seq=939 Ack=5593 Win=64128 Len=0 TSval=3232757752 TSecr=2740113459"
"120","3.107289416","2601:5cf:4100:3de0:53f4:479c:be9c:997d","2001:4860:4860::8844","TCP","86","","","32","","51212  >  443 [RST, ACK] Seq=939 Ack=5593 Win=64128 Len=0 TSval=3232757754 TSecr=2740113459"
"121","3.108044980","2001:4860:4860::8844","2601:5cf:4100:3de0:53f4:479c:be9c:997d","TCP","86","","","32","","443  >  51212 [ACK] Seq=5593 Ack=939 Win=67840 Len=0 TSval=2740113462 TSecr=3232757727"
"122","3.108060350","2601:5cf:4100:3de0:53f4:479c:be9c:997d","2001:4860:4860::8844","TCP","74","","","20","","51212  >  443 [RST] Seq=939 Win=0 Len=0"
"123","3.128330431","2601:5cf:4100:3de0:53f4:479c:be9c:997d","2001:4860:4860::8844","TCP","94","","","40","","51220  >  443 [SYN] Seq=0 Win=64800 Len=0 MSS=1440 SACK_PERM TSval=3232757775 TSecr=0 WS=128"
"124","3.422097610","2001:4860:4860::8844","2601:5cf:4100:3de0:53f4:479c:be9c:997d","TCP","94","","","40","","443  >  51220 [SYN, ACK] Seq=0 Ack=1 Win=65535 Len=0 MSS=1440 SACK_PERM TSval=855851433 TSecr=3232757775 WS=256"
"125","3.422131656","2601:5cf:4100:3de0:53f4:479c:be9c:997d","2001:4860:4860::8844","TCP","86","","","32","","51220  >  443 [ACK] Seq=1 Ack=1 Win=64896 Len=0 TSval=3232758069 TSecr=855851433"
"126","3.422488437","2601:5cf:4100:3de0:53f4:479c:be9c:997d","2001:4860:4860::8844","TLSv1.3","603","","","32","512","Client Hello (SNI=dns.google)"
"128","3.584856560","2001:4860:4860::8844","2601:5cf:4100:3de0:53f4:479c:be9c:997d","TCP","86","","","32","","443  >  51220 [ACK] Seq=1 Ack=518 Win=66816 Len=0 TSval=855851734 TSecr=3232758069"
"129","3.584974982","2001:4860:4860::8844","2601:5cf:4100:3de0:53f4:479c:be9c:997d","TLSv1.3","2502","","","32","122,1","Server Hello, Change Cipher Spec"
"130","3.585003088","2601:5cf:4100:3de0:53f4:479c:be9c:997d","2001:4860:4860::8844","TCP","86","","","32","","51220  >  443 [ACK] Seq=518 Ack=2417 Win=63744 Len=0 TSval=3232758232 TSecr=855851735"
"131","3.586858471","2001:4860:4860::8844","2601:5cf:4100:3de0:53f4:479c:be9c:997d","TLSv1.3","2117","","","32","4309","Encrypted Extensions, Certificate, Certificate Verify, Finished"
"132","3.586884121","2601:5cf:4100:3de0:53f4:479c:be9c:997d","2001:4860:4860::8844","TCP","86","","","32","","51220  >  443 [ACK] Seq=518 Ack=4448 Win=62208 Len=0 TSval=3232758233 TSecr=855851735"
"133","3.593462157","2601:5cf:4100:3de0:53f4:479c:be9c:997d","2001:4860:4860::8844","TLSv1.3","166","","","32","1,69","Change Cipher Spec, Finished"
"134","3.593761625","2601:5cf:4100:3de0:53f4:479c:be9c:997d","2001:4860:4860::8844","HTTP2","190","SETTINGS,WINDOW_UPDATE","36,4","32","99","Magic, SETTINGS[0], WINDOW_UPDATE[0]"
"135","3.609541679","2601:5cf:4100:3de0:53f4:479c:be9c:997d","2001:4860:4860::8844","DoH","287","HEADERS,WINDOW_UPDATE,DATA,DATA","65,4,30,0","32","104,56,26","Standard query 0x746e NS 00117163.xyz"
"136","3.729455664","2001:4860:4860::8844","2601:5cf:4100:3de0:53f4:479c:be9c:997d","HTTP2","734","SETTINGS,WINDOW_UPDATE","18,4","32","581,57","SETTINGS[0], WINDOW_UPDATE[0]"
"137","3.729456115","2001:4860:4860::8844","2601:5cf:4100:3de0:53f4:479c:be9c:997d","HTTP2","117","SETTINGS","0","32","26","SETTINGS[0]"
"138","3.729456235","2001:4860:4860::8844","2601:5cf:4100:3de0:53f4:479c:be9c:997d","TCP","86","","","32","","443  >  51220 [ACK] Seq=5127 Ack=903 Win=67840 Len=0 TSval=855851926 TSecr=3232758256"
"139","3.730255384","2601:5cf:4100:3de0:53f4:479c:be9c:997d","2001:4860:4860::8844","HTTP2","117","SETTINGS","0","32","26","SETTINGS[0]"
"140","3.752763139","2001:4860:4860::8844","2601:5cf:4100:3de0:53f4:479c:be9c:997d","TCP","86","","","32","","443  >  51220 [ACK] Seq=5127 Ack=934 Win=67840 Len=0 TSval=855852030 TSecr=3232758377"
"141","4.037753386","2001:4860:4860::8844","2601:5cf:4100:3de0:53f4:479c:be9c:997d","HTTP2","369","HEADERS","252","32","278","HEADERS[1]: 200 OK"
"142","4.037753837","2001:4860:4860::8844","2601:5cf:4100:3de0:53f4:479c:be9c:997d","HTTP2","294","DATA","177","32","203","DATA[1]"
"143","4.037753957","2001:4860:4860::8844","2601:5cf:4100:3de0:53f4:479c:be9c:997d","DoH","117","DATA","0","32","26","Standard query response 0x746e NS 00117163.xyz NS ns1.huaweicloud-dns.net NS ns1.huaweicloud-dns.org NS ns1.huaweicloud-dns.com NS ns1.huaweicloud-dns.cn"
"144","4.037754068","2001:4860:4860::8844","2601:5cf:4100:3de0:53f4:479c:be9c:997d","HTTP2","125","PING","8","32","34","PING[0]"
"145","4.039598900","2601:5cf:4100:3de0:53f4:479c:be9c:997d","2001:4860:4860::8844","TCP","86","","","32","","51220  >  443 [RST, ACK] Seq=934 Ack=5688 Win=64128 Len=0 TSval=3232758686 TSecr=855852142"
"146","4.060108752","2601:5cf:4100:3de0:53f4:479c:be9c:997d","2001:4860:4860::8844","TCP","94","","","40","","51222  >  443 [SYN] Seq=0 Win=64800 Len=0 MSS=1440 SACK_PERM TSval=3232758707 TSecr=0 WS=128"
"147","4.343569070","2001:4860:4860::8844","2601:5cf:4100:3de0:53f4:479c:be9c:997d","TCP","94","","","40","","443  >  51222 [SYN, ACK] Seq=0 Ack=1 Win=65535 Len=0 MSS=1440 SACK_PERM TSval=446529214 TSecr=3232758707 WS=256"
"148","4.343599801","2601:5cf:4100:3de0:53f4:479c:be9c:997d","2001:4860:4860::8844","TCP","86","","","32","","51222  >  443 [ACK] Seq=1 Ack=1 Win=64896 Len=0 TSval=3232758990 TSecr=446529214"
"149","4.343914328","2601:5cf:4100:3de0:53f4:479c:be9c:997d","2001:4860:4860::8844","TLSv1.3","603","","","32","512","Client Hello (SNI=dns.google)"
"150","4.370409613","2001:4860:4860::8844","2601:5cf:4100:3de0:53f4:479c:be9c:997d","TCP","86","","","32","","443  >  51222 [ACK] Seq=1 Ack=518 Win=66816 Len=0 TSval=446529498 TSecr=3232758990"
"151","4.371282737","2001:4860:4860::8844","2601:5cf:4100:3de0:53f4:479c:be9c:997d","TLSv1.3","1294","","","32","122,1","Server Hello, Change Cipher Spec"
"152","4.371335010","2601:5cf:4100:3de0:53f4:479c:be9c:997d","2001:4860:4860::8844","TCP","86","","","32","","51222  >  443 [ACK] Seq=518 Ack=1209 Win=64128 Len=0 TSval=3232759018 TSecr=446529499"
"153","4.372851327","2001:4860:4860::8844","2601:5cf:4100:3de0:53f4:479c:be9c:997d","TCP","1294","","","32","","443  >  51222 [PSH, ACK] Seq=1209 Ack=518 Win=66816 Len=1208 TSval=446529499 TSecr=3232758990 [TCP segment of a reassembled PDU]"
"154","4.372851558","2001:4860:4860::8844","2601:5cf:4100:3de0:53f4:479c:be9c:997d","TLSv1.3","2119","","","32","4311","Encrypted Extensions, Certificate, Certificate Verify, Finished"
"155","4.372878120","2601:5cf:4100:3de0:53f4:479c:be9c:997d","2001:4860:4860::8844","TCP","86","","","32","","51222  >  443 [ACK] Seq=518 Ack=2417 Win=63872 Len=0 TSval=3232759019 TSecr=446529499"
"156","4.372890204","2601:5cf:4100:3de0:53f4:479c:be9c:997d","2001:4860:4860::8844","TCP","86","","","32","","51222  >  443 [ACK] Seq=518 Ack=4450 Win=61952 Len=0 TSval=3232759019 TSecr=446529499"
"157","4.374020743","2601:5cf:4100:3de0:53f4:479c:be9c:997d","2001:4860:4860::8844","TLSv1.3","166","","","32","1,69","Change Cipher Spec, Finished"
"158","4.374302306","2601:5cf:4100:3de0:53f4:479c:be9c:997d","2001:4860:4860::8844","HTTP2","190","SETTINGS,WINDOW_UPDATE","36,4","32","99","Magic, SETTINGS[0], WINDOW_UPDATE[0]"
"159","4.384819448","2601:5cf:4100:3de0:53f4:479c:be9c:997d","2001:4860:4860::8844","DoH","288","HEADERS,WINDOW_UPDATE,DATA,DATA","65,4,31,0","32","104,57,26","Standard query 0x7758 NS 001k.exchange"
"160","4.651123817","2001:4860:4860::8844","2601:5cf:4100:3de0:53f4:479c:be9c:997d","HTTP2","734","SETTINGS,WINDOW_UPDATE","18,4","32","581,57","SETTINGS[0], WINDOW_UPDATE[0]"
"161","4.651124268","2001:4860:4860::8844","2601:5cf:4100:3de0:53f4:479c:be9c:997d","HTTP2","117","SETTINGS","0","32","26","SETTINGS[0]"
"162","4.651124399","2001:4860:4860::8844","2601:5cf:4100:3de0:53f4:479c:be9c:997d","HTTP2","368","HEADERS","251","32","277","HEADERS[1]: 200 OK"
"163","4.651124499","2001:4860:4860::8844","2601:5cf:4100:3de0:53f4:479c:be9c:997d","HTTP2","203","DATA","86","32","112","DATA[1]"
"164","4.651124599","2001:4860:4860::8844","2601:5cf:4100:3de0:53f4:479c:be9c:997d","DoH","117","DATA","0","32","26","Standard query response 0x7758 NS 001k.exchange NS chin.ns.cloudflare.com NS gabe.ns.cloudflare.com"
"165","4.651124699","2001:4860:4860::8844","2601:5cf:4100:3de0:53f4:479c:be9c:997d","HTTP2","125","PING","8","32","34","PING[0]"
"166","4.652031319","2601:5cf:4100:3de0:53f4:479c:be9c:997d","2001:4860:4860::8844","HTTP2","117","SETTINGS","0","32","26","SETTINGS[0]"
"167","4.653071873","2601:5cf:4100:3de0:53f4:479c:be9c:997d","2001:4860:4860::8844","TCP","86","","","32","","51222  >  443 [RST, ACK] Seq=935 Ack=5598 Win=64128 Len=0 TSval=3232759300 TSecr=446529535"
"168","4.674249516","2601:5cf:4100:3de0:53f4:479c:be9c:997d","2001:4860:4860::8844","TCP","94","","","40","","51224  >  443 [SYN] Seq=0 Win=64800 Len=0 MSS=1440 SACK_PERM TSval=3232759321 TSecr=0 WS=128"
"169","4.680851199","2001:4860:4860::8844","2601:5cf:4100:3de0:53f4:479c:be9c:997d","TCP","86","","","32","","443  >  51222 [ACK] Seq=5598 Ack=935 Win=67840 Len=0 TSval=446529811 TSecr=3232759299"
"170","4.680868934","2601:5cf:4100:3de0:53f4:479c:be9c:997d","2001:4860:4860::8844","TCP","74","","","20","","51222  >  443 [RST] Seq=935 Win=0 Len=0"
"171","4.776261131","2001:4860:4860::8844","2601:5cf:4100:3de0:53f4:479c:be9c:997d","TCP","94","","","40","","443  >  51224 [SYN, ACK] Seq=0 Ack=1 Win=65535 Len=0 MSS=1440 SACK_PERM TSval=103796699 TSecr=3232759321 WS=256"
"172","4.776312612","2601:5cf:4100:3de0:53f4:479c:be9c:997d","2001:4860:4860::8844","TCP","86","","","32","","51224  >  443 [ACK] Seq=1 Ack=1 Win=64896 Len=0 TSval=3232759423 TSecr=103796699"
"173","4.776858714","2601:5cf:4100:3de0:53f4:479c:be9c:997d","2001:4860:4860::8844","TLSv1.3","603","","","32","512","Client Hello (SNI=dns.google)"
"180","5.026142748","2001:4860:4860::8844","2601:5cf:4100:3de0:53f4:479c:be9c:997d","TCP","86","","","32","","443  >  51224 [ACK] Seq=1 Ack=518 Win=66816 Len=0 TSval=103796808 TSecr=3232759423"
"181","5.026142998","2001:4860:4860::8844","2601:5cf:4100:3de0:53f4:479c:be9c:997d","TLSv1.3","2502","","","32","122,1","Server Hello, Change Cipher Spec"
"182","5.026143058","2001:4860:4860::8844","2601:5cf:4100:3de0:53f4:479c:be9c:997d","TLSv1.3","2118","","","32","4310","Encrypted Extensions, Certificate, Certificate Verify, Finished"
"183","5.026143098","2001:4860:4860::8844","2601:5cf:4100:3de0:53f4:479c:be9c:997d","TCP","910","","","32","","[TCP Retransmission] 443  >  51224 [PSH, ACK] Seq=3625 Ack=518 Win=66816 Len=824 TSval=103797017 TSecr=3232759423 [TCP segment of a reassembled PDU]"
"184","5.026176745","2601:5cf:4100:3de0:53f4:479c:be9c:997d","2001:4860:4860::8844","TCP","86","","","32","","51224  >  443 [ACK] Seq=518 Ack=2417 Win=63744 Len=0 TSval=3232759673 TSecr=103796809"
"185","5.026193878","2601:5cf:4100:3de0:53f4:479c:be9c:997d","2001:4860:4860::8844","TCP","86","","","32","","51224  >  443 [ACK] Seq=518 Ack=4449 Win=62208 Len=0 TSval=3232759673 TSecr=103796809"
"186","5.026203086","2601:5cf:4100:3de0:53f4:479c:be9c:997d","2001:4860:4860::8844","TCP","98","","","44","","[TCP Dup ACK 185#1] 51224  >  443 [ACK] Seq=518 Ack=4449 Win=62208 Len=0 TSval=3232759673 TSecr=103797017 SLE=3625 SRE=4449"
"187","5.027887874","2601:5cf:4100:3de0:53f4:479c:be9c:997d","2001:4860:4860::8844","TLSv1.3","166","","","32","1,69","Change Cipher Spec, Finished"
"188","5.028178144","2601:5cf:4100:3de0:53f4:479c:be9c:997d","2001:4860:4860::8844","HTTP2","190","SETTINGS,WINDOW_UPDATE","36,4","32","99","Magic, SETTINGS[0], WINDOW_UPDATE[0]"
"189","5.034467734","2601:5cf:4100:3de0:53f4:479c:be9c:997d","2001:4860:4860::8844","DoH","281","HEADERS,WINDOW_UPDATE,DATA,DATA","65,4,24,0","32","104,50,26","Standard query 0xe1df NS 003.cx"
"193","5.058316724","2001:4860:4860::8844","2601:5cf:4100:3de0:53f4:479c:be9c:997d","HTTP2","734","SETTINGS,WINDOW_UPDATE","18,4","32","581,57","SETTINGS[0], WINDOW_UPDATE[0]"
"194","5.058316844","2001:4860:4860::8844","2601:5cf:4100:3de0:53f4:479c:be9c:997d","HTTP2","117","SETTINGS","0","32","26","SETTINGS[0]"
"196","5.059133548","2601:5cf:4100:3de0:53f4:479c:be9c:997d","2001:4860:4860::8844","HTTP2","117","SETTINGS","0","32","26","SETTINGS[0]"
"198","5.073506971","2001:4860:4860::8844","2601:5cf:4100:3de0:53f4:479c:be9c:997d","TCP","86","","","32","","443  >  51224 [ACK] Seq=5128 Ack=897 Win=67840 Len=0 TSval=103797072 TSecr=3232759681"
"200","5.079893812","2001:4860:4860::8844","2601:5cf:4100:3de0:53f4:479c:be9c:997d","HTTP2","368","HEADERS","251","32","277","HEADERS[1]: 200 OK"
"201","5.079894263","2001:4860:4860::8844","2601:5cf:4100:3de0:53f4:479c:be9c:997d","HTTP2","198","DATA","81","32","107","DATA[1]"
"202","5.079894393","2001:4860:4860::8844","2601:5cf:4100:3de0:53f4:479c:be9c:997d","DoH","117","DATA","0","32","26","Standard query response 0xe1df NS 003.cx NS jerome.ns.cloudflare.com NS sima.ns.cloudflare.com"
"203","5.079894494","2001:4860:4860::8844","2601:5cf:4100:3de0:53f4:479c:be9c:997d","HTTP2","125","PING","8","32","34","PING[0]"
"204","5.081675370","2601:5cf:4100:3de0:53f4:479c:be9c:997d","2001:4860:4860::8844","TCP","86","","","32","","51224  >  443 [RST, ACK] Seq=928 Ack=5592 Win=64128 Len=0 TSval=3232759728 TSecr=103797079"
"206","5.093173548","2001:4860:4860::8844","2601:5cf:4100:3de0:53f4:479c:be9c:997d","TCP","86","","","32","","443  >  51224 [ACK] Seq=5592 Ack=928 Win=67840 Len=0 TSval=103797092 TSecr=3232759706"
"208","5.093224167","2601:5cf:4100:3de0:53f4:479c:be9c:997d","2001:4860:4860::8844","TCP","74","","","20","","51224  >  443 [RST] Seq=928 Win=0 Len=0"
"210","5.102731015","2601:5cf:4100:3de0:53f4:479c:be9c:997d","2001:4860:4860::8888","TCP","94","","","40","","51002  >  443 [SYN] Seq=0 Win=64800 Len=0 MSS=1440 SACK_PERM TSval=3903974375 TSecr=0 WS=128"
"212","5.230137977","2001:4860:4860::8888","2601:5cf:4100:3de0:53f4:479c:be9c:997d","TCP","94","","","40","","443  >  51002 [SYN, ACK] Seq=0 Ack=1 Win=65535 Len=0 MSS=1440 SACK_PERM TSval=1963050219 TSecr=3903974375 WS=256"
"213","5.230218986","2601:5cf:4100:3de0:53f4:479c:be9c:997d","2001:4860:4860::8888","TCP","86","","","32","","51002  >  443 [ACK] Seq=1 Ack=1 Win=64896 Len=0 TSval=3903974503 TSecr=1963050219"
"214","5.230906085","2601:5cf:4100:3de0:53f4:479c:be9c:997d","2001:4860:4860::8888","TLSv1.3","603","","","32","512","Client Hello (SNI=dns.google)"
"215","5.368010860","2001:4860:4860::8888","2601:5cf:4100:3de0:53f4:479c:be9c:997d","TCP","86","","","32","","443  >  51002 [ACK] Seq=1 Ack=518 Win=66816 Len=0 TSval=1963050352 TSecr=3903974503"
"216","5.368011732","2001:4860:4860::8888","2601:5cf:4100:3de0:53f4:479c:be9c:997d","TLSv1.3","1294","","","32","122,1","Server Hello, Change Cipher Spec"
"217","5.368063404","2601:5cf:4100:3de0:53f4:479c:be9c:997d","2001:4860:4860::8888","TCP","86","","","32","","51002  >  443 [ACK] Seq=518 Ack=1209 Win=64128 Len=0 TSval=3903974641 TSecr=1963050352"
"218","5.369878337","2001:4860:4860::8888","2601:5cf:4100:3de0:53f4:479c:be9c:997d","TCP","1294","","","32","","443  >  51002 [PSH, ACK] Seq=1209 Ack=518 Win=66816 Len=1208 TSval=1963050352 TSecr=3903974503 [TCP segment of a reassembled PDU]"
"219","5.369878427","2001:4860:4860::8888","2601:5cf:4100:3de0:53f4:479c:be9c:997d","TLSv1.3","2118","","","32","4310","Encrypted Extensions, Certificate, Certificate Verify, Finished"
"222","5.369904419","2601:5cf:4100:3de0:53f4:479c:be9c:997d","2001:4860:4860::8888","TCP","86","","","32","","51002  >  443 [ACK] Seq=518 Ack=2417 Win=64128 Len=0 TSval=3903974642 TSecr=1963050352"
"223","5.369909208","2601:5cf:4100:3de0:53f4:479c:be9c:997d","2001:4860:4860::8888","TCP","86","","","32","","51002  >  443 [ACK] Seq=518 Ack=4449 Win=63104 Len=0 TSval=3903974642 TSecr=1963050352"
"224","5.371455895","2601:5cf:4100:3de0:53f4:479c:be9c:997d","2001:4860:4860::8888","TLSv1.3","166","","","32","1,69","Change Cipher Spec, Finished"
"226","5.371771685","2601:5cf:4100:3de0:53f4:479c:be9c:997d","2001:4860:4860::8888","HTTP2","190","SETTINGS,WINDOW_UPDATE","36,4","32","99","Magic, SETTINGS[0], WINDOW_UPDATE[0]"
"227","5.379136746","2601:5cf:4100:3de0:53f4:479c:be9c:997d","2001:4860:4860::8888","DoH","283","HEADERS,WINDOW_UPDATE,DATA,DATA","65,4,26,0","32","104,52,26","Standard query 0x0373 NS 003ms.ru"
"228","5.664180320","2601:5cf:4100:3de0:53f4:479c:be9c:997d","2001:4860:4860::8888","TCP","283","","","32","","[TCP Retransmission] 51002  >  443 [PSH, ACK] Seq=702 Ack=4449 Win=64128 Len=197 TSval=3903974937 TSecr=1963050352"
"229","5.666010073","2001:4860:4860::8888","2601:5cf:4100:3de0:53f4:479c:be9c:997d","HTTP2","734","SETTINGS,WINDOW_UPDATE","18,4","32","581,57","SETTINGS[0], WINDOW_UPDATE[0]"
"230","5.666010514","2001:4860:4860::8888","2601:5cf:4100:3de0:53f4:479c:be9c:997d","HTTP2","117","SETTINGS","0","32","26","SETTINGS[0]"
"231","5.666010644","2001:4860:4860::8888","2601:5cf:4100:3de0:53f4:479c:be9c:997d","HTTP2","368","HEADERS","251","32","277","HEADERS[1]: 200 OK"
"232","5.666010744","2001:4860:4860::8888","2601:5cf:4100:3de0:53f4:479c:be9c:997d","HTTP2","199","DATA","82","32","108","DATA[1]"
"233","5.666010845","2001:4860:4860::8888","2601:5cf:4100:3de0:53f4:479c:be9c:997d","HTTP2","156","DATA,PING","0,8","32","26,34","Standard query response 0x0373 NS 003ms.ru NS micah.ns.cloudflare.com NS rose.ns.cloudflare.com, PING[0]"
"235","5.666995859","2601:5cf:4100:3de0:53f4:479c:be9c:997d","2001:4860:4860::8888","HTTP2","117","SETTINGS","0","32","26","SETTINGS[0]"
"236","5.669530976","2601:5cf:4100:3de0:53f4:479c:be9c:997d","2001:4860:4860::8888","TCP","86","","","32","","51002  >  443 [RST, ACK] Seq=930 Ack=5593 Win=64128 Len=0 TSval=3903974942 TSecr=1963050492"
"237","5.684450001","2001:4860:4860::8888","2601:5cf:4100:3de0:53f4:479c:be9c:997d","TCP","156","","","32","","[TCP Spurious Retransmission] 443  >  51002 [PSH, ACK] Seq=5523 Ack=899 Win=67840 Len=70 TSval=1963050773 TSecr=3903974652"
"238","5.684476263","2601:5cf:4100:3de0:53f4:479c:be9c:997d","2001:4860:4860::8888","TCP","74","","","20","","51002  >  443 [RST] Seq=899 Win=0 Len=0"
"239","5.687658121","2001:4860:4860::8888","2601:5cf:4100:3de0:53f4:479c:be9c:997d","TCP","98","","","44","","[TCP Dup ACK 231#1] 443  >  51002 [ACK] Seq=5593 Ack=899 Win=67840 Len=0 TSval=1963050778 TSecr=3903974937 SLE=702 SRE=899"
"240","5.687674032","2601:5cf:4100:3de0:53f4:479c:be9c:997d","2001:4860:4860::8888","TCP","74","","","20","","51002  >  443 [RST] Seq=899 Win=0 Len=0"
"241","5.689925824","2601:5cf:4100:3de0:53f4:479c:be9c:997d","2001:4860:4860::8888","TCP","94","","","40","","51018  >  443 [SYN] Seq=0 Win=64800 Len=0 MSS=1440 SACK_PERM TSval=3903974962 TSecr=0 WS=128"
"242","5.695758446","2001:4860:4860::8888","2601:5cf:4100:3de0:53f4:479c:be9c:997d","TCP","86","","","32","","443  >  51002 [ACK] Seq=5593 Ack=930 Win=67840 Len=0 TSval=1963050786 TSecr=3903974940"
"243","5.695772985","2601:5cf:4100:3de0:53f4:479c:be9c:997d","2001:4860:4860::8888","TCP","74","","","20","","51002  >  443 [RST] Seq=930 Win=0 Len=0"
"244","5.982300635","2001:4860:4860::8888","2601:5cf:4100:3de0:53f4:479c:be9c:997d","TCP","94","","","40","","443  >  51018 [SYN, ACK] Seq=0 Ack=1 Win=65535 Len=0 MSS=1440 SACK_PERM TSval=4070506709 TSecr=3903974962 WS=256"
"245","5.982332377","2601:5cf:4100:3de0:53f4:479c:be9c:997d","2001:4860:4860::8888","TCP","86","","","32","","51018  >  443 [ACK] Seq=1 Ack=1 Win=64896 Len=0 TSval=3903975255 TSecr=4070506709"
"246","5.982675441","2601:5cf:4100:3de0:53f4:479c:be9c:997d","2001:4860:4860::8888","TLSv1.3","603","","","32","512","Client Hello (SNI=dns.google)"
"247","6.009971860","2001:4860:4860::8888","2601:5cf:4100:3de0:53f4:479c:be9c:997d","TCP","86","","","32","","443  >  51018 [ACK] Seq=1 Ack=518 Win=66816 Len=0 TSval=4070506997 TSecr=3903975255"
"248","6.011669734","2001:4860:4860::8888","2601:5cf:4100:3de0:53f4:479c:be9c:997d","TLSv1.3","1294","","","32","122,1","Server Hello, Change Cipher Spec"
"249","6.011716305","2601:5cf:4100:3de0:53f4:479c:be9c:997d","2001:4860:4860::8888","TCP","86","","","32","","51018  >  443 [ACK] Seq=518 Ack=1209 Win=64128 Len=0 TSval=3903975284 TSecr=4070506998"
"250","6.012612355","2001:4860:4860::8888","2601:5cf:4100:3de0:53f4:479c:be9c:997d","TCP","1294","","","32","","443  >  51018 [PSH, ACK] Seq=1209 Ack=518 Win=66816 Len=1208 TSval=4070506998 TSecr=3903975255 [TCP segment of a reassembled PDU]"
"251","6.012612645","2001:4860:4860::8888","2601:5cf:4100:3de0:53f4:479c:be9c:997d","TLSv1.3","2118","","","32","4310","Encrypted Extensions, Certificate, Certificate Verify, Finished"
"252","6.012636883","2601:5cf:4100:3de0:53f4:479c:be9c:997d","2001:4860:4860::8888","TCP","86","","","32","","51018  >  443 [ACK] Seq=518 Ack=2417 Win=63360 Len=0 TSval=3903975285 TSecr=4070506998"
"253","6.012660109","2601:5cf:4100:3de0:53f4:479c:be9c:997d","2001:4860:4860::8888","TCP","86","","","32","","51018  >  443 [ACK] Seq=518 Ack=4449 Win=61440 Len=0 TSval=3903975285 TSecr=4070506998"
"254","6.020153652","2601:5cf:4100:3de0:53f4:479c:be9c:997d","2001:4860:4860::8888","TLSv1.3","166","","","32","1,69","Change Cipher Spec, Finished"
"255","6.020445455","2601:5cf:4100:3de0:53f4:479c:be9c:997d","2001:4860:4860::8888","HTTP2","190","SETTINGS,WINDOW_UPDATE","36,4","32","99","Magic, SETTINGS[0], WINDOW_UPDATE[0]"
"256","6.033877701","2601:5cf:4100:3de0:53f4:479c:be9c:997d","2001:4860:4860::8888","DoH","285","HEADERS,WINDOW_UPDATE,DATA,DATA","65,4,28,0","32","104,54,26","Standard query 0xaee2 NS 004307.com"
"257","6.289450765","2001:4860:4860::8888","2601:5cf:4100:3de0:53f4:479c:be9c:997d","HTTP2","734","SETTINGS,WINDOW_UPDATE","18,4","32","581,57","SETTINGS[0], WINDOW_UPDATE[0]"
"258","6.289451215","2001:4860:4860::8888","2601:5cf:4100:3de0:53f4:479c:be9c:997d","HTTP2","117","SETTINGS","0","32","26","SETTINGS[0]"
"259","6.289451346","2001:4860:4860::8888","2601:5cf:4100:3de0:53f4:479c:be9c:997d","HTTP2","368","HEADERS","251","32","277","HEADERS[1]: 200 OK"
"260","6.289451446","2001:4860:4860::8888","2601:5cf:4100:3de0:53f4:479c:be9c:997d","HTTP2","198","DATA","81","32","107","DATA[1]"
"261","6.289451546","2001:4860:4860::8888","2601:5cf:4100:3de0:53f4:479c:be9c:997d","DoH","117","DATA","0","32","26","Standard query response 0xaee2 NS 004307.com NS bella.ns.cloudflare.com NS dion.ns.cloudflare.com"
"262","6.289451646","2001:4860:4860::8888","2601:5cf:4100:3de0:53f4:479c:be9c:997d","HTTP2","125","PING","8","32","34","PING[0]"
"265","6.290348056","2601:5cf:4100:3de0:53f4:479c:be9c:997d","2001:4860:4860::8888","HTTP2","117","SETTINGS","0","32","26","SETTINGS[0]"
"266","6.291480380","2601:5cf:4100:3de0:53f4:479c:be9c:997d","2001:4860:4860::8888","TCP","86","","","32","","51018  >  443 [RST, ACK] Seq=932 Ack=5592 Win=64128 Len=0 TSval=3903975564 TSecr=4070507041"
"267","6.311675495","2601:5cf:4100:3de0:53f4:479c:be9c:997d","2001:4860:4860::8888","TCP","94","","","40","","51030  >  443 [SYN] Seq=0 Win=64800 Len=0 MSS=1440 SACK_PERM TSval=3903975584 TSecr=0 WS=128"
"268","6.596577840","2001:4860:4860::8888","2601:5cf:4100:3de0:53f4:479c:be9c:997d","TCP","94","","","40","","443  >  51030 [SYN, ACK] Seq=0 Ack=1 Win=65535 Len=0 MSS=1440 SACK_PERM TSval=2269385389 TSecr=3903975584 WS=256"
"269","6.596634090","2601:5cf:4100:3de0:53f4:479c:be9c:997d","2001:4860:4860::8888","TCP","86","","","32","","51030  >  443 [ACK] Seq=1 Ack=1 Win=64896 Len=0 TSval=3903975869 TSecr=2269385389"
"270","6.597242274","2601:5cf:4100:3de0:53f4:479c:be9c:997d","2001:4860:4860::8888","TLSv1.3","603","","","32","512","Client Hello (SNI=dns.google)"
"271","6.856461427","2001:4860:4860::8888","2601:5cf:4100:3de0:53f4:479c:be9c:997d","TCP","86","","","32","","443  >  51030 [ACK] Seq=1 Ack=518 Win=66816 Len=0 TSval=2269385682 TSecr=3903975870"
"272","6.856461677","2001:4860:4860::8888","2601:5cf:4100:3de0:53f4:479c:be9c:997d","TLSv1.3","2502","","","32","122,1","Server Hello, Change Cipher Spec"
"273","6.856461737","2001:4860:4860::8888","2601:5cf:4100:3de0:53f4:479c:be9c:997d","TLSv1.3","2118","","","32","4310","Encrypted Extensions, Certificate, Certificate Verify, Finished"
"274","6.856491786","2601:5cf:4100:3de0:53f4:479c:be9c:997d","2001:4860:4860::8888","TCP","86","","","32","","51030  >  443 [ACK] Seq=518 Ack=2417 Win=63744 Len=0 TSval=3903976129 TSecr=2269385683"
"275","6.856503349","2601:5cf:4100:3de0:53f4:479c:be9c:997d","2001:4860:4860::8888","TCP","86","","","32","","51030  >  443 [ACK] Seq=518 Ack=4449 Win=62208 Len=0 TSval=3903976129 TSecr=2269385683"
"276","6.857742542","2601:5cf:4100:3de0:53f4:479c:be9c:997d","2001:4860:4860::8888","TLSv1.3","166","","","32","1,69","Change Cipher Spec, Finished"
"277","6.858025879","2601:5cf:4100:3de0:53f4:479c:be9c:997d","2001:4860:4860::8888","HTTP2","190","SETTINGS,WINDOW_UPDATE","36,4","32","99","Magic, SETTINGS[0], WINDOW_UPDATE[0]"
"278","6.866419771","2601:5cf:4100:3de0:53f4:479c:be9c:997d","2001:4860:4860::8888","DoH","288","HEADERS,WINDOW_UPDATE,DATA,DATA","65,4,31,0","32","104,57,26","Standard query 0x53f8 NS 004837963.xyz"
"279","6.902895544","2001:4860:4860::8888","2601:5cf:4100:3de0:53f4:479c:be9c:997d","HTTP2","734","SETTINGS,WINDOW_UPDATE","18,4","32","581,57","SETTINGS[0], WINDOW_UPDATE[0]"
"280","6.902895985","2001:4860:4860::8888","2601:5cf:4100:3de0:53f4:479c:be9c:997d","HTTP2","117","SETTINGS","0","32","26","SETTINGS[0]"
"281","6.902896105","2001:4860:4860::8888","2601:5cf:4100:3de0:53f4:479c:be9c:997d","TCP","86","","","32","","443  >  51030 [ACK] Seq=5128 Ack=904 Win=67840 Len=0 TSval=2269385946 TSecr=3903976139"
"282","6.903645226","2601:5cf:4100:3de0:53f4:479c:be9c:997d","2001:4860:4860::8888","HTTP2","117","SETTINGS","0","32","26","SETTINGS[0]"
"283","6.923680908","2001:4860:4860::8888","2601:5cf:4100:3de0:53f4:479c:be9c:997d","TCP","86","","","32","","443  >  51030 [ACK] Seq=5128 Ack=935 Win=67840 Len=0 TSval=2269385977 TSecr=3903976176"
"284","7.211266918","2001:4860:4860::8888","2601:5cf:4100:3de0:53f4:479c:be9c:997d","HTTP2","369","HEADERS","252","32","278","HEADERS[1]: 200 OK"
"285","7.211267369","2001:4860:4860::8888","2601:5cf:4100:3de0:53f4:479c:be9c:997d","HTTP2","295","DATA","178","32","204","DATA[1]"
"286","7.211267489","2001:4860:4860::8888","2601:5cf:4100:3de0:53f4:479c:be9c:997d","DoH","117","DATA","0","32","26","Standard query response 0x53f8 NS 004837963.xyz NS ns1.huaweicloud-dns.cn NS ns1.huaweicloud-dns.net NS ns1.huaweicloud-dns.org NS ns1.huaweicloud-dns.com"
"287","7.211267589","2001:4860:4860::8888","2601:5cf:4100:3de0:53f4:479c:be9c:997d","HTTP2","125","PING","8","32","34","PING[0]"
"288","7.213071512","2601:5cf:4100:3de0:53f4:479c:be9c:997d","2001:4860:4860::8888","TCP","86","","","32","","51030  >  443 [RST, ACK] Seq=935 Ack=5690 Win=64128 Len=0 TSval=3903976486 TSecr=2269386065"
"289","7.233725378","2601:5cf:4100:3de0:53f4:479c:be9c:997d","2001:4860:4860::8844","TCP","94","","","40","","51226  >  443 [SYN] Seq=0 Win=64800 Len=0 MSS=1440 SACK_PERM TSval=3232761880 TSecr=0 WS=128"
"290","7.518336526","2001:4860:4860::8844","2601:5cf:4100:3de0:53f4:479c:be9c:997d","TCP","94","","","40","","443  >  51226 [SYN, ACK] Seq=0 Ack=1 Win=65535 Len=0 MSS=1440 SACK_PERM TSval=141994870 TSecr=3232761880 WS=256"
"291","7.518368769","2601:5cf:4100:3de0:53f4:479c:be9c:997d","2001:4860:4860::8844","TCP","86","","","32","","51226  >  443 [ACK] Seq=1 Ack=1 Win=64896 Len=0 TSval=3232762165 TSecr=141994870"
"292","7.518740660","2601:5cf:4100:3de0:53f4:479c:be9c:997d","2001:4860:4860::8844","TLSv1.3","603","","","32","512","Client Hello (SNI=dns.google)"
"293","7.551309343","2001:4860:4860::8844","2601:5cf:4100:3de0:53f4:479c:be9c:997d","TCP","86","","","32","","443  >  51226 [ACK] Seq=1 Ack=518 Win=66816 Len=0 TSval=141995162 TSecr=3232762165"
"294","7.553135188","2001:4860:4860::8844","2601:5cf:4100:3de0:53f4:479c:be9c:997d","TLSv1.3","1294","","","32","122,1","Server Hello, Change Cipher Spec"
"295","7.553195867","2601:5cf:4100:3de0:53f4:479c:be9c:997d","2001:4860:4860::8844","TCP","86","","","32","","51226  >  443 [ACK] Seq=518 Ack=1209 Win=64128 Len=0 TSval=3232762200 TSecr=141995163"
"296","7.553555153","2001:4860:4860::8844","2601:5cf:4100:3de0:53f4:479c:be9c:997d","TCP","1294","","","32","","443  >  51226 [PSH, ACK] Seq=1209 Ack=518 Win=66816 Len=1208 TSval=141995163 TSecr=3232762165 [TCP segment of a reassembled PDU]"
"297","7.553555454","2001:4860:4860::8844","2601:5cf:4100:3de0:53f4:479c:be9c:997d","TCP","1294","","","32","","443  >  51226 [ACK] Seq=2417 Ack=518 Win=66816 Len=1208 TSval=141995163 TSecr=3232762165 [TCP segment of a reassembled PDU]"
"298","7.553579801","2601:5cf:4100:3de0:53f4:479c:be9c:997d","2001:4860:4860::8844","TCP","86","","","32","","51226  >  443 [ACK] Seq=518 Ack=2417 Win=63360 Len=0 TSval=3232762200 TSecr=141995163"
"299","7.553600622","2601:5cf:4100:3de0:53f4:479c:be9c:997d","2001:4860:4860::8844","TCP","86","","","32","","51226  >  443 [ACK] Seq=518 Ack=3625 Win=62208 Len=0 TSval=3232762200 TSecr=141995163"
"300","7.554974831","2001:4860:4860::8844","2601:5cf:4100:3de0:53f4:479c:be9c:997d","TLSv1.3","910","","","32","4310","Encrypted Extensions, Certificate, Certificate Verify, Finished"
"301","7.555026633","2601:5cf:4100:3de0:53f4:479c:be9c:997d","2001:4860:4860::8844","TCP","86","","","32","","51226  >  443 [ACK] Seq=518 Ack=4449 Win=64128 Len=0 TSval=3232762202 TSecr=141995163"
"302","7.556467071","2601:5cf:4100:3de0:53f4:479c:be9c:997d","2001:4860:4860::8844","TLSv1.3","166","","","32","1,69","Change Cipher Spec, Finished"
"303","7.556731911","2601:5cf:4100:3de0:53f4:479c:be9c:997d","2001:4860:4860::8844","HTTP2","190","SETTINGS,WINDOW_UPDATE","36,4","32","99","Magic, SETTINGS[0], WINDOW_UPDATE[0]"
"304","7.557036700","2601:5cf:4100:3de0:53f4:479c:be9c:997d","2001:4860:4860::8844","HTTP2","195","HEADERS,WINDOW_UPDATE","65,4","32","104","HEADERS[1]: POST /dns-query, WINDOW_UPDATE[1]"
"305","7.567930141","2601:5cf:4100:3de0:53f4:479c:be9c:997d","2001:4860:4860::8844","DoH","176","DATA,DATA","28,0","32","54,26","Standard query 0x22be NS 006622.xyz"
"306","7.584205409","2001:4860:4860::8844","2601:5cf:4100:3de0:53f4:479c:be9c:997d","HTTP2","734","SETTINGS,WINDOW_UPDATE","18,4","32","581,57","SETTINGS[0], WINDOW_UPDATE[0]"
"307","7.584205850","2001:4860:4860::8844","2601:5cf:4100:3de0:53f4:479c:be9c:997d","HTTP2","117","SETTINGS","0","32","26","SETTINGS[0]"
"308","7.584973748","2601:5cf:4100:3de0:53f4:479c:be9c:997d","2001:4860:4860::8844","HTTP2","117","SETTINGS","0","32","26","SETTINGS[0]"
"309","7.680830735","2001:4860:4860::8844","2601:5cf:4100:3de0:53f4:479c:be9c:997d","TCP","86","","","32","","443  >  51226 [ACK] Seq=5128 Ack=901 Win=66816 Len=0 TSval=141995211 TSecr=3232762214"
"310","7.680830996","2001:4860:4860::8844","2601:5cf:4100:3de0:53f4:479c:be9c:997d","HTTP2","368","HEADERS","251","32","277","HEADERS[1]: 200 OK"
"311","7.680831046","2001:4860:4860::8844","2601:5cf:4100:3de0:53f4:479c:be9c:997d","HTTP2","201","DATA","84","32","110","DATA[1]"
"312","7.681080125","2001:4860:4860::8844","2601:5cf:4100:3de0:53f4:479c:be9c:997d","HTTP2","156","DATA,PING","0,8","32","26,34","Standard query response 0x22be NS 006622.xyz NS isabel.ns.cloudflare.com NS jay.ns.cloudflare.com, PING[0]"
"313","7.682133303","2601:5cf:4100:3de0:53f4:479c:be9c:997d","2001:4860:4860::8844","TCP","86","","","32","","51226  >  443 [RST, ACK] Seq=932 Ack=5595 Win=64128 Len=0 TSval=3232762329 TSecr=141995214"
"314","7.703687166","2601:5cf:4100:3de0:53f4:479c:be9c:997d","2001:4860:4860::8844","TCP","94","","","40","","51238  >  443 [SYN] Seq=0 Win=64800 Len=0 MSS=1440 SACK_PERM TSval=3232762350 TSecr=0 WS=128"
"315","7.705461090","2001:4860:4860::8844","2601:5cf:4100:3de0:53f4:479c:be9c:997d","TCP","86","","","32","","443  >  51226 [ACK] Seq=5595 Ack=932 Win=66816 Len=0 TSval=141995319 TSecr=3232762232"
"316","7.705473243","2601:5cf:4100:3de0:53f4:479c:be9c:997d","2001:4860:4860::8844","TCP","74","","","20","","51226  >  443 [RST] Seq=932 Win=0 Len=0"
"317","8.030367487","2001:4860:4860::8844","2601:5cf:4100:3de0:53f4:479c:be9c:997d","TCP","94","","","40","","443  >  51238 [SYN, ACK] Seq=0 Ack=1 Win=65535 Len=0 MSS=1440 SACK_PERM TSval=2922177468 TSecr=3232762350 WS=256"
"318","8.030400341","2601:5cf:4100:3de0:53f4:479c:be9c:997d","2001:4860:4860::8844","TCP","86","","","32","","51238  >  443 [ACK] Seq=1 Ack=1 Win=64896 Len=0 TSval=3232762677 TSecr=2922177468"
"319","8.030781310","2601:5cf:4100:3de0:53f4:479c:be9c:997d","2001:4860:4860::8844","TLSv1.3","603","","","32","512","Client Hello (SNI=dns.google)"
"320","8.032351122","2001:4860:4860::8844","2601:5cf:4100:3de0:53f4:479c:be9c:997d","TCP","94","","","40","","[TCP Out-Of-Order] 443  >  51238 [SYN, ACK] Seq=0 Ack=1 Win=65535 Len=0 MSS=1440 SACK_PERM TSval=2922177769 TSecr=3232762350 WS=256"
"321","8.032407182","2601:5cf:4100:3de0:53f4:479c:be9c:997d","2001:4860:4860::8844","TCP","86","","","32","","[TCP Dup ACK 318#1] 51238  >  443 [ACK] Seq=518 Ack=1 Win=64896 Len=0 TSval=3232762679 TSecr=2922177468"
"322","8.337771631","2001:4860:4860::8844","2601:5cf:4100:3de0:53f4:479c:be9c:997d","TCP","86","","","32","","443  >  51238 [ACK] Seq=1 Ack=518 Win=66816 Len=0 TSval=2922177800 TSecr=3232762677"
"323","8.337771891","2001:4860:4860::8844","2601:5cf:4100:3de0:53f4:479c:be9c:997d","TLSv1.3","2502","","","32","122,1","Server Hello, Change Cipher Spec"
"324","8.337771941","2001:4860:4860::8844","2601:5cf:4100:3de0:53f4:479c:be9c:997d","TLSv1.3","2118","","","32","4310","Encrypted Extensions, Certificate, Certificate Verify, Finished"
"325","8.337803824","2601:5cf:4100:3de0:53f4:479c:be9c:997d","2001:4860:4860::8844","TCP","86","","","32","","51238  >  443 [ACK] Seq=518 Ack=2417 Win=63744 Len=0 TSval=3232762984 TSecr=2922177801"
"326","8.337813864","2601:5cf:4100:3de0:53f4:479c:be9c:997d","2001:4860:4860::8844","TCP","86","","","32","","51238  >  443 [ACK] Seq=518 Ack=4449 Win=62208 Len=0 TSval=3232762984 TSecr=2922177801"
"327","8.339199224","2601:5cf:4100:3de0:53f4:479c:be9c:997d","2001:4860:4860::8844","TLSv1.3","166","","","32","1,69","Change Cipher Spec, Finished"
"328","8.339461439","2601:5cf:4100:3de0:53f4:479c:be9c:997d","2001:4860:4860::8844","HTTP2","190","SETTINGS,WINDOW_UPDATE","36,4","32","99","Magic, SETTINGS[0], WINDOW_UPDATE[0]"
"329","8.346786753","2601:5cf:4100:3de0:53f4:479c:be9c:997d","2001:4860:4860::8844","DoH","284","HEADERS,WINDOW_UPDATE,DATA,DATA","65,4,27,0","32","104,53,26","Standard query 0x8dbe NS 00a4g.top"
"330","8.364075512","2001:4860:4860::8844","2601:5cf:4100:3de0:53f4:479c:be9c:997d","HTTP2","734","SETTINGS,WINDOW_UPDATE","18,4","32","581,57","SETTINGS[0], WINDOW_UPDATE[0]"
"331","8.364076003","2001:4860:4860::8844","2601:5cf:4100:3de0:53f4:479c:be9c:997d","HTTP2","117","SETTINGS","0","32","26","SETTINGS[0]"
"332","8.364881424","2601:5cf:4100:3de0:53f4:479c:be9c:997d","2001:4860:4860::8844","HTTP2","117","SETTINGS","0","32","26","SETTINGS[0]"
"333","8.371480924","2001:4860:4860::8844","2601:5cf:4100:3de0:53f4:479c:be9c:997d","HTTP2","368","HEADERS","251","32","277","HEADERS[1]: 200 OK"
"334","8.371481365","2001:4860:4860::8844","2601:5cf:4100:3de0:53f4:479c:be9c:997d","HTTP2","203","DATA","86","32","112","DATA[1]"
"335","8.371726296","2001:4860:4860::8844","2601:5cf:4100:3de0:53f4:479c:be9c:997d","DoH","117","DATA","0","32","26","Standard query response 0x8dbe NS 00a4g.top NS oaklyn.ns.cloudflare.com NS yevgen.ns.cloudflare.com"
"336","8.371726586","2001:4860:4860::8844","2601:5cf:4100:3de0:53f4:479c:be9c:997d","HTTP2","125","PING","8","32","34","PING[0]"
"337","8.375217230","2601:5cf:4100:3de0:53f4:479c:be9c:997d","2001:4860:4860::8844","TCP","86","","","32","","51238  >  443 [RST, ACK] Seq=931 Ack=5597 Win=64128 Len=0 TSval=3232763022 TSecr=2922178110"
"338","8.392861487","2001:4860:4860::8844","2601:5cf:4100:3de0:53f4:479c:be9c:997d","TCP","86","","","32","","443  >  51238 [ACK] Seq=5597 Ack=931 Win=67840 Len=0 TSval=2922178132 TSecr=3232763011"
"339","8.392884472","2601:5cf:4100:3de0:53f4:479c:be9c:997d","2001:4860:4860::8844","TCP","74","","","20","","51238  >  443 [RST] Seq=931 Win=0 Len=0"
"340","8.396839779","2601:5cf:4100:3de0:53f4:479c:be9c:997d","2001:4860:4860::8844","TCP","94","","","40","","51244  >  443 [SYN] Seq=0 Win=64800 Len=0 MSS=1440 SACK_PERM TSval=3232763043 TSecr=0 WS=128"
"341","8.644966863","2001:4860:4860::8844","2601:5cf:4100:3de0:53f4:479c:be9c:997d","TCP","94","","","40","","443  >  51244 [SYN, ACK] Seq=0 Ack=1 Win=65535 Len=0 MSS=1440 SACK_PERM TSval=4026386659 TSecr=3232763043 WS=256"
"342","8.645026079","2601:5cf:4100:3de0:53f4:479c:be9c:997d","2001:4860:4860::8844","TCP","86","","","32","","51244  >  443 [ACK] Seq=1 Ack=1 Win=64896 Len=0 TSval=3232763292 TSecr=4026386659"
"343","8.645685103","2601:5cf:4100:3de0:53f4:479c:be9c:997d","2001:4860:4860::8844","TLSv1.3","603","","","32","512","Client Hello (SNI=dns.google)"
"344","8.670427909","2001:4860:4860::8844","2601:5cf:4100:3de0:53f4:479c:be9c:997d","TCP","86","","","32","","443  >  51244 [ACK] Seq=1 Ack=518 Win=66816 Len=0 TSval=4026386900 TSecr=3232763292"
"345","8.672478045","2001:4860:4860::8844","2601:5cf:4100:3de0:53f4:479c:be9c:997d","TLSv1.3","2502","","","32","122,1","Server Hello, Change Cipher Spec"
"346","8.672478496","2001:4860:4860::8844","2601:5cf:4100:3de0:53f4:479c:be9c:997d","TLSv1.3","2118","","","32","4310","Encrypted Extensions, Certificate, Certificate Verify, Finished"
"347","8.672521841","2601:5cf:4100:3de0:53f4:479c:be9c:997d","2001:4860:4860::8844","TCP","86","","","32","","51244  >  443 [ACK] Seq=518 Ack=2417 Win=62592 Len=0 TSval=3232763319 TSecr=4026386901"
"348","8.672547582","2601:5cf:4100:3de0:53f4:479c:be9c:997d","2001:4860:4860::8844","TCP","86","","","32","","51244  >  443 [ACK] Seq=518 Ack=4449 Win=60672 Len=0 TSval=3232763319 TSecr=4026386901"
"349","8.680715099","2601:5cf:4100:3de0:53f4:479c:be9c:997d","2001:4860:4860::8844","TLSv1.3","166","","","32","1,69","Change Cipher Spec, Finished"
"350","8.681009868","2601:5cf:4100:3de0:53f4:479c:be9c:997d","2001:4860:4860::8844","HTTP2","190","SETTINGS,WINDOW_UPDATE","36,4","32","99","Magic, SETTINGS[0], WINDOW_UPDATE[0]"
"351","8.681795351","2601:5cf:4100:3de0:53f4:479c:be9c:997d","2001:4860:4860::8844","DoH","292","HEADERS,WINDOW_UPDATE,DATA,DATA","65,4,35,0","32","104,61,26","Standard query 0xe41b NS 00b5dxgbkl.online"
"352","8.840263546","2001:4860:4860::8844","2601:5cf:4100:3de0:53f4:479c:be9c:997d","HTTP2","734","SETTINGS,WINDOW_UPDATE","18,4","32","581,57","SETTINGS[0], WINDOW_UPDATE[0]"
"353","8.840263797","2001:4860:4860::8844","2601:5cf:4100:3de0:53f4:479c:be9c:997d","HTTP2","117","SETTINGS","0","32","26","SETTINGS[0]"
"354","8.840263857","2001:4860:4860::8844","2601:5cf:4100:3de0:53f4:479c:be9c:997d","HTTP2","368","HEADERS","251","32","277","HEADERS[1]: 200 OK"
"355","8.840263897","2001:4860:4860::8844","2601:5cf:4100:3de0:53f4:479c:be9c:997d","HTTP2","209","DATA","92","32","118","DATA[1]"
"356","8.840568295","2001:4860:4860::8844","2601:5cf:4100:3de0:53f4:479c:be9c:997d","HTTP2","156","DATA,PING","0,8","32","26,34","Standard query response 0xe41b NS 00b5dxgbkl.online NS hadlee.ns.cloudflare.com NS sean.ns.cloudflare.com, PING[0]"
"357","8.840824147","2601:5cf:4100:3de0:53f4:479c:be9c:997d","2001:4860:4860::8844","HTTP2","117","SETTINGS","0","32","26","SETTINGS[0]"
"358","8.841917494","2601:5cf:4100:3de0:53f4:479c:be9c:997d","2001:4860:4860::8844","TCP","86","","","32","","51244  >  443 [RST, ACK] Seq=939 Ack=5603 Win=64128 Len=0 TSval=3232763488 TSecr=4026386937"
"359","8.862309657","2601:5cf:4100:3de0:53f4:479c:be9c:997d","2001:4860:4860::8844","TCP","94","","","40","","51248  >  443 [SYN] Seq=0 Win=64800 Len=0 MSS=1440 SACK_PERM TSval=3232763509 TSecr=0 WS=128"
"360","9.157149243","2001:4860:4860::8844","2601:5cf:4100:3de0:53f4:479c:be9c:997d","TCP","86","","","32","","443  >  51244 [ACK] Seq=5603 Ack=939 Win=67840 Len=0 TSval=4026387097 TSecr=3232763487"
"361","9.157149693","2001:4860:4860::8844","2601:5cf:4100:3de0:53f4:479c:be9c:997d","TCP","94","","","40","","443  >  51248 [SYN, ACK] Seq=0 Ack=1 Win=65535 Len=0 MSS=1440 SACK_PERM TSval=3296027404 TSecr=3232763509 WS=256"
"362","9.157191445","2601:5cf:4100:3de0:53f4:479c:be9c:997d","2001:4860:4860::8844","TCP","74","","","20","","51244  >  443 [RST] Seq=939 Win=0 Len=0"
"363","9.157234300","2601:5cf:4100:3de0:53f4:479c:be9c:997d","2001:4860:4860::8844","TCP","86","","","32","","51248  >  443 [ACK] Seq=1 Ack=1 Win=64896 Len=0 TSval=3232763804 TSecr=3296027404"
"364","9.157862102","2601:5cf:4100:3de0:53f4:479c:be9c:997d","2001:4860:4860::8844","TLSv1.3","603","","","32","512","Client Hello (SNI=dns.google)"
"365","9.464169368","2001:4860:4860::8844","2601:5cf:4100:3de0:53f4:479c:be9c:997d","TCP","86","","","32","","443  >  51248 [ACK] Seq=1 Ack=518 Win=66816 Len=0 TSval=3296027709 TSecr=3232763804"
"366","9.464169598","2001:4860:4860::8844","2601:5cf:4100:3de0:53f4:479c:be9c:997d","TLSv1.3","2502","","","32","122,1","Server Hello, Change Cipher Spec"
"367","9.464169648","2001:4860:4860::8844","2601:5cf:4100:3de0:53f4:479c:be9c:997d","TLSv1.3","2118","","","32","4310","Encrypted Extensions, Certificate, Certificate Verify, Finished"
"368","9.464201882","2601:5cf:4100:3de0:53f4:479c:be9c:997d","2001:4860:4860::8844","TCP","86","","","32","","51248  >  443 [ACK] Seq=518 Ack=2417 Win=63744 Len=0 TSval=3232764111 TSecr=3296027710"
"369","9.464211911","2601:5cf:4100:3de0:53f4:479c:be9c:997d","2001:4860:4860::8844","TCP","86","","","32","","51248  >  443 [ACK] Seq=518 Ack=4449 Win=62208 Len=0 TSval=3232764111 TSecr=3296027710"
"370","9.465518858","2601:5cf:4100:3de0:53f4:479c:be9c:997d","2001:4860:4860::8844","TLSv1.3","166","","","32","1,69","Change Cipher Spec, Finished"
"371","9.465783718","2601:5cf:4100:3de0:53f4:479c:be9c:997d","2001:4860:4860::8844","HTTP2","190","SETTINGS,WINDOW_UPDATE","36,4","32","99","Magic, SETTINGS[0], WINDOW_UPDATE[0]"
"372","9.474976068","2601:5cf:4100:3de0:53f4:479c:be9c:997d","2001:4860:4860::8844","DoH","289","HEADERS,WINDOW_UPDATE,DATA,DATA","65,4,32,0","32","104,58,26","Standard query 0x87be NS 00hgmaq6yv.com"
"373","9.771393415","2001:4860:4860::8844","2601:5cf:4100:3de0:53f4:479c:be9c:997d","HTTP2","734","SETTINGS,WINDOW_UPDATE","18,4","32","581,57","SETTINGS[0], WINDOW_UPDATE[0]"
"374","9.771393856","2001:4860:4860::8844","2601:5cf:4100:3de0:53f4:479c:be9c:997d","HTTP2","117","SETTINGS","0","32","26","SETTINGS[0]"
"375","9.771393986","2001:4860:4860::8844","2601:5cf:4100:3de0:53f4:479c:be9c:997d","TCP","86","","","32","","443  >  51248 [ACK] Seq=5128 Ack=905 Win=67840 Len=0 TSval=3296028033 TSecr=3232764122"
"376","9.771394086","2001:4860:4860::8844","2601:5cf:4100:3de0:53f4:479c:be9c:997d","HTTP2","365","HEADERS","248","32","274","HEADERS[1]: 200 OK"
"377","9.771394197","2001:4860:4860::8844","2601:5cf:4100:3de0:53f4:479c:be9c:997d","HTTP2","149","DATA","32","32","58","DATA[1]"
"378","9.771394297","2001:4860:4860::8844","2601:5cf:4100:3de0:53f4:479c:be9c:997d","HTTP2","156","DATA,PING","0,8","32","26,34","Standard query response 0x87be Server failure NS 00hgmaq6yv.com, PING[0]"
"379","9.772273233","2601:5cf:4100:3de0:53f4:479c:be9c:997d","2001:4860:4860::8844","HTTP2","117","SETTINGS","0","32","26","SETTINGS[0]"
"380","9.773142810","2601:5cf:4100:3de0:53f4:479c:be9c:997d","2001:4860:4860::8844","TCP","86","","","32","","51248  >  443 [RST, ACK] Seq=936 Ack=5540 Win=64128 Len=0 TSval=3232764420 TSecr=3296028017"
"381","9.792772737","2001:4860:4860::8844","2601:5cf:4100:3de0:53f4:479c:be9c:997d","TCP","86","","","32","","443  >  51248 [ACK] Seq=5540 Ack=936 Win=67840 Len=0 TSval=3296028313 TSecr=3232764419"
"382","9.792795542","2601:5cf:4100:3de0:53f4:479c:be9c:997d","2001:4860:4860::8844","TCP","74","","","20","","51248  >  443 [RST] Seq=936 Win=0 Len=0"
"383","9.794274887","2601:5cf:4100:3de0:53f4:479c:be9c:997d","2001:4860:4860::8888","TCP","94","","","40","","51040  >  443 [SYN] Seq=0 Win=64800 Len=0 MSS=1440 SACK_PERM TSval=3903979067 TSecr=0 WS=128"
"384","10.078507969","2001:4860:4860::8888","2601:5cf:4100:3de0:53f4:479c:be9c:997d","TCP","94","","","40","","443  >  51040 [SYN, ACK] Seq=0 Ack=1 Win=65535 Len=0 MSS=1440 SACK_PERM TSval=1097207214 TSecr=3903979067 WS=256"
"385","10.078541295","2601:5cf:4100:3de0:53f4:479c:be9c:997d","2001:4860:4860::8888","TCP","86","","","32","","51040  >  443 [ACK] Seq=1 Ack=1 Win=64896 Len=0 TSval=3903979351 TSecr=1097207214"
"386","10.078893607","2601:5cf:4100:3de0:53f4:479c:be9c:997d","2001:4860:4860::8888","TLSv1.3","603","","","32","512","Client Hello (SNI=dns.google)"
"387","10.385909673","2001:4860:4860::8888","2601:5cf:4100:3de0:53f4:479c:be9c:997d","TCP","86","","","32","","443  >  51040 [ACK] Seq=1 Ack=518 Win=66816 Len=0 TSval=1097207506 TSecr=3903979351"
"388","10.385909913","2001:4860:4860::8888","2601:5cf:4100:3de0:53f4:479c:be9c:997d","TLSv1.3","2502","","","32","122,1","Server Hello, Change Cipher Spec"
"389","10.385909953","2001:4860:4860::8888","2601:5cf:4100:3de0:53f4:479c:be9c:997d","TLSv1.3","2118","","","32","4310","Encrypted Extensions, Certificate, Certificate Verify, Finished"
"390","10.385940884","2601:5cf:4100:3de0:53f4:479c:be9c:997d","2001:4860:4860::8888","TCP","86","","","32","","51040  >  443 [ACK] Seq=518 Ack=2417 Win=63744 Len=0 TSval=3903979658 TSecr=1097207506"
"391","10.385950793","2601:5cf:4100:3de0:53f4:479c:be9c:997d","2001:4860:4860::8888","TCP","86","","","32","","51040  >  443 [ACK] Seq=518 Ack=4449 Win=62208 Len=0 TSval=3903979659 TSecr=1097207506"
"392","10.387338208","2601:5cf:4100:3de0:53f4:479c:be9c:997d","2001:4860:4860::8888","TLSv1.3","166","","","32","1,69","Change Cipher Spec, Finished"
"393","10.387618859","2601:5cf:4100:3de0:53f4:479c:be9c:997d","2001:4860:4860::8888","HTTP2","190","SETTINGS,WINDOW_UPDATE","36,4","32","99","Magic, SETTINGS[0], WINDOW_UPDATE[0]"
"394","10.394568616","2601:5cf:4100:3de0:53f4:479c:be9c:997d","2001:4860:4860::8888","DoH","283","HEADERS,WINDOW_UPDATE,DATA,DATA","65,4,26,0","32","104,52,26","Standard query 0x90a0 NS 00px.net"
"395","10.693102806","2001:4860:4860::8888","2601:5cf:4100:3de0:53f4:479c:be9c:997d","HTTP2","734","SETTINGS,WINDOW_UPDATE","18,4","32","581,57","SETTINGS[0], WINDOW_UPDATE[0]"
"396","10.693103257","2001:4860:4860::8888","2601:5cf:4100:3de0:53f4:479c:be9c:997d","HTTP2","117","SETTINGS","0","32","26","SETTINGS[0]"
"397","10.693103387","2001:4860:4860::8888","2601:5cf:4100:3de0:53f4:479c:be9c:997d","HTTP2","367","HEADERS","250","32","276","HEADERS[1]: 200 OK"
"398","10.693103488","2001:4860:4860::8888","2601:5cf:4100:3de0:53f4:479c:be9c:997d","HTTP2","213","DATA","96","32","122","DATA[1]"
"399","10.693103588","2001:4860:4860::8888","2601:5cf:4100:3de0:53f4:479c:be9c:997d","DoH","117","DATA","0","32","26","Standard query response 0x90a0 NS 00px.net NS ns1.digitalocean.com NS ns2.digitalocean.com NS ns3.digitalocean.com"
"400","10.693103698","2001:4860:4860::8888","2601:5cf:4100:3de0:53f4:479c:be9c:997d","HTTP2","125","PING","8","32","34","PING[0]"
"401","10.694075897","2601:5cf:4100:3de0:53f4:479c:be9c:997d","2001:4860:4860::8888","HTTP2","117","SETTINGS","0","32","26","SETTINGS[0]"
"402","10.695167330","2601:5cf:4100:3de0:53f4:479c:be9c:997d","2001:4860:4860::8888","TCP","86","","","32","","51040  >  443 [RST, ACK] Seq=930 Ack=5606 Win=64128 Len=0 TSval=3903979968 TSecr=1097207815"
"403","10.717138004","2601:5cf:4100:3de0:53f4:479c:be9c:997d","2001:4860:4860::8844","TCP","94","","","40","","51254  >  443 [SYN] Seq=0 Win=64800 Len=0 MSS=1440 SACK_PERM TSval=3232765364 TSecr=0 WS=128"
"404","10.720802269","2001:4860:4860::8888","2601:5cf:4100:3de0:53f4:479c:be9c:997d","TCP","86","","","32","","443  >  51040 [ACK] Seq=5606 Ack=930 Win=67840 Len=0 TSval=1097208119 TSecr=3903979967"
"405","10.720821196","2601:5cf:4100:3de0:53f4:479c:be9c:997d","2001:4860:4860::8888","TCP","74","","","20","","51040  >  443 [RST] Seq=930 Win=0 Len=0"
"406","10.824309195","2001:4860:4860::8844","2601:5cf:4100:3de0:53f4:479c:be9c:997d","TCP","94","","","40","","443  >  51254 [SYN, ACK] Seq=0 Ack=1 Win=65535 Len=0 MSS=1440 SACK_PERM TSval=1073846395 TSecr=3232765364 WS=256"
"407","10.824341207","2601:5cf:4100:3de0:53f4:479c:be9c:997d","2001:4860:4860::8844","TCP","86","","","32","","51254  >  443 [ACK] Seq=1 Ack=1 Win=64896 Len=0 TSval=3232765471 TSecr=1073846395"
"408","10.824756773","2601:5cf:4100:3de0:53f4:479c:be9c:997d","2001:4860:4860::8844","TLSv1.3","603","","","32","512","Client Hello (SNI=dns.google)"
"409","11.102435715","2001:4860:4860::8844","2601:5cf:4100:3de0:53f4:479c:be9c:997d","TCP","86","","","32","","443  >  51254 [ACK] Seq=1 Ack=518 Win=66816 Len=0 TSval=1073846507 TSecr=3232765471"
"410","11.102726115","2001:4860:4860::8844","2601:5cf:4100:3de0:53f4:479c:be9c:997d","TLSv1.3","2502","","","32","122,1","Server Hello, Change Cipher Spec"
"411","11.102726235","2001:4860:4860::8844","2601:5cf:4100:3de0:53f4:479c:be9c:997d","TLSv1.3","2118","","","32","4310","Encrypted Extensions, Certificate, Certificate Verify, Finished"
"412","11.102726286","2001:4860:4860::8844","2601:5cf:4100:3de0:53f4:479c:be9c:997d","TCP","910","","","32","","[TCP Retransmission] 443  >  51254 [PSH, ACK] Seq=3625 Ack=518 Win=66816 Len=824 TSval=1073846725 TSecr=3232765471 [TCP segment of a reassembled PDU]"
"413","11.102746084","2601:5cf:4100:3de0:53f4:479c:be9c:997d","2001:4860:4860::8844","TCP","86","","","32","","51254  >  443 [ACK] Seq=518 Ack=2417 Win=63744 Len=0 TSval=3232765749 TSecr=1073846509"
"414","11.102758819","2601:5cf:4100:3de0:53f4:479c:be9c:997d","2001:4860:4860::8844","TCP","86","","","32","","51254  >  443 [ACK] Seq=518 Ack=4449 Win=62208 Len=0 TSval=3232765749 TSecr=1073846509"
"415","11.102764731","2601:5cf:4100:3de0:53f4:479c:be9c:997d","2001:4860:4860::8844","TCP","98","","","44","","[TCP Dup ACK 414#1] 51254  >  443 [ACK] Seq=518 Ack=4449 Win=62208 Len=0 TSval=3232765749 TSecr=1073846725 SLE=3625 SRE=4449"
"416","11.104141234","2601:5cf:4100:3de0:53f4:479c:be9c:997d","2001:4860:4860::8844","TLSv1.3","166","","","32","1,69","Change Cipher Spec, Finished"
"417","11.104423869","2601:5cf:4100:3de0:53f4:479c:be9c:997d","2001:4860:4860::8844","HTTP2","190","SETTINGS,WINDOW_UPDATE","36,4","32","99","Magic, SETTINGS[0], WINDOW_UPDATE[0]"
"418","11.112622799","2601:5cf:4100:3de0:53f4:479c:be9c:997d","2001:4860:4860::8844","DoH","285","HEADERS,WINDOW_UPDATE,DATA,DATA","65,4,28,0","32","104,54,26","Standard query 0xbf95 NS 00xwin.com"
"419","11.392175162","2601:5cf:4100:3de0:53f4:479c:be9c:997d","2001:4860:4860::8844","TCP","285","","","32","","[TCP Retransmission] 51254  >  443 [PSH, ACK] Seq=702 Ack=4449 Win=64128 Len=199 TSval=3232766039 TSecr=1073846725"
"420","11.395081589","2001:4860:4860::8844","2601:5cf:4100:3de0:53f4:479c:be9c:997d","HTTP2","734","SETTINGS,WINDOW_UPDATE","18,4","32","581,57","SETTINGS[0], WINDOW_UPDATE[0]"
"421","11.395082040","2001:4860:4860::8844","2601:5cf:4100:3de0:53f4:479c:be9c:997d","HTTP2","117","SETTINGS","0","32","26","SETTINGS[0]"
"422","11.395082170","2001:4860:4860::8844","2601:5cf:4100:3de0:53f4:479c:be9c:997d","TCP","86","","","32","","443  >  51254 [ACK] Seq=5128 Ack=901 Win=67840 Len=0 TSval=1073846796 TSecr=3232765759"
"423","11.395082270","2001:4860:4860::8844","2601:5cf:4100:3de0:53f4:479c:be9c:997d","HTTP2","368","HEADERS","251","32","277","HEADERS[1]: 200 OK"
"424","11.395082371","2001:4860:4860::8844","2601:5cf:4100:3de0:53f4:479c:be9c:997d","HTTP2","197","DATA","80","32","106","DATA[1]"
"425","11.395082481","2001:4860:4860::8844","2601:5cf:4100:3de0:53f4:479c:be9c:997d","DoH","117","DATA","0","32","26","Standard query response 0xbf95 NS 00xwin.com NS evan.ns.cloudflare.com NS kami.ns.cloudflare.com"
"426","11.395082581","2001:4860:4860::8844","2601:5cf:4100:3de0:53f4:479c:be9c:997d","HTTP2","125","PING","8","32","34","PING[0]"
"427","11.395758598","2601:5cf:4100:3de0:53f4:479c:be9c:997d","2001:4860:4860::8844","HTTP2","117","SETTINGS","0","32","26","SETTINGS[0]"
"428","11.399127875","2601:5cf:4100:3de0:53f4:479c:be9c:997d","2001:4860:4860::8844","TCP","86","","","32","","51254  >  443 [RST, ACK] Seq=932 Ack=5591 Win=64128 Len=0 TSval=3232766046 TSecr=1073846783"
"429","11.402485017","2001:4860:4860::8844","2601:5cf:4100:3de0:53f4:479c:be9c:997d","TCP","125","","","32","","[TCP Spurious Retransmission] 443  >  51254 [PSH, ACK] Seq=5552 Ack=901 Win=67840 Len=39 TSval=1073847053 TSecr=3232765759"
"430","11.402499355","2601:5cf:4100:3de0:53f4:479c:be9c:997d","2001:4860:4860::8844","TCP","74","","","20","","51254  >  443 [RST] Seq=901 Win=0 Len=0"
"431","11.416629914","2001:4860:4860::8844","2601:5cf:4100:3de0:53f4:479c:be9c:997d","TCP","98","","","44","","[TCP Dup ACK 422#1] 443  >  51254 [ACK] Seq=5591 Ack=901 Win=67840 Len=0 TSval=1073847067 TSecr=3232766039 SLE=702 SRE=901"
"432","11.416688799","2601:5cf:4100:3de0:53f4:479c:be9c:997d","2001:4860:4860::8844","TCP","74","","","20","","51254  >  443 [RST] Seq=901 Win=0 Len=0"
"433","11.426352416","2001:4860:4860::8844","2601:5cf:4100:3de0:53f4:479c:be9c:997d","TCP","86","","","32","","443  >  51254 [ACK] Seq=5591 Ack=932 Win=67840 Len=0 TSval=1073847077 TSecr=3232766042"
"434","11.426417033","2601:5cf:4100:3de0:53f4:479c:be9c:997d","2001:4860:4860::8844","TCP","74","","","20","","51254  >  443 [RST] Seq=932 Win=0 Len=0"
"435","11.430878834","2601:5cf:4100:3de0:53f4:479c:be9c:997d","2001:4860:4860::8844","TCP","94","","","40","","58290  >  443 [SYN] Seq=0 Win=64800 Len=0 MSS=1440 SACK_PERM TSval=3232766077 TSecr=0 WS=128"
"436","11.717096106","2001:4860:4860::8844","2601:5cf:4100:3de0:53f4:479c:be9c:997d","TCP","94","","","40","","443  >  58290 [SYN, ACK] Seq=0 Ack=1 Win=65535 Len=0 MSS=1440 SACK_PERM TSval=165074082 TSecr=3232766077 WS=256"
"437","11.717154831","2601:5cf:4100:3de0:53f4:479c:be9c:997d","2001:4860:4860::8844","TCP","86","","","32","","58290  >  443 [ACK] Seq=1 Ack=1 Win=64896 Len=0 TSval=3232766364 TSecr=165074082"
"438","11.717520980","2601:5cf:4100:3de0:53f4:479c:be9c:997d","2001:4860:4860::8844","TLSv1.3","603","","","32","512","Client Hello (SNI=dns.google)"
"439","12.024112701","2001:4860:4860::8844","2601:5cf:4100:3de0:53f4:479c:be9c:997d","TCP","86","","","32","","443  >  58290 [ACK] Seq=1 Ack=518 Win=66816 Len=0 TSval=165074367 TSecr=3232766364"
"440","12.024112931","2001:4860:4860::8844","2601:5cf:4100:3de0:53f4:479c:be9c:997d","TLSv1.3","2502","","","32","122,1","Server Hello, Change Cipher Spec"
"441","12.024112971","2001:4860:4860::8844","2601:5cf:4100:3de0:53f4:479c:be9c:997d","TLSv1.3","2118","","","32","4310","Encrypted Extensions, Certificate, Certificate Verify, Finished"
"442","12.024146397","2601:5cf:4100:3de0:53f4:479c:be9c:997d","2001:4860:4860::8844","TCP","86","","","32","","58290  >  443 [ACK] Seq=518 Ack=2417 Win=63744 Len=0 TSval=3232766671 TSecr=165074368"
"443","12.024156657","2601:5cf:4100:3de0:53f4:479c:be9c:997d","2001:4860:4860::8844","TCP","86","","","32","","58290  >  443 [ACK] Seq=518 Ack=4449 Win=62208 Len=0 TSval=3232766671 TSecr=165074368"
"444","12.025438685","2601:5cf:4100:3de0:53f4:479c:be9c:997d","2001:4860:4860::8844","TLSv1.3","166","","","32","1,69","Change Cipher Spec, Finished"
"445","12.025719656","2601:5cf:4100:3de0:53f4:479c:be9c:997d","2001:4860:4860::8844","HTTP2","190","SETTINGS,WINDOW_UPDATE","36,4","32","99","Magic, SETTINGS[0], WINDOW_UPDATE[0]"
"446","12.033885342","2601:5cf:4100:3de0:53f4:479c:be9c:997d","2001:4860:4860::8844","DoH","285","HEADERS,WINDOW_UPDATE,DATA,DATA","65,4,28,0","32","104,54,26","Standard query 0x5524 NS 0101.co.jp"
"447","12.050745581","2001:4860:4860::8844","2601:5cf:4100:3de0:53f4:479c:be9c:997d","HTTP2","734","SETTINGS,WINDOW_UPDATE","18,4","32","581,57","SETTINGS[0], WINDOW_UPDATE[0]"
"448","12.051651730","2601:5cf:4100:3de0:53f4:479c:be9c:997d","2001:4860:4860::8844","HTTP2","117","SETTINGS","0","32","26","SETTINGS[0]"
"449","12.056871330","2001:4860:4860::8844","2601:5cf:4100:3de0:53f4:479c:be9c:997d","HTTP2","117","SETTINGS","0","32","26","SETTINGS[0]"
"450","12.072460133","2001:4860:4860::8844","2601:5cf:4100:3de0:53f4:479c:be9c:997d","TCP","86","","","32","","443  >  58290 [ACK] Seq=5128 Ack=901 Win=67840 Len=0 TSval=165074690 TSecr=3232766680"
"451","12.080153550","2001:4860:4860::8844","2601:5cf:4100:3de0:53f4:479c:be9c:997d","TCP","86","","","32","","443  >  58290 [ACK] Seq=5128 Ack=932 Win=67840 Len=0 TSval=165074698 TSecr=3232766698"
"452","12.094302355","2001:4860:4860::8844","2601:5cf:4100:3de0:53f4:479c:be9c:997d","HTTP2","367","HEADERS","250","32","276","HEADERS[1]: 200 OK"
"453","12.094302806","2001:4860:4860::8844","2601:5cf:4100:3de0:53f4:479c:be9c:997d","HTTP2","278","DATA","161","32","187","DATA[1]"
"454","12.094302926","2001:4860:4860::8844","2601:5cf:4100:3de0:53f4:479c:be9c:997d","DoH","117","DATA","0","32","26","Standard query response 0x5524 NS 0101.co.jp NS a3-64.akam.net NS a28-66.akam.net NS a13-64.akam.net NS a1-129.akam.net NS a26-64.akam.net NS a14-66.akam.net"
"455","12.094303037","2001:4860:4860::8844","2601:5cf:4100:3de0:53f4:479c:be9c:997d","HTTP2","125","PING","8","32","34","PING[0]"
"456","12.094352664","2601:5cf:4100:3de0:53f4:479c:be9c:997d","2001:4860:4860::8844","TCP","86","","","32","","58290  >  443 [ACK] Seq=932 Ack=5409 Win=64128 Len=0 TSval=3232766741 TSecr=165074675"
"457","12.096039657","2601:5cf:4100:3de0:53f4:479c:be9c:997d","2001:4860:4860::8844","TCP","86","","","32","","58290  >  443 [RST, ACK] Seq=932 Ack=5671 Win=64128 Len=0 TSval=3232766743 TSecr=165074712"
"458","12.118149194","2601:5cf:4100:3de0:53f4:479c:be9c:997d","2001:4860:4860::8844","TCP","94","","","40","","58302  >  443 [SYN] Seq=0 Win=64800 Len=0 MSS=1440 SACK_PERM TSval=3232766765 TSecr=0 WS=128"
"459","12.331597822","2001:4860:4860::8844","2601:5cf:4100:3de0:53f4:479c:be9c:997d","TCP","94","","","40","","443  >  58302 [SYN, ACK] Seq=0 Ack=1 Win=65535 Len=0 MSS=1440 SACK_PERM TSval=2937403192 TSecr=3232766765 WS=256"
"460","12.331656437","2601:5cf:4100:3de0:53f4:479c:be9c:997d","2001:4860:4860::8844","TCP","86","","","32","","58302  >  443 [ACK] Seq=1 Ack=1 Win=64896 Len=0 TSval=3232766978 TSecr=2937403192"
"461","12.332334559","2601:5cf:4100:3de0:53f4:479c:be9c:997d","2001:4860:4860::8844","TLSv1.3","603","","","32","512","Client Hello (SNI=dns.google)"
"462","12.638855117","2001:4860:4860::8844","2601:5cf:4100:3de0:53f4:479c:be9c:997d","TCP","86","","","32","","443  >  58302 [ACK] Seq=1 Ack=518 Win=66816 Len=0 TSval=2937403341 TSecr=3232766979"
"463","12.638855557","2001:4860:4860::8844","2601:5cf:4100:3de0:53f4:479c:be9c:997d","TLSv1.3","2502","","","32","122,1","Server Hello, Change Cipher Spec"
"464","12.638855688","2001:4860:4860::8844","2601:5cf:4100:3de0:53f4:479c:be9c:997d","TLSv1.3","2119","","","32","4311","Encrypted Extensions, Certificate, Certificate Verify, Finished"
"465","12.638911758","2601:5cf:4100:3de0:53f4:479c:be9c:997d","2001:4860:4860::8844","TCP","86","","","32","","58302  >  443 [ACK] Seq=518 Ack=2417 Win=63744 Len=0 TSval=3232767285 TSecr=2937403342"
"466","12.638934172","2601:5cf:4100:3de0:53f4:479c:be9c:997d","2001:4860:4860::8844","TCP","86","","","32","","58302  >  443 [ACK] Seq=518 Ack=4450 Win=62208 Len=0 TSval=3232767285 TSecr=2937403342"
"467","12.640671493","2601:5cf:4100:3de0:53f4:479c:be9c:997d","2001:4860:4860::8844","TLSv1.3","166","","","32","1,69","Change Cipher Spec, Finished"
"468","12.640940341","2601:5cf:4100:3de0:53f4:479c:be9c:997d","2001:4860:4860::8844","HTTP2","190","SETTINGS,WINDOW_UPDATE","36,4","32","99","Magic, SETTINGS[0], WINDOW_UPDATE[0]"
"469","12.648940652","2601:5cf:4100:3de0:53f4:479c:be9c:997d","2001:4860:4860::8844","DoH","286","HEADERS,WINDOW_UPDATE,DATA,DATA","65,4,29,0","32","104,55,26","Standard query 0xeb72 NS 0109480.xyz"
"470","12.656130892","2001:4860:4860::8844","2601:5cf:4100:3de0:53f4:479c:be9c:997d","TCP","911","","","32","","[TCP Spurious Retransmission] 443  >  58302 [PSH, ACK] Seq=3625 Ack=518 Win=66816 Len=825 TSval=2937403631 TSecr=3232766979 [TCP segment of a reassembled PDU]"
"471","12.656168436","2601:5cf:4100:3de0:53f4:479c:be9c:997d","2001:4860:4860::8844","TCP","98","","","44","","[TCP Dup ACK 466#1] 58302  >  443 [ACK] Seq=902 Ack=4450 Win=64128 Len=0 TSval=3232767303 TSecr=2937403631 SLE=3625 SRE=4450"
"472","12.669494665","2001:4860:4860::8844","2601:5cf:4100:3de0:53f4:479c:be9c:997d","HTTP2","734","SETTINGS,WINDOW_UPDATE","18,4","32","581,57","SETTINGS[0], WINDOW_UPDATE[0]"
"473","12.669495156","2001:4860:4860::8844","2601:5cf:4100:3de0:53f4:479c:be9c:997d","HTTP2","117","SETTINGS","0","32","26","SETTINGS[0]"
"474","12.669561366","2601:5cf:4100:3de0:53f4:479c:be9c:997d","2001:4860:4860::8844","TCP","86","","","32","","58302  >  443 [ACK] Seq=902 Ack=5098 Win=64128 Len=0 TSval=3232767316 TSecr=2937403645"
"475","12.669584712","2601:5cf:4100:3de0:53f4:479c:be9c:997d","2001:4860:4860::8844","TCP","86","","","32","","58302  >  443 [ACK] Seq=902 Ack=5129 Win=64128 Len=0 TSval=3232767316 TSecr=2937403645"
"476","12.670146675","2601:5cf:4100:3de0:53f4:479c:be9c:997d","2001:4860:4860::8844","HTTP2","117","SETTINGS","0","32","26","SETTINGS[0]"
"477","12.682936962","2001:4860:4860::8844","2601:5cf:4100:3de0:53f4:479c:be9c:997d","HTTP2","368","HEADERS","251","32","277","HEADERS[1]: 200 OK"
"478","12.682937353","2001:4860:4860::8844","2601:5cf:4100:3de0:53f4:479c:be9c:997d","HTTP2","200","DATA","83","32","109","DATA[1]"
"479","12.682937483","2001:4860:4860::8844","2601:5cf:4100:3de0:53f4:479c:be9c:997d","DoH","117","DATA","0","32","26","Standard query response 0xeb72 NS 0109480.xyz NS dora.ns.cloudflare.com NS sam.ns.cloudflare.com"
"480","12.682937583","2001:4860:4860::8844","2601:5cf:4100:3de0:53f4:479c:be9c:997d","HTTP2","125","PING","8","32","34","PING[0]"
"481","12.684638704","2601:5cf:4100:3de0:53f4:479c:be9c:997d","2001:4860:4860::8844","TCP","86","","","32","","58302  >  443 [RST, ACK] Seq=933 Ack=5595 Win=64128 Len=0 TSval=3232767331 TSecr=2937403659"
"482","12.702158348","2001:4860:4860::8844","2601:5cf:4100:3de0:53f4:479c:be9c:997d","TCP","86","","","32","","443  >  58302 [ACK] Seq=5595 Ack=933 Win=67840 Len=0 TSval=2937403678 TSecr=3232767317"
"483","12.702184069","2601:5cf:4100:3de0:53f4:479c:be9c:997d","2001:4860:4860::8844","TCP","74","","","20","","58302  >  443 [RST] Seq=933 Win=0 Len=0"
"484","12.705582542","2601:5cf:4100:3de0:53f4:479c:be9c:997d","2001:4860:4860::8888","TCP","94","","","40","","34494  >  443 [SYN] Seq=0 Win=64800 Len=0 MSS=1440 SACK_PERM TSval=3903981978 TSecr=0 WS=128"
"485","12.840316004","2001:4860:4860::8888","2601:5cf:4100:3de0:53f4:479c:be9c:997d","TCP","94","","","40","","443  >  34494 [SYN, ACK] Seq=0 Ack=1 Win=65535 Len=0 MSS=1440 SACK_PERM TSval=1069970006 TSecr=3903981978 WS=256"
"486","12.840350963","2601:5cf:4100:3de0:53f4:479c:be9c:997d","2001:4860:4860::8888","TCP","86","","","32","","34494  >  443 [ACK] Seq=1 Ack=1 Win=64896 Len=0 TSval=3903982113 TSecr=1069970006"
"487","12.840684157","2601:5cf:4100:3de0:53f4:479c:be9c:997d","2001:4860:4860::8888","TLSv1.3","603","","","32","512","Client Hello (SNI=dns.google)"
"488","13.151017306","2001:4860:4860::8888","2601:5cf:4100:3de0:53f4:479c:be9c:997d","TCP","86","","","32","","443  >  34494 [ACK] Seq=1 Ack=518 Win=66816 Len=0 TSval=1069970142 TSecr=3903982113"
"489","13.151017756","2001:4860:4860::8888","2601:5cf:4100:3de0:53f4:479c:be9c:997d","TLSv1.3","2502","","","32","122,1","Server Hello, Change Cipher Spec"
"490","13.151017887","2001:4860:4860::8888","2601:5cf:4100:3de0:53f4:479c:be9c:997d","TLSv1.3","2118","","","32","4310","Encrypted Extensions, Certificate, Certificate Verify, Finished"
"491","13.151018007","2001:4860:4860::8888","2601:5cf:4100:3de0:53f4:479c:be9c:997d","TCP","910","","","32","","[TCP Retransmission] 443  >  34494 [PSH, ACK] Seq=3625 Ack=518 Win=66816 Len=824 TSval=1069970403 TSecr=3903982113 [TCP segment of a reassembled PDU]"
"492","13.151078065","2601:5cf:4100:3de0:53f4:479c:be9c:997d","2001:4860:4860::8888","TCP","86","","","32","","34494  >  443 [ACK] Seq=518 Ack=2417 Win=63744 Len=0 TSval=3903982424 TSecr=1069970143"
"493","13.151104216","2601:5cf:4100:3de0:53f4:479c:be9c:997d","2001:4860:4860::8888","TCP","86","","","32","","34494  >  443 [ACK] Seq=518 Ack=4449 Win=62208 Len=0 TSval=3903982424 TSecr=1069970143"
"494","13.151118184","2601:5cf:4100:3de0:53f4:479c:be9c:997d","2001:4860:4860::8888","TCP","98","","","44","","[TCP Dup ACK 493#1] 34494  >  443 [ACK] Seq=518 Ack=4449 Win=62208 Len=0 TSval=3903982424 TSecr=1069970403 SLE=3625 SRE=4449"
"495","13.152796720","2601:5cf:4100:3de0:53f4:479c:be9c:997d","2001:4860:4860::8888","TLSv1.3","166","","","32","1,69","Change Cipher Spec, Finished"
"496","13.153072341","2601:5cf:4100:3de0:53f4:479c:be9c:997d","2001:4860:4860::8888","HTTP2","190","SETTINGS,WINDOW_UPDATE","36,4","32","99","Magic, SETTINGS[0], WINDOW_UPDATE[0]"
"497","13.162117284","2601:5cf:4100:3de0:53f4:479c:be9c:997d","2001:4860:4860::8888","DoH","282","HEADERS,WINDOW_UPDATE,DATA,DATA","65,4,25,0","32","104,51,26","Standard query 0xfc9a NS 011.com"
"498","13.457852727","2001:4860:4860::8888","2601:5cf:4100:3de0:53f4:479c:be9c:997d","HTTP2","734","SETTINGS,WINDOW_UPDATE","18,4","32","581,57","SETTINGS[0], WINDOW_UPDATE[0]"
"499","13.457853178","2001:4860:4860::8888","2601:5cf:4100:3de0:53f4:479c:be9c:997d","HTTP2","117","SETTINGS","0","32","26","SETTINGS[0]"
"500","13.457853298","2001:4860:4860::8888","2601:5cf:4100:3de0:53f4:479c:be9c:997d","TCP","86","","","32","","443  >  34494 [ACK] Seq=5128 Ack=898 Win=67840 Len=0 TSval=1069970466 TSecr=3903982435"
"501","13.458832791","2601:5cf:4100:3de0:53f4:479c:be9c:997d","2001:4860:4860::8888","HTTP2","117","SETTINGS","0","32","26","SETTINGS[0]"
"502","13.480353362","2001:4860:4860::8888","2601:5cf:4100:3de0:53f4:479c:be9c:997d","TCP","86","","","32","","443  >  34494 [ACK] Seq=5128 Ack=929 Win=67840 Len=0 TSval=1069970749 TSecr=3903982731"
"503","13.765052587","2001:4860:4860::8888","2601:5cf:4100:3de0:53f4:479c:be9c:997d","HTTP2","368","HEADERS","251","32","277","HEADERS[1]: 200 OK"
"504","13.765053038","2001:4860:4860::8888","2601:5cf:4100:3de0:53f4:479c:be9c:997d","HTTP2","188","DATA","71","32","97","DATA[1]"
"505","13.765053158","2001:4860:4860::8888","2601:5cf:4100:3de0:53f4:479c:be9c:997d","DoH","117","DATA","0","32","26","Standard query response 0xfc9a NS 011.com NS fog.dnspod.net NS len.dnspod.net"
"506","13.765053268","2001:4860:4860::8888","2601:5cf:4100:3de0:53f4:479c:be9c:997d","HTTP2","125","PING","8","32","34","PING[0]"
"507","13.766369383","2601:5cf:4100:3de0:53f4:479c:be9c:997d","2001:4860:4860::8888","TCP","86","","","32","","34494  >  443 [RST, ACK] Seq=929 Ack=5582 Win=64128 Len=0 TSval=3903983039 TSecr=1069970883"
"508","13.786829922","2601:5cf:4100:3de0:53f4:479c:be9c:997d","2001:4860:4860::8844","TCP","94","","","40","","58306  >  443 [SYN] Seq=0 Win=64800 Len=0 MSS=1440 SACK_PERM TSval=3232768433 TSecr=0 WS=128"
"509","14.072236477","2001:4860:4860::8844","2601:5cf:4100:3de0:53f4:479c:be9c:997d","TCP","94","","","40","","443  >  58306 [SYN, ACK] Seq=0 Ack=1 Win=65535 Len=0 MSS=1440 SACK_PERM TSval=3419361690 TSecr=3232768433 WS=256"
"510","14.072281386","2601:5cf:4100:3de0:53f4:479c:be9c:997d","2001:4860:4860::8844","TCP","86","","","32","","58306  >  443 [ACK] Seq=1 Ack=1 Win=64896 Len=0 TSval=3232768719 TSecr=3419361690"
"511","14.072746800","2601:5cf:4100:3de0:53f4:479c:be9c:997d","2001:4860:4860::8844","TLSv1.3","603","","","32","512","Client Hello (SNI=dns.google)"
"512","14.379760248","2001:4860:4860::8844","2601:5cf:4100:3de0:53f4:479c:be9c:997d","TCP","86","","","32","","443  >  58306 [ACK] Seq=1 Ack=518 Win=66816 Len=0 TSval=3419361979 TSecr=3232768719"
"513","14.379760699","2001:4860:4860::8844","2601:5cf:4100:3de0:53f4:479c:be9c:997d","TLSv1.3","2502","","","32","122,1","Server Hello, Change Cipher Spec"
"514","14.379760819","2001:4860:4860::8844","2601:5cf:4100:3de0:53f4:479c:be9c:997d","TLSv1.3","2117","","","32","4309","Encrypted Extensions, Certificate, Certificate Verify, Finished"
"515","14.379818833","2601:5cf:4100:3de0:53f4:479c:be9c:997d","2001:4860:4860::8844","TCP","86","","","32","","58306  >  443 [ACK] Seq=518 Ack=2417 Win=63744 Len=0 TSval=3232769026 TSecr=3419361980"
"516","14.379845436","2601:5cf:4100:3de0:53f4:479c:be9c:997d","2001:4860:4860::8844","TCP","86","","","32","","58306  >  443 [ACK] Seq=518 Ack=4448 Win=62208 Len=0 TSval=3232769026 TSecr=3419361980"
"517","14.381421922","2601:5cf:4100:3de0:53f4:479c:be9c:997d","2001:4860:4860::8844","TLSv1.3","166","","","32","1,69","Change Cipher Spec, Finished"
"518","14.381710017","2601:5cf:4100:3de0:53f4:479c:be9c:997d","2001:4860:4860::8844","HTTP2","190","SETTINGS,WINDOW_UPDATE","36,4","32","99","Magic, SETTINGS[0], WINDOW_UPDATE[0]"
"519","14.389753844","2601:5cf:4100:3de0:53f4:479c:be9c:997d","2001:4860:4860::8844","DoH","284","HEADERS,WINDOW_UPDATE,DATA,DATA","65,4,27,0","32","104,53,26","Standard query 0x2164 NS 011st.com"
"520","14.687623838","2001:4860:4860::8844","2601:5cf:4100:3de0:53f4:479c:be9c:997d","HTTP2","734","SETTINGS,WINDOW_UPDATE","18,4","32","581,57","SETTINGS[0], WINDOW_UPDATE[0]"
"521","14.687624098","2001:4860:4860::8844","2601:5cf:4100:3de0:53f4:479c:be9c:997d","TCP","86","","","32","","443  >  58306 [ACK] Seq=5096 Ack=900 Win=67840 Len=0 TSval=3419362298 TSecr=3232769028"
"522","14.687624148","2001:4860:4860::8844","2601:5cf:4100:3de0:53f4:479c:be9c:997d","HTTP2","117","SETTINGS","0","32","26","SETTINGS[0]"
"523","14.687624188","2001:4860:4860::8844","2601:5cf:4100:3de0:53f4:479c:be9c:997d","HTTP2","368","HEADERS","251","32","277","HEADERS[1]: 200 OK"
"524","14.687624238","2001:4860:4860::8844","2601:5cf:4100:3de0:53f4:479c:be9c:997d","HTTP2","281","DATA","164","32","190","DATA[1]"
"525","14.687624278","2001:4860:4860::8844","2601:5cf:4100:3de0:53f4:479c:be9c:997d","DoH","117","DATA","0","32","26","Standard query response 0x2164 NS 011st.com NS ns-1216.awsdns-24.org NS ns-1732.awsdns-24.co.uk NS ns-488.awsdns-61.com NS ns-583.awsdns-08.net"
"526","14.687624318","2001:4860:4860::8844","2601:5cf:4100:3de0:53f4:479c:be9c:997d","HTTP2","125","PING","8","32","34","PING[0]"
"529","14.687706139","2601:5cf:4100:3de0:53f4:479c:be9c:997d","2001:4860:4860::8844","TCP","86","","","32","","58306  >  443 [ACK] Seq=900 Ack=5674 Win=63744 Len=0 TSval=3232769334 TSecr=3419362290"
"530","14.688191773","2601:5cf:4100:3de0:53f4:479c:be9c:997d","2001:4860:4860::8844","HTTP2","117","SETTINGS","0","32","26","SETTINGS[0]"
"531","14.689392250","2601:5cf:4100:3de0:53f4:479c:be9c:997d","2001:4860:4860::8844","TCP","86","","","32","","58306  >  443 [RST, ACK] Seq=931 Ack=5674 Win=64128 Len=0 TSval=3232769336 TSecr=3419362290"
